title,plot,genre
bloody moon,"Miguel, a young man with a horribly disfigured face, goes on a rampage at a masquerade party and rapes a girl. He then brutally hacks up the young woman with a pair of scissors. Miguel is institutionalized at a mental asylum for five years. Afterward, he is released into the care of his sister, Manuela. Along with their wheelchair bound mother, they operate a boarding school for young woman, called Europe's International Youth-Club Boarding School of Languages, on the Spanish...",thriller
buddy buddy,"Buddy Buddy is a 1981 American comedy film directed by Billy Wilder that stars Jack Lemmon, Walter Matthau, Paula Prentiss and Klaus Kinski. The screenplay by Wilder and I.A.L. Diamond is based on the 1973 French language film L'Emmerdeur, which screenwriter Francis Veber had adapted from his play Le contrat. The film proved to be the last directed by Wilder.",comedy
burning an illusion,"A young black woman in England becomes increasingly frustrated with her life with her lazy, demanding boyfriend, and with the help of friends seeks something better.",drama
bustin' loose,"After ex-con Joe Braxton violates his probation he is given a second chance, all he has to do is drive a group of special kids across the country. What could possibly go wrong?",comedy
cafè express,To pull a living and to keep his son at the college Michele sells abusively coffee to the passengers of a train in the South Grolla D'Oro 1980 in Vittorio Caprioli.,comedy
carbon copy,"A white corporate executive is surprised to discover that he has a black teen-age son who can't wait to be adopted into the, almost-exclusively-white community of, San Marino, California.",comedy
carnival scenes,"Based on a theatrical text by Romanian writer Ion Luca Caragiale (1852-1912), who was a bitter and funny witness of the turn-of-the-20th-century Romanian bourgeois mores, Carnival Scenes manages to preserve and further enhance the slightly hysteric atmosphere of his plays. Pintilie creates a strange combination of carnival scenes which is brought to the screen as a burlesque, fast-paced, screwball comedy with a meditative undertone. This film was banned in Romania for a decade until the death...",comedy
cattle annie and little britches,"Cattle Annie and Little Britches is a 1981 American film[1] starring Burt Lancaster, Rod Steiger, Diane Lane, and Amanda Plummer, based on the lives of two adolescent girls in the late 19th century Oklahoma Territory, who became infatuated with the Western outlaws that they had read about in Ned Buntline's stories and left their homes to join the criminals. It was scripted by David Eyre and Robert Ward from Robert Ward's book and directed by Lamont Johnson.",drama
charlie chan and the curse of the dragon queen," Famous detective Charlie Chan is called out of retirement to help a San Francisco detective solve a mysterious series of murders. With his bumbling grandson as his sidekick, Chan also encounters an old nemesis known as the Dragon Queen who is the prime suspect. Written by Anonymous ",comedy
"chi trova un amico, trova un tesoro","Alan et son ami Charlie partent à la recherche d'un mystérieux trésor situé sur une île de l'Océan Pacifique. Pour mettre la main sur ledit trésor, ils vont devoir se débarasser de quelques concurrents...",adventure
choices,"A popular high school student seems to have it all; a spot on the football team, the love of playing music in the school orchestra and a girlfriend. His world seems to come apart when the school doctor discovers he is partially deaf, causing him to be cut from the football team on the advice of the doctor. The student's friends fight to keep him on the team; while he struggles with his problem by withdrawing from everything he loves and starts falling in with the wrong crowd.",drama
chu chu and the philly flash,"Chu Chu and the Philly Flash is a 1981 comedy film starring Alan Arkin, Carol Burnett, Jack Warden, Ruth Buzzi, and Danny Aiello. It was released in 1981 by 20th Century Fox. Arkin plays a down-his-luck former baseball player and Burnett plays a Carmen Miranda-style performer. The film was panned by critics and was not a box office success. Many of the scenes, particularly the exterior scenes of ""Chu Chu"" home, were filmed in San Francisco's Potrero Hill district.",comedy
continental divide,"A delightful romantic comedy that launched the career of screenwriter Lawrence Kasdan (Raiders of the Lost Ark, The Empire Strikes Back). Emmy Award winner John Belushi plays Ernie, a tough Chicago reporter whose stories on the Mafia nearly get him killed. To take the heat off, he's sent to investigate an eagle researcher in rural Colorado. The two fall for each other in a hilariously heartwarming fashion. Continental Divide is a perfect romantic comedy, sincere and full of genuine laughs.",comedy
coup de torchon,"In 1938 in the french West Africa, Lucien Cordier is a weak and corrupted policeman despised by the local bad boys. His wife is openly cheating on him and he hasn't got any self-respect anymore. But when comes the occasion, his revenge will be terrible.",comedy
dawn of the mummy," A group of fashion models disturb the tomb of a mummy and revive an ancient curse. Along with the mummy rising, slaves who were buried in the desert thousands of years before, also rise, with a craving for human flesh. Written by Humberto Amador ",horror
dead kids,"Widowed John Brady is the Chief of Police in small town Galesburg, Illinois, where he has lived most of his life. His only offspring, Pete Brady, is a bright high school senior. John has been in turmoil since the suspicious death of his wife Catherine years earlier, which he always believed had something to do with her boss, Dr. Le Sange, who himself died shortly after Catherine's passing. Only recently has John and Pete's home life gotten back on track with John dating Barbara...",horror
death hunt,"Canada 1931: The unsociable trapper Johnson lives for himself in the ice-cold mountains near the Yukon river. During a visit in the town he witnesses a dog-fight. He interrupts the game and buys one of the dogs - almost dead already - for $200 against the owner's will. When the owner Hasel complains to Mountie Sergeant Millen, he refuses to take action. But then the loathing breeder and his friends accuse Johnson of murder. So Millen, although sympathetic, has to try to take him under arrest -...",action
demonoid: messenger of death, A British woman visits her husband at the Mexican mine he is attempting to reopen and discovers that the workers refuse to enter the mine fearing an ancient curse. The couple enter the mine to prove there is no danger and inadvertently release a demon which possess people's left hands and forces them to behave in a suitably diabolical manner. The only way for a possessed person to free themselves from this torment is to cut off their left hand after which it scurries away in search of its...,horror
dirty tricks,"A Harvard University student finds a strange letter that seems to be signed by George Washington. When trying to contact an expert (Prof. Chandler) to authenticate it, he is murdered but the letter disappears. Then Chandler, who does not know anything about the case, gets chased by the mafia and haunted by a TV reporter (Polly Bishop).",comedy
diva,"Jules, a young Parisian postman, secretly records a concert performance given by the opera singer Cynthia Hawkins, whom he idolises. The following day, Jules runs into a woman who is being pursued by armed thugs. Before she is killed, the woman slips an audio cassette into his mail bag...",thriller
docteur jekyll et les femmes," The film takes place before, during and immediately after the engagement party of Dr.Henry Jekyll and Miss Fanny Osborne, attended by numerous highly respectable guests (a general, a doctor, a priest, a lawyer), the last of which informs the company that a child has been murdered in the street outside. While the others watch a young dancer perform, Dr.Jekyll instructs the lawyer to alter his will, leaving everything to a certain Mr.Hyde. Shortly afterwards, the dancer is found murdered, and...",horror
don't go in the woods,"Four young campers, Craig, Peter, Ingrid and Joanie, back-pack through the mountains for a relaxing weekend in the wilderness. They are out camping in broad daylight, while someone else is killing tourists in the woods. Craig warns the others not to go into the woods alone. The hillsides are crawling with fat women huffing up hillsides, nerdy bird-watchers, and young couples. Most of whom meet gruesome ends at the hands of a deranged and growling back-woodsman with a sharp spike...",horror
don't go near the park," In the prehistory of man, 12,000 years ago, two members of a superhuman tribe abuse the treasured secret of eternal youth. They use the methods of ritual cannibalism on the children of their own tribe and when discovered by the 'Queen' of the tribe, they are cursed to an eternity of old age with no chance to ever die. Now, in present day Los Angeles, their only hope to recapture eternal youth is the ritualistic sacrifice of a 16-year-old female virgin. Their existence is discovered...",horror
dreadnaught," A short-tempered, violent criminal named ""White Tiger"" is on the run from the police and joins a theater troupe for disguise, killing anyone who angers him or who suspects his identity. One person he unsuccessfully tries to kill several times is a cowardly laundry man named ""Mousy"" who manages to escape mostly by running and hiding. When a very close friend of Mousy's is killed by the White Tiger, Mousy overcomes his cowardliness enough to seek revenge. Spectacular...",action
duel of the tough,"During the Ching Dynasty, a Buddhist priest named Hung must take a journey to spread the word of Buddha. He takes the holy Scriptures along on his journey to southern China. During Hung's trip one of Dai-kiang's henchmen (Wah-sang), attacks him and steals the sacred documents. Luckily Priest Hung is able to escape from the attackers and meets a fellow northerner, Huang, who swears to aid the holy man. Hung and Huang return to the temple to regroup, where Huang is taught the deadly technique...",action
dvadtsat shest dney iz zhizni dostoevskogo,"Twenty-Six Days in the Life of Dostoyevsky was entered on February 16th at the 1981 Berlin Film Festival to commemorate the 100th anniversary of Dostoyevsky's death on February 9th, 1881, and won a ""Best Actor"" award for Anatoly Solonitsyn as Dostoyevsky. Solonitsyn was a favorite actor in Andrei Tarkovsky's films, and this was to be his penultimate role. This brief imaginary period in the famed Russian writer's life encapsulates one of his darker moments in 1866. At that time he was still a...",romance
earthbound,"In this sci-fi film, a spaceship crash lands in the Midwest and strands an alien family. A gentle innkeeper takes in the marooned group. Except for their green chimpanzee that eats light bulbs, the aliens look like normal humans. Unfortunately, the family is pursued by a government agent determined to see that the aliens don't intermingle with the humans.",family
elephant parts,"Winner of the first video Grammy Award, Michael Nesmith (The Monkees) wrote and starred in Elephant Parts, a collection of comedy and music videos using money he inherited from his mother, the inventor of Liquid Paper. Elephant Parts is one hour long and features five full length music videos, including the popular songs ""Rio"", and ""Cruisin'"", which featured wrestler Steve Strong and Monterey-based comic ""Chicago"" Steve Barkley. An off-beat collection that is very entertaining to view while in...",comedy
enter the ninja,"After completing his training of ninjutsu within Japan, an American Vietnam veteran by the name of Cole (Franco Nero) visits his war buddy Frank Landers (Alex Courtney) and his newly wed wife Mary Ann Landers (Susan George), who are the owners of a large piece of farming land in the Philippines. Cole soon finds that the Landers are being repeatedly harassed by a CEO named Charles Venarius.",action
eyewitness,"Daryll Deever is a janitor in an office building in New York, and a big fan of TV news reporter, Tony Sokolow. When a rich man is murdered in Daryll's building, Tony comes to cover the story and Daryll introduces himself to her. Thinking he may know something about the crime, Tony pursues him, and in order to keep seeing her, he pretends that he does. As the two of them play this game, the killers are watching, assuming that Daryll and Tony both know more about the crime than they do.",thriller
family reunion,"A woman fights for what she believes in. Stars Bette Davis, J. Ashley Hyman, David Huddleston, John Shea, Roy Dotrice, David Rounds, Kathryn Walker, Roberts Blossom, Roberta Wallach, Jeff McCracken.",drama
farewell to matyora," Matyoroy is a small village on a beautiful island with the same name. It has been decided that the island shall be flooded and returned to the sea. This is the story of the inhabitants of Matyoroy, who are forced to see the disassembling of their village, and their saying farewell to their homeland. Written by Jochen Bauer ",drama
ferat vampire," A doctor (Marek) is shocked when his beloved nurse (Mima) signs a contract with foreign car manufacturer Ferat, in order to work for them as a rally-driver. A fellow doctor makes him believe that human blood is being used as fuel for Mima's ever winning car, but does that really work? Written by Otto Oberhauser <[email protected]> ",comedy
final exam,"In a small college in North Carolina, only a select few students are left to take mid terms. But, when a killer strikes, it could be everyone's final exam.",horror
firebird 2015 ad,"In one of many unpopular and unsupported policy decisions, the US government of the near future outlaws vehicle petrol in an effort to curb the overuse of limited natural resources - except, of course, for official purposes. There are many renegades who oppose the authorities, and will stop at nothing to allow themselves the freedom of burning around the countryside.",action
first monday in october,"For the first time in history a woman is appointed to the U.S. Supreme Court, where she becomes a friendly rival to a liberal associate.",comedy
for y'ur height only," Mr. Giant has kidnapped the brilliant Dr. Van Kohler and is planning to use the Doctor's invention, the N-bomb, to hold the world hostage. The only one who can foil Mr. Giant's evil scheme is Agent 00, a 3-foot-tall filipino martial arts master, expert marksman, top-class romancer and all-around superspy. Can Agent 00 rescue Dr. Kohler before it's too late? Written by Jean-Marc Rocher <[email protected]> ",action
force: five,A martial-arts expert leads a team of fellow martial artists to rescue a senator's daughter from an island ruled by the evil leader of a fanatical religious cult.,action
four friends,"Also known as Moritorium and Georgia's Friends, Four Friends follows the titular quartet from high school to young adulthood. The film is set during the tumultuous 1960s, an era when everyone's values were turned inside out, shaken around, and reassembled. The central character is first-generation American Craig Wasson, who confounds his Yugoslavian father (Miklos Simon) by pursuing his own let-it-all-hang-out lifestyle. Wasson's best friends are athlete Jim Metzler and chubby Michael...",comedy
frankenstein island," When a hot-air balloon crashes on a remote island, the crew discovers Dr. Frankenstein's ancestor carrying on the family work, along with a race of mutants and a population of Amazons. Written by Jeremy Lunt <[email protected]> ",horror
freddie the freeloader's christmas dinner," Freddie the Freeloader sets out to have Xmas dinner in a very expensive New York restaurant with his good friend, the Professor. Along the way he stops in a hospital to entertain some children on Xmas. Red Skelton does a couple of songs on his own & a duet with Vincent Price. Written by GEORGE W HUDSON ",comedy
fruits of passion," The story takes place in Shanghai. A girl loves a rich and much older man (played by Kinski). She is willing to do everything he wants to show her love, but he is playing a sick game with her. As part of this game he sends her to a Chinese brothel. A poor young boy sees her and falls in love with her. To get the money needed to sleep with her, he joins ""the revolution"". Additionally the movie shows the fate of some of the other prostitutes. Written by Thomas Schmall ",drama
game of death ii,"In this dark tale of revenge, Bruce Lee ""returns"" as Billy Lo, whose best friend Chin Ku (Wong Ching Lei) dies of a sudden illness. But suspicion of foul play arises when a gang tries to steal Ku's coffin at the funeral using a helicopter. When Lo's younger brother Lo (Tong Lung) hears about the incident, he leaves his Buddhist master (Roy Chiao) to investigate the truth. His trail soon leads him to the Castle of Death, the last place Chin Ku was seen alive. There, he meets and befriends an...",action
gas,"Susan Anspach stars in this comedy as a news reporter who investigates a story about stolen milk causing milk and gas prices to rise. During the course of her investigation, other people become involved, culminating in a multiple car chase.",comedy
going ape!,"When his father - who owned a circus - dies, Oscar inherits 5 million dollars - and 3 orang outangs. However there's a condition connected to the money: if he gives away the apes or just one gets sick or dies during the next 3 years, the zoologic society will get all the money. So he not only has to deal with 3 apes and an annoyed girlfriend, but also with a greedy zoologic society's president.",comedy
goliath awaits," During World War II the passenger liner ""Goliath"" is sunk by a German submarine. Portions of the ship's hull remain airtight, and some of the passengers and crew survive. Over the decades they build a rigidly regulated society completely isolated from the surface world, until in contemporary times a diving team begins to explore the wreck. Written by Marg Baskin <[email protected]> ",adventure
göta kanal eller vem drog ur proppen?,"An order for 1,000 yachts for a middle-east sheik is up for grabs. The list of contestants has been narrowed down to two companies: one is a multinational one with good backing and the other is run by visionaries and enthusiasts with their main focus on rowing-boats. Having a hard time to decide between the two the sheik declares a race on the Göta Canal through Sweden, from the capital of Stockholm to the second city of Gothenburg, where the winner gets the order. Pretty soon...",comedy
graduation day," After a high school track runner, named Laura, suddenly dies from a heart attack after finishing a 30-second 200-meter race, a killer wearing a sweat suit and a fencing mask begins killing off her friends on the school track team one by one. The suspects include the track coach Michaels, Laura's sister Anne who arrives in town for the funeral, the creepy school principal Mr. Guglione, and Laura's strange boyfriend Kevin. Written by matt-282 ",horror
great white,"An enormous and angry 35 foot Great White Shark takes revenge on humans when they build a beach just for swimmers by a coastal town. After several shark attacks, and the Mayor does nothing to stop it, James Franisscus and Vic Morrow sail in pursuit to stop it.",adventure
gregory's girl,A comedy about a wimpy 16-year-old who is going through his first high-school crush... on the girl who replaced him on the school's winless soccer team.,comedy
hänsel und gretel,Engelbert Humperdinck's beloved musical fairy tale HÄNSEL UND GRETEL is brought to life by Sir Georg Solti and an illustrious cast - all part of a shimmering production that continues to enchant audiences of all ages.,family
hellhole women,"Soon after newlyweds Olga (Uta Koepke) and Michel (Angel Caballero) set foot on the grounds of a notorious women's prison, they're arrested by topless guards and ushered behind bare, where the warden (transsexual adult film star Ajita Wilson) quickly dismisses Michel but demands that Olga do a little time. Director Jesus Franco also makes an appearance as a masochistic white enslaver in this erotically over-the-top S&M romp.",action
hitman in the hand of buddha," A country bumpkin arrives to help his brother's rice business. Things get out of hand while a rival company becomes corrupt. The bumpkin, an ace martial artist, fights off the rivals. Angered, the rivals hire a martial arts expert to fight the hero, only to get beaten up himself. The expert send his teacher to hurt the hero and succeeds. The hero is sent to a temple where he learns a new style of kung fu. Now with the skills, our hero is ready to get even. Written by Ninja01 ",action
home sweet home,"An escaped mental patient steals a station wagon and makes his way to the Bradleys' Thanksgiving celebration, where he plans to make them a little less thankful...",horror
honky tonk freeway," Ticlaw, a small town in Florida, has only one attraction: a safari park. The government constructs a freeway that passes near Ticlaw, but decides not to put an exit into the town. The people of Ticlaw, leaded by it's Mayor, will do anything in order to convince the governor to alter the project. Written by Michel Rudoy <[email protected]> ",action
hot bubblegum," Three high school seniors preparing for final exams in the early 1960s have the normal teenage concerns about girls, sex and relationships. They try to find out if going steady with one girlfriend is better or if changing girlfriends all the time makes for too many complications. By the end of summer, all things get better. Written by Anonymous ",comedy
hotel america," Hélène, a distracted pill-popping anesthetist, almost runs down Gilles one evening on a Biarritz street. She is still numb from the drowning death earlier that year of her lover, a visionary architect. Gilles presses for a relationship, then backs away, deciding she could never love someone of lower class and limited prospects. But she does fall in love with him and gradually her depression eases. As she heals, he becomes obsessed with her lover's talents and his own...",drama
improper channels,"A father brings a young child to an emergency room to get treatment for a minor injury occurring in an innocent accident, but he gets accused of child abuse. Child welfare agencies commit grossly unfair over-reactions to remove the child forcibly from the Father (Arkin), who must brave the arcane system to reclaim his daughter.",comedy
kisapmata,"Dadong Carandang (Silayan), a retired police officer, is the domineering father of Mila (Santos), and he is extremely jealous of the latter's suitors, never allowing them into his house. One day, Mila falls in love with Noel Manalansan (Ilagan) and they decide to seek Dadong's permission to get married. Mila finds out she is pregnant. Dadong agrees on the condition that Noel pay a ridiculously costly dowry as well as shoulder a luxurious wedding. Noel agrees and works hard to meet Dadong's...",drama
knightriders,"A travelling troupe of jousters and performers are slowly cracking under the pressure of hick cops, financial troubles and their failure to live up to their own ideals. The group's leader, King Billy, is increasingly unable to maintain his warrior's rule while the Black Knight is being tempted away to LA and stardom, as they all have to ask why they were here in the first place.",action
kung fu zombie,"A criminal comes to town in order to kill Billy Chong over a past dispute. But instead of getting his own hands dirty, he hires a Taoist wizard to animate some zombies to do the job for him. The plan goes horribly awry, and the bad guy ends up getting killed in his own trap. This pisses off the villain's spirit and he forces the priest to reincarnate him - only they can't find a suitable body. Meanwhile, an undead fiend of sorts comes to town to kill Billy's father over some...",action
la chèvre,"When the boss' unlucky daughter is missing in South America, Campana is sent to watch the boss' most unlucky employee who is sent as a private detective in hopes he can duplicate the daughter's mistakes.",adventure
le notti del terrore,"Professor Ayres discovers a secret in an ancient stone and when he opens a crypt, he revives zombies that kill him. He had invited three couples to visit him in his manor to reveal his discovery. However, they never get around to meeting the professor. Out of the blue, the zombies attack them and they seek shelter in the mansion.",horror
le professionnel,"French secret agent Joss Baumont is sent to kill the president Njala of an African country. However, a counter-order is given before he can execute his mission and he is abandoned in the hands of foreign authorities. He escapes and seeks revenge by pursuing what was his original mission.",action
lili marleen,Lili Marleen is the story of a German singer named Wilkie who while working in Switzerland falls in love with a Jewish composer named Robert who’s family is helping people to flee from the Nazis. Roberts family is skeptical of Walkie thinking she could be a Nazi as she becomes famous for singing Lili Marleen.,drama
lola,"Ten years after the war, West Germany's market economy is booming. Into an unnamed city that's rife with corruption comes a new building commissioner, Herr von Bohm, committed to progress but also upright. He's smitten by Marie-Louise, a single mother who's his landlady's daughter. Von Bohm does not realize she is also Lola, a singer at a bordello and the mistress of Schuckert, a local builder whose profits depend on von Bohm's projects. When von Bohm discovers Marie-Louise's real vocation and...",comedy
