title,plot,genre
the player's club,"When she's not raising her young son and trying to make ends meet, Diana Armstrong (Lisa Raye) dreams of becoming a broadcast journalist. Determined to survive and get a college degree, Diana takes a job as a stripper at The Players Club, a notorious strip joint run by a two-bit hustler named Dollar Bill (Bernie Mac). Under the stage name Diamond, Diana becomes a playful seductress, teasing and tempting the denizens of the dark for the crumpled dollar bills they toss on-stage. Unlike the other...",comedy
the replacement killers,"In exchange for the safe passage of his family from Beijing to America, Chinese immigrant John Lee - a skilled assassin - takes a job with powerful underworld figure, Mr. Wei. Wei wants Lee to settle a deadly vendetta against police detective Stan Zedkov (Michael Rooker). The assignment, however, is so unspeakable that Lee would rather brave Wei's vengeance than go through with it. With the help of document forger Meg Coburn (Mira Sorvino), who in helping him becomes an unwitting target...",action
the newton boys,"The true story of America's most successful bank robbers. From 1919 to 1924, they robbed over eighty banks from Texas to Canada, capping their career with America's largest train robbery, a three million dollar mail train heist outside of Chicago. From a poor upbringing as cowboys and cotton farmers the brothers brought their frontier-born ""code of the west"" into the roaring twenties, considering themselves not gunfighters, but ""businessmen."" True to their aims, they never killed anyone in...",action
the opposite of sex,"The story of Dedee Truitt (Christina Ricci), a sixteen-year-old girl who runs away from her troubled Louisiana home one summer to live with her rich half brother Bill (Martin Donovan). She soon wreaks havoc in the lives of everyone she encounters, from Bill's new boyfriend Matt (Ivan Sergei) to his sexually repressed best friend Lucia (Lisa Kudrow).",comedy
the spanish prisoner,"When a naïve inventor (Campbell Scott) develops ""The Process,"" a top-secret program guaranteed to make billions for his company, the wolves come out to fleece him in this cunning mystery with a masterful sleight of hand from writer-director David Mamet. Powerful performances by Ben Gazarra and Steve Martin -- in addition to plenty of surprises and stings -- permeate this twisty and suspenseful con flick.",drama
wide awake,"Lately, young Joshua A. Beal (Cross) has been having a hard time just waking up in the morning. Up until now, his life has been all about Batman action figures, Ninja turtle cartoons and Captain Crunch cereal. But not any more. It's the first day of fifth grade, and he's finally decided it's time to wake up and discover life. It's been several months since his beloved grandfather (Loggia) passed away, and while everyone else seems certain his Grandpa is in good hands, Joshua just isn't sure. No...",comedy
pecker,"A Baltimore sandwich shop employee becomes an overnight sensation when photographs he's taken of his weird family become the latest rage in the art world. The young man is called ""Pecker"" because he pecks at his food like a bird.",comedy
the mighty,"Kevin Dillon (Kieran Culkin) and his mother (Sharon Stone) move next door to Maxwell Kane (Eldon Henson) and his grandparents (Gena Rowlands, Harry Dean Stanton). Thirteen-year-old Max is a giant boy in size 14 shoes who's slow in school, short on courage, and long on not fitting in. But then, he meets Kevin, a tiny Einstein in leg braces with more smarts, lip and nerve than any kid in town. Both boys have been outcasts all their lives. To the local hoods, they're ""Frankenstein and Igor."" But...",comedy
13 gantry row,"When newlyweds Peter and Julie purchase an old house with plans to renovate it, they begin to discover the strangest things. First, they find one of the living room walls covered with iron plates that reveal an expanding sepia stain. Afterwards, they realize that the stain is beginning to take the shape of a man climbing from the darkness under the house. Whenever they paint over the stain, it reappears. The evil events that took place in the house 100 years prior, are becoming the cause of...",thriller
15 amore," Peace within war. An adult voice narrates a story of childhood during World War II when he lived with his mother, brother, and sister on an estate in Australia's Hunter Valley, his father away fighting, and two Italian prisoners of war staying with them, in effect being his papa. They are joined by Jewish refugees from Berlin, a mother and daughter. There's heat between the German daughter, Rachel, and Joseph, one of the Italians, and there's an attraction between Dorothy, the...",drama
23,"The movie's plot is based on the true story of a group of young computer hackers from Hannover, Germany. In the late 1980s the orphaned Karl Koch invests his heritage in a flat and a home computer. At first he dials up to bulletin boards to discuss conspiracy theories inspired by his favorite novel, R.A. Wilson's ""Illuminatus"", but soon he and his friend David start breaking into government and military computers. Pepe, one of Karl's rather criminal acquaintances senses that there is money in...",thriller
3 ninjas: high noon at mega mountain,"The three unstoppable ninja brothers, Rocky, Colt, and Tum Tum, take a vacation to the Mega Mountain amusement park where they look forward to seeing their favorite TV action superstar, Dave Dragon. While the brothers are enjoying themselves, the evil bandit queen Medusa and her vicious chief henchman, Lothar Zogg, take over the park by force of arms. Medusa demands a ransom of $10 million. Tum Tum spots Dave Dragon being captured. He gets his ninja brothers and they go into action, using their...",action
a bright shining lie," Something in his past keeps career Army man John Paul Vann from advancing past colonel. He views being sent to Vietnam as part of the US military advisory force a stepping stone to promotion. However, he disagrees vocally (and on the record) with the way the war is being run and is forced to leave the military. Returning to Vietnam as a civilian working with the Army, he comes to despise some South Vietnamese officers while he takes charge of some of the U.S. forces and continues his liaisons...",drama
a brooklyn state of mind,"Al Stanco has lived all of his life in Brooklyn and works for the local crime lord. Al becomes friendly with a filmmaker but the relationship is strained when he discovers her true goal is to expose criminal activities. When Al sees the evidence, which implicates his boss in the death of his father a dangerous confrontation ensues.",action
a cool dry place,"A single father balances his work as an attorney with the care of his five year old son and his work as a high school basketball coach in rural Kansas, where he moved after his wife abandoned him in Chicago. Just as he starts to develop a new relationship with a veterinarian's assistant, his ex-wife suddenly reappears and wants to re-assert herself in her husband and son's life. On top of the romantic conflict, he is also suddenly presented with the opportunity of a lifetime to join a major...",drama
a hero never dies," Jack and Martin are members of rival Chinese triads in the middle of a gang war. Both of their gang leaders like to get advice from a fortune teller living in Thailand. On one such trip, Martin's gang ambushes Jack's at a Thai hotel. There is a spectacular shootout, in which both Martin and Jack are severely wounded. The leader of Jack's gang was at the hotel, unlike Martin's, and escapes. Afterwards, both gang leaders, Mr. Fong of Martin's and Mr. Yam of Jack's,...",drama
a kid in aladdin's palace,"Calvin, a young pizza delivery boy, is mistaken for the ""Great Deliverer"" by Aladdin, an eighth century genie imprisoned in a lamp. Thinking that the boy is his only hope for deliverance, the genie lures him back to the eigth century where he must join forces with Ali Baba in order to save Aladdin from the evil hands of Luxor.",family
a knight in camelot,"Yet another variation on Mark Twain's ""A Connecticut Yankee At King Arthur's Court."" Here, a computer malfunction causes a science researcher to be sent back in time with her laptop, which she uses to amaze the court.",comedy
a price above rubies,About a young woman who is married to a devout Jew and the problems that trouble their marriage because of the woman wanting something more out of her life.,drama
a soldier's daughter never cries,"This fictionalized story, based on the family life of writer James Jones, is an emotionless slice-of-life story. Jones here is portrayed as Bill Willis, a former war hero and now successful author who obviously drinks too much and is starting to experience health problems. Living in France with his wife, daughter, and an adopted son, the family travels an unconventional road that leaves all of them as outsiders to others. Preaching a sexual freedom, his daughter's sexual acceptance begins at an...",drama
a true mob story," A low level gangster in Hong Kong gains new respect after saving a boss's life in a gang fight. Despite his wife's death in this attack, he appears to be moving up in the Triad family until he discovers the other bosses are not looking out for him when he is double crossed and the gangster he previously hospitalized in the gang fight comes back for revenge. Written by RandyO ",action
a very unlucky leprechaun,"Nine year old Molly and her father, (Tim Matheson) move to ireland to a house they've inherited nicknamed ""Misfortune Manor"". It brings bad luck to anyone who lives in it, and Molly and her father soon fall victim to the curse: they will lose their new found home unless they can pay the taxes they owe on it.",fantasy
addams family reunion," Gomez and Morticia are horrified to discover that Grandpa and Grandma Addams have a rare disease that is slowly turning them ""normal"". The only chance they have of curing them is to organise a family reunion, hoping that someone knows a home remedy. Unfortunately, due to a printing error, the family arrives at the reunion of an ordinary family named Adams (with one D). While Gomez and Morticia, oblivious to the mistake, search for a cure amongst a family divided by the wish to...",comedy
addicted to murder 2: tainted blood,"New York City is one of the prime breeding grounds for the vampire, a creature that is very selective in whom it chooses to bestow the gift of eternal life. Among the candidates are the twenty-something Tricia, who desires to experience any life but her own; Jonathan, a young vampire with an attitude problem; and, of course, a few serial killer types like Joel Winter, who search for something beyond their psychopathic lives... But there's one problem--a rogue vampire who is...",horror
after life,"Hirokazu Kore-ede’s (Nobody Knows) award-winning film is a warm and inventive story about what matters in the world beyond. At a station somewhere between heaven and earth, the newly dead are greeted by guides that help the dead look through their memories and find the one defining moment of their lives. The guides are then tasked to re-create the past as the dead remember it, so that they may always keep with them their most beloved of remembrances. But what of the mysterious guides and...",drama
air bud: golden receiver,"In this follow-up to last year's comedy Air Bud, Josh Framm's wonder dog Buddy is up to his old tricks when he breaks onto the court of a pro basketball game the Framm family is attending. After seeing Buddy play basketball on TV, two animal ""collectors"" decide he would be the perfect star attraction for their fledgling Moscow circus - and make a plan to kidnap him. For Buddy and his family, that's just the beginning of another adventure filled...",comedy
alice and martin," At the age of 20, Martin leaves his home town and comes to Paris, where he fortunately becomes a model by chance. He meets Alice, his brother's friend, and falls in love with her. They start a passionate relationship, although Martin remains very mysterious about his past and the reasons why he left his family. But when Alice tells him she's pregnant, he is suddenly almost driven to madness, as his past comes back to his mind. Alice will now do anything she can to help him. Written...",drama
alice: through the looking glass," A modern adaptation of the classic children's story 'Alice through the Looking Glass' written by Lewis Carol, which continued on from the popular 'Alice in Wonderland' story. This time Alice is played by the mother, who falls asleep while reading the the bedtime story to her daughter. Walking through the Looking Glass, Alice finds herself in Chessland, a magical and fun world. There she meets the Red and White Queens, as well as many other amusing friends on her...",fantasy
alien abduction,"After a mysterious blackout, a son goes out to investigate and captures footage of actual aliens. When the aliens follow him and his brothers back to their home, all hell breaks lose.",drama
always outnumbered," An ex-con moves to L.A. to find work and creates a disturbance by fighting for a position. More importantly he touches the lives of many of his neighbors including an older man dying of cancer, a young married couple whose husband is too proud to accept a lesser position which causes strife with his wife, and a young boy on the verge of getting in trouble with street gangs. Written by John Sacksteder <[email protected]> ",drama
ambushed,"Jim Natter, the leader of a violent Kuk Klux Klan lodge, is shot dead. His teenage son Eric Natter is found nearby, and taken into police custody for his protection pending the investigation. While four cops drive him to a safe-house, they are ambushed. Three of them shot dead, including Deputy Lawrence, and his black partner Jerry Robinson is accused of the murders.  - Written byKGF Vissers ",thriller
american alien," Baron Dixon has been teased his whole life. He believes, with all his heart, that he really is an alien and that he will soon be leaving Planet Earth. His two best friends - a couple of doped-up, gun loving, outcast hillbillies-believe in Baron. His beautiful girlfriend wants to believe him, but Baron is just too crazy! Soon, they discover that even the impossible is possible and that aliens really do exist! Written by Echelon Studios ",comedy
among giants,"A manager hires Ray, off the books, to paint all the power towers in a 15-mile stretch of high-tension wires outside Sheffield. Ray's crew of men are friends, especially Ray with Steve, a young Romeo. Into the mix comes Gerry, an Australian with a spirit of adventure and mountain climbing skills. She wants a job, and against the others' advice, who don't want a woman on the job, Ray hires her. Then she and Ray fall in love. He asks her to marry him, gives her a ring. Steve's jealous; Ray's...",romance
an alan smithee film: burn hollywood burn,"Filmmaker Alan Smithee finds himself the unwilling puppet of a potentially bad, big budget action film which he proceeds to steal the reels and leave the cast and crew in a frenzy.",comedy
anna magdalena," Scruffy but irresistibly attractive Yau Muk-yan, without a job or a place to live, moves in with sensitive, shy piano tuner Chan Kar-fu. Both are disturbed, then obsessed, by the amateurish piano playing of upstairs neighbour Mok Man-yee. Obsession turns to romance, and romance to fantasy. The film is structured in four ""movements"": two themes (Yau Muk-yan, Mok Man-yee), a duet (Yau Muk-yan & Mok Man-yee), and a set of variations (a wild fantasy of Chan Kar-fu in his new novel)....",comedy
appetite,"One night at the Station Hotel a group of strangers play cards to see who will sleep in hotel room 207 - a room rumoured to be haunted, where you 'dream the dreams of the ones who slept before you...' And in the process learn too much about each other's dark secrets. As their lives tangle in paranoid deadlock, the only escape becomes murder.  - Written bySimon Johnson <[email protected]> ",horror
art museum by the zoo,"Chun-hee (Shim Eun-ha) shoots wedding videos for a living, and secretly loves In-kong (Ahn Sung-ki), an assistant to a senator. He barely looks at her, but anytime she's in the proximity of the man, it's a nightmare. She can hardly speak and her awkward mannerisms are completely exposed. She knows it's an impossible love story, but keeps believing that one day he'll talk to her. Enter Chul-soo (Lee Sung-jae), a soldier on leave who is looking for his girlfriend Da-hye (Song Sun-mi). The only...",romance
avalon: beyond the abyss," An island blows up, and from its remains a black poison fills the ocean. A team of underwater specialists with high-tech gear have to stop the poison before it contaminates the earth, but things get increasingly bizarre the more they investigate. Written by Anonymous ",scifi
baby monitor: sound of fear, A neglectful mother overhears her husband on the telephone at their workplace talking with their babysitter. She discovers they are having an affair and are going to have a baby. She concocts an evil plan to win back her husband and remove the girl and baby. Two men are hired to kill the girl and hold the son hostage in order for her to play the hero and reclaim her husband. The plan hits a snag when the criminals enter the wrong apartment. Written by One of the idiots who went in the wrong...,thriller
babylon 5: the river of souls," Captain Lochley now has solid proof that Garibaldi is a disaster magnet: when he comes to the station to meet with one of his new company's subordinates, she's being sued by the owner of an illegal virtual reality ""holo-brothel"" and besieged by Soul Hunters looking for one of their soul vessels, this one containing the souls of the long-lost Ralga alien species. Written by Jeff Cross <[email protected]> ",action
babylon 5: thirdspace, The crew of Babylon 5 discover a mysterious artifact of unknown origin. The artifact influences the minds of people aboard the station and endangers the lives of everyone aboard. Takes place during season 4 of the Babylon 5 TV series. Written by Darin Adler <[email protected]> ,action
back to even,"When an expert counterfeiter finds himself in debt to a dangerous bookie and on the run from the mob, he races to clear his name and settle the score.",action
bad manners," Wes and Nancy are a married academics couple. One day they host Nancy's long-ago lover Matt and his current sexy girlfriend Kim. Matt is a musician and Kim is a computer specialist who helped Matt to make some discovery in his science. Wes suspects Kim of stealing 50 dollars from him and that starts tension, intrigues, mistrust. Written by Anonymous ",comedy
badmaash," Lalu Seth is a gangster, who carries on his nefarious activities without any fear of the police. Then one day, his men's cross paths with a young man named Gautam Hiraskar, a violent confrontation ensues - and Lalu Seth decides to teach Gautam a lesson and entraps him in a never-ending web of deceit and deception, which results in Gautam running for his life - not only from Lalu Seth's hoodlum's, but also from the police. Written by rAjOo ([email protected]) ",action
bajo california: el límite del tiempo,"Damian is a married artist living in Los Angeles with his wife. After Damian accidentally hits a woman with his car and flees the scene, he seeks atonement and travels alone to Mexico, both to find peace and to reconnect with his family roots. Assisted by local guide Arce, Damian locates his grandmother's resting place and searches for redemption through a long trek in the arid wilderness of his ancestral land.",drama
barney's great adventure: the movie,"While Barney's new movie broadens his horizons and introduces him to new friends, it stays true to Barney's overall theme. Bamey's Great Adventure: The Movie begins with nine-year-old Cody Newton, his little sister Abby and her best-friend Marcella traveling along the highway in their parents' mini-van towards Grandma and Grandpa's farm. Cody is not happy -- a whole week without cable television, marooned with Abby, Marcella and his baby brother, Fig. Of course, Abby and Marcella insist on...",adventure
batman & mr. freeze: subzero," Mr. Freeze is living in the arctic with his cryogenically-frozen wife. When a submarine destroys her containment capsule, he has to find someone to ""donate"" a new heart for her. His search turns up one donor with the right blood type: Barbara (Batgirl) Gordon. Her kidnapping sends Batman and Robin on a hurried chase to free her in time. Written by Michael ""Rabbit"" Hutchison <[email protected]> ",action
baywatch: white thunder at glacier bay," In this wrap-up to the 1997-98 season of Baywatch, L.A. lifeguards Mitch, Cody, and Mitch's son Hobie win a free ocean cruise to Alaska where coincidently lifeguards Neely, Lani and Donna are also along for a photo shoot. Hobie unknowlingly brings along a certain Claire Hodges, who's real name is Leslie Stryker, a professional jewel thief and con artist seeking a way to escape into Alaska with $5 million of stolen emeralds while a ruthless hitman, named Gavin, pursues her. Written...",action
bedrooms and hallways,"At the suggestion of a friend, gay Leo (Kevin McKidd) enters therapy after many failed relationships make him fear for his social life. In a group session (led by Simon Callow), Leo comes clean about his feelings for a straight member of the group (James Purefoy), which leads to an affair between the two. The situation becomes further complicated by the appearance of Leo's high school sweetheart (Jennifer Ehle), who still has feelings for him.",comedy
berkeley square,"Three young women from very different backgrounds meet, become friends and share experiences when they all gain positions as nannies in the wealthy households of London's exclusive Berkeley Square.",drama
best of the best 4: without warning," A group of Russian mobsters have stolen a huge supply of paper for printing U.S. currency, and are now flooding the market with conterfeit bills. When one of the mobsters decides to give herself in and hand over a data CD to the DA, she is shot and killed, but not before handing the disc to an unsuspecting Tommy Lee. Despite working with the police as a martial arts instructor, Lee doesn't go to the cops with the disc, but instead goes on the run, giving the mafia time to kidnap his...",action
billboard dad,"High above Hollywood Mary-Kate andiAshley Olsen are playing Matchmakers! One's a surfer. The other's a high diver. When these two sisters team up to find a new love for their newly single Dad, it's a fun-loving, eye-catching California adventure gone wild. Mary-Kate and Ashley star in this fabulously funny love-struck comedy filled with crazy schemes and cool surprises. Determined to find their Dad, Max, a new love, the girls paint a personal ad on a giant billboard in the heart of Hollywood....",comedy
billy's hollywood screen kiss,"Billy, a struggling young gay photographer (who likes Polaroids), tired of being the ""other man"", falls in love with Gabriel, a waiter and aspiring musician who is probably straight but possibly gay or at least curious. Billy tries to get Gabriel to model for his latest project, a series of remakes of famous Hollywood screen kisses, featuring male couples, while also trying to win his affections.",comedy
bio zombie," Hong Kong's answer to George Romero's Dawn Of The Dead. A soft drink tainted with bio-chemicals has the power to turn people into flesh-eating zombies. A man drinks from the bottle, and wanders into the night. As two young VCD sellers (Woody Invincible and Crazy Bee) from a local mall are returning to the mall with their bosses' car, they hit the man. Unsure of what to do, they bring the man back to the mall with them. The mall closes, and soon there are zombies everywhere! A...",comedy
black cat run," A girl is in love with a gas station attendant and sees him against her father's wishes. The father is the sheriff and shortly after a confrontation with the boy friend, he is killed by escaped convicts and the daughter is kidnapped. Everyone, including the deputy, is convinced that the boy friend committed the murder and ran away with the girl. This sets up a chase of the convicts by the boy friend and of the boy friend by the police. Written by John Sacksteder...",action
black widow escort,"In this adult thriller, psychotic and beautiful killer, Suzanne, is captured after a murderous rampage and dumped in a mental hospital. Her therapist wants her to meet the woman she tried to kill. But they confront each other, the tables are turned and they become victims of the psychotic doctor...  - Written byAnonymous ",thriller
blindness," A blind Asian-American woman lives with her son and daughter-in-law. The two women barely tolerate one another and the son, a doctor simply turns himself off to avoid any confrontation with either. Into this environment, an armed intruder breaks in. He is eventually revealed to be an old family friend who was sent to prison for murdering his father, but he insists that the older woman's husband, now deceased, was the actual murderer. Slowly, all the characters have to explore past hidden...",drama
blood,Kasaki the hitman needs to set scores with his target Ri after the syndicate hunts him and blackmails his childhood friend to kill him.,action
"blood, guts, bullets and octane","A Cherry Pontiac Lemans Convertible...Two Days...Two-Hundred & Fifty Grand. When your lemon lot hits the skids you glom the gig no matter what the smell. For Bob and Sid, two slicked-back burnouts, bum luck runs in spades. With a goose-egg for cash flow and a fore-closure falling fast, they take the gig. The Upside: Fat Cash...The Flipside...Every Thug, Crook, Punk and Mercenary on the planet looking to get rich.",action
