title,plot,genre
venom," International terrorists attempt to kidnap a wealthy couples child. Their plan comes unstuck when, a deadly Black Mamba sent by mistake instead of a harmless snake, escapes,and the terrorists and several hostages are trapped in the boy's London home. A tense evening is had by all as the snake creeps around the house picking off the various characters one by one. Written by R Lindsay ",horror
we're fighting back,A group of city youth decide to form a neighborhood watch and clean their streets and the subway from criminals who rob and abuse the good people every night and day.,action
yesterday," During the Vietnam conflict, a young American Hockey Player, Matthew, goes to college in Canada on a scholarship. There, he meets and falls in love with a beautiful young French-Canadian coed, Gabrielle. After a stupid stunt, Matthew loses his scholarship and is faced with having to return to America where he will become eligible for the draft. His grandfather, having served in the military, encourages him to do the right thing and to do his duty. At first, Matthew is conflicted, staying in...",drama
zombie lake," In a small village, somewhere in France, German soldiers, killed and thrown into the lake by the Resistance during WW II, come back. Written by Denis Ruckebusch <[email protected]> ",horror
"zorro, the gay blade","George Hamilton stars in a dueling dual role as twin sons of the legendary Zorro. Soon after the dashing Don Diego Vega inherits his father's famous sword and costume, a broken ankle prevents the masked avenger from fulfilling his heroic duties. When his flamboyantly fashion-conscious brother assumes the secret identity to continue an ongoing fight for justice, the results are nothing short of hilarious!",action
