title,plot,genre
evidence of blood," When a Pulitzer prize winning author of true crimes returns to his hometown in Georgia, it isn't long before he is involved in a forty year old case of a teenage girl who had been murdered. Together with the daughter of the man convicted of the crime, they find themselves caught up in a conspiracy of devastating proportions... but even more, as the story moves on to its terrifying climax, it also reveals something very personal about his own family. Written by BOB STEBBINS...",drama
expect the unexpected,"In this ""cops and robbers"" film, a raid on a jewelry store staged by a band of amateur hold-up artists goes horribly wrong, leading to a shoot-out. The elite Organized Crime Bureau team, headed by Captain Ching King Gen, is poised to go into action at a moment's notice. Working as a unit, they bring law and order to Hong Kong streets, where they must rely on their courage and skills to survive.",action
exposé," Jason Drake is a reporter who gets an anonymous tip that turns him into an eyewitness to a judge's murder. Separated from his wife Nancy, Jason meets Amber, an intriguing photographer. There is instant heat between them. After a passionate night together, Jason finds a bullet hole in his windshield and a menacing note. As Jason gets increasingly violent death threats, he realizes the judge's killer is after him... Written by Anonymous ",drama
extraordinary visitor," As the new millennium approaches, God considers pulling the plug on the planet unless St. John the Baptist finds a reason to spare humanity. John travels to the Newfoundland city that bears his name where he becomes entangled in the lives of talk-show host Marietta, her husband Rick. Written by Toronto International Film Festival ",comedy
extreme crisis,Hot-headed Hong Kong cop Ken Cheung (Julian Cheung) teams with die-hard Japanese Interpol agent Takami (Kenya Sawada) to stop a ruthless gang of Japanese terrorists. The crime fighters must race to find a hidden time bomb filled with noxious gas that threatens the city -- but first they'll have to survive attacks from vicious terrorist thugs. This action-packed adventure is a directorial debut for renowned action choreographer Bruce Law.,action
falling for a dancer," Romantic drama set in rural Ireland of the 1930s. The story begins when 19-year-old Elizabeth has a brief fling with an actor and falls pregnant. Community pressure forces her to marry a dull middle-aged man, but maybe there is hope on the horizon. Written by Simon Shearn <[email protected]> ",drama
fifteen and pregnant," Based on a true story, 15 year old Tina Spangler discovers she is pregnant. Her choices are abortion, adoption, or a lonely, exhausting life as a single parent. Abandoned by her boyfriend, she turns to her mother. Tina discovers although it has torn her world apart, her pregnancy could re-unite her shattered family and help her find her true purpose in life. Written by Anonymous ",drama
final cut," The film opens with the cast gathering after the funeral of Jude to see a film he had been working on for two years. It turns out that the film is secret videos of all those gathered together in their most despicable moments including thievery, spousal abuse, adultery, etc. The revelations remove the masks from the so-called close friends. Written by John Sacksteder <[email protected]> ",drama
final justice," Gwen (Annette O'Toole) grieves her murdered brother and hopes for justice in court, only to sit helplessly as her brother is defamed by a sleazy attorney (Michael McKean) and the murderer acquitted. Out of desperation she kidnaps the killer to deliver final justice. Written by A. C. Jaggard <[email protected]> ",drama
finding north," Screwball romance involving a woman (Makkena) who gets fired from her job as a bank teller when her friends arrange for a stripper to appear at the bank for her birthday. She then meets a man (Hickey) whom she had earlier seen jump off a bridge and had assumed had committed suicide. With nothing else to do, she follows him to Texas. Along the way she slowly comes to realize he is gay and is despondent over the AIDS-related death of his former lover. Written by John Sacksteder...",comedy
firestorm,"When two forest fires collide, they create a ferocious storm. Howling winds whip the flames into a frenzy, creating massive tornadoes of fire rising up to 600 feet -- becoming so massive that they actually become their own weather system. Parachuting into and fighting these firestorms is a regular occurrence for smokejumper Jesse Graves and his close-knit team. But as Graves again prepares to battle a rampaging blaze, he is unaware that convicted murderer Earl Shaye, posing as a firefighter, is...",thriller
"first love, last rites","Based on a short story by acclaimed author Ian McEwan, Joey (Giovanni Ribisi) and Sissel (Natasha Gregson Wagner) are two misfits falling in love for the first time.",drama
fishing with gandhi," Danno is hitching his way down the California coast, trying to forget his mother's recent marriage to his uncle. He meets Roy and Gil, two truck-driving brothers who are dealing with some pretty severe family inbreeding issues of their own. Written by Gabe Weisert <[email protected]> ",comedy
flowers of shanghai," Shanghai, the 1880s, four elegant brothels (flower houses): each has an auntie (the madam), a courtesan in her prime, older servants, and maturing girls in training. The men gather around tables of food, playing drinking games. An opium pipe is at hand. The women live within dark-paneled walls. The atmosphere is stifling, as if Chekov was in China. The melancholy Wang is Crimson's patron; will he leave her for the younger Jasmin? Emerald schemes to buy her freedom, aided by Luo, a patron....",drama
flypaper,"Greed, lust and fate bring together a motley collection of oddballs and lowlifes for some rather sticky situations in Hoch's twisted neo-noir debut. Three separate but interconnected stories, all set on a deceptively sunny day in California and centered around one million dollars in cash, inspire Hoch's quirky characters to commit acts both devious and depraved in an attempt to make the big score.",comedy
forever fever," Kung Fu meets disco in Singapore. Hock is a grocery clerk longing for a motorbike. He lives with his parents and sister; they idolize his younger brother, Beng, a medical student calling himself Leslie. Hock loves Bruce Lee; he works out and imitates his moves. When Hock sees a cheesy local version of ""Saturday Night Fever,"" he gets the disco bug, taking his pal Mei to nightly lessons in hopes of winning a contest and buying the bike. He's blind to Mei's falling in love...",comedy
free enterprise,"Young filmmakers trying to hawk a movie titled ""Bradykillers"" about a serial killer who goes after victims Marcia, Jan, and Cindy meet their screen idol, William Shatner. The two young men, who idolize him and in their fantasies have seen him as a shadowy fairy godfather figure, are alarmed at the reality of the middle-aged non-Captain Kirk man that they meet.",comedy
freedom deep,"Abandoned at six by his off-kilter parents, Liam pursues his passion for writing, and reaches child-prodigy status while under the roof of a pair of drug-addicted mates, one of whom is a transvestite. The 1998-problem is with the ""creative editing"" of his words. Twenty years later, there's been a global holocaust, and the problem is, simply, getting ANYBODY to see his words.  - Written byKim Williams <[email protected]> ",fantasy
freedom strike,"When a peace treaty between America and Syria is thwarted, the renegade head of the Syrian army retaliates in a major way. He steals a nuclear weapon that only the Freedom Strike team can stop! Cue an action-packed race against time to save the world.  - Written byAnonymous ",action
frogs for snakes,"A group of unemployed theater actors survive by working as illegal money collectors. The loan shark they are working for owns an Off-Broadway theater. As he decided to play ""American Buffalo"" there, a bloody battle for the favorite roles begin.",comedy
from the earth to the moon," Through dramatization, this series relates the story of the conquest of the moon by the Americans, from the Mercury and Gemini projects to the legendary Apollo missions. Written by Steve Richer <[email protected]> ",action
fung wan: hung ba tin ha,"Based on a comic book called Fung Wan (or Tin Ha), the movie stars Ekin Cheng as Wind and Aaron Kwok as Cloud. The plot involves two children, Whispering Wind and Striding Cloud, who become powerful warriors under the evil warlord Conquer's tutelage. They grow up serving as his subordinates, but a love triangle and an accident leads to a quest for retribution.",action
futuresport,"In the not too distant future, a new deadly sport is the only way to stop a war that will kill millions. Fix (Snipes) is the creator of the sport, but the spotlight has always been on Ramzey (Cain), this hothead must use this game to stop the Revolution.",action
gargantua,"Marine biologist Jack Ellway and his son Brandon are drawn to the Polynesian island of Malau to study the effects of recent seismic activity on the area's marine life. Along with the local doctor Alyson Hart, they soon become caught up in the investigation of a series of recent drownings with unexpected results. As Jack explores the surrounding ocean for a mysterious marine creature, Brandon discovers and befriends a three-foot-long baby creature that is able to leave the ocean and walk on...",horror
girl,"Andrea Marr is a bright, straight-A, mature, 18-year-old high school senior on the verge of womanhood who decides to abandon her sheltered, boring lifestyle and her bookish friend Darcy for a look into the local rock and roll scene as a groupie to local rock singer Tod Sparrow and learn more about the life of one who follows a touring band along with her new friends aspiring rock star wannabee Cybil, outgoing fellow groupie Rebecca, and music critic Kevin.",comedy
god said ha!,Julia Sweeney tells the viewers the monologue about the hard time in her life when her brother fought with cancer and she was also diagnosed with a rare form of cancer.,comedy
goodbye lover,"Sandra (Arquette) is carrying on an affair with her husband's brother Ben. When Ben dies mysteriously, a cynical police detective must investigate a sleazy web of deceit. Goodbye Lover"" is a wry look at life, a thriller filled with an enjoyable gallery of characters who aren't quite what they seem and have learned not to seem quite what they are.",comedy
"goodbye, 20th century","Goodbye, 20th Century! opens in the year 2019, where war has left the world barren and devastated. Kuzman (Nikola Ristanovski) has been sentenced to death for blasphemy (the superstitious among his people believe his verbal outbursts may have brought a disease to the community), but he somehow survives his execution and has a series of strange adventures and sexual escapades. Meanwhile in the year 1999, people are celebrating New Year's Eve as a downcast gentleman in a Santa Claus outfit...",adventure
ground control,"Jack Harris was the best air traffic controller in the business, until one plane crash cost him everything. His personal and professional fortunes wiped out, the only thing Jack has left is the haunting memory of the pilot's last words.",action
gunda,"Shankar, a coolie, comes in the way of the bad guys, Bulla and his cronies. They kill his father and sister. Shankar vows revenge and eliminates all of them in bizarre and gruesome fashion.",action
gunslinger's revenge," The idealistic lifestyle of an old West farmer, his Indian wife and half-breed son, who narrates the tale, is disrupted when his grandfather, an old gunslinger, shows up on the farm. Although looking to retire, the family is not happy with his return, given his past lifestyle and mistreatment of his family. Things get worse when another gunfighter shows up and terrorizes the town, trying to force the father into a gun fight. Written by John Sacksteder <[email protected]> ",comedy
half a chance,"Alice Tomaso (Paradis) gets out of jail, and goes looking for Léo (Belmondo) and Julien (Delon), one of whom, it appears, is her father. On the way, she steals the wrong car - one belonging to the Russian mafia, and arrives at her destination with a gang of thugs out looking for her and the car.",action
hamilton,"Swedish agent Carl Hamilton (Peter Stormare) and Finnish Åke Stålhandske (Mats Långbacka) are ordered to stop Russian smugglers. The smuggled goods is a nuclear missile. It's an SS 20, 1,5 megatons, ""enough to turn Paris, Washington or New York to ashes"". The American villain is Mike Hawkins (Mark Hamill).",action
hamish macbeth," Hamish Macbeth is a police constable in the small Scottish town of Lochdubh, who occasionally bends the rules when it suits him or when it can help some of his fellow eccentric townsfolk. Based on characters created by M.C. Beaton, from her series of mystery novels. Written by Alexander Lum <[email protected]> ",comedy
haunted mansion,"Married couple Gigi (Gigi Lai) and Fai (Anthony Wong) find themselves heading home to Gigi’s mother’s Yuen Long estate, instead of Japan as intended, for their annual vacation, as shifty property developers have been trying to oust Mum (Helena Law) and sister Fen (Shirley Cheung) from the family home. While Gigi struggles with mysterious stomach cramps, Fai and Fen have their own share of hassles with ghosts and ghostly possession.",drama
hazaar chaurasi ki maa," Dibyanath Chatterji, his bank-employed wife, Sujata, and only child, a son, Brati, live a middle-class existence in Calcutta, West Bengal, India, circa early 1970s. Sujata is a quiet, devout Hindu, religious, and compassionate woman, and Brati has finished his school and is now attending college. His parents are proud of him, and keep track of his progress. Then their world is shattered during the early hours, when they are informed by the police that Brati has been killed. Dibyanath and...",drama
head on,"Nineteen years old. A little confused. Very pissed off. Ari jams all his energy and defiance, pain and joy into one high velocity night of dancing, sex and drugs. He's running Head On in his own kind of freedom.",drama
hell mountain," In an apocalyptical future, the world is completely destroyed and ruled by the tyrannical Stryker. He controls the unique source of food and uses young women as slaves to explore the mines in the Hell Mountain. When he abducts Shira, her lover Kal meets with the last professor on earth, Garrett, who helps him to rescue Shira. Written by Claudio Carvalho, Rio de Janeiro, Brazil ",action
hell's kitchen," When a robbery goes awry, the bandits all end up in a puddle of blood and only one lives and goes to jail for five years. Upon his release, the girlfriend wants her new boyfriend to kill him. Only trouble is the boyfriend knows that the fault was not the ex-con's and can't bring himself to do the town. Meanwhile, the ex-con tries to turn his life around by becoming a boxer and training under a former heavyweight contender. Written by John Sacksteder...",drama
hercules and xena - the animated movie: the battle for mount olympus," Mighty Zeus brings Hercules' mother, Alcmene, to Mount Olympus, and Hercules, believing she has been kidnapped, leads a rescue mission to save her. Zeus' jealous wife, Hera, decides that it should now be her time to rule the universe. Hera steals the Chronos Stone, source of the God's power, and unleashes the four Titans from their eons of imprisonment. With these angry behemoths on the loose, only the combined forces of Hercules and Xena, together with their trusty sidekicks...",action
hersey çok güzel olacak,"When Altan swipes prescription drugs from his brother Nuri's pharmacy, they soon find themselves on a dangerous but funny road trip to get rid of the stuff and escape the mafiosi Altan tried to double-cross. Along the way, the brother who are compete opposites finally bond.",comedy
hi-lo country,"THE HI-LO COUNTRY recounts the enduring bond of friendship, one of common values and easy rapport, between two hard-living men ... and how that friendship would come to be challenged by the two men's passionate desires for the same woman.",drama
hideous kinky,"In 1972, disenchanted about the dreary conventions of English life, 25-year-old Julia heads for Morocco with her daughters, six-year-old Lucy and precocious eight-year-old Bea.",drama
his bodyguard," A deaf man working at his father's high tech chemical engineering firm witnesses criminals fleeing from the firm's headquarters just after they've stolen an ultra-valuable experimental migraine cure. A female security officer is assigned to protect him, and as she does, the two fall for each other. Written by Kristiina ",thriller
holy man,"In the new film, Holy Man, Murphy plays ""G,"" an inspirational guru who hilariously personifies the message that in today's world, shopping via television is, for many people, a religious experience. Once he gets off the streets and on the air, ""G"" proves to be an over-the-top marketing genius. He takes a cable shopping network, and then the country, by storm, while at the same time helping to heal the soul of the jaded television executive (Goldblum) who got him on TV in the first place.",comedy
homegrown,"Jack, Carter, and Harlan are journeymen practitioners of their craft in a world that just doesn't appreciate fine craftsmanship anymore. The craft they just happen to be plying is pot farming and they are seasoned experts at it. The three inept but lovable farmers go about their merry work until the day they witness the murder of their boss, the plantation owner, by a mysterious assailant. After a moment of panic, the naive trio decides to take over the business themselves. However, their lazy...",comedy
homo heights,"Gay guru and fading icon Malcolm wants to escape from Homo Heights town, which is ruled by drag queen and leader of gay mafia Maria Callous.",comedy
horatio hornblower: the fire ship," Still serving aboard the HMS Indefatigable, Horatio Hornblower has been promoted to acting Lieutenant. Neutral Spain has concluded a peace treaty with France and the British now have another enemy to face. They soon come across a sunken British supply ship and rescue its Captain, 'Dreadnought' Foster, a man with a reputation for bravery that some consider borders on foolishness. Hornblower is also pleased to learn that Captain Pellew has scheduled him for the next round of...",adventure
hornblower: episode 1: the even chance," Midshipman Horatio Hornblower joins the British fleet just as the French Revolution is about to change European history. But he has worries closer to home as he incurs the wrath of a shipmate named Simpson, a bully who everyone else avoids and placates. Events lead to a duel, but one of Hornblower's mates takes his place and is killed. At war with France, Hornblower and Simpson are assigned different ships, but are reunited when Simpson's ship is sunk. Events lead to another duel...",adventure
hot blooded,"College boy Trent is returning home for the holidays when he crosses the path of bad-girl Miya at a truck stop. When he agrees to give her a ride, he becomes part and parcel to all her twisted desires.",thriller
hot war,"Blue, Tango, and C.S. are CIA research scientists working on Project VR Fighter, which is designed to train any unskilled person into a magnificent combat agent. Tango and C.S. decide to undergo the training themselves, because Alien, the international terrorist, has killed C.S.’s fiancée and kidnapped Blue for his conspiracy. However, the side effects of Project VR Fighter cause problems between the two friends and their mission is soon put into jeopardy.",thriller
hotel room,"The coincidence cross fates of five characters in a hotel room in New York. A newlyweds couples discussing, a touring magician requesting the services of a prostitute, a voyeur photographer that is silent witness to the fight of a couple on the street and a journalist who is going to kill himself because he made public his penchant for crossdressing.",comedy
how stella got her groove back,"Stella(Angela Basset),at age 40 seems to have it all: a great job as a high-powered, high-salaried stock broker, a beautiful home overlooking San Francisco, and a bright, loving young son. She is a dedicated single mother, and a devoted sister and friend. But she's lost her groove. For what seems like forever, Stella has forgotten to have fun ... to take chances. But Stella's vivacious friend, Delilah(Whoopi), has the antidote for Stella's rut - a vacation to the golden, sun-kissed beaches of...",romance
hurlyburly,"Based on a play by David Rabe, Hurlyburly is about the intersecting lives of several Hollywood players and wannabes, whose dysfunctional personal lives are more interesting than anything they're peddling to the studios.",comedy
i got the hook up," Two broke buddies feel lucky when they come upon a truckload of cellular phones and begin selling them out of the back of their van. Trouble arises though, when the phones develop faults. The two friends then not only have to deal with unsatisfied customers but also the FBI. Written by Guy Johns ",comedy
i think i do,"Screwball comedy with a modern twist; instead of Kate Hepburn and Cary Grant, it's Cary Grant and Jimmy Stewart. Two college roommates (victims of a mutually unrequited love) meet up again five years after school at their housemate's wedding. With the introduction of a Bellamy-esque soap star, the sparks, sexual and verbal, start to fly, as the ex-roommates try to navigate their new romance.  - Written byStrand Releasing...",comedy
i'll be home for christmas,"Jake Wilkinson (Jonathan Taylor Thomas) is a self-absorbed college student, who, just days before Christmas awakens to find himself stranded in the middle of the California desert - wearing a Santa suit and a white beard glued to his face.The butt of a pay-back by the football team who thinks he double-crossed them by not providing the correct answers to a finals exam, Jake has to find a way to get to New York by 6:00 p.m. on Christmas Eve - and catch up with his girlfriend Allie (Jessica...",comedy
i'm losing you," A melodrama of a wealthy Los Angeles family - and the journey each one begins after a death in the family. The title of the film refers not only to the loss of life and love, but to a phrase used by most Angelenos while talking on cellular phones; I'm Losing You... ""I'm Losing You"" follows the path of each character after a cataclysmic event: the death of Bertie's young daughter Tiffany, in an ""accident"". The family comes closer together in the wake of such...",drama
i've been waiting for you," When a California teen with an interest in the occult moves to a New England town, she finds that the town teens believe she is a witch sent to seek revenge on the descendants of the people who originally killed another witch a hundred years earlier. Things take a particularly deadly turn when they convince her to play a seer at a Halloween party where they will feed her information over an earphone about those who enter her tent, only she suddenly sees things beyond their knowledge or help. ...",horror
il fantasma dell'opera,"Gory remake of the Gaston Leroux classic story, only this time, the phantom is not disfigured, but a man who was raised by rats deep under the Paris Opera House.",horror
in god's hands,"Three thrill-seeking adventurers, best friends and world-class surfers who are committed to each other and to following their instincts as they follow the waves, set out on a journey that will take them to the depths of the ocean and the depths of their souls. Along the way, they will form the kind of bond that only those who have faced joy, death and delirium together can.",action
in the doghouse,"A family dog is pushed into show business and into taking on the role of breadwinner, as the man of the house loses his job and takes the dog to auditions secretly while his family is unaware of this unemployment.",family
indiscreet," A multi-millionaire client of a detective agency hires an investigator to get dirt on his wife, so he can divorce her. What the investigator finds instead is that the wife takes care of her elderly mother, likes to drink a little too much, and skinny dips in the ocean. He also sees that she is physically abused and when she apparently is going to attempt to drown herself, he dives in and saves her setting off a romantic coupling that innocently moves him unknowingly as the chief suspect in the...",thriller
ivory tower,"In the cutthroat environment of the computer industry, a young executive's passion, determination and integrity are put to the test.",drama
jaane jigar," Ravi and Vijay's friendship was an example by itself. One was Life-Jaan, the other Jigar-Courage, the famous singer Ravi Kumar and the daring Vijay Kumar. Vijay's mother looked after Ravi since his childhood; as such Ravi's life is indebted to them. It was said that nobody could separate the two friends. Vijay's father was died when he was very young and till today his mother had not told him that the reason for his father's death was Jaikishan who is hiding from...",comedy
jeff foxworthy: totally committed,"Comedian Jeff Foxworthy shot to national fame with his hilarious stand-up routine, ""You Know You're a Redneck If ..."" Part outrageous humor, part social commentary, Foxworthy's redneck routines are spot-on send-ups of American Southern culture. In ""Totally Committed,"" originally aired as an HBO special, the comedian gamely tackles the subjects of baldness, marriage, commemorative plates and more.",comedy
