title,plot,genre
the big lebowski,"Jeff Lebowski (Jeff Bridges) is the victim of mistaken identity. Two thugs break into his apartment in the errant belief that they are accosting Jeff Lebowski, the Pasadena millionaire--not the laid-back, unemployed, `stuck in the 70s' Jeff Lebowski who calls himself the Dude. The Dude's first mistake is paying a visit to his wealthy namesake in the hopes of getting a replacement for his soiled carpet. But instead of a Persian loaner, our reluctant hero and his buddy Walter (John...",comedy
saving private ryan,"Following the Allied invasion of Normandy, two brothers lay dead in the wake of the onslaught. Meanwhile, in New Guinea, a third brother has been killed fighting the Japanese. After the Army General Staff learns that a fourth brother is missing in the French countryside, a rescue mission is ordered to find the young soldier and return him safely home. The mission is mounted by a veteran Ranger Captain commanding a platoon of men who have mixed feelings about risking their lives to ""Save Private...",action
there's something about mary,"Having never fully recovered from a prom date,a man finally gets a chance to reunite with his old prom date, only to run up against other suitors including the detective he hired to find her.",comedy
the parent trap,"Hallie (Lindsay Lohan) is growing up in Napa Valley with her vineyard-owner father, Nick Parker (Dennis Quaid). Annie (also Lindsay Lohan) is raised in fashionable London by her mother, Elizabeth James (Natasha Richardson), a renowned wedding gown designer. Unaware of each other's existence, fate intervenes when the girls coincidentally meet at summer camp in Maine. Eager to meet their respective parents, the girls devise a scheme to switch places and ultimately, reunite their mom and dad....",adventure
the truman show,"Truman's life is entirely make-believe. He was adopted by a media corporation when he was a baby and, since then, his entire life has been a set-up for the most popular television show of all time.While Truman thinks that he is an ordinary man with an ordinary life, he has no idea that everything around him is the set of a television show and that he has no idea about the world outside.",drama
meet joe black,"The charmed life and orderly household of media tycoon William Parrish (Anthony Hopkins) are suddenly disrupted by the arrival of enigmantic young Joe Black (Brad Pitt) who falls in love with Parrish's beautiful daughter Susan (Claire Forlani).For Parrish, Susan and the rest of the family, the consequences of this romance are profound, complicated and bittersweet, for Joe Black is actually the personification of Death -- come to call on Parish.",drama
blade,"When Blade's mother was bitten by a vampire during pregnancy, she did not know that she gave her son a special gift while dying: All the good vampire attributes in combination with the best human skills. Blade grew up to be a vampire hunter for revenge on his mother's death. The vampires, who managed to infiltrate nearly every major organization, need Blade's very special blood to summon La Magra, the blood god, in order to reign over the human cattle, as they call us.",action
armageddon,"An asteroid the size of Texas is heading directly toward Earth at 22,000 mph. NASA's executive director, Dan Truman, has only one option - to send up a crew to destroy the asteroid. He enlists the help of Harry S. Stamper (BRUCE WILLIS) - the world's foremost deep core oil driller - and Stamper's roughneck team of drillers to land on the asteroid, drill into its surface, and drop a nuclear device into the core. On this heroic journey, they face the most physically and emotionally challenging...",action
the thin red line,"A group of men, an Army Rifle company called C-for-Charlie, change, suffer and ultimately make essential discoveries about themselves during the fierce World War II battle of Guadalcanal.",drama
half baked,"Politically incorrect at every turn, Half Baked has all the ingredients of classic, toked-out cinema: bad language, smoking and inhaling controlled substances, tasteless humor, dimwitted young men, gratuitous nudity, celebrity cameos and questionable methods of raising large sums of cash quickly. It's a recipe that will appeal to audiences beyond the short-term memory impaired.",comedy
godzilla,"A devastating, blinding flash of white light fills the Eastern sky. Thousands of miles away, the Pacific Ocean churns, engulfing a freighter with wicked speed. Ships off both U.S. coasts capsize and are dragged into an inexplicably roiling sea. On another part of the globe, giant footprints plow an ominous path through miles of Panamanian forests, Tahitian villages and Jamaican beaches. What is the source of all this mysterious, far-flung mayhem? Godzilla, the undisputed king of movie monsters,...",action
the wedding singer,"Robbie Hart (Adam Sandler) is an aspiring musician with dreams of being a songwriter. When he is dumped at the altar, he retreats into his art -- as a Wedding Singer -- systematically destroying the newlyweds' perfect day. He has become the worst wedding singer in the world.When he finally falls for his friend and fellow wedding singer, Julia (Drew Barrymore), he finds out that her fiance is a two-timing creep. Will Robbie be able to convince her that her fiance is a big mistake before it's...",comedy
the man in the iron mask,"It has been many years since Aramis, Athos, Porthos and d'Artagnan fought together as the bravest and best of the King's Royal Guards, the Musketeers. Athos (John Malkovich) lives a simple life raising his son Raoul. Porthos (Gerard Depardieu), though thicker and older, still eats lustily of life, though he misses the great battles of the past. Aramis (Jeremy Irons) has followed his faith and become a priest. Only d'Artagnan still serves the King as Captain of the Musketeers. It is 1660 and...",action
fear and loathing in las vegas,"Sportswriter Raoul Duke (Johnny Depp) and his corpulent Samoan attorney, Dr. Gonzo (Benicio Del Toro) head for Las Vegas with a load of mind-bending pharmaceuticals and herbal remedies - on a savage journey to the heart of the American Dream.Duke may call it an assignment. Gonzo may believe it's a sacred mission to protect his client. Whatever ""it"" is, it's moving, and fast.",adventure
the avengers,"John Steed (Fiennes) has been called by The Ministry (Britain's ultra-top-secret secret agency) to investigate some very strange goings-on in Her Majesty's kingdom. The weather seems out of control, foul, deadly - even for England. Freak snowstorms, hail of Old Testament proportions, temperatures wildly fluctuating from blast furnace to arctic. Someone is out to control the weather, literally, and bring the country and the world to its knees. Who could master such a plan, such a brilliant and...",action
the waterboy,"Bobby Boucher (Adam Sandler), a socially inept 31-year-old from the swamps of Louisiana, is home schooled and sheltered by his over-protective Mama (Kathy Bates). His only contact with society is his waterboy job for a college team where the players relentlessly make fun of him, and his coach doesn't let him fight back. This all changes when Bobby gets a new coach (Henry Winkler) who lets him stand up for himself. Bobby finally unleashes years of pent up rage and is transformed into the most...",comedy
deep impact,Fourteen-year-old Leo Beiderman (Elijah Wood) did not expect to make an earth-shattering discovery when he joined his high school astronomy club. He didn't expect to make any discoveries at all; he simply hoped that classmate Sarah Hotchner (Leelee Sobieski) would discover him. Yet a photograph he takes through his small telescope makes him co-discoverer of Comet Wolf-Beiderman ... a comet that scientists determine is on a fatal collision course with the Earth. In the weeks and months that...,action
lost in space,"Packed with more than 750 state-of-the-art special effects, including exploding planets, talking robots and spaceship dogfights, one of the best-loved television series of the 1960s becomes New Line Cinema's most ambitious and eagerly anticipated presentation to date, Lost In Space.",action
the mask of zorro,"In early 19th century Mexico the masked swordsman hero Zorro was a champion of the people against the tyranny of Spanish rule, represented by the ruthless Governor Montero. Unfortunately, on the eve of his greatest triumph, the liberation of Mexico, Montero learns of Zorro's secret identity as Don Diego de la Vega and attacks the rebel in his home leaving him imprisoned, his wife dead and his daughter abducted to be claimed as the child of Montero. Twenty years pass, and Montero returns to...",action
the faculty,"Like so many schools today, Herrington High has passed its prime. Its walls are grimy, its textbooks out-dated, its teachers burned out. There's no money for field trips, new computers or the drama department's musical. Yet its crumbling corridors vibrate with the future of America - loners, leaders, hipsters, nerds, brains and jocks. Like teenagers everywhere, they struggle with parents who don't get it, teachers who never had it and hormones that won't quit. But the students of Herrington...",horror
bride of chucky,"Serial killer Charles Lee Ray is back! This time his girlfriend Tiffany has revived him, once again in the form of the popular ""Chucky"" doll. Shortly after the ""happy"" couple's reunion, Chucky kills her and brings her back in the form of a girl's bridal doll. The two then embark on a killing spree en route to dig up Ray's corpse, which was buried with a Satanic voodoo charm capable of bringing back the dead.",comedy
can't hardly wait,"Now that the graduation ceremony is over at Huntington Hills High, it's time for the real festivities to begin at the graduation party, where an assortment of jocks, geeks, prom queens, bimbos, headbangers and misfits will unload four years' worth of emotional baggage. Aspiring writer Preston Meyers (Embry) has been in love with beautiful class knockout Amanda Beckett (Hewitt) since the first time he laid eyes on her during their freshman year. His tormented infatuation with Amanda has...",comedy
elizabeth,"In England, 1554, Queen Mary (Kathy Burke) dies and young Elizabeth (Cate Blanchett), her youngest half-sister is proclaimed Queen. Elizabeth must address grave problems that face England, including Bankruptcy, French aggression and the political correctness of her love life.While learning the ways of the monarchy, Elizabeth must walk a fine political line and use an appropriate amount of ferocity to establish herself firmly in the throne. In the end, Elizabeth emerges as the legendary Virgin...",drama
shakespeare in love,"It is the summer of 1593, and the rising young star of London's theater scene, Will Shakespeare (Joseph Fiennes), faces a scourge like no other: a paralyzing bout of writer's block. What Will needs is a muse - and in an extraordinary moment in which life imitates art, he finds and falls for a woman who draws him into his own dramatic adventure of star-crossed love.It all begins when Lady Viola (Gwyneth Paltrow), desperate to become an actor at a time when women were forbidden from such...",comedy
mercury rising,"FBI agent Art Jeffries (Bruce Willis) is despondent and without hope, teetering on the verge of a nervous breakdown. But when he is assigned to investigate the disappearance of a nine-year-old autistic child who's parents have been mysteriously slain, he unknowingly stumbles into a situation that is anything but routine. While exploring the scene of the murders at a modest Chicago home, Jeffries discovers the missing boy hidden in a crawl space. The autistic child, Simon (Miko Hughes), is...",action
practical magic,"Sally (Sandra Bullock) and Gillian (Nicole Kidman) Owens have always known they were different. Raised by their aunts after their parents' death, the sisters grew up in a household that was anything but typical-rules were for other people. Attempting to pass on the unique and powerful psychic heritage of the Owens women, Aunt Jet (Dianne Wiest) and Aunt Frances (Stockard Channing) hope to give their nieces the strength that comes from the use of practical magic. But the invocation of the Owens'...",comedy
ever after,"With the sudden death of her loving father, Danielle is made a servant by her new stepmother. She also has two new stepsisters, one quite kind but the other one really horrid. Still, Danielle grows up to be a happy and strong-willed young lady, and one day her path crosses that of handsome Prince Henry, who has troubles of his own at home. Luckily the nice Leonardo da Vinci is on hand to help all round.",comedy
rush hour,"Jackie Chan is Inspector Lee, a Hong Kong Detective who helps confiscate millions of dollars worth of stolen Chinese artifacts from Crime Lord Juntao. Seeking revenge, Juntao kidnaps the eleven year old daughter of the Chinese consul when he moves to America. Chan is sent as a diplomatic advisor and finds himself paired up with a Los Angeles cop (Chris Tucker) - a man who works alone, and wants to stay that way.",action
you've got mail,"Once upon a time there were two book store owners. One was a passionate young woman who ran a small children's book store. The other was the owner of Manhattan's largest book superchain, a man whose enterprise could put every independent book store out of business. The man and the woman were natural enemies. But when they coincidentally - and anonymously - met in cyberspace, they accidentally fell in love.",comedy
psycho,"Marion Crane (Anne Heche) is a Phoenix, Arizona working girl fed up with having to sneak away during lunch breaks to meet her lover, Sam Loomis (Viggo MOrtensen), who cannot get married because most of his money goes towards alimony. One Friday, Marion's employer asks her to take $400,000 in cash to a local bank for deposit. Desperate to make a change in her life, she impulsively leaves town with the money, determined to start a new life with Sam in California.As night falls and a torrential...",horror
what dreams may come,"For those who believe in eternal love, no explanation is necessary; for those who do not, no explanation is possible. For Chris Nielsen (Robin Williams), his love for his wife Annie (Annabella Sciorra) defines the core of his being and completes his very soul. When they met, they were conjoined as soul mates in a divine love to exist no longer as two, but as one. If Destiny decrees that Chris must journey to the very depths of Hell to be with her, then he will... and he does!",drama
lethal weapon 4,"In Lethal Weapon 4, the quartet is joined by junior detective Lee Butters (actor, comedian Chris Rock), as the team struggles to unravel a series of crimes involving immigrant smuggling and counterfeiting. Their leads converge on a man named Wah Sing Ku (Chinese action star Jet Li), a fiercely disciplined Asian Triad princeling bent on a complex and deadly mission.",action
u.s. marshals,A ruthless and mysterious assassin (WESLEY SNIPES) is on the run from the law while trying to discover who implicated him in two murders in New York City.,action
rushmore,"Max Fischer (Jason Schwartzman) is a 10th grader at Rushmore Academy who is currently: editor of the school newspaper and yearbook; president of the French Club, German Club, Chess Club, Astronomy Club; captain of the fencing and debate teams; founder of the Double-team Dodgeball Society; and director of the Max Fischer Players, for whom he writes and produces plays about police corruption, inner-city violence, war, etc. He is applying for early admission to Oxford. (Harvard is his safety.) He...",comedy
pleasantville,"David Wagner (Tobey Maguire) is a Nineties kid with a Fifties addiction. He's hooked on reruns of a classic television show called ""Pleasantville,"" set in a simple place where everyone is swell and perky. David immerses himself in ""Pleasantville"" as an innocent escape from the trouble-plagued real world that he must share with his ultra-hip, totally popular twin sister, Jennifer (Reese Witherspoon). But one evening, life takes a bizarre twist when a peculiar repairman (Don Knotts) gives him a...",comedy
sliding doors,"Gwyneth Paltrow plays London publicist Helen, effortlessly sliding between parallel storylines that show what happens if she does or does not catch a train back to her apartment. Love. Romantic entanglements. Deception. Trust. Friendship. Comedy. All come into focus as the two stories shift back and forth, overlap and surprisingly converge.",comedy
stepmom,"Isabel (Julia Roberts) is a career-minded fashion photographer forced into a role as unwelcome stepmother to her boyfriend Luke's (Ed Harris) two children-12-year-old Anna (Jena Malone) and seven-year-old Ben (Liam Aiken). When Jackie (Susan Sarandon)-the 'natural' mother and peerless supermom who not only resents Isabel's intrusion on a number of levels but is fiercely devoted to her kids-enters the mix, the often comical, always complex interplay between parents, stepparents, stepchildren,...",comedy
small soldiers,"In the small suburban town of Winslow Corners, Ohio, life is quiet, people are friendly, and action figures are only toys. Then again, dont judge an action figure by its box. Meet the Commado Elite action figures with an attitude. To them, everything else is just a toy. . . including the unsuspecting suburbanites of Winslow Corners, who have somehow found themselves allied with the Commandos sworn enemies, the Gorgonites. The monstrous-looking, but noble Gorgonites want only to hide from the...",action
species ii,"The son of a senator and the first man on Mars, Patrick Ross (Justin Lazard) returns home a hero, a champion and a carrier of the deadliest DNA in the universe. Something is taking over his body, a strain of alien DNA that has been to earth before. Now, the only chance for the human race is the woman who tried to destroy it (Natasha Henstridge). Dr. Laura Baker (Marg Helgenberger) has recreated the alien species from a frozen lab embryo that is identical to Sil in every respect except that...",action
great expectations,"Loosely based on the Charles Dickens' classic novel, Great Expectations is a sensual tale of a young man's unforgettable passage into manhood, and the three individuals who will undeniably change his life forever. Through the surprising interactions of these vivid characters,Great Expectations takes a unique and contemporary look at life's great coincidences.",drama
enemy of the state,"A chance encounter with an old friend destroys attorney Robert Clayton Dean's (Will Smith) fast-track career and happy home life when he is framed for murder by a corrupt intelligence official. As an administrator on loan from the State Department to the National Security Agency, Thomas Brian Reynolds (Jon Voight) appropriates the vast resources of his department to commit the perfect crime and conceal a political cover up of immense proportions. Dean's only hope to reclaim his life and prove...",action
out of sight,"Jack Foley is the most successful bank robber in the history of the country. In two decades, he has robbed more banks than anyone in the FBI's computer. The only problem is that he keeps getting caught. A 3-time loser, looking at over 30 years of jail time, he is determined to get out and stay out.But on the day he busts out of jail, he finds himsel stealing something far more precious than money or diamonds -- the heart of Karen Sisco, a Federal Marshal.Now, with Jack attempting the...",comedy
"six days, seven nights","He's a cargo pilot who is heading up another carefree, easy-money plane trip from one island to the next. She's a New York magazine editor who has planned a relaxing holiday in a tropical wonderland. However, nature plots a decidedly different course for these two when an unexpected storm squall forces them to crash land on an uncharted island. With no plane, no communication and no patience for each other, neither is prepared for the exhausting, exhilarating adventure that awaits them in...",action
pi,Max is a genius mathematician who built a supercomputer that provides the key for understanding all existence. Representatives from a Hasidic cabalistic sect and high-powered Wall Street firm hear of the secret and attempt to seduce him.,drama
ronin,"Six strangers, experts in munitions, surveillance and covert operations, meet in a musty warehouse in the heart of Paris. Field soldiers during the Cold War, some hold dark secrets that could topple governments. Sam (Robert De Niro), an American, is well-versed in the language of weapons and the strategy of battle. Also present are driver Larry (Skipp Sudduth), also an American, English weapons specialist Spence (Sean Bean), Eastern Bloc electronics specialist Gregor (Stellan Skarsgard),...",action
the horse whisperer,"14-year-old Grace MacLean (Scarlett Johansson) is emotionally and physically scarred after suffering a terrible riding accident while astride her prized horse, Pilgrim. Realizing that the fates of her daughter and the horse are inextricably linked, Grace's mother, Annie (Kristin Scott Thomas), launches an all-out campaign to find a ""horse whisperer,"" someone with a unique gift for curing troubled horses. She learns of Tom Booker (Robert Redford) known to be a legend for this sort of work and...",drama
the negotiator,"Expert hostage negotiator Danny Roman (Samuel L. Jackson) has just become a hostage-taker. His world has been destroyed by false allegations of murder and embezzlement. His hostage gambit is carefully orchestrated because he knows that people listen when lives are at stake.Roman requests Chris Sabian (Kevin Spacey), a respected negotiator from another precinct, be brought in to mediate the crisis. Sabian squares off with his formidable opponent, a man he knows only by reputation, as he...",action
urban legend,"Everybody's heard them... yet they have no traceable source. There's no proof they really happened... yet they can't necessarily be proven false. They're urban legends, contemporary tall tales and bits of macabre mythology that emerge from the underground and take on colorful lives of their own. Like a virus they spread quickly, develop a stubborn staying power as they are passed by whisper from person to person, then come to rest firmly wedged in our collective consciousness. Did Mikey from...",horror
deep rising,"In the South China Sea, gruesome creatures surface from the deep to attack and cannibalize the passengers on a luxury cruise liner. Few survivors remain when resourceful mercenary John J. Finnegan (Treat Williams), his mechanic (Kevin J. O'Connor) and first mate (Una Damon) moore their vessel alongside this luxury liner.When they board the liner, they discover gruesome evidence that something hideous has attacked the ship. The decks are pooled with blood. The air is thick with a deafening...",action
strangeland,"15 year-old Genevieve (Linda Cardellini) and her friend Tiana (Amal Rhoe) disappear after going to a party to meet up with Captain Howdy (Dee Snider), an electronic ""pen-pal"" that she met in a chat-room. Genevieve's father, Detective Mike Gage (Kevin Gage) and a maverick young juvenile patrol cop, Steve Christianson (Brett Harrellson), form an unlikely alliance as they launch an investigation.When Tiana turns up dead in the trunk of her car, brutally tortured, Gage and Christian delve into a...",horror
baseketball,"Two losers from Milwaukee, Coop & Remer (Parker & Stone), invent a new game playing basketball, using baseball rules. When the game becomes a huge success, they, along with a billionaire's help, form the Professional Baseketball League where everyone gets the same pay and no team can change cities. Coop & Remer's team, the Milwaukee Beers is the only team standing in the way of major rule changes that the owner of the Dallas Felons (Vaughn) wants to institute.",comedy
happiness,"When a woman breaks up with her current overweight boyfriend, he places a curse on her and her extended family. The sister's husband falls for his 11 year old son's male classmates, and her parents 40 years marriage falls apart when dad moves to Florida.",comedy
star trek: insurrection,"Lt. Cmdr. Data, on a mission to observe the race of Ba'ku, suddenly behaves as if having to fear for his existance. The peaceful Ba'ku, whose planet offers regenerative radiation and therefore incredible lifespans, live in harmony with nature and reject any kind of technology. Their planet and their culture is studied by the starfleet and the associated Son'a - in secrecy. But the So'na, lead by Ru'afo, intend to abduct the Ba'ku in order to take the planet for themselves and for the starfleet...",action
hope floats,"Birdee Pruitt(Sandra Bullock) seems to have it all. She's been married for years to her handsome high school sweetheart, and has a brilliant and sensitive child. But when her picture perfect life comes crashing down around her, Birdee must start over. With no place else to turn, the former beauty queen, along with daughter Bernice (Mae Whitman), heads back home ... to Smithville, Texas. There Birdee's life becomes even more complicated as she tries to deal with a mother (Gene Rowlands) she must...",drama
run lola run,"Lola receives a phone call from her boyfriend Manny. He lost 100,000 DM in a subway train that belongs to a very bad guy. She has 20 minutes to raise this amount and meet Manny. Otherwise, he will rob a store to get the money. Three different alternatives may happen depending on some minor event along Lola's run.",action
