title,plot,genre
outrage,"Tom Casey reports to the police some youngsters stealing from cars. He becomes the target of the 3 teenagers, who start to terrorise him and his family.",drama
outside ozona," A serial killer is stalking the roads between New Mexico and Texas and the passengers that we meet are destined to become his victims. We meet our parties at a cafeteria where a trucker stops for coffee. In the restaurant are a woman who has run out of gas and is trying to get her grandmother to the coast one last time before she dies, a fired and broke circus clown trying to get to Vegas with his stripper girl friend, and sisters who are going to their father's funeral. The killer is...",comedy
overnight delivery,"A man suspects his girlfriend of being unfaithful. So he sends her a letter, but than finds out that he was wrong. He has 24 hours to stop the package, prevent a disaster, and fall in love. The only problem is the delivery man will not stop until the package has been delivered.",romance
palwolui christmas,A Korean tale of romance and unrequited love. It explores the small daily details of a building romance in the few days left to the couple.,drama
paparazzi," At a football match, an unscrupulous photographer, Michel Verdier, takes pictures of a celebrity couple. Magazine editors go with the photos even though the dominant figure in them is a chubby football fan. ""So let him sue."" When the magazine appears, the fan, Franck Bordoni, is fired since he was supposed to be at work. Bordoni comes to the magazine where, by coincidence, he meets Verdier. Verdier says he knows how to make some money. They go to a restaurant where Johnny Hallyday is...",comedy
pariah," An interracial couple is attacked and the woman is gang-raped in a random attack. This prompts the woman to commit suicide and the man decides to seek revenge from the inside by joining the gang. However, once inside he learns of the reasons (poverty, social rejection) for their existence and starts developing a kinship until he is asked to kill someone to prove his loyalty. Written by John Sacksteder <[email protected]> ",drama
pep squad," Set in and around a small town high school in Kansas, Beth is a naive senior student who asks her two new friends, the slick and outgoing Julie, and her boyfriend Scott to help her cover up the accidental killing of the hated school principal. But they are observed by Terra, a student nominated for prom queen, who blackmails them into rigging the election in her favor. Undaunted, Beth, Julie and Scott turn to the most popular/hated student Cherry to kill Terra for them. Cherry agrees to the...",comedy
perfect assassins, When Dr Ben Carroway (McCarthy) is involved in an assassination where the killers commit suicide once trapped he finds that the killers have no criminal record. However they are all registered missing children and he sets on a journey of discovery with one of the killer's sister (Portia de Rossi) and a mob hitman (Robert Patrick). In Mexico they find a mansion in large grounds belonging to disgraced Dr Greely where children are taught to be killers by a regime of mental conditioning and...,action
perfect prey," Forensic psychologist and ex-Texas Ranger Dr. Audrey MacLeah assists the police in the case of a serial killer who abducts women and holds them for a short time before he kills them. As the doll-obsessed killer hunts his next prey, MacLeah deals with inter-agency politics and her own tortured memories. Written by Anonymous ",drama
phantasm iv: oblivion,"Taking off immediately where the last one ended, in this episode Mike travels across dimensions and time fleeing from the Tall Man, at the same time he tries to find the origins of his enemy, and what really happened the night that his brother died. Meanwhile, Reggie battles the spheres and the undead in a quest to find Mike before the Tall Man can complete his transformation.",horror
"policarpo quaresma, herói do brasil"," Policarpo is a chauvinistic patriot, a major who tries to find solutions for Brazilian problems using only the resources of his own country. His visionary and idealistic temperament is behind his strange ideas about how to build a great nation. Written by [email protected] ",comedy
polish wedding,"The film centers on a big Polish family. Jadzia is the mother and the ruler of the Pzoniak family (she has five children). Though she's happily married to Bolek, she is also having a long-time affair with Roman. Her young daughter Hala is having an affair with neighbour cop Russell and becomes pregnant by him. Russell is pressed hard to marry Hala.",comedy
portland street blues,"This spin-off movie provides a different contrast to the familiar Young and Dangerous films with greater character development. This time, the story's focus is on a female character - Sister 13 (Sandra Ng) of the ""Hung Hing"" triad. In a triad underworld dominated by men, the film tells the story of how she faces trials and tribulations of rising to become the branch leader of Portland Street. The story shows the reasons she became a lesbian. The film also gives more details about the ""Tung...",drama
psycho sisters," Mean and domineering Jane and the sweet and ditsy Jackie are two radically contrasting sisters who suffer from severe trauma after witnessing the murder/suicide of their parents as well as seeing their other sibling Janice raped and killed by her assailants. The pair are deemed fit to re-enter society and get released from a sanitarium where they have undergone extensive rehabilitation therapy. However, Jane and Jackie prove to be anything but sane and harmless as they embark on a vicious...",horror
pyaar to hona hi tha,"Sanjana loves Rahul, but Rahul treats Sanjana as a friend. He is attracted to Nisha, and announces that he will be marrying her soon. Sanjana does not take kindly to this, and in her heart hopes to make Rahul change his mind. She hires Shekhar to be her lover/boyfriend, and go out with her, so as to make Rahul jealous. This does not work, Rahul is drawn even closer to Nisha, and Shekhar finds himself falling in love with Sanjana. Sanjana finds herself getting attracted to Shekhar, only to find...",comedy
qian bu gou yong,"""Money No Enough"" is about three friends of different backgrounds who end up facing the same problem of surviving in a cash-strapped society where lack of money can bring endless problems. The film stars Chew Wah Keong (Jack Neo), who is white collar but a spend thrift, Ong (Mark Lee), a contractor, and Hui (Henry Thia), a coffee shop waiter who has a crush on his customer...",comedy
radiofreccia," Five friends Freccia, Bruno, Tito, Jena and Boris are very keen on music but they live in a little town in northern Italy and spend most of their days at the local bar. They decide to set up an independent radio which soon becomes the voice of a generation. When Freccia dies from an overdose the radio takes his name. Written by Salvatore Santangelo <[email protected]> ",drama
raising the heights,"When a perfect storm breeds violence in the Brooklyn neighborhood of Crown Heights, a black teenager and a Jewish reporter face pivotal choices that could alter the course of their lives.",action
random encounter,"Elizabeth Berkley stars as a young and rising Public Relations executive who meets a strange man after a cocktail party, and she is framed for murder.",thriller
razor blade smile," A 19th century woman, who has become one of the undead, acts as a hired killer in modern times. When she starts knocking off part of the elite businessmen, ""The Illuminati"", who secretly are taking over business and the government, she becomes the target of a hired Scotland Yard detective. Of course, the head of ""The Illuminati"" is the vampire who first gave her immortality. Written by John Sacksteder <[email protected]> ",horror
reach the rock,"Two school kids who are best friends are drinking on the side of a river. One friend bets the other that he can't swim across the river and ""Reach The Rock"". The friend takes the bet and drowns halfway towards the rock. The entire town blames the the kid for his friends death, he runs away never to be seen again. He eventually comes back to his home town of Shermerville and goes crazy, and starts to trash the town (i.e. breaking store-front windows, stealing a police car). He...",comedy
rebirth of mothra iii," A meteorite yields the three-headed dragon King Ghidorah on Earth, after Mothra's priestesses predicted that the King of Terror would return. The monster was said to be responsible for the death of the dinosaurs, and now, he is out to get all of Earth's children. While Mothra's powers are no match for the dragon, he is sent to the past, in the time of the dinosaurs, to battle a younger, and apparently less powerful, King Ghidorah. Written by Oliver Chu ",adventure
requiem,"What is the nature of life? What is the nature of art? How can art influence our lives? These are the questions of this movie. The main character, a man who lives both in the world of dreams and reality, searches his past, in order to understand its meaning. He has meetings with the ghosts of his dead friend, his dead lover, his dead father and Pessoa, the great portuguese writer. These four encounters give him clues about what he is looking for. Beside that, he finds himself in front of art,...",drama
restaurant,"Young waiters working at a local restaurant, with dreams of show-business, struggle through love, racial politics, betrayal, heartache, death and, ultimately, life...",drama
restless souls," Newlyweds spend the night at a haunted mansion, having had car trouble. When the wife disappears, the husband's rich father sends a team of parapsychologists to get the wife back. Except for the leader, each of the team has a special power... Dr. Donna Hemming is a telekinetic, Anthony Leeds can see things by touching objects, and Heather Siris is sexually irresistible to both the dead and the living. They soon discover a Civil War general has made a pact with the devil, if he can only...",horror
resurrection,"To find the truth a man must sacrifice one thing...his life. Based on the short story by renowned author Max Lucado, Resurrection is set in Israel at the time of Christ. Claudius, a Roman guard, finds himself in the midst of a cover-up regarding the tumultuous events after Christ's execution. As his digs for the truth, he discovers that the religious leaders, the Roman government and even his closest friends are attempting to hide something from him and the world. His relentless pursuit of...",drama
rhapsody in bloom,Artist Lilah Bloom's life is upended when her widowed brother decides to remarry a strong-willed business woman. Humor and self-awareness emerge as she ventures out to start a new life with a charming musician.  - Written byMichael Eastin ,romance
ride,"A group of young people leave Harlem for a bus trip down to Miami. The voyage starts off with problems, but it ends up becoming a learning experience, as they end up learning things about each other they had not previously known.  - Written byGuy Johns ",comedy
ringmaster,"Incest, adultury and love triangles may be taboo to some; but its all in a day's work for the producers of The Jerry Show. Ringmaster delves into the lives of the guests who, for their chance at fame in Hollywood, come onto the show and reveal their darkest secrets to the world. Ringmaster takes you down a twisted road and into the twisted lives of the guests of one particular show, where we find out who these people are, why they come to the show, how they get there, and why they are willing...",comedy
rivers of babylon," This tragicomic parable is about the increasing power of an un-educated, ill-mannered and dishonest stoker working at a hotel in Bratislava. Making advantage of the confused political and social situation in the country after 1989 he gradually becomes the most powerful person in the business. Written by Michael ",comedy
rosie: the devil in my head," In a juvenile lockup, a new ward answers questions: she's Rosie, 13, no parents, a sister Irene, a brother Michel. In flashbacks we find out what happened. She lives with Irene, who's 27, whom Rosie knows is in fact her mother, but that's their secret. Irene's brother Michel, unemployed, a compulsive gambler, comes to stay with them. Around then, Irene meets Bernard; they come to care for each other. This leaves Rosie without attention, so she puts all her adolescent hopes...",drama
rusty: a dog's tale,"Two orphans named Jory and Tess live with their grandparents. However, their cousins Bart and Bertha try to take them away because the two kids have trust funds from their dead parents. When Bart and Bertha kidnap the newborn puppies, Rusty the dog decides to save them.",family
sabrina goes to rome," American teenage witch Sabrina and her food-obsessed magical talking cat and mouse travel to Rome, the last whereabout of her 16th-century aunt Sophia, who was banished after breaking the rule not to divulge her powers to a non-witch; her mission is to find out how Sophia can be freed by opening her golden locket. Sabrina stays with her Italian relatives; notably niece Gwen, an certain and therefore dangerously clumsy budding witch, actually joins her quest there. Being seen using magic,...",comedy
safe house," A psychological thriller; Mace Sowell, an ex-intelligence operative and whose past government activities catches up with him, faces his own mortality, in the shape of the onset of Alzheimer's disease. Holding the electronic key to secret information which implicates a Presidential front-runner, Mace struggles for his life while battling the debilitating effects of the disease. Written by Anonymous ",thriller
safe men,"Two untalented singers are mistaken for a pair of major league safe crackers in Providence, Rhode Island. The two are pressed into service by the local hoodlums and quickly find themselves in conflict with their professional colleagues. Romantic interest is added by the daughter of the underworld leader who won't date the men she knows are gangsters.",comedy
safety patrol," Scout Bozell dreams of being on his school safety patrol, but he has never been allowed on because he is very clumsy. He's sent to another school just because his old school will not let him on there Safety patrol. So he gets on the safety patrol at his new school... Written by Bill Jackson ",comedy
saint maybe,"A lonely teen troubled by a past family tragedy is suspicious of his sister-in-law, believing she is being unfaithful. His confrontation with his brother sets off a series of tragic events.",drama
sanctuary," Luke Kovak is part of a covert group within the CIA that works on illegal black ops involving blackmail and assassinations. When his boss orders the murder of one of the team, Luke realises how expendable they all are and gets out (taking proof of their activities with him). He now lives as a priest until the group start to get close to tracking him down. Written by bob the moo ",action
saturday night live: the best of eddie murphy,"Before he was The Nutty Professor, before he was Dr. Dolittle, and even before he was the Beverly Hills Cop, Eddie Murphy was an SNL comic! From 1981-1984 he entertained us with sketches as Gumby, Mister Robinson, Buckwheat, Velvet Jones and many more! He was before Chris Rock, Tracey Morgan, and Tim Meadows! And after Garrett Morris!  - Written byDylan Self <[email protected]> ",comedy
satya,"A young man named Satya comes to Mumbai from South India in search of a job. Jailed for something he did not do, the once-honest young man meets an underworld boss, Bhiku Mhatre in jail and joins his gang.",action
savior,A hardened mercenary in the Foreign Legion begins to find his own humanity when confronted with atrocities during the fighting in Bosnia,drama
screwed," It has been two years since unsuccessful cartoonist, Tsube (Asano), started to live with Kuniko (Fujitani) casually in a small apartment. They are in the depths of poverty and can no longer pay the rent. As a result, they are forced to leave the apartment. Kuniko manages to find a live-in job and starts to work at a company dormitory as a cook. On the other hand, Tsube, being in a pitiful state without a penny to his name, winds up crashing at his friend, Kimoto's (Kanayama) place known...",drama
search for treasure island," Seven people get shipwrecked on an island that turns out to be the famous ""Treasure Island"" from Robert L. Stevenson's famous novel. But the island is occupied by three tribes, each of them very dangerous. The shipwrecked have to fight for their lives and have to find a way to escape from the island. Written by Joerg Fenin <[email protected]> ",family
secrets of a chambermaid,"In this erotically-charged drama, a group of people are gathered at a secluded mansion to hear the reading of a rich man's will. The assembled guests are to stay the night and learn of their inheritance the next day, but as the night wears on, many of the guests find it impossible to curb their sexual appetites. What they don't know is that their bedroom activities are being observed, and that there's more to this gathering than they've been led to believe",drama
senseless,"Darryl Witherspoon (Marion Wayans) is an impoverished but brilliant economics student on a personal mission to pay his college tuition and earn enough money to keep his single mom and younger brothers and sisters afloat. He enters an employment competition, where he stands to gain an ample salary and a world of opportunity. The odds are against Darryl, but he has drive and heart. While engaged in the competition, he also participates in a well-paying medical experiment for a little extra...",comedy
sf: episode one,"Three centuries ago, a precious sword has been stolen by Kazamatsuri -- the sword, which historic and symbolic value is priceless for the clan (Shogun Tokugawa donated it to clan 80 years before that, at the same time that he established them as the local rulers). Lord's counselor's young son Heishiro goes to retrieve the sword himself to protect the clan from the shame or possible demise. He is accompanied with two friends, Shintaro and Tadasuke, and followed by the ninjas of the clan. After...",action
shadrach,"One fateful summer day, while Paul and Little Mole shoot marbles, Shadrach, a 99-yearold former slave, appears in the Dabneys' yard. He has walked from Alabama in order to die and be buried on the plantation where he was born into slavery, the plantation owned by Dabney ancestors. It is his only wish - and his right, as he feels he is a Dabney, too. For Vernon Dabney - proud, pragmatic and emotionally explosive - Shadrach's sudden claim of Dabney kinship doesn't go down easily. He is neither...",drama
shampoo horns,"Sensationalistic group portrait of New York City ‘’club kids,’’ makes you long for those good old days when Andy Warhol’s self-appointed superstars brought a certain humor and bohemian sense of style to his semi-improvised films.",drama
sheer passion,"A lingerie model has been strangled inside a wealthy fashion designer's house, and the designer is the obvious suspect. When the police appear to be dragging their feet on the investigation, private detective Cassandra decides to do her own investigation, posing as a model.",thriller
shin kidô senki gundam w: endless waltz, The year is AC 196. A year has past since the Gundam pilots fought for peace between the colonies and Earth. Now a new threat has arisen and threatens to take over the Earth. The result: Relena is kidnapped by Trieze's daughter and the Gundam pilots must fight for peace...one last time. The Endless Waltz has begun. Written by BigD07 ,drama
sibirskiy tsiryulnik,"Douglas is a foreign entrepreneur, who ventures to Russia in 1885 with dreams of selling a new, experimental steam-driven timber harvester in the wilds of Siberia. Jane is his assistant, who falls in love with a young Russian officer, André, and spends the next 10 years perfecting the harvester and pursuing her love, who has been exiled to Siberia.",comedy
silencing mary," History exam questions are stolen from Cornwall University's history professor's home by Falcons football players, who nearly escape campus police. Campus paper reporter Mary keeps pushing the case. Soon after, her friend Holly Sherman gets drunk and claims to be raped at that party by star player Clay Roberts. But then retracts the accusation realizing she probably gave the wrong signals. Mary pushes even harder, even after the college finds no proof, no case, ignoring Clay's...",drama
since you've been gone," The story of a 10th anniversary High School reunion, told through the eyes of a doctor who was humiliated on graduation day by being badly beaten up by a fellow graduate. Written by Alan Keith Carver <[email protected]> ",comedy
sitcom,"The adventures of an upper-class suburban family abruptly confronted with the younger brother's discovery of his homosexuality, the elder sister's suicide attempt and sado-masochist tendencies, and the intrusion of a very free-spirited maid and her husband... And it all started with the arrival in the family of an innocent looking rat...",drama
six-string samurai,"In a post-apocalyptic world where the Russians have taken over a nuked USA and Elvis is king of Lost Vegas, Buddy is a '50s rocker and wandering warrior rolled into one, too-cool package. Armed with his six-string in one hand and his sword in the other, Buddy is on his way to Vegas to succeed Elvis as King. Along the way, he saves an orphan who decides to tag along.",action
slam,"Slam tells the story of Ray Joshua, an original, gifted young MC trapped in a war-zone housing project known as Dodge City. Unable to find a job, Ray copes with the despair and poverty of his neighborhood by using his wits and verbal talent. Written by Offline Publicist Young Ray Joshua lives in the Washington, DC, district known as Dodge City, which is dominated by gang wars. One day he is arrested when his drug dealer is gunned down while talking to him. He is put to prison where two rival...",drama
slappy and the stinkers,"Nicknamed the ""Stinkers"" by the snooty headmaster (Wong) of the private school where they are on summer enrichment scholarships, five feisty kids wreak havoc and humor with their irrepressible sense of adventure and ingenuity. They band together to build a flying machine powered by a leaf blower, escape from the comic villain in their homemade hotrod-bathtub-bikeplane, and even pull off the daring ""rescue"" of a contented sea lion in a misguided effort to free Slappy!",comedy
sled kraja na sveta," This is a funny and woeful story, resembling an old Jewish anecdote, aiming to wrap a comical framework around the dark side of life. At the time, the poorest neighborhood of Plovdiv (an ancient town in Bulgaria) represented a unique European recess, a realm of perfect ethnic harmony among Bulgarians, Armenians, Turks, Jews, Gypsies and Greeks. A priest, a rabbi and a hodjah and an Antichrist nicknamed the Boozer are smitten with the same full-bosomed Turkish woman. Along with their rivalry,...",drama
some prefer cake," In San Francisco, Kira has a day job at a warehouse, writes jokes for her sister (who does stand-up back East), wants to perform her own material, hangs out with best friend Sydney (who writes food reviews), and sleeps once with every woman she can. Then, her roommate sets her up with Robin - who's recently come out and hasn't had a serious relationship yet - and her friendship with Sydney gets rocky. Meanwhile, Kira's being stalked by one of her one-night stands, her sister...",comedy
someone to love me," Cayley is still recovering from her father's sudden death when she begins attending a new school. Lonely and depressed, she has sex on the first and only date with classmate Ian Hall. After Ian gives her the cold shoulder, she succumbs to his friend's advances. Soon the school is abuzz with rumors about Cayley. With help from a guidance counselor, Cayley begins to change her behavior, but one night Ian approaches her expecting sex. When she rejects him, he rapes her. Now,...",drama
sometimes they come back... for more,"On a arctic circle radio shack, an ancient evil lurks, ready to strike at a psychologist, an army man and their collective forces.",horror
somewhere in the city," The film portrays life of New York City's Lower East Side inhabitants. Introvert therapist Betty is befriended with Chinese immigrant Lu Lu, leftist radical Che is also Lu Lu's friend. Italian immigrant and wife of supervisor of building where they all live, Marta, is having an affair with her neighbour Frankie who likes scams. One of his scams goes terribly wrong. Written by Anonymous ",drama
sorority house vampires,"The UFO-Demon, Rabaalhazor, has sent the vampire, Natalia to destroy the Earth. Each time she takes a victim a natural disaster rocks the planet. Humanity's only hope is the sexy sorority pledge, Buffy, and the members of her sisterhood. She must not only save the world but she also must save herself from the perverted desires of both Rabaalhazor and Natalia.  - Written byRaymond Honeycutt <[email protected]> ",horror
sour grapes,"Richie, a sneaker sole designer, and his cousin Evan, a brain surgeon, are spending this weekend with their girlfriends in Atlantic City. When one of them ends up with a $436,000 jackpot, sour grapes is what results. Even though Richie uses two quarters from Evan to win the progressive jackpot, he sees no connection with that and sharing the jackpot. This ignites a hilarious, runaway chain of even",comedy
