title,plot,genre
the most dangerous game,An insane hunter arranges for a ship to be wrecked on an island where he can indulge in some sort of hunting and killing of the passengers.,adventure
the mouthpiece," When a hot young prosecutor learns that a man he got convicted and executed was in fact innocent, he quits his DA job and becomes a defense attorney. He grows rich and powerful defending guilty racketeers, but eventually sees the errors of his ways. Written by John Oswalt <[email protected]> ",drama
the music box," The Laurel & Hardy Moving Co. have a challenging job on their hands (and backs): hauling a player piano up a monumental flight of stairs to Prof. von Schwarzenhoffen's house. Their task is complicated by a sassy nursemaid and, unbeknownst to them, the impatient Prof. von Schwarzenhoffen himself. But the biggest problem is the force of gravity, which repeatedly pulls the piano back down to the bottom of the stairs. Finally, the irate Professor explodes in fury to discover the...",comedy
the night mayor," Opportunistic film seeking to capitalize on a scandal in New York mayor Jimmy Walker's office before his name was out of the newspapers. Tracy plays a mayor who has a penchant for the night life, sports, the theater, and an actress, Knapp. When scandal rocks his administration, Tracy has his girl friend marry Dillaway, a writer friend, so that the press will leave him alone. Written by Anonymous ",drama
the purchase price,"Barbara Stanwyck plays Joan Gordon, a torch singer who runs away from her gangster boyfriend (Lyle Talbot) to become a mail-order bride to a struggling North Dakota farmer (George Brent). Their relationship has a rocky start, but just as Joan realizes that she is developing feelings for her husband, her old boyfriend arrives to win her back.",drama
the red head,"Adapted from various stories by Jules Renard, Poil de Carotte (The Red Head) is the poetically related tale of a delicate domestic situation. Robert Lynen plays the young son of Catherine Fourtenay. Fourtenay's husband Harry Baur knows that Lynen is not his son, but remains married for appearances' sake. Baur remains aloof and distant until he discovers the cruelties heaped upon Lynen by his resentful mother. Foster father and son develop a respect and friendship for one another that finally...",drama
the rich are always with us," The ten year marriage of of Caroline Van Dyke and Greg Grannard is falling apart. A young woman, Allison, plots to become his second wife. Caroline's friend, novelist Julian, has long loved her and now sees his chance, but she refuses him and goes to Paris to file for divorce. Julian follows but on hearing that Greg has fallen on financial hardship Caroline returns to help him. Greg tells Caroline that his now-wife Allison is pregnant and Caroline realizes that she loves Julian and to...",comedy
the roadhouse murder,"After he stumbles across a murder, a young reporter devises an elaborate scene to keep his newspaper stories about the crime front-page news. Eric Linden, Dorothy Jordan, Bruce Cabot, Roscoe Ates, Roscoe Karns and Purnell Pratt star in this 1932 thriller, directed by J. Walter Ruben.",thriller
the thirteenth guest,"13 years before the movie opens, there was a dinner party, at which the 13th guest failed to show up. The master of the manner has died, and left the bulk of his estate to this 13th guest, but nobody knows who that is. Now someone is murdering the remaining guests, and placing their dead bodies at the table, in the same seat they had occupied 13 years before.  - Written byJohn Oswalt <[email protected]> ",thriller
they just had to get married,"Molly Hull, a maid, and Sam Sutton, a butler, are bequeathed a million dollars, and they encounter many problems and difficulties as they try to become the newest members of the idle rich.",adventure
three wise girls,Romantic comedy drama about three friends in New York. Cassie has come to New York and goes to work as a model where her friend Gladys works. She falls in love with wealthy young Jerry who is already married. Gladys has the same probelm with her man Phelps.,comedy
towed in a hole," Laurel and Hardy are in the fish business. They drive around town seeing if they can sell any. Stan suggests they catch their own fish and could keep all the profits when selling them to people. Ollie likes the idea so they buy a boat at the junk yard and try, sometimes unsuccessfully, to fix it up. When the boat is finally fixed up, the whole operation goes south. Written by Dylan Self <[email protected]> ",comedy
trouble in paradise,"Trouble in Paradise is one of the most important films of Actor, Producer, and Director Ernst Lubitisch, and his personal favorite of all the films he’s made. A story of two thieves who fall in love and begin doing jobs together under the employment of a beautiful woman who stirs up the relationship.",comedy
two-fisted law,"Rancher Tim Clark borrows money from Bob Russell, who then rustles Clark's cattle so he will be unable to repay the money. Thus Russell is able to cheat Clark out of his ranch. Clark becomes a prospector for silver and ultimately comes to settle accounts with Russell and crooked deputy Bendix.",romance
vampyr,"Young traveller Allan Grey arrives in a remote castle and starts seeing weird, inexplicable sights (a man whose shadow has a life of its own, a mysterious scythe-bearing figure tolling a bell, a terrifying dream of his own burial). Things come to a head when one of the daughters of the lord of the castle succumbs to anaemia - or is it something more sinister?",horror
veiled aristocrats,"A young woman plans to marry, but her mother and brother--a lawyer--don't like her prospective husband and scheme to prevent the marriage.",drama
westward passage,"A struggling writer divorces his wife to pursue his career without interference, but they meet in Europe years later after she has remarried.",drama
what price hollywood?,"The career of a waitress takes off when she meets an amiable drunken Hollywood producer. Sassy and ambitious waitress Mary Evans (Constance Bennett) amuses and befriends seldom-sober director Max Carey (Lowell Sherman), who stumbles into her restaurant. Max invites Mary to his film premiere and, after a night of drinking and carousing, Mary charms her way into a screen test and then a contract with a movie studio. Just as Mary finds her dreams coming true and her career on the upswing,...",drama
white zombie,"Young couple Madeleine and Neil are coaxed by acquaintance Monsieur Beaumont to get married on his Haitian plantation. Beaumont's motives are purely selfish as he makes every attempt to convince the beautiful young girl to run away with him. For help Beaumont turns to the devious Legendre, a man who runs his mill by mind controlling people he has turned into zombies. After Beaumont uses Legendre's zombie potion on Madeleine, he is dissatisfied with her emotionless being and wants her to be...",horror
winner take all,"Young boxer Jim Hunt, resting at a New Mexico ""health ranch,"" meets and falls for Peggy Harmon, former nightclub table singer...who needs $600 more for her sickly son to stay in the place. To help her, Jim endangers his health with a tough boxing match in Tijuana. Before long, he's back fighting while Peggy stays in the desert. But in the city, after new triumphs, Jim meets Joan, a teasing Society blonde. Will he see through her before it's too late?",drama
