title,plot,genre
the lord of the rings: the return of the king,"Sauron's forces have laid siege to Minas Tirith, the capital of Gondor, in their efforts to eliminate the race of men. The once-great kingdom, watched over by a fading steward, has never been in more desperate need of its king. But can Aragorn (Mortensen) answer the call of his heritage and become what he was born to be? In no small measure, the fate of Middle-earth rests on his broad shoulders. With the final battle joined and the legions of darkness gathering, Gandalf (McKellen) urgently...",action
hulk,"A top secret military project hires prestigous university students to assist create a cell altering machine called the 'gammasphere'. Lead of the group is arrogant Bruce Banner, mainly complimented by compassionate Betty Ross. When the gammasphere goes wrong, Bruce Banner is afflicted with the ability to turn into a mammoth creature soon dubbed 'The Hulk', a manifestation of his own inner demons that he mutates into when it is emotionally triggered. A ruined, Jeckal and Hyde man he may be, but...",action
love actually,"Set in contemporary London in the weeks before Christmas, ""Love Actually"" tells one story which weaves together a spectacular number of love stories-sometimes romantic, sometimes sad, sometimes stupid-all funny in their own way. Everywhere you look, love is causing chaos. From the new bachelor Prime Minister who falls in love 30 seconds after entering Downing Street to a loser sandwich delivery guy who doesn't have a hope with the girls in the UK, so heads for Wisconsin; from a jilted writer...",comedy
kill bill vol. 1,"A recently retired master assassin, The Bride (played by Thurman) is gunned down on her wedding day by Bill (David Carradine of the 1970s American TV series Kung Fu), her onetime boss and lover. She wakes up from a coma four years later and resolves to wreak vengeance by hunting down the killers in Bill's posse?a multinational Charlie's Angels-style trio called the Deadly Viper Assassination Squad, played by Daryl Hannah, Lucy Liu and Vivica Fox. Eventually, one can safely assume, The Bride...",action
pirates of the caribbean: the curse of the black pearl,"For the roguish yet charming Captain Jack Sparrow (Depp), the crystalline waters of the Caribbean, like the high seas the world over, present a vast playground where adventure and mystery abound. But Jack's idyllic life capsizes after his nemesis, the wily Captain Barbossa (Rush), steals his ship, the Black Pearl, and later attacks the town of Port Royal, kidnapping the Governor's (Pryce) beautiful daughter, Elizabeth Swann (Knightly). Elizabeth's childhood friend, Will Turner (Bloom), joins...",action
lost in translation,After a washed up TV star goes to Tokyo for a whiskey commercial. While in the city for the commercial the star meets a young photographer and together they end up spending the weekend on a soul-searching mission.,drama
the dreamers,"Left alone in Paris whilst their parents are on holiday, Isabelle (Green) and her brother Theo (Garrel) invite Matthew (Pitt), a young American student, to stay at their apartment. Here they make their own rules as they experiment with their emotions and sexuality while playing a series of increasingly demanding mind games. Set against the turbulent political backdrop of France in the spring of 1968 when the voice of youth was reverberating around Europe, ""The Dreamers"" is a story of...",drama
oldboy,"A man is inexplicably kidnapped and imprisoned for 15 years and his wife is brutally murdered. On his release, he is given a wallet full of money and a mobile phone. A stranger calls and asks him to try and figure out why he was imprisoned. A girl appears and promises to help him solve the enigma and seek vengeance for his cruel fate. As the search progresses, the man finally comes face to face with his kidnapper, who proposes a game: if the man discovers the reason for his imprisonment, his...",drama
the matrix reloaded,"In the second chapter of the Matrix trilogy, freedom fighters Neo (Reeves), Trinity (Moss) and Morpheus (Fishburne) continue to lead the revolt against the Machine Army, unleashing their arsenal of extraordinary skills and weaponry against the systematic forces of repression and exploitation. In their quest to save the human race from extinction, they gain greater insight into the construct of The Matrix and Neo?s pivotal role in the fate of mankind.",action
freddy vs. jason,"It has been almost 10 years since one of the scariest horror characters of all time, Freddy Krueger, invaded the dreams of a generation to exact his deadly form of revenge and murder. Now, Freddy has entered into the dreams of another master of evil, the unstoppable Jason Voorhees -- plunging cinema's two greatest titans of terror into a battle to end all battles.",horror
the room,"""The Room"" is an American black comedy about love, passion, betrayal and lies. It has five major characters. Johnny is a successful banker with great respect for and dedication to the people in his life, especially his future wife Lisa. Johnny can also be a little too trusting at times which haunts him later on. Lisa is a beautiful blonde fiancé of Johnny. She has always gotten her way and will manipulate to get what she wants. She is a taker, with a double personality, and her deadly schemes...",drama
underworld,"""Underworld"" reimagines Vampires as a secretive clan of modern, aristocratic sophisticates whose mortal enemies are the Lycans (werewolves), a shrewd gang of street thugs who prowl the city's underbelly. The balance of power is upset when a beautiful young Vampire and a nascent Lycan - deadly rivals for centuries - fall in love. Len Wiseman directs Kate Beckinsdale and Scott Speedman in a fast-paced, modern-day tale of deadly action, ruthless intrigue and forbidden love, all set against the...",action
big fish,"In the heartwarming film ""Big Fish,"" director Tim Burton (""Batman,"" 'Edward Scissorhands"") brings his inimitable imagination on a journey that delves deep into a fabled relationship between a father and his son. Edward Bloom (Finney) has always been a teller of tall-tales about his oversized life as a young man (McGregor), when his wanderlust led him on an unlikely journey from a small-town in Alabama, around the world, and back again. His mythic exploits dart from the delightful to the...",adventure
the texas chainsaw massacre,"Based loosely on true events that inspired both the original The Texas Chainsaw Massacre and the Oscar-winning The Silence of the Lambs, the new film will center around a handful of friends who become isolated in the company of a deadly clan of cannibals. The original film not only struck a deep chord with the youth culture of the time but revitalized the horror genre, influencing virtually all of the successful horror franchises that followed it, from New Line's own Nightmare on Elm Street...",horror
x2: x-men united,"Mutants continue their struggle against a society that fears and mistrusts them. Their cause becomes even more desperate following an incredible attack by as an yet undetermined assailant possessing extraordinary abilities. The shocking attack renews the political and public outcry for a Mutant Registration Act and an anti-mutant movement now led by William Stryker (Brian Cox), a wealthy former Army commander who is rumoured to have experimented on mutants.Stryker's mutant ""work"" is somehow...",action
holes,"Based on the award-winning children's book of the same name, Holes tells the story of Stanley Yelnats, a teen sent to a detention camp in Texas for a crime he didn't commit. The warden, a cruel woman who uses snake venom to paint her nails, forces the boys to dig holes as punishment and to build character. Her motives seem unusually sadistic, until the boys discover her secret �",adventure
school of rock,"After being fired from his band, a guitarist and singer, Dewey Finn ends up getting a job as a fourth grade substitute teacher at a private school. With his free living ways, attitude and quirky antics he starts to influence the kids and at the same time he prepares them for a battle of the bands.",comedy
old school,"Three former college buddies (Luke Wilson, Will Ferrell, Vince Vaughn), now in their 30s, are unhappy with their lives and try to find fulfillment in reliving their college glory days by starting their own off-campus fraternity.",comedy
peter pan,"A haunting tale of adventure and dreams, Peter Pan has thrilled audiences around the world since it premiered on a London stage 100 years ago. But J. M. Barrie's classic story of the boy who wouldn't grow up - and the girl whose family insists that she must - has never been fully realized onscreen. Until now. Universal Pictures, Columbia Pictures and Revolution Studios are proud to present the first live-action feature film version of Peter Pan since the silent era. And for the first time, a...",adventure
daredevil,"Fate deals young orphan Matt Murdock a strange hand when he is doused with radioactive waste. The accident leaves Matt blind but also gives him a heightened ""radar sense"" that allows him to ""see"" far better than any man. Years later Murdock has grown into a man and becomes a respected criminal attorney. But after he's done his ""day job"" Matt takes on a secret identity as ""The Man Without Fear,"" Daredevil, the masked avenger that patrols the neighborhood of Hell's Kitchen and New York City to...",action
the last samurai,"Set in Japan during the 1870s, The Last Samurai tells the story of Capt. Nathan Algren (Tom Cruise), an American military officer hired by the Emperor of Japan to train the country's first army in the art of modern warfare.? As the?government attempts to eradicate the ancient Samurai warrior class?in preparation for more Westernized and trade-friendly policies, Algren finds himself unexpectedly?affected by his encounters with the Samurai, which places him at the center of a struggle between two...",action
cheaper by the dozen,"When Tom Baker (Martin) gets a job offer to coach football at Northwestern University in Chicago, he and his wife, Mary, move to the big city, which is a big change for them and their 12 children, who range from preschool-age twins Kyle and Nigel all the way up to 22-year-old Anne who has already left home. With the recent publication of her long-in-the-works book, Mary feels demands outside the home taking away as much time as Tom's new job does, so the two are forced to try to find new ways...",comedy
house of 1000 corpses,"There are four college-age kids driving cross-country, researching a book on weird roadside attractions...This stuff has kind of disapeared now, but it was very prevalent in the 70's- like 'World's Biggest Ball of String,' 'Bigfoot Museum,' things like that. So they stumble upon this place called 'Captain Sapulding's Museum of Monsters and Madmen.' It's basically a serial killer museum in the middle of nowhere, and Captain Sapulding is played by Sid [Spider Baby] Haig- he's the crazy-looking...",horror
spy kids 3d: game over,In this installment the Cortez family is thrust into a virtual reality game by the Toymaker as he tries to take over the children of the world. The Cortez family must stop the evil Toymaker by defeating the impossible games that are thrown at them.,action
2 fast 2 furious,"After letting Dominic get away in the first movie, Brian Spilner (Paul Walker) is stripped of his badge. To redeem himself, the cop is sent to Miami to infiltrate a gang of street racers.",action
wrong turn,"Chris (Harrington) has a job interview in Raleigh in three hours and he's making good time in his refurbished classic Mustang convertible... until an accident miles down the highway turns Chris' three-hour trip into a six-hour wait. Determined to make his critical appointment, Chris makes a hard U-turn and heads back up the West Virginia highway. Running low on fuel, he finds a dirt road that seemingly intersects the highway after about 20 miles. It's clearly a road less traveled, but to Chris...",horror
bad boys ii,"Will Smith and Martin Lawrence are back - and oh so bad - on the streets of Miami in ""Bad Boys II,"" reuniting them with director Michael Bay and producer Jerry Bruckheimer. Narcotics detectives Mike Lowrey (Smith) and Marcus Burnett (Lawrence) have been assigned to a high-tech task force investigating the flow of designer ecstasy into Miami. Their inquiries inadvertently lead them to a major conspiracy involving a vicious kingpin (Molla), whose ambitions to take over the city's drug trade have...",action
terminator 3: rise of the machines,"A decade has passed since John Connor (Stahl) helped prevent Judgment Day and save mankind from mass destruction. Now 25, Connor lives ""off the grid"" - no home, no credit cards, no cell phone and no job. No record of his existence. No way he can be traced by Skynet - the highly developed network of machines that once tried to kill him and wage war on humanity. Until... out of the shadows of the future steps the T-X (Loken), Skynet's most sophisticated cyborg killing machine yet. Sent back...",action
the matrix revolutions,"In The Matrix Revolutions, the final chapter in the Matrix trilogy, the rebels' long quest for freedom culminates in a final explosive battle. As the Machine Army wages devastation on Zion, its citizens mount an aggressive defense -- but can they stave off the relentless swarm of Sentinels long enough for Neo to harness the full extent of his powers and end the war?",action
dogville,"The beautiful fugitive, Grace (Kidman), arrives in the isolated township of Dogville on the run from a team of gangsters. With some encouragement from Tom (Bettany), the self-appointed town spokesman, the little community agrees to hide her and in return, Grace agrees to work for them. However, when a search sets in, the people of Dogville demand a better deal in exchange for the risk of harbouring poor Grace and she learns the hard way that in this town, goodness is relative. But Grace has a...",drama
cold mountain,"Based on the well known novel by Charles Frazier the story follows Inman, played by Jude Law, a wounded confederate soldier who is on a perilous journey home to his mountain community, hoping to reunite with his prewar sweetheart, Ada, played by Nicole Kidman.",drama
the league of extraordinary gentlemen,"Set in Victorian England, the story centers around a team of extraordinary figures enlisted by a mysterious caller to stop a villain intent on turning the nations of the world against one another. The coterie of heroes are led by Allan Quartermain (Sean Connery) and comprise some of the greatest figures from adventure literature: Captain Nemo (Naseeruddin Shah), Dracula vampiress Mina Harker (Peta Wilson), invisible man Rodney Skinner, (Tony Curran), American secret service agent Sawyer (Shane...",action
american wedding,"The crew reunites in East Great Falls once again for the ultimate occasion, Jim and Michelle are getting married. Everyone is back for the happy day including Stifler who is there to plan the best bachelor party ever! Finch and the rest of the guys are back for all the fun and hilarity and Jim's dad is there to provide the boys with his brand of advice.",comedy
the italian job,"A band of thieves, led by Charlie Croker (Wahlberg), pulls off the ultimate heist by rigging the stoplights of the city of Los Angeles so that they can drive right out of the city with a carful of gold (in a safe that they're stealing back after Croker's double-crossing ex-partner, played by Edward Norton, stole it from Croker first), with nothing but greenlights, while everyone else gets redlights, thus keeping the roads plugged with the largest traffic jam in L.A. history, and the police from...",action
something's gotta give,"Academy Award winners Jack Nicholson and Diane Keaton star in a sparkling and sophisticated romantic comedy from acclaimed writer/director Nancy Meyers (""What Women Want,"" ""The Parent Trap""), which proves that in matters of the heart, sometimes you can teach an old playboy new tricks. Harry Sanborn (Nicholson) is a New York music mogul with a libido much younger than his years. He has the world on a string -- and a string of beautiful young girlfriends to prove it. During a romantic rendezvous...",comedy
daddy day care,"In the hilarious comedy ""Daddy Day Care,"" two fathers (Murphy, Garlin) lose their jobs in product development at a large food company and are forced to take their sons out of the exclusive Chapman Academy and become stay-at-home fathers. With no job possibilities on the horizon, the two dads open their own day care facility, ""Daddy Day Care,"" and employ some fairly unconventional and sidesplitting methods of caring for children. As ""Daddy Day Care"" starts to catch on, it launches them into a...",comedy
freaky friday,"A tomboy teenage girl, Annabel (Lohan), and her widowed mother, Ellen (Curtis), who are always arguing with each other, simultaneously wish they could be someone else, they somehow exchange bodies, as they both learn (or in the mother's case, remembers) what it's like to be in the other person's situation. As nice as that might be, the duo faces a deadline, as the mother is due to get married soon, and doesn't want to miss the big event (obviously) or for her daughter to get to know her new...",comedy
how to lose a guy in 10 days,"Andie Anderson (Kate Hudson), Composure Magazine's ""How-To"" columnist, has a very unusual assignment and a quick deadline. She has to write a firsthand account of all the things that women do to inadvertently drive men away...and she's got to do it in 10 days. Now she's on a mission to find a guy, get him to fall in love with her, then make all the classic dating mistakes so he'll dump her. Too bad Andie's target is ad agency hottie, Benjamin Barry (Matthew McConaughey), who has just made a...",comedy
charlie's angels: full throttle,"The Angels are ready to strike without warning and kick some serious butt as they go undercover to retrieve two missing silver bands. These are no ordinary wedding rings. They contain valuable encrypted information that reveals the new identities of every person in the federal Witness Protection Program. When witnesses start to turn up dead, only the Angels can stop the perpetrator, using their expertise as masters of disguise, espionage and martial arts. Good morning, Angels. Get ready to...",action
s.w.a.t.,"Based on the 1970s TV series of the same title, this film follows a squad of Los Angeles' Special Weapons and Tactics assigned to protect a drug kingpin who has offered a $100 million reward to anyone who can free him from the cops. Samuel L. Jackson plays a grizzled S.W.A.T. veteran who's in charge of the venture.",action
bruce almighty,Bruce is a whiny guy who questions once too often why God gives him so much grief. He is suddenly given almighty power for 24 hours to teach him how difficult it is to run the world and see if he can do a better job. If Bruce fails to do a better job then God will release an apocalyptic cataclysm that would hurtle mankind back to the Dark Ages.,comedy
master and commander: the far side of the world,"Based on the best-selling novels of Patrick O'Brian, the film stars Russell Crowe as ""Lucky"" Jack Aubrey, who pits his crew of the H.M.S. Surprise against a much better armed and ruthless privateer, in a chase that takes him all the way to the far side of the world. Rising newcomer Paul Bettany (""A Beautiful Mind"") plays the ship's surgeon Dr. Stephen Maturin.",action
dreamcatcher,"Dreamcatcher tells the story of four young friends who perform a heroic act - and are changed forever by the uncanny powers they gain in return. Years later, on a hunting trip in the Maine woods, they are overtaken by a blizzard, a vicious storm in which something much more ominous moves. Challenged to stop an alien force, the friends must first prevent the slaughter of innocent civilians by a military vigilante, then overcome a threat to the bond between them. In the end, they confront an...",drama
dr. seuss' the cat in the hat,"This take will be based on Dr. Seuss' children's classic, in which a little boy and girl sit around bored on a rainy day while their mother is out, until a Cat in a Hat shows up, along with Thing One and Thing Two, and proceeds to trash the house. But just in the nick of time he cleans up his fun and tips his hat and runs. Will the kids confess about the Cat in the Hat who made a mess? Much like Dr. Seuss' How the Grinch Stole Christmas, expect lots of back story and cool costumes and...",adventure
final destination 2,"Driving with a group of friends to Daytona Beach, Kimberly (A.J. Cook) has a sudden premonition that saves them all from a catastrophic freeway pileup � or so it seems. Ali Larter returns from the first film as Clear Rivers, the lone survivor of the Flight 180 airplane crash, whom Kimberly goes to see once death starts coming after her friends. It�s a rollercoaster ride of fear and fate as Kimberly races to save her friends and herself from the implacable jaws of death. The sequel...",horror
the core,"Geophysicist Dr. Josh Keyes (Eckhart) discovers that an unknown force has caused the earth's inner core to stop rotating. With the planet's magnetic field rapidly deteriorating, our atmosphere literally starts to come apart at the seams with catastrophic consequences. To resolve the crisis, Keyes, along with a team of the world's most gifted scientists, travel into the earth's core in a subterranean craft piloted by ""terranauts,"" Major Rebecca ""Beck"" Childs (Swank) and Colonel Robert Iverson...",action
scary movie 3,"Be warned. From the director of the 'Airplane!' comes the hilarious third instalment of the Scary Movie franchise. Now out of College, the hapless Cindy Campbell is a TV News Anchorwoman. Within a matter of days, Cindy is summoned to investigate the mysterious crop circles on Tom Logan's farm, and uncover the eerie secret behind the death of a close friend. Whilst on her journey, Cindy meets Orpheus, who explains to her that she is ""The One"" and prophecizes that she must help the President of...",comedy
johnny english,"Rowan Atkinson plays an unimportant British diplomat who is accidentally mistaken for Britain's most famous spy, Johnny English. Spoofery ensues.",action
gothika,"Dedicated and successful criminal psychologist Dr. Miranda Grey (Halle Berry) awakens to find herself a patient in her own mental institution with no memory of the murder she's apparently committed. She soon learns that her husband was brutally murdered three days earlier, and the bloody evidence points directly at her. With no memory of that night except for a cryptic encounter with a mysterious young girl, the doctor's behavior becomes increasingly erratic. Her claims of innocence are seen by...",horror
tears of the sun,"Lt. Waters travels to war-torn Nigeria to rescue Dr. Lena Kendricks (Monica Bellucci), a U.S. citizen who runs a mission in the countryside. But when Lt. Waters arrives, Dr. Kendricks refuses to abandon the refugees under her care. She implores Waters to escort them on a dangerous trek through the dense jungle to the nearby border of Cameroon. During the journey, the S.E.A.L.s find themselves the unwitting guardians of a man sought by the rebel militia. This further endangers their already...",action
shanghai knights,"This sequel to the successful Shanghai Noon reunites 19th-century imperial guard Chon Wang (Jackie Chan) and train robber Roy O'Bannon (Owen Wilson). When a Chinese rebel murders Chon's estranged father, Chon and Roy head to England seeking revenge. Chon's sister, Lin, has the same idea, and uncovers a conspiracy to murder England's royal family.",action
secondhand lions,This story takes place in Texas in the 1960's and is about a boy that is forced to spend the summer with his two eccentric great-uncles. As the summer passes the boy learns a lot about his uncles as they tell him stories about their dangerous past.,comedy
once upon a time in mexico,"The saga of the mythic guitar-slinging hero, El Mariachi (Banderas), continues in Robert Rodriguez's bold, non-stop action epic ""Once Upon a Time in Mexico"". The new adventure is set against a backdrop of revolution and greed. Haunted and scarred by loss, El Mariachi has retreated into a life of isolation. He is forced out of hiding by Sands (Depp), a corrupt CIA agent. Sands recruits the reclusive hero to sabotage a plot by the evil cartel kingpin Barillo (Dafoe), who is planning to...",action
matchstick men,"Phobia-addled con artist Roy (Nicholas Cage) and his protege, Frank (Sam Rockwell), are on the verge of pulling off a lucrative swindle when the unexpected arrival of Roy's teenage daughter Angela (Alison Lohman) disrupts his carefully-ordered life and jeopardizes his high-risk scam.",comedy
cabin fever,"College is finally over and five friends escape to a remote log cabin in the woods to enjoy some last days of decadence before entering the working world. Merriment and good times sour when a delirious stranger covered in bloody sores crashes their party. Shots are fired and the lunatic flees into the woods, but it's too late for our five friends: contact was already made. Soon one member of the circle gets ill and her skin starts to bubble and burn as a trail of oozing sores ravages her flesh....",horror
open range,"Following the day-to-day encounters of four wandering cattle ranchers living in the final years of the Wild West, this film tells the story of how they eventually team up to rid a burgeoning remote town, Harmonville, from the machinations of a ruthlessly evil rancher, Baxter, who forms a sort of ""outlaw state"" where he makes the laws and rules, and enforces them using scare tactics and brute force.",action
