title,plot,genre
a guy thing,"Paul Morse (Jason Lee) is a good guy. When his friends throw him a wild bachelor party, he just wants to keep his conscience clean - which is why he's shocked when he wakes up in bed with a beautiful girl named Becky (Julia Stiles) and can't remember the night before. Worse than that, she also happens to be his fianc&#65533e's cousin.Desperate to keep his fianc&#65533e, Karen (Selma Blair), from finding out what may or may not be the truth, he tells her a teensy lie. Which turns into a bigger...</p></div></div></section><section class=""movie""><figure class=""movie-poster-missing""></figure><div class=""movie-description""><h2 class=""movie-title""> A House on a Hill </h2><div class=""movie-info""><ul class=""movie-info-items""></ul><ul class=""movie-info-items movie-info-items-second""><li class=""movie-age-rating"">NONE</li><li class=""movie-release-date""><time datetime=""2003-11-14"">November 14th, 2003</time></li><li class=""movie-genre""> Drama </li></ul></div><div class=""movie-synopsis""><p>Harry Mayfield (Baker Hall) was once an extremely successful Los Angeles architect. Today, he is an aging, charming but cantankerous idealist who teaches rather than practices architecture. Decades earlier, he had started work on a magnificent house for his family on a hillside site overlooking the city and the sea. A rich young couple, Kate and Richard Banks, see the charred remains of what was once his house, and decide they want Mayfield to come out of retirement and re-build the house for...</p></div></div></section><section class=""movie""><figure class=""movie-poster""><picture><!--[if IE 9]><video style=""display: none;""><![endif]--><source media=""(min-width: 1024px) and (-webkit-min-device-pixel-ratio: 1.25), (min-width: 1024px) and (min-resolution: 120dpi)"" srcset=""https://cdn3.movieweb.com/i/movie/9w5mo9gp0X4kW1jIzlDZh0ilPFnYob/460:50/A-Long-Weekend-In-Pest-And-Buda.jpg""><source media=""(min-width: 1024px)"" srcset=""""><source media=""(min-width: 768px) and (-webkit-min-device-pixel-ratio: 1.25), (min-width: 768px) and (min-resolution: 120dpi)"" srcset=""https://cdn3.movieweb.com/i/movie/9w5mo9gp0X4kW1jIzlDZh0ilPFnYob/484:50/A-Long-Weekend-In-Pest-And-Buda.jpg""><source media=""(min-width: 768px)"" srcset=""https://cdn3.movieweb.com/i/movie/9w5mo9gp0X4kW1jIzlDZh0ilPFnYob/304:50/A-Long-Weekend-In-Pest-And-Buda.jpg""><source media=""(min-width: 481px) and (-webkit-min-device-pixel-ratio: 1.25), (min-width: 481px) and (min-resolution: 120dpi)"" srcset=""https://cdn3.movieweb.com/i/movie/9w5mo9gp0X4kW1jIzlDZh0ilPFnYob/384:50/A-Long-Weekend-In-Pest-And-Buda.jpg""><source media=""(min-width: 481px)"" srcset=""https://cdn3.movieweb.com/i/movie/9w5mo9gp0X4kW1jIzlDZh0ilPFnYob/274:50/A-Long-Weekend-In-Pest-And-Buda.jpg""><source media=""(min-width: 0px) and (-webkit-min-device-pixel-ratio: 1.25), (min-width: 0px) and (min-resolution: 120dpi)"" srcset=""https://cdn3.movieweb.com/i/movie/9w5mo9gp0X4kW1jIzlDZh0ilPFnYob/272:50/A-Long-Weekend-In-Pest-And-Buda.jpg""><source media=""(min-width: 0px)"" srcset=""https://cdn3.movieweb.com/i/movie/9w5mo9gp0X4kW1jIzlDZh0ilPFnYob/136:50/A-Long-Weekend-In-Pest-And-Buda.jpg""><!--[if IE 9]></video><![endif]--><img src=""https://cdn3.movieweb.com/i/movie/9w5mo9gp0X4kW1jIzlDZh0ilPFnYob/384:50/A-Long-Weekend-In-Pest-And-Buda.jpg"" alt=""A Long Weekend In Pest And Buda (2003)""></picture></figure><div class=""movie-description""><h2 class=""movie-title""> A Long Weekend In Pest And Buda </h2><div class=""movie-info""><ul class=""movie-info-items""></ul><ul class=""movie-info-items movie-info-items-second""><li class=""movie-age-rating"">Unrated</li><li class=""movie-release-date""><time datetime=""2003-11-13"">November 13th, 2003</time></li><li class=""movie-runtime"">88 min</li><li class=""movie-genre""> Drama </li></ul></div><div class=""movie-synopsis""><p>Iván is living in exile from Hungary when he receives word that an old flame is ill. His return to Budapest rekindles old memories and reopens old wounds.</p></div></div></section><section class=""movie""><figure class=""movie-poster-missing""></figure><div class=""movie-description""><h2 class=""movie-title""> A Mother's Fight for Justice </h2><div class=""movie-info""><ul class=""movie-info-items""></ul><ul class=""movie-info-items movie-info-items-second""><li class=""movie-age-rating"">Unrated</li><li class=""movie-release-date""><time datetime=""2003-07-28"">July 28th, 2003</time></li><li class=""movie-runtime"">88 min</li><li class=""movie-genre""> Drama </li></ul></div><div class=""movie-synopsis""><p> Based on the true story of one mother&#x27;s quest for justice, this Lifetime Original Movie explores the extraordinary impact on an ordinary family when the oldest son is critically injured by a drunk driver. The movie begins with every mother&#x27;s worst nightmare: Terry Stone and her husband, Geoff, answer an early-morning phone call and learn that their 19-year-old son, Andrew, has been in a car accident. When they arrive at the hospital, the distraught family members are told that Andrew...</p></div></div></section><section class=""movie""><figure class=""movie-poster""><picture><!--[if IE 9]><video style=""display: none;""><![endif]--><source media=""(min-width: 1024px) and (-webkit-min-device-pixel-ratio: 1.25), (min-width: 1024px) and (min-resolution: 120dpi)"" srcset=""https://cdn3.movieweb.com/i/movie/vWJF48c2TKFmtOlrK5xRoVVDcJUN4f/460:50/A-Painted-House.jpg""><source media=""(min-width: 1024px)"" srcset=""""><source media=""(min-width: 768px) and (-webkit-min-device-pixel-ratio: 1.25), (min-width: 768px) and (min-resolution: 120dpi)"" srcset=""https://cdn3.movieweb.com/i/movie/vWJF48c2TKFmtOlrK5xRoVVDcJUN4f/484:50/A-Painted-House.jpg""><source media=""(min-width: 768px)"" srcset=""https://cdn3.movieweb.com/i/movie/vWJF48c2TKFmtOlrK5xRoVVDcJUN4f/304:50/A-Painted-House.jpg""><source media=""(min-width: 481px) and (-webkit-min-device-pixel-ratio: 1.25), (min-width: 481px) and (min-resolution: 120dpi)"" srcset=""https://cdn3.movieweb.com/i/movie/vWJF48c2TKFmtOlrK5xRoVVDcJUN4f/384:50/A-Painted-House.jpg""><source media=""(min-width: 481px)"" srcset=""https://cdn3.movieweb.com/i/movie/vWJF48c2TKFmtOlrK5xRoVVDcJUN4f/274:50/A-Painted-House.jpg""><source media=""(min-width: 0px) and (-webkit-min-device-pixel-ratio: 1.25), (min-width: 0px) and (min-resolution: 120dpi)"" srcset=""https://cdn3.movieweb.com/i/movie/vWJF48c2TKFmtOlrK5xRoVVDcJUN4f/272:50/A-Painted-House.jpg""><source media=""(min-width: 0px)"" srcset=""https://cdn3.movieweb.com/i/movie/vWJF48c2TKFmtOlrK5xRoVVDcJUN4f/136:50/A-Painted-House.jpg""><!--[if IE 9]></video><![endif]--><img src=""https://cdn3.movieweb.com/i/movie/vWJF48c2TKFmtOlrK5xRoVVDcJUN4f/384:50/A-Painted-House.jpg"" alt=""A Painted House (2003)""></picture></figure><div class=""movie-description""><h2 class=""movie-title""> A Painted House </h2><div class=""movie-info""><ul class=""movie-info-items""></ul><ul class=""movie-info-items movie-info-items-second""><li class=""movie-age-rating"">Unrated</li><li class=""movie-release-date""><time datetime=""2003-04-27"">April 27th, 2003</time></li><li class=""movie-runtime"">120 min</li><li class=""movie-genre""> Drama </li></ul></div><div class=""movie-synopsis""><p> A young boy, his family, and the migrant workers they hire to work their cotton farm struggle against difficult odds to raise and sell the crop. Meanwhile, the boy dreams of living in better conditions. However, with this particularly tough farming season, the boy learns that his challenges guide him in discovering who he really is. Written by Anonymous </p></div></div></section></div><nav class=""pagination""><ul class=""pagination-items""><li><a href=""https://movieweb.com/movies/2003/"" class=""pagination-link"">&laquo;</a></li><li><a href=""https://movieweb.com/movies/2003/?page=7"" class=""pagination-link"">7</a></li><li><a href=""https://movieweb.com/movies/2003/?page=8"" class=""pagination-link"">8</a></li><li><a href=""https://movieweb.com/movies/2003/?page=9"" class=""pagination-link"">9</a></li><li><a href=""https://movieweb.com/movies/2003/?page=10"" class=""pagination-link"">10</a></li><li><span class=""pagination-link-current"">11</span></li><li><a href=""https://movieweb.com/movies/2003/?page=12"" class=""pagination-link"">12</a></li><li><a href=""https://movieweb.com/movies/2003/?page=13"" class=""pagination-link"">13</a></li><li><a href=""https://movieweb.com/movies/2003/?page=14"" class=""pagination-link"">14</a></li><li><a href=""https://movieweb.com/movies/2003/?page=15"" class=""pagination-link"">15</a></li><li><a href=""https://movieweb.com/movies/2003/?page=16"" class=""pagination-link"">16</a></li><li><a href=""https://movieweb.com/movies/2003/?page=65"" class=""pagination-link"">&raquo;</a></li></ul></nav></article><aside class=""sidebar""><section class=""movie-categories""><h2 class=""movie-categories-heading"">Movie Releases</h2><ul class=""movie-categories-items""><li><a href=""https://movieweb.com/new-movies/"">New Movies</a></li><li><a href=""https://movieweb.com/movies-this-week/"">Movies This Week</a></li><li><a href=""https://movieweb.com/movies/now-playing/"">Movies Now Playing</a></li><li><a href=""https://movieweb.com/movies/coming-soon/"">Movies Coming Soon</a></li><li><a href=""https://movieweb.com/popular-movies-2019/"">Popular Movies 2019</a></li></ul><ul class=""movie-categories-items""><li><a href=""https://movieweb.com/star-wars-release-dates/"">Star Wars Release Dates</a></li><li><a href=""https://movieweb.com/upcoming-marvel-movies/"">Upcoming Marvel Movies</a></li><li><a href=""https://movieweb.com/upcoming-dc-movies/"">Upcoming DC Movies</a></li></ul></section><div class=""ad""><div id='div-gpt-ad-1416204122903-4'><script type='text/javascript'> googletag.cmd.push(function() { googletag.display('div-gpt-ad-1416204122903-4'); }); </script></div></div><section class=""sidebar-top""><header class=""sidebar-heading""><h2>Top Movies</h2></header><ul class=""sidebar-top-items""><li><a href=""/movie/star-wars-the-rise-of-skywalker/"" class=""sidebar-top-link"" title=""Star Wars 9""><strong class=""sidebar-top-link-heading"">Star Wars 9</strong><figure class=""sidebar-top-link-figure""><img src=""https://cdn3.movieweb.com/i/backdrop/RVCoyd9OdsCEi2euzVrae0sK592MHx/70:50/Star-Wars-The-Rise-Of-Skywalker.jpg"" alt=""Star Wars 9""></figure></a></li><li><a href=""/movie/avengers-endgame/"" class=""sidebar-top-link"" title=""Avengers: Endgame""><strong class=""sidebar-top-link-heading"">Avengers: Endgame</strong><figure class=""sidebar-top-link-figure""><img src=""https://cdn3.movieweb.com/i/backdrop/48T1b4pVbgCN3Yt2ctRgASfBSarTF9/70:50/Avengers-Endgame.jpg"" alt=""Avengers: Endgame""></figure></a></li><li><a href=""/movie/captain-marvel/"" class=""sidebar-top-link"" title=""Captain Marvel""><strong class=""sidebar-top-link-heading"">Captain Marvel</strong><figure class=""sidebar-top-link-figure""><img src=""https://cdn3.movieweb.com/i/backdrop/KUnVozBvOQutkEGYcSvrQNhuw5bdrL/70:50/Captain-Marvel.jpg"" alt=""Captain Marvel""></figure></a></li><li><a href=""/movie/joker-2019/"" class=""sidebar-top-link"" title=""Joker""><strong class=""sidebar-top-link-heading"">Joker</strong><figure class=""sidebar-top-link-figure""><img src=""https://cdn3.movieweb.com/i/backdrop/hcV58rffoLN9374BqjhvN0oRo3fJ0n/70:50/Joker.jpg"" alt=""Joker""></figure></a></li><li><a href=""/movie/aquaman/"" class=""sidebar-top-link"" title=""Aquaman""><strong class=""sidebar-top-link-heading"">Aquaman</strong><figure class=""sidebar-top-link-figure""><img src=""https://cdn3.movieweb.com/i/backdrop/ww6C6qO2PKTUcvjUykqxSmmBAKJmnO/70:50/Aquaman.jpg"" alt=""Aquaman""></figure></a></li><li><a href=""/movie/shazam/"" class=""sidebar-top-link"" title=""Shazam!""><strong class=""sidebar-top-link-heading"">Shazam!</strong><figure class=""sidebar-top-link-figure""><img src=""https://cdn3.movieweb.com/i/backdrop/1eG3I70oZxr4vx7u2CuQWlnGuCF0sS/70:50/Shazam.jpg"" alt=""Shazam!""></figure></a></li><li><a href=""/movie/detective-pikachu/"" class=""sidebar-top-link"" title=""Detective Pikachu""><strong class=""sidebar-top-link-heading"">Detective Pikachu</strong><figure class=""sidebar-top-link-figure""><img src=""https://cdn3.movieweb.com/i/backdrop/YpvEgQXa0aSUULArVDTN19xHiWx8na/70:50/Detective-Pikachu.jpg"" alt=""Detective Pikachu""></figure></a></li><li><a href=""/movie/godzilla-king-of-the-monsters/"" class=""sidebar-top-link"" title=""Godzilla: King of Monsters""><strong class=""sidebar-top-link-heading"">Godzilla: King of Monsters</strong><figure class=""sidebar-top-link-figure""><img src=""https://cdn3.movieweb.com/i/backdrop/ak5Yg3x6liWNNPcXKC1yBfn8IS0bt8/70:50/Godzilla-King-Of-The-Monsters.jpg"" alt=""Godzilla: King of Monsters""></figure></a></li><li><a href=""/movie/dark-phoenix/"" class=""sidebar-top-link"" title=""X-Men: Dark Phoenix""><strong class=""sidebar-top-link-heading"">X-Men: Dark Phoenix</strong><figure class=""sidebar-top-link-figure""><img src=""https://cdn3.movieweb.com/i/backdrop/QwDoGjsNYbGcV6agMZKPomifHjNvw0/70:50/Dark-Phoenix.jpg"" alt=""X-Men: Dark Phoenix""></figure></a></li><li><a href=""/movie/hellboy-2019/"" class=""sidebar-top-link"" title=""Hellboy""><strong class=""sidebar-top-link-heading"">Hellboy</strong><figure class=""sidebar-top-link-figure""><img src=""https://cdn3.movieweb.com/i/backdrop/O64dDjKz3yG6x4JbgnSDZQF6L8ki9b/70:50/Hellboy.jpg"" alt=""Hellboy""></figure></a></li></ul></section><div class=""sidebar-sticky""><div class=""ad""><div id='div-gpt-ad-1416204122903-2'><script type='text/javascript'> googletag.cmd.push(function() { googletag.display('div-gpt-ad-1416204122903-2'); }); </script></div></div></div></aside></div></main><div class=""ad-leaderboard ad-leaderboard-wrap""><div id='div-gpt-ad-1416204122903-0'><script type='text/javascript'> googletag.cmd.push(function() { googletag.display('div-gpt-ad-1416204122903-0'); }); </script></div></div><footer class=""site-footer""><div class=""site-footer-social""><ul class=""site-footer-social-links""><li><a href=""https://movieweb.com/rss/"" class=""site-footer-feed""><span>Feed</span></a></li><li><a href=""https://www.facebook.com/movieweb/"" class=""site-footer-facebook""><span>Facebook</span></a></li><li><a href=""https://twitter.com/intent/follow?source=followbutton&variant=1.0&screen_name=movieweb&original_referer=https://movieweb.com/movies/2003/"" class=""site-footer-twitter""><span>Twitter</span></a></li><li><a href=""https://www.instagram.com/movieweb/"" class=""site-footer-instagram""><span>Instagram</span></a></li><li><a href=""https://www.youtube.com/user/movieweb?sub_confirmation=1"" class=""site-footer-youtube""><span>YouTube</span></a></li></ul></div><div class=""site-footer-info""><ul class=""site-footer-info-links""><li><a href=""https://movieweb.com/about/"">About</a></li><li><a href=""https://movieweb.com/privacy/"">Privacy</a></li><li><a href=""https://movieweb.com/terms/"">Terms</a></li><li><a href=""https://movieweb.com/contact/"">Contact</a></li></ul><p class=""site-footer-copyright""><small>&copy; Watchr Media &bullet; All rights reserved</small></p></div></footer><div class=""hidden""><script type='text/javascript'> googletag.cmd.push(function() { googletag.defineOutOfPageSlot('/1007926/Interstitial', 'div-gpt-ad-1416695535258-0-oop').addService(googletag.pubads()); googletag.pubads().enableSingleRequest(); googletag.enableServices(); }); </script><div id='div-gpt-ad-1416695535258-0-oop'><script type='text/javascript'> googletag.cmd.push(function() { googletag.display('div-gpt-ad-1416695535258-0-oop'); }); </script></div></div><div class=""hidden""></div><script src=""https://cdn.movieweb.com/assets/5cb5b8ef3309b/sites/sites-main/js/app2.min.js""></script><script> var _comscore = _comscore || []; _comscore.push({ c1: ""2"", c2: ""17091571"" }); (function() { var s = document.createElement(""script""), el = document.getElementsByTagName(""script"")[0]; s.async = true; s.src = (document.location.protocol == ""https:"" ? ""https://sb"" : ""http://b"") + "".scorecardresearch.com/beacon.js""; el.parentNode.insertBefore(s, el); })(); </script><noscript><img src=""https://sb.scorecardresearch.com/p?c1=2&c2=17091571&cv=2.0&cj=1"" /></noscript><script type=""text/javascript""> _atrk_opts = { atrk_acct:""4fQco1IWNa10zK"", domain:""movieweb.com"",dynamic: true}; (function() { var as = document.createElement('script'); as.type = 'text/javascript'; as.async = true; as.src = ""https://certify-js.alexametrics.com/atrk.js""; var s = document.getElementsByTagName('script')[0];s.parentNode.insertBefore(as, s); })(); </script><noscript><img src=""https://certify.alexametrics.com/atrk.gif?account=4fQco1IWNa10zK"" style=""display:none"" height=""1"" width=""1"" alt=""alexa"" /></noscript><script>docReady();</script></body></html>",comedy
a problem with fear,"A young man in Calgary, Alberta is multiphobic: nonetheless, he believes that he is the cause of the fear which is killing people around him.",comedy
a small world," A prominent doctor wants to commit a suicide. Two cops chose a wrong way while driving down the road. The suspected one believes that he'll never be caught. His pretty wife who works in a confectionery and she's able only to love. One boy will help them all, but he's not even born yet... Just an ordinary day. Written by Mario ",comedy
a tale of two pizzas," The Bianco and Rossi families of Yonkers have been feuding for years - over pizza! Those who prefer a tangy sauce go to Rossi's; those who like their crust thin and crispy go to Bianco's. When young Angela Rossi, armed with a newly minted associates degree in marketing from FIT, tries to help her father put the Bianco's out of business, pizza détente goes out the window. And when young doodle artist Tony Bianco agrees to help his father steal the secret of the Rossi's...",comedy
a talking picture,"Rosa Maria, a young History professor, sets out with her daughter Maria Joana on a cruise that will travel through the Mediterranean to Bombay , India, where they will meet her husband. This pleasure cruise also serves for Rosa Maria, to get to know for the first time and show her daughter, places about which she talks in her classes but which she never visited. So, this trip through Ceuta, Marseille, the ruins of Pompei, Athens, the pyramids of Egypt, Istanbul, is also a journey through...",comedy
a touch of fate," One night in a small town in North Carolina, fate brings together three lives: an entertainment lawyer returning home to his dying mother after years in escape of his past, a woman trying to reclaim her supposed love, and a boy with a penchant for the sixth sense who struggles with the death of his father and overbearing love of his single mother. When the past and future suddenly bind these people together on a journey of need, forgiveness and discovery, they realize they've gained...",drama
a touch of spice,"Fanis, a 40 year-old astrophysics professor, journeys back to his childhood home in Greece. In affectionate, uplifting scenes, the film shows Fanis' relationship with his beloved grandfather as his grandfather recalls the suffering he endured when he was thrown out of Turkey at an early age, and the difficulties the family faced as they adjusted to life in Greece.",comedy
a wrinkle in time," The movie is based on a children's series by the same name. Meg and Charles Wallace are aided by Calvin and 3 interesting women, Mrs. Which, Mrs. Whatsit, and Mrs. Who in the search for their father who disappeared during an experiment he was working on for the government. Their travels take them around the universe to a place unlike any other. They must learn to trust each other and to understand that everyone is different. Written by Mandy Heuer ",family
a.b. normal college (todo na 'yan! kulang pa 'yun!),"Dominic (Ogie Alcasid) and Miguel (Mikey Macapagal Arroyo), the school's most notorious students, are challenged when the school participates in a quiz show to upgrade the image of the school. With the gorgeous Professor Eula Yulo (Rufa Mae Quinto) as their mentor, the three are out to prove to everyone that they are more than just troublemakers.",comedy
absolon,"In the near future, a virus has infected everyone on the planet, and Absolon is a drug that everyone must take to stay alive. One corporation controls the drug. Murchison is the leader of this firm. A scientist who was researching the virus is found murdered, and Norman Scott is the policeman who investigates the crime.",scifi
absolution,"An angel descends to Earth - intending to learn what it is like to live as a human being. While on Earth, this spirit becomes involved in terrorism, drug deals, and pornography. Chemicals used in a new super-bomb are to be melted down in VHS tape shells and secretly shipped out of the U.S. as part of a porn film deal. Overseas, the porno tapes will be melted down again so that the chemicals can be extracted and used for mass destruction. The angel wants to stop these evils,...",thriller
addiction," Addiction is the story of a young businessman, happily married to a sweet, understanding woman. After accidentally killing a mugger in self-defense, he is caught up in a flood of emotions he doesn't understand...rage, excitement, joy, even lust. This need soon blossoms into desire, desperation and then total dependence, a desperate rush that he cannot live without. And as he slowly alienates himself from his friends, his job, and the only woman who truly loves him, the downward spiral of...",thriller
air marshall,"A commercial jet plane has been hijacked by a group of terrorists who don't realize that a U.S. Air Marshal, Brett Prescott (Dean Cochran), is among the passengers. The fate of dozens of people lies in the hands of Prescott, who must forge a one-man war against the hijackers destructive plans.",action
al qods fee yom akhar," About a Palestinian girl of 17 who wants to get married to the man of her own choosing. Rana wakes up one morning to an ultimatum delivered by her father: she must either choose a husband from a preselected list of men, or she must leave Palestine for Egypt with her father by 4:00 that afternoon. With ten hours to find her boyfriend in occupied Jerusalem, she sneaks out of her father's house at daybreak to find her forbidden love Khalil (Natour). Written by [Excerpted from the MFA Film...",drama
alex and emma,"Alex (Wilson) is an author whose writer?s block and gambling debts have landed him in a jam. In order to get loan sharks off his back, he must finish his novel in 30 days or wind up dead. To help him complete his manuscript he hires stenographer Emma (Hudson). As Alex begins to dictate his tale of a romantic love triangle to the charming yet somewhat opinionated stenographer, Emma challenges his ideas at every turn. Her unsolicited yet intriguing input begins to inadvertently influence Alex and...",comedy
alexandra's project,A regular suburban family man comes home from work on his birthday to find a deserted house and a videotape waiting to be played.,drama
alibi," ""Alibi"" is a thriller with a bit of romance and touches of black humour along the way. Greg is discovered with the dead body of his wife's lover by Marcey, a public servant moonlighting as a waitress at a party thrown by Greg for he and his wife's wedding anniversary. Marcey sets about 'organising' the slightly neurotic Greg in his attempts to cover up the 'accident'. Written by Florrie ",thriller
alien hunter,"In 1947, in New Mexico, a radio operator receives a signal following patterns and while investigating the occurrence, he vanishes. In the present days, the same signal is transmitted from a base in Malvinas Island to United States of America, and a satellite captures images of a unknown object in Antartic.",action
alien tracker,"In a galaxy far away, alien criminals organize a spectacular prison break. Pursued by their home planet's authorities, their leader Zin decides there's only one place to go: through a wormhole that allows instantaneous travel to Earth. Cole is the Alien Tracker who's in hot pursuit of the escaped convicts.",action
all the real girls,"A young Southern man (Paul Schnedier), who's sowed his wild oats in just about every field in town, falls for a virgin (Zooey Deschanel) who happens to be his best friend's little sister.",drama
alles samba,"Art expert Katharina Diezmann is out of the blue, when one day the little Brazilian Marcia is standing at her door. Years ago Katharina had taken over a sponsorship for the eleven-year-old, but never expected that she would ever meet her. The little girl is in Berlin with her samba group over Christmas and has only one wish: finally to see real snow!",comedy
american misfits,"Skateboarding and stupidity have never looked this good. Jason ""Wee Man"" Acuna and Laban Pheidias wreak havoc and lay waste to anyone who crosses their path in American Misfits.",comedy
anatomie 2,"The doctor and soccer player in the leisure time Jo Hauser decides to move to Berlin and be an intern in a famous clinic, expecting to increase his knowledge and expertize, and help his handicap brother Willi Hauser. He joins a secret fraternity of doctors, under the leadership of Prof. Muller-LaRousse, who is researching the use of bionic muscles in human beings without any ethics or respect to the laws. The team is also volunteer to the experiences, and is under investigation of Paula...",horror
