title,plot,genre
fishing without nets,"A desperate Somali father becomes a pirate in order to feed his family, but experience an intense crisis of conscience in this thought-provoking drama. Abdi knows that his wife and child could starve should he fail to find work fast. After falling in with a band of local pirates, he helps to capture a French oil tanker, and the ransom negotiations begin. Meanwhile, as the money is being transported, Abdi strikes up a tenuous friendship with a frightened hostage. Abdi's resolve is soon tested,...",thriller
five star,"After John’s absent father is struck by a stray bullet, Primo takes it upon himself to verse the young boy in the code of the streets—one founded on respect and upheld by fear. A member of the Bloods since the age of twelve—both in the film and in reality—the streets of Brooklyn are all Primo has ever known. While John questions whether or not to enter into this life, Primo must decide whether to leave it all behind as he vows to become a better husband and father. Set during those New...",drama
flowerman,Loving wife & mother Sarah is abducted by intelligent and forensically aware psychopath Nigel. The family and the police are subjected to a manipulation of the reality that surrounds them. Relating to the darkest side of the human character Flowerman also connects with both a spiritual aspect and a basic drive for survival.,drama
flutter,"With her husband away indefinitely, a young mother struggles to nurture her son in the face of poverty, isolation and incarceration. FLUTTER explores the truest love on earth-the love of a mother and child.",drama
flying home,"Colin, an ambitious young American businessman, has a deal with a potential client, a rich Arab sheikh who is a passionate pigeon fancier. The sheikh has tried several times to buy a champion pigeon, but the owner continues to stubbornly refuse his offer. In an attempt to gain the trust of the Sheikh, Colin offers him a deal: if he manages to convince the owner to sell the champion pigeon, the sheikh will agree to do business with Colin's company. But when Colin meets Jos, the grumpy owner of...",romance
flytrap,"Flytrap mixes sci-fi with dark humor to tell the story of a reserved English Astronomer who becomes ensnared by the mysterious Mary Ann and her creepy and dangerous comrades. Held hostage in a twisted version of suburban San Fernando Valley, the Astronomer slowly uncovers the reason for his capture and the miserable fate that awaits him-and humanity-unless he acts.",comedy
for francis,"Francis is a seven year old boy who loves dresses. When his teacher makes Francis a dress, his father Matt becomes enraged. Fearing the worst, Matt is forced to face his own fears and to choose between protecting his son from an intolerant world, or allowing the boy to live truthfully.",drama
forbidden empire,"Early 18th century. Cartographer Jonathan Green undertakes a scientific voyage from Europe to the East. Having passed through Transylvania and crossed the Carpathian Mountains, he finds himself in a small village lost in impassible woods. Nothing but chance and heavy fog could bring him to this cursed place. People who live here do not resemble any other people which the traveler saw before that. The villagers, having dug a deep moat to fend themselves from the rest of the world, share a naive...",adventure
force majeure,"A Swedish family travels to the French Alps to enjoy a few days of skiing. The sun is shining and the slopes are spectacular but, during a lunch at a mountainside restaurant, an avalanche turns everything upside down. With diners fleeing in all directions, mother Ebba calls for her husband Tomas as she tries to protect their children. Tomas, meanwhile, is running for his life... The anticipated disaster failed to occur, and yet the family's world has been shaken to its core, a question mark...",drama
fort bliss,"After returning home from an extended tour in Afghanistan, a decorated U.S. Army medic and single mother struggles to rebuild her relationship with her young son.",drama
fort mccoy,"Unable to serve in World War II because of a heart condition, a barber moves his family adjacent to a Wisconsin army base and prisoner-of-war camp to provide his services. But even in rural America -- far from the frontline -- the war finds victims.",drama
fort tilden,"Amidst quarter-life crises, Allie struggles to prepare for the Peace Corps, while Harper awaits checks from her father to fund her artistic dreams. But the two friends quickly shun responsibilities for the day when a pair of good-looking guys invites them along for a carefree Fort Tilden afternoon. As the two young women board their bikes and embark on a lengthy journey to the beach, they quickly realize that, akin to their confusing, transitioning lives, they neither know where they’re going...",comedy
four of hearts,"Like many couples, April (Nadine Ellis) and Derrick (Darrin DeWitt Henson) feel like the spark is missing from their marriage. With the demands of work and their hectic schedules, they find themselves in a six-month dry spell. Desperate to shake up their love life and rekindle their passion for each other, they decide to share a steamy night with their free-spirited friends, Christy (Michelle Krusiec) and Matt (Gabriel Olds). Soon after, April and Derrick find themselves dealing with unexpected...",drama
frank vs. god,"Frank is a man who thinks he has lost everything, until his house is destroyed by a tornado. Then when he goes to the insurance company, he’s told they won't pay because the damage falls under the ""Act of God"" exclusion in his policy. With nothing left, and nothing left to lose, he decides to sue God himself for damages, naming representatives of the world's religions as defendants in the suit. What starts as a ridiculous stunt, becomes a beautiful, funny, soulful odyssey in which he...",comedy
free fall,"When the sudden and shocking death of a coworker sends everyone reeling at Gault Capital, JANE, uncovers a very dangerous secret. Her boss, charismatic billionaire Thaddeus Gault, is suspected of massive financial fraud. An assassin, FRANK, is dispatched to silence her forever. Jane's flight from the office is forestalled when her pursuer shuts down her elevator. Now, trapped and alone, Jane must find a way to escape her steel cage before the killer reaches her. This brooding and relentless...",action
freedom,"Two men separated by 100 years are united in their search for freedom. In 1856 a slave, Samuel Woodward and his family, escape from the Monroe Plantation near Richmond, Virginia. A secret network of ordinary people known as the Underground Railroad guide the family on their journey north to Canada. They are relentlessly pursued by the notorious slave hunter Plimpton. Hunted like a dog and haunted by the unthinkable suffering he and his forbears have endured, Samuel is forced to decide between...",drama
freezer,"Robert (McDermott), an everyday guy, finds himself tested beyond human endurance when he awakens to find himself locked in an industrial freezer by Russian thugs. They insist he returns the $8 million dollars he stole from them, the only problem is, Robert has no idea what they are talking about. Surprised as anyone would be, Robert finds he is not alone in the freezer when he finds Sam (Facinelli) hiding behind a series of boxes. Unsure of each other, but stuck in a battle together, the two...",action
friends and romans,"A group of lifelong mob movie extras mount a production of Shakespeare's Julius Caesar in their local Staten Island theater in order to finally get some speaking roles. But the theater is the secret hideout of a real-life gangster who fancies himself an actor, and whom the FBI are hunting for the recent murder of a Broadway producer. The Feds insert their own undercover agent to audition for the role of Cassius, seeking to determine who is the real gangster among a cast of make-believe...",comedy
from the dark,"A sinister being has awakened from a thousand-year sleep and it has set its sights on the stranded young couple. Deep within the dark bog, the two are faced with an unimaginable evil, but they soon realize that there may be one thing that can stop the creature: light. As the sun sets and light sources dwindle, the creature becomes more powerful, and Sarah and Mark find themselves in a fight for their lives where a gas lamp or even just the illumination of a single match may be the only thing...",horror
from what is before,"The Philippines, 1972. Mysterious things are happening in a remote barrio. Wails are heard from the forest, cows are hacked to death, a man is found bleeding to death at the crossroad and houses are burned. Ferdinand E. Marcos announces Proclamation No. 1081 putting the entire country under Martial Law.",drama
frontera,"In the vein of Traffic and Babel, Frontera is set in the dangerous area between the United States and Mexico. After crossing the border illegally for work, Miguel (Michael Pena), a hard-working father and devoted husband, finds himself wrongfully accused of murdering a former sheriff’s (Ed Harris) wife. After learning of his imprisonment, Miguel’s pregnant wife (Eva Longoria) tries to come to his aid and lands in the hands of corrupt coyotes who hold her for ransom. Dissatisfied with the...",drama
fury: the tales of ronan pierce,"Ronan Pierce is a vigilante cop with one thing on his mind, revenge. When his past comes back to haunt him in the form of a former friend Damien Logan, now human trafficking kingpin, Ronan must fight his way through the deadly streets of Harbor City and all the scum bags in his way to find his kidnapped ex wife. With the help of a former circus clown Karina McCoy, Ronan will paint the town red in this action packed comic book style adventure.",action
futatsume no mado,"Taking place during the full-moon night of traditional dances in August and set on the Japanese island of Amami-Oshima, the drama centers on a 14-year-old boy who finds a dead body floating in the sea. The young man enlists the help of his girlfriend to solve the mystery. The pair “will learn to become adults by experiencing the interwoven cycles of life, death and love.",drama
future fighters,"The fate of all humanity rests with a small clutch of brave soldiers, and their sophisticated intra-stellar fighting machines, as they must defend the free solar system from a sinister invading force, in order to fight... for their future.",action
gabriel,"GABRIEL, a troubled young man, is convinced that reuniting with his first love will bring him the stability and happiness he craves. Against his family’s better judgment, he sets out to find her, but as the obstacles mount on his search, his grip on reality begins to slip and his behavior becomes more erratic. In the end, he risks everything in an increasingly obsessive and desperate pursuit.",drama
gabriel,GABRIEL is both subtle and cheerful as well as a deeply touching story of friendship and love contrasted with elements of competition and conflict. Dynamic action and an excellent cast create huge potential to attract young spectators.  - Written byAnonymous ,adventure
garm wars: the last druid,"In a world where clone soldiers from three military tribes are locked in a perpetual battle of air, land and technology, one clone is separated from the battle and finds herself on the run with a group of unlikely companions.",action
gemma bovery,"When British beauty Gemma Bovery (Arterton) and her furniture restorer husband move to a charming old farmhouse in the same Norman village where Flaubert’s literary classic “Madame Bovary” was written a century earlier, a local baker and Flaubert expert becomes entranced with Gemma and sets out to be her guide and mentor to her new surroundings. As reality sets in on rural French domesticity, the Boverys’ marriage begins to fray and Gemma finds herself catching the eye of a young...",comedy
gente de bien,"Ten-year-old Eric finds himself almost overnight living in a grungy quarter of downtown Bogotá with his father, Gabriel, whom he barely knows. Gabriel is a carpenter by trade, but struggles to make ends meet. He works doing odd jobs for Maria Isabel, an upper middle class woman with children of her own, who takes an interest in their situation. Over the Christmas holidays she invites them to come to stay at her family’s luxurious country villa. But tensions soon begin to crackle...",drama
gentlemen,"Beaten up, bruised, and scared, a young writer hides in a Stockholm apartment, writing the story of its disappeared inhabitants: the flamboyant and charismatic Morgan brothers.",drama
get back,"Get Back centers on the discovery of a time machine by two die-hard Beatles fans, who travel back in time to prevent John Lennon from meeting Yoko Ono, who they blame for the break-up of the Fab Four.",comedy
get santa,"Get Santa tells the story of a father and son who must team up to save Christmas, once they discover Santa Claus sleeping in their garage after crashing his sleigh and finding himself on the run from the police.",comedy
gett: the trial of viviane amsalem,"The trial story of Viviane Amsalem's five year fight to obtain her divorce in front of the only legal authority competent for divorce cases in Israel, the Rabbinical Court.",drama
ghost in the shell arise - border 4: ghost stands alone,"The anime's story is set in 2027, one year after the end of the fourth non-nuclear war. New Port City is still reeling from the war's aftermath when it suffers a bombing caused by a self-propelled mine. Then, a military member implicated in arms-dealing bribes is gunned down. During the investigation, Public Security Section's Daisuke Aramaki encounters Motoko Kusanagi, the cyborg wizard-level hacker assigned to the military's 501st Secret Unit. Batou, a man with the ""eye that...",scifi
ghost of goodnight lane,"When the staff inside a renovated film studio finds a co-worker dead one morning, the pieces of a forty year puzzle add up to an angry ghost who has let the last person step inside her house. But will they ever get out alive?",comedy
gilgamesh,"A military expedition in Siberia gone wrong. The existence of humanity is in peril as Inanna, Sumerian goddess of lust and war has summoned a giant meteor to destroy the planet, after being accidentally set free from her ancient prison.",drama
girlhood,"Oppressed by her family setting, dead-end school prospects and the boys law in the neighborhood, Marieme starts a new life after meeting a group of three free-spirited girls. She changes her name, her dress code, and quits school to be accepted in the gang, hoping that this will be a way to freedom.",drama
girltrash: all night long,"The story of five girls and one epic night. The girls will find love, lust, girl-fights, rock and roll, and a whole lot of stoned sorority girls.",comedy
gloria jesus,"A young Brazilian pastor zealously pursues his mission to convert the indigenous people of the Amazon.His fervor and charisma draw the attention of the World Christ Channel, a U.S.-based evangelical network methodically expanding across five continents which recruits him to be part of its team of televangelists.Emboldened by their success and momentum, the crusaders march toward their ultimate challenge: Afghanistan... Inspired by true events, this film neither defends nor indicts. It is a...",comedy
goal of the dead,"First half: For the Olympique de Paris soccer team, this away match scheduled against Caplongue was merely supposed to be one last chore before the end of the professional season. Yet no one could ever have imagined that an unknown rabies-like infection was going to spread like wildfire, turning this small town’s inhabitants into ultra-violent and highly contagious creatures. For Samuel, the former golden boy who is nearing retirement, Idriss, the arrogant wunderkind, Coubert, the team’s...",comedy
god's pocket,"When Mickey's crazy stepson Leon is killed in a construction 'accident', nobody in the working class neighborhood of God's Pocket is sorry he's gone. Mickey tries to bury the bad news with the body, but when the boy's mother demands the truth, Mickey finds himself stuck in a life and death struggle between a body he can't bury, a wife he can't please and a debt he can't pay.",drama
gold,An offbeat comedy about an estranged father who returns to his hometown after an absence of ten years in order to reconnect with his daughter and ex-wife but unwittingly finds himself responsible for almost destroying all their lives.,comedy
gone doggy gone,"Gone Doggy Gone is a comedic feature about a couple stuck in a lack-luster marriage who treat their dog like a baby. Working the grind in LA they leave little time for each other, and what free time they have they spend doting on the dog... until it gets kidnapped. What ensues is an outlandish cat-and-mouse adventure as they hunt down the kidnapper, enlist a schlubby PI, find a renewed love of each other, and conquer their fear of parenthood.",adventure
gone too far!,"GONE TOO FAR follows two estranged teenage brothers over the course of a single day as they meet for the first time, and struggle to accept each other for who they are. Yemi can't wait for his big brother to join him on the estate in Peckham - but when Ikudayisi arrives from Nigeria wearing socks and sandals Yemi questions both his judgement and his African heritage. A day on the estate filled with danger and excitement teaches both of them the values of family and self respect.",comedy
gone with the bullets,"Set in 1920s Shanghai, Ma Zouri and Xiang Feitian establish a notorious beauty pageant called the Flowers Competition. All of the city's elite attend the gala event, but when Wanyan Ying unexpectedly wins, it sets into motion a series of tragic events that change their destinies.",action
good for nothing,"Easygoing Gianni looks forward to retirement - until he is informed that a change in the law obliges him to work three more years. Faced with the outrageous possibility of having to do a full day's work, he sets about finding a way to achieve a quiet life",comedy
goodbye to all that,"Paul Schneider (Parks and Recreation) stars as a newly single dad navigating the good, the bad, and the weird of the 30-something singles scene in this whip-smart comedy. When his wife unexpectedly informs him that she wants a divorce, well-meaning but oblivious husband Otto Wall (Schneider) finds himself thrust back into bachelorhood. Cue a hilarious sequence of romantic encounters-from reconnecting with a former crush to online dating-as Otto searches for the real thing amidst a string of one...",comedy
goodbye to language,About a man who’s angry at his wife because she’s met another man on a park bench and they no longer even speak the same language.,drama
"gore, quebec","Gore, Quebec tells the story of two acquaintances who are set up by their mutual friends on a cottage weekend in Quebec. What was supposed to be an exciting and fun weekend, quickly turns into the blind date from hell, as the Couple discover that the cottage is not safe, and that their friends are already dead. The film begins in a home movie found-footage style, but quickly shifts into a more cinematic style once things start unraveling. With a serial killer terrorizing them, the Couple have...",horror
grace,"Gracie knows hangovers. She's intimately acquainted with them. But this one? Why did she wake up, half-dressed, on a Florida beach, 1100 miles from home? And this time her father - who also knows about the tragedy of addiction from his struggles with Gracie's mom - isn't going to clean things up.",drama
grace: the possession,"A unique horror film told from the first-person perspective of Grace - a naive, virginal college freshman trying to deal with campus culture and her outgoing roommate as an evil entity takes over her body and unleashes chaos.",horror
grantham & rose,"When a petty crime thrusts him into the company of a feisty eighty-one-year-old African-American woman named Rose Price, Grantham and Rose push the boundaries of their relationship, their lives, and what it means to love, as they take a road trip back to their roots.",comedy
grim night,"Grim Night, a thriller about about a night that happens once a year globally, where people lock themselves at home and fend off the senseless and random attacks by Grims.",horror
growing up and other lies,"After struggling for years as an artist in New York City, Jake is calling it quits and returning home to Ohio. On his last day in the city, he persuades his three oldest friends to help him retrace their greatest adventure together: a walk down the entire length of Manhattan. But their attempt to reclaim the glory of their early 20s doesn't go quite as planned. Over the course of the day, buried conflicts emerge as Jake becomes embroiled with his ex-girlfriend and his friends dip into their own...",comedy
grumpy cat's worst christmas ever,"Grumpy Cat is a lonely cat living in a mall pet shop. Because she never gets chosen by customers, she develops a sour outlook on life...until one day during the holidays, a very special 12-year-old girl named Chyrstal enters the pet store and falls in love with her after realizing she is the only person who can hear this unique cat talk. As the two develop a close friendship during the holiday rush, Grumpy reluctantly thwarts the kidnapping of an exotic dog she dislikes, and on Christmas Eve...",comedy
guardian,"After the killing of Vishnu in his house, Sarah (Dominique Diyose) his wife, trying to teach martial arts to their daughter, Regis (Belinda Comesi), which is actually really do not like martial arts. Until one day, Paquita (Sarah Carter) and his group hunt them. Sarah is asking for help Captain Roy (Nino Fernandez), a friend of Vishnu in the police, knowing later it turns out they are also hunted by men Oscar (Tio Pakusadewo). Scenes adrenaline rush ensued. Of racing on the main streets of...",action
guardian angel,"After the tragic death of his wife, Ray, a veteran security specialist, must protect the daughter of a businessman who embezzled millions from a crime boss in Los Angeles. Uncovering much more than he bargained for, Ray takes matters into his own hands and must risk his life to save the lives of two innocent women. All in. No mercy.",action
guidance,"Fabricating credentials to score a last-ditch job as a high school guidance counsellor, a boozing, drug-addled former child star becomes an improbable hit with his students by dispensing the worst advice possible, in this hilarious reprobate comedy from writer-director-star Pat Mills.",comedy
guido,"Guido is an Iraqi immigrant-turned-New Jersey hit man. After finding himself in the middle of a deal gone awry, Guido is then assigned to transport the body of the man he was meant to protect across the country. Before he’s off to get the job done, his elderly landlady, Maria (Lupe Ontiveros), blackmails him into taking her along for the ride. With Maria beside him, and several Albanian assassins and the FBI in pursuit, Guido’s mission turns into an experience that forces him to confront...",action
gun woman,"A brilliant doctor on a quest for revenge buys a young woman and trains her to be the ultimate assassin, implanting gun parts in her body that she must later assemble and use to kill her target before she bleeds to death.",action
gunday,"Based in Calcutta during its most unsettled times in the 1970s, the film deals with the inseparable life of Bikram and Bala. The story of 2 boys, boys who became refugees. Refugees who became gun couriers. Gun Couriers who became coal bandits, coal bandits who became Calcutta's Most Loved, Most Celebrated, Most Reckless, Most Fearless, Most Powerful! A story of two happy-go-lucky renegades who came to be known as...GUNDAY!",action
guys and girls can't be friends,A young man discovers love for the first time with a girl he's been friends with since grade school but struggles to avoid first-time heartbreak in small-town Virginia.,romance
h.,"H. is a modern interpretation of a classic Greek tragedy in which two women, each named Helen, live out their mirrored lives of one another in the town of Troy, NY. The first Helen is in her 60s, lives with her husband Roy, and takes care of a small, extremely lifelike baby doll called a “Reborn Doll,” which she cares for as a living baby. The second Helen is in her 30s, has a successful art career with her partner Alex, and is four months pregnant. One night, something falls out of the...",drama
hackney's finest,A small-time drug-dealer gets into big trouble when a corrupt East London cop tries to steal a consignment meant for Welsh-Jamaican Yardies.,action
hae-jeok: ba-da-ro gan san-jeok,"On the eve of the founding of the Joseon Dynasty, a whale swallows the Emperor's Seal of State being brought to Joseon by envoys from China. With a big reward on whoever brings back the royal seal, mountain bandits led by Jang Sa-jung go out to sea to hunt down the whale. But he soon clashes with Yeo-wol, a female captain of pirates, and unexpected adventure unfolds.",adventure
haganenet,"A teacher discovers in a five year-old child a prodigious gift for poetry. Amazed and inspired by this young boy, she decides to protect his talent in spite of everyone.",drama
hallåhallå,"Disa's husband has found himself a new love and a new future, while Disa has found herself in an unsatisfactory life. But one day a chatty father with seven children appearance, an uncommunicative patient at Disa's hostipal has begun to open up, and a new martial arts teacher has begun teaching in this small town in Dalarna.",comedy
han gong-ju,"After transferring to a new school, a teenage girl finds her troubled past exposed when she innocently signs up for a singing club.",drama
