title,plot,genre
dreaming of julia,"The year is 1958, and in Holguín, Cuba, a boy's world is about to change forever.  - Written byL.M. Arza-Goderich <[email protected]> ",comedy
duda,"A gaggle of friends and observers ponder the fate of a relationship as they watch it collapse in this independent drama from the Philippines. Cris (Andoy Ranay) is a documentary filmmaker with a well-regarded body of work and a large community of friends and admirers. Cris is also gay, and possesses a voracious sexual appetite, claiming to have had sex with over 4,000 men during his years of frequent cruising. But Cris has fallen for Eric (Paolo Gabriel), and has sworn off meaningless sex for...",drama
dumb luck,"After a blind date with the wrong woman at the mall, divorced accountant Stephen Hitchcock (Scott Baio)suddenly finds himself in the middle of a conspiracy scheme to steal 29 million dollars. Norman Byers (Scott Subiono), a computer expert, is supposed to meet his partner Kelly Jordan (Tracy Nelson)at the mall to pass her some incriminating phone numbers as part of the scheme. Two mysterious men in suits begin chasing him, forcing him to act fast-- he ditches the evidence into someone's...",comedy
dysfunktional family,"Eddie Griffin stars in this hilariously raunchy concert film which features no-holds barred real life interviews with his family in Kansas City integrated into the comedy star's over the top stand-up performance. ""DysFunKtional Family showcases Griffin's raucous and frank take on life, family and celebrity. If you think ""The Osbournes"" are outrageous, you haven't seen anything yet...",comedy
easy six," Packard Schmidt is a burnt-out, middle-aged college English professor. In a desperate attempt to restore some sense of vitality to his lonely existence he embarks on a series of impulsive romantic exploits resulting in a cavalcade of disaster both personally and professionally. These disasters change and educate Pack and serve eventually as a meditation on the meaning and power of desire, loss, and love. Written by Anonymous ",comedy
eddie izzard: sexie,"Filmed in Eastbourne where his grandfather and father were born and where he went to school, this show is the funniest live show that could ever be performed by a warm blooded animal.",comedy
ek din 24 ghante," Sameera Dutta is an enlightened and intelligent young woman, who knows exactly what she wants of life. She belongs to an upper class family, and lives with her mom and dad, a business executive. She is in love with a young man by the name of Virendra, who comes from a poor family, and is disliked by her dad. Nevertheless, Sameera loves him, and will not marry anyone else, despite warnings from her dad. One day, Virendra telephones Sameera and asks her to bring in two lac rupees as he has to...",thriller
elina: as if i wasn't there," In rural Sweden of the early 1950s, little Elina goes to school again after recovering from tuberculosis, the same illness that has killed her father a few years earlier. Elina's family belongs to Finnish-speaking Finns frowned upon by a staunch schoolmistress who starts hounding Elina for questioning her authority. Elina's mother, sister, and a liberal young male teacher all try to mediate the ensuing battle of wills between Elina and Miss Holm. Elina finds consolation in wandering...",drama
ellen degeneres: here and now,"Ellen DeGeneres has done everything, from starring in hit sitcoms and movies, to writing best-selling books, to having her own new talk show, but she's never forgotten her roots as a stand-up comedian. Taped at New York City's Beacon Theatre before a live audience, Ellen DeGeneres: Here and Now features the kind of humor that first made her a star, offering her offbeat insights into everyday life. Her feel-good humor touches on something that anyone can identify with, be it the obligatory gay...",comedy
eloise at the plaza,"Eloise is an imaginative little girl living in New York City with her nanny, going on various adventures.  - Written byGasmaskProductionsBooks ",comedy
emile,"Starring two-time academy award nominated Sir Ian McKellen, ""Emile"" is the poignant exploration of an older man's struggle to reconnect with his past. From the director of ""Johnny"" (1999) and ""Lola"" (2001) comes the third chapter of films dealing with a character's search for identity at a critical point in life. When Emile (McKellen) is given the opportunity to travel from England to Victoria on Canada's west coat to receive an honorary degree at the university, he goes knowing that it might...",drama
endangered species,"When police are puzzled by several horrific murders, they assume they have a serial killer on their hands. But soon they realise that the unimaginable has happened. A killing machine from another world has arrived on Earth determined to brutally execute human beings. Finding themselves out of their depth they are forced to rely on a mysterious alien hunter that has volunteered his help.",horror
er di," The young adult life of Hong Yunsheng, nicknamed Little Brother, is seen as somewhat of a failure by those that know him. A Chinese national, he stowed away on a boat to the United States, where he worked as a dishwasher in the restaurant of a family from his hometown back in Fujian province. After two years in the States and after fathering an illegitimate child there named Fusheng, the child's mother Xuhui who is the restaurateur's daughter, he was deported back to China. Since, he...",drama
escape from taliban," Sushmita and Jaanbaz live in India, and they are in love. They intend to marry, but Sushmita's family is strongly opposed to the marriage, since Jaanbaz is a Muslim and they are Hindus. But Sushmita and Jaanbaz do get married, and Jaanbaz takes her with him to his country--Afghanistan. On the way there, Sushmita is horrified to see mutilated corpses, bomb explosions, and armed militants. She is terrified and asks Jaanbaz to take her back, but Jaanbaz takes her to his home. Jaanbaz's...",drama
evil alien conquerors," My-ik [Diedrich Bader] and Du-ug [Chris Parnell] are evil alien conquerors from the planet Kabijj. They have exactly 822,000 tilkrons (2 and half days) to behead all of mankind. Otherwise they will feel the wrath of a 100 foot giant, named Croker [Tyler Labine]. Armed with only their swords, these inept evil aliens find Earth harder to conquer than planned. Will alcohol, fast food, mad cows, and women stand in their way? Or is the Earth doomed? Written by Daynera ",comedy
evil breed: the legend of samhain," Two American tourists on a romantic camping trip are brutally murdered. A few days later, during the ancient festival of Samhain, a group of American university students moves into a beautiful cottage, surrounded by a lush forest and a majestic lake They are here to learn about the rituals of the ancient Druids and other Celtic legends. But in the remains of an abandoned copper mine, lives the ancestors of an incestuous clan of cannibals. Stalked by a hulking, disfigured mutant, the students...",comedy
exam," While fully enjoying the life of the 70's, in communist Romania, a young man is arrested and accused of a terrible crime. Freed a few years later and deeply affected by his sinister experience, he tries to find out what had really happened. Does he have the right to revenge himself? Written by FcPoliFan ",drama
exposed,"A best selling author for 30 years, Carlos Castaneda inspired millions to break free from social dogma, fueling controversy over his work's authenticity and assertions of perceiving non-ordinary reality. Genius, guru, cult leader or fraud? No one really knows.",comedy
facing windows,"Giovanna, though still very young, has been married to her devoted husband Filippo for 9 years. She divides her time between her job at the poultry factory, looking after her 2 children, and baking cakes for the local cafe, bearing the weight of responsibility on her shoulders. The strain on Giovanna is increased when Filippo, in his kindness, brings home a refined elderly gentleman who has lost his memory. In trying to help this man Giovanna reluctantly spends more and more time with him,...",drama
fake,โป้ และ ซุง เป็นชายหนุ่มวัยยี่สิบต้นๆ ชีวิตจึงอยู่ในวัยเริ่มต้นและแสวงหา ทั้ง 3 คน พักอยู่ด้วยกัน แม้จะเป็นเพื่อนสนิทแต่ต่างคนก็มีวิถีชีวิตเป็นของตนเอง...,romance
fallen angel," When his father dies, Terry (Gary Sinese) returns to the house where he grew up, planning to stay only long enough to clean and settle the estate. Yet something indescribable keeps him there longer than expected. Soon, he is reunited with memories and people from his past and his life is changed forever. Written by Anonymous ",romance
falling angels," The wickedly funny story of three sisters' coming of age in a wildly dysfunctional family, set against the backdrop of the 60's, free love, the Cold War, LSD and the dawn of feminism. Affectionately dubbed ""Little Women on acid"", this is a story about the destructive effects of secrecy and the bonds of duty between parents and their children. Written by Anonymous ",drama
fanfan la tulipe,"In this 2003 remake of the classic 1952 French film, Fanfan la Tulipe is a swashbuckling lover who is tricked into joining the army of King Louis XV by Adeline La Franchise, who tells Fanfan that by doing so, he will eventually marry one of the king's daughters",adventure
far side of the moon,"Before Galileo, it was believed that the moon was a polished mirror, its surface a reflection of the globe. In the 1960s, a Soviet lunar probe exposed the far side of the moon (which can never be seen from Earth) as scored and disfigured by storms of celestial debris. From this discovery, writer-director Robert Lepage crafts an engaging metaphor of mysterious dualities, juxtaposing sibling rivalry with the US-Soviet space race. Estranged brothers Philippe and André (dual performance by...",drama
fast food high,"Fast Food High tells the story of Emma Redding, a young fast food restaurant employee who musters her inner Erin Brockovich and tries to start a union. When new management takes over the local fast food restaurant, favoritism, unstable hours and sexual harassment come with it. Eager to do something about it, Emma risks losing her job, her boyfriend, and her status with the ""in"" crowd as she squares off against big business in the greatest challenge of her young life.",comedy
fat pizza,"Fat Pizza the Film is yet another slice of life at a dodgy suburban Sydney take away. Bobo Gigliotti the psychotic pizzeria owner/pizza chef is awaiting the arrival of his mail-order refugee bride Lin Chow Bang, and a new pizza deliverer is on the block. Channel V's Jabba almost steals the show as token skip delivery boy Davo Dinkum, a stoner with a bong strapped to his face like a feedbag.",action
father and son,"Father and Son live together in a rooftop apartment. They have lived alone for years in their own private world, full of memories and daily rituals. Sometimes they seem like brothers. Sometimes even like lovers. Following in his father's footsteps, Alexei attends military school. He likes sports, tends to be irresponsible and has problems with his girlfriend. She is jealous of Alexei's close relationship with his father. Despite knowing that all sons must one day live their own lives, Alexei is...",drama
fear and trembling,"Amélie, a dreamy and romantic young Belgian woman, arrives in Japan to begin work as a translator for the giant Yumimoto Corporation. For Amélie, who spent her childhood in Japan, this is a dream come true. It is her chance to become a ""real Japanese."" Eager to please her bosses and co-workers, Amélie diligently accomplishes her daily tasks with invention and enthusiasm. But unfamiliar with the customs of the Japanese workplace, she commits a series of cultural missteps and is...",comedy
fear of the dark,"Twelve year old Ryan Billings has been diagnosed with an acute fear of the dark. He spends each night lying awake in torment, waiting and watching as the evil in the darkness grows stronger, feeding off his fear. His older brother Dale, suspects that there is nothing wrong with Ryan and that this is just a ploy for more attention. Regardless, he promises to watch over his little brother as their parents head off to a party for the night. Outside a storm rages and when the power goes out,...",horror
fear x,"When his wife is killed in a seemingly random incident Harry (Turturro), prompted by mysterious visions, journeys to discover the true circumstances surrounding her murder.",thriller
final flight of the osiris," Thaddeus and Jue, the senior officers of the hovership The Osiris, have their erotic martial arts sparring session interrupted when the crew discovers a dire threat to the hidden city of Zion. The crew resolves to warn the settlement, but they are immediately detected by the machines and the chase is on. Now Jue must enter the Matrix to send the warning and hope that her comrades can hold off the enemy until she can complete her mission. Written by Kenneth Chisholm ([email protected]) ",action
finding home,The story of a young woman's struggle to reclaim her life and love as she unravels the mysteries of her family's turbulent past.,drama
firedancer," The film follows Haris, a hip, handsome Afghan-American artist who shows his work at a downtown Manhattan art gallery. His story explores the ramifications of leaving Afghanistan and living as a refugee in America. Haris seems to be an all-American guy except that he creates strange installations of hanging ropes, and suffers from terrible visions- of himself as a child in Afghanistan in traditional dress, of smoke and bombs, of his dead parents and the Russian soldier who shot them during the...",drama
fish without a bicycle,"Comedy - Julianna (Jenna Mattison) is a struggling actress in a dead end relationship with Danny (Brad Rowe), a fireman who no longer lights her fire. When she decides to leave him and go ""find herself"" she ends up falling in love with an egotistical director, Michael (Bryan Callen), who can barely fit her in between Pilates classes.",comedy
flesh for the beast," A team of parapsychologists is invited by John Stoker to research the evil Fischer Manor, an ancient brothel where the owner Alfred Fischer was a gigolo that practiced black witchcraft. While investigating, the men are attacked by flesh-eater succubus and the psychic Erin Cooper seeks a powerful amulet for John Stoker. When they meet the trio of succubus, John finds a lethal secret. Written by Claudio Carvalho, Rio de Janeiro, Brazil ",fantasy
flywheel,"Jay Austin wants to sell you a used car, but watch out! Many victims have fallen prey to his smiling face and hasty promises. Austin does everything his way until his dishonesty and manipulation are exposed. Like many men, he becomes disgusted by the masks he wears and the lies he tells. In every man's life, there can be a turning point. When Jay makes his turn, he never looks back.",drama
football days,"Six friends, talentless and unfit, form a seven-a-side football team. They call themselves Brazil. They plan to play soccer until they win.",comedy
footsteps," Daisy Lowendahl (Bergen) is a best-selling suspense novelist who finds herself at her isolated beach house with a local young fan (Hall) who knows almost everything about her, and two men - one of whom may be trying to kill her, the other of whom could save her life, causing Daisy to be thrown into the middle of a real-life drama. Written by Atellix <[email protected]> ",thriller
found someone,"Ranjit Mehra and his wife Sonia live a middle-class life in rural India. Ranjit's passion is studying the heavenly bodies through various computers, telescopes, and communicators as he believes there is life beyond Earth. He continuously transmits the sound generated by the syllable ""om"" and hopes that someone somewhere will hear this and respond to it.",drama
frankie and johnny are married,"A romantic comedy about Michael Pressman, a successful television director/producer and Lisa Chess, a talented struggling actress, who are married and decide to mount a production of ""Frankie and Johnnie in the Clair de Lune"" in equity-waiver in Los Angeles with the hopes of bringing some life and joy back into their marriage. They bring in Alan Rosenberg to play Johnny and Lisa plays Frankie and Michael directs. What starts off as a simple idea to revitalize the marriage turns into an utter...",comedy
free radicals,"After surviving a plane crash, the blandly contented suburbanite Manu is killed in a head-on collision that is as tragically banal as her earlier accident was miraculous. Ricocheting between these two poles of the mundane and the fantastic, the forces of fate that stem from Manu's death begin to knit a rich tapestry of chance, choice, and emotion among the disparate array of people connected to her in life. Like P.T. Anderson's Magnolia, Austrian director Barbara Albert's FREE RADICALS is a...",drama
frozen stars,"A dramatic coming-of-age story that explores the lives of four young people struggling with emotional conflicts, family issues, personal identities, religious beliefs and the overwhelming power of love and friendship.",drama
full court miracle,"Full-Court Miracle is a 2003 Disney Channel Original Movie. It premiered on November 23, 2003. Inspired by the true story of University of Virginia basketball star Lamont Carr, the film centers on a group of young Jewish basketball players who search for a coach to help them out of a slump. The main character Alex Schlotsky is inspired by the true story of Alex Barbag and Chad Korpeck.",drama
gang of roses,"Set in the 1800's, the town of Flat ridge is over run by a band of outlaws looking for lost treasure said to be buried somewhere in town. In their quest for dominance, the outlaws kill Sally, a whore who happens to be the sister of Rachel and a 1/5 member of the Roses Gang. With the weight of grief on her heart, Rachel decides to shed her new found religious faith to bring vengeance upon her sister's killers. After placing Sally to rest, she goes in search of her former posse to assist her in...",action
garden of heaven,"Oh-sung, a doctor at a hospice facility, is emotionally scarred by the experience of losing his parents as a child. One night he meets Young-ju, a make-up artist who has been diagnosed with terminal stomach cancer. Despite having very little time together, the two start to develop feelings for each other.",drama
gate to heaven,"With the help of airport technician Dak, Alexej breaks out of the holding area for refugees. Dak puts up the Russian, who yearns to become a pilot, in an underground labyrinth of pipes and vents. The young Indian woman Nisha is an aircraft cleaner who dreams of being a flight attendant.",comedy
gaz bar blues,"Mr. Brochu runs a gas station, the Gaz Bar. A number of challenges face him daily -- from holdups, to competition and the fact that his sons are not interested in the ""family business"". To make matters worse, he is starting to face Parkinson's disease.",drama
genius," Mike has the hots for class beauty Hannah, but she only dates smart boys. Mike's learning that disability is a definite obstacle, so he turns to his snooty economics teacher, Miss Helen Goldwyn, to help him raise his I.Q. and win over Hannah. When it turns out that Mike can return the favor in an unexpected way, student and teacher develop a special friendship full or warmth and surprises. Written by Anonymous ",drama
gentle ben 2: danger on the mountain," With tensions running high between Jack & Fog over plans to drill on his land that abuts the wilderness preserve, Fog announces to the whole town that he isn't drilling for oil - but is opening a natural spring water business. Jack doesn't believe him & the night of the big annoucement he is jailed, suspected of sabotaging Fog's well. But Ben & Mark soon uncover a secret that Fog's business partners aren't telling him about. In fact this new venture...",drama
george of the jungle 2," It's been 5 years since socialite Ursula Stanhope left civilization to marry George, lovable and clumsy King of the Jungle. Now father to George Junior, George finds himself stressed at having to juggle his cherished roles of jungle king, Junior's dad, and Ursula's loving husband. George's stress level goes way up when Really Mean Lion challenges him for leadership of the jungle, and Ursula's mother Beatrice teams up with Ursula's ex-fiance Lyle in a plot to...",comedy
gettin' square,"Gettin' Square is about starting over, keeping clean and going straight. Barry Wirth is fresh out of prison and determined to stay on the straight and narrow. But like his mate Johnny 'Spit' Spiteri and reformed gangster turned restaurateur Dabba, he finds out the hard way that there are old scores and a few new ones that'll make getting square a lot harder than he thought.",comedy
ghost dog: a detective tail," Kyle's a police officer, and his partner is his dog, Hunter. Hunter gets killed in the line of duty, and his spirit comes back in the body of a criminal named Howie. Howie, with the spirit of Hunter in him, helps Kyle in solving a dastardly plot. Written by Joy Beaumont ",action
ghost of the needle," A photographer lures women to his studio, then injects them with a deadly serum before taking pictures of their corpses. But when the photographer starts hearing strange sounds and having strange visions, he begins wondering if he's going insane or if its his latest victim coming to exact vengeance on him. Written by Speed_n_up ",horror
ginger & cinnamon," When Stefania breaks up with her boyfriend Andrea, little does she realize what the summer has in store for her. She winds up on vacation at a Greek resort 'isle of love' with her 14 year old niece. Unfortunately, her teenage niece has something more than sun and surf on her mind; she decides that this Mediterannean paradise is where she will finally lose her virginity. However, in an ironic twist, the cute guy she has her eye out on turns out to be none other than Andrea, her...",comedy
girls will be girls,"Three actresses at various places on the Hollywood food chain navigate the minefield of love, aging and ambition. Oh, and they are all played by men!",comedy
goddess of mercy,"Yang Rui falls in love for the cleaning woman who works in a taekwando gym, only to later discover she's an undercover cop named An Xin. An is in hiding from drug smugglers who have a score to settle with her - a raid she led resulted in the death of one of the smuggler's parents. To complicate matters further, An was previously romantically involved with the smuggler whose parents were killed.",action
godzilla: tokyo s.o.s.," Forty-two years after her first visit in Tokyo, Mothra returns to warn mankind that they must return Mechagodzilla, along with Godzilla's bones, to the sea, for the dead must not be disturbed. If not, dire consequences will follow. However, Godzilla is once again on the rampage, and Mechagodzilla is Japan's only defense. Written by Oliver Chu ",action
going down,"A blow out party...one trashed house, two teenage misfits, three hot girls, four dumb jocks, a hooker, a dead body and three hours to clean up the mess.",comedy
goldfish memory,"""Goldfish Memory"" is a light-hearted look at the dangers and delights of dating in contemporary Dublin. When Clara sees her boyfriend Tom kissing Isolde, it sets off a chain reaction of romances and heartbreaks until the entire cycle has turned full circle, each character trying to solve the pressing question of what is the perfect relationship! Some favour marriage, others a week-at-a-time arrangement. The only thing they can all agree on is that love is the one thing we can't live without.",comedy
"good morning, night","The 1978 kidnapping and murder of Aldo Moro, president of the most important political party in Italy at the time, Democrazia Cristiana, as seen from the perspective of one of his assailants -- a conflicted young woman in the ranks of the Red Brigade.",drama
"good times, bed times","This is the story of Carrie (Sammi Cheng), who plays a tabloid reporter who is doing a story on pin up police officer Paul Ko (Louis Koo). The word around is that he is impotent and Carrie is looking for the truth. Of course, from there you are looking to see if they will hook up. Also here are Raymond (Lau Ching Wan) as Carrie's ex, a judge and a very young looking Charlene Choi, who plays Tabbie, who wants to live with Raymond. In a small but fun interlude, the always great Sandra Ng plays...",comedy
"goodbye, dragon inn","Goodbye, Dragon Inn is set in the approximately ninety minutes of the last feature at an old Taipei cinema that is closing down, showing King Hu's 1967 sword-fighting classic Dragon Inn. Only a few people are present in the cinema, and a variety of subplots are developed around them. Throughout the film, the ticket woman tries to find the projectionist, searching for him in order to present him with a steamed bun. A young Japanese tourist wanders around the cinema in search of a homosexual...",drama
goth," GOTH blurs the boundaries between reality-driven horror and the hallucinatory style of REQUIEM FOR A DREAM in this raw and blood-soaked ride through the dark underbelly of the Gothic subculture. Chrissy and her boyfriend BOONE are two Gothic teenagers living in L.A. who have seen and done it all. As the sun goes down, they get ready for a hardcore concert at the local club. The night takes a gruesome turn when they run into a savage, darkly beautiful woman with a taste for pain and sexual...",thriller
