title,plot,genre
rats," ""The Brookdale Institute"" is a mysterious, little-known hospital for the criminally insane (a fact which is kept on a need-to know basis). Brookdale has another, more lucrative facet; a safe harbor for the chronically drug-addicted rich and famous, especially the sons and daughters of the above, whose families have tried everything. ""The Institute"" is also for the once-famous, who, having bottomed out, also have no where else to turn but Brookdale. Investigating possible...",horror
"ready, steady, charlie!","In a Swiss church, Antonio Carrera is getting married to the pretty daughter of an Italian Mafioso, when army police officers march in and take him to the 15 week compulsory Swiss military training...",comedy
reconstruction,"In Copenhagen, two lovers meet, make love and make plans to reunite after a chance meeting leads to a passionate one-night stand. Photographer Alex makes a split-second decision to leave his girlfriend Simone after he spots gorgeous Aimee on a subway platform. It's an impromptu union that feels like true love. But nothing is what it seems on the morning after the encounter. Alex returns home only to discover his apartment doesn't exist-and Simone treats him like a complete stranger. Aimee's...",drama
red roses and petrol,"The dark comedy explores the complex dynamics of love, life and the loss of a family member with delightfully scathing humor and surprising plot twists. Amidst a haze of cigarette smoke, uneaten food and enough whiskey to sink a ship, the family of Enda Doyle (Golden Globe nominee Malcolm McDowell) gathers in Dublin for their patriarch's eventful wake. A university librarian, poet and rascal, Enda's legacy includes a trail of unresolved issues, a dysfunctional family, and a disturbing mystery.",drama
red rover, William Baldwin and Jodi Lyn O'Keefe of 'Halloween:H20' fame are both set to star in a new movie playing as brother and sister who travel to their family's ancestral mansion after their father's death. Discovering the hard way that their involved in witchcraft. Written by Dare <[email protected]> ,horror
regel nr. 1, When Caroline finds her boyfriend having sex with another woman she is invited to stay at her sister Sarahs place. Now that she is suddenly back on the dating market she takes advice on men and fashion from her somewhat shallow sister. This leads to one dating disaster after the other. The one guy she meets on her own appears to be spoken for. Written by Frank Dabelstein <[email protected]> ,comedy
"remember me, my love","""Remember Me, My Love,"" Muccino's bittersweet drama delves into the lives and loves of a modern Italian family whose individual aspirations pull at the seams of their increasingly fragile unit. As their children come of age and begin to follow their own dreams, Carlo (Fabrizio Bentivoglio) finds himself torn between a passionate affair with Alessia (Monica Bellucci) and his wife Guilia (Laura Morante), while Guilia must face her own buried desires.",comedy
rent control,"An attractive couple in their early 20's, Holly and Calvin arrive in the Big Apple fresh from Iowa. They are optimistic, naive and eager to succeed as actors. However, they find the path to success in New York a little more treacherous than they thought. The sky-high rents throughout the city force them to move in temporarily with Holly's Aunt Agatha, an eccentric woman with fifteen cats and an addiction to diet pills. Aunt Agatha lives in a rent-controlled, spacious 1-bedroom...",romance
return to the batcave: the misadventures of adam and burt," Adam West and Burt Ward are taken on a crazy adventure when the Batmobile is stolen from a car museum and they must track down the thief and return it. After solving a puzzle, they realize that the clues to finding the fiend who stole the Batmobile are hidden in their past. During the search, they flashback to their three seasons in tights, including their many sexual escapades. Ultimately they find the Batmobile, but get caught in the villain's lair. Tied to dynamite, will Adam and Burt...",action
returning mickey stern,"DVD description: You'll love the ""warm, winning comic chemistry"" (New York Magazine) between comedy legends Joseph Bologna (Big Daddy) and Tom Bosley (TV's Happy Days) in this timeless tale of second chances. Joined by an irresistible young ensemble cast, Bologna and Bosley set out on a quest that's ""filled with little pleasures"" (New York Sun). Fifty years ago, top pro baseball prospect Mickey Stern met the girl of his dreams on the magical Fire Island. Now Mickey returns with his bestfriend...",comedy
revenge in olympia,A story about sex and fighting. A man finds his father and has sex with several men in order to show he can have fun and a disciplined life.  - Written byAnonymous ,action
rhinoceros eyes,"Chep, a reclusive young man, gets comfort from the movies and his vivid imagination. When Fran walks into the prop house where he lives looking for unusual objects, Chep immediately develops a crush. Obsessed with her job, for which she designs movie sets, Fran insists that each prop be the real thing, even if it happens to be a pair of rhinoceros eyes or a human finger. Chep's growing love for Fran makes him willing to prowl the dark streets at night in search of items for her. As Fran's...",drama
rick,"From best-selling children's author, Daniel Handler (aka ""Lemony Snicket""), comes a morally reprehensible movie that's definitely not for children. It's a fairy tale of New York all about internet porn, carnivorous capitalism and cold-blooded murder, just in time for the holiday season. Meet Rick (Pullman). Trapped in an upper management job that's paid him buckets of cash in exchange for his soul, he's dominated by a boss who's a third his age, adrift on a sea of corporate testosterone,...",comedy
roads to koktebel," A widowed aeronautics engineer, who has lost his job, travels with his son hopping freight trains from Moscow to Koktebel, a town by the Black Sea, to start a new life with the father's sister. After they are stopped by a train guard, they continue their travel on foot. The father battles against his alcohol addiction and the son is fascinated with the idea of flight. One rainy day an old man accepts them in his house in return for the repair of the roof. The father gives in to the...",drama
robin's hood," Robin is a social worker in Oakland on the verge of losing her job for getting too close to her clients; she's African-American and grew up in the neighborhood. She falls for Brooklyn, a White Frenchwoman, who's a thief with dreams of running a motorcycle repair shop. Robin is not only willing to be Brooklyn's lover, she's willing to join in the robberies because she sees community projects that need money: she becomes an anonymous Robin Hood. When her personal life takes a...",drama
robokon,"Written and directed by Tomoyuki Furumaya, this movie's premise allowed for a sneak peek into one of Japan's many robotic competitions.",comedy
robot stories,"Four stories starring Tamlyn Tomita (""Joy Luck Club,"" ""Babylon 5"") and Sab Shimono (""The Big Hit,"" ""Suture"") in which utterly human characters struggle to connect in a world of robot babies and android office workers. The stories include: ""My Robot Baby,"" in which a couple must care for a robot baby before adopting a human child; ""The Robot Fixer,"" in which a mother tries to connect with her dying son by completing his toy robot collection; ""Machine Love,"" in which an office worker android...",drama
rosenstrasse,"In Berlin in 1943 on a street called Rosenstrasse, Jewish men were rounded up for deportation to concentration camps and certain death. Based on a true story, their Aryan wives fought to save their lives. This little known and powerful struggle of their ultimate success is both moving and inspirational, and shows that there is nothing stronger than the power of love. ROSENSTRASSE is unique because it is the first feature film on this subject presented from a truly German point of view. ",drama
ruang rak noi nid mahasan,"An obsessive-compulsive Japanese librarian living in Bangkok spends most of his days contemplating suicide in his lifeless apartment. His life changes when he witnesses the death of Nid, seconds before he was about to jump off a bridge. This brings him in contact with Nid's elder sister Noi - these two lost and lonely souls help each other find the meaning to their meaningless existences.",comedy
rush of fear," Vin, John 'J.J.' Gillis and Carl steal a 50-carat diamond from De Beers and smuggle it trough customs in a cosmetics jar, but the makeup-bag gets lost in Carly's makeup-bag -she didn't know- in the rental Pontiac, which is rented by the time they find out by lawyer Jack McGuire who took his wife Alex along for a bonding weekend, after marital problems, to a coast hotel in Glen Cove. Gillis is shot after kidnapping Jack, the other two crooks demand the bag -trough a...",action
saints and soldiers,"ased on actual World War II events, ""Saints and Soldiers"" tells the dramatic story of four Allied soldiers trapped behind enemy lines after escaping the Malmedy Massacre. Led by a tormented sharpshooter known as ""Deacon,"" they must traverse a frigid German wilderness teeming with German troops to smuggle critical intelligence back to Allied territory.",action
salt,"The film centers around the friendship and family of a young girl, Hildur, who lives in a small fishing village on the East coast of Iceland.",drama
sam hon," Sammi and her husband Chan find themselves resurrecting their nearly failed marriage after Sammi suffers a severe injury during a robbery. Though the injury gives Sammi and Chan another chance at love, it also puts her in great danger. After she heals from the incident, Sammi begins to have premonitions of murders, an event which Chan, a police officer, uses to further a murder investigation, but which also places them at risk from the murderer. Written by Irishlass240 ([email protected]) ",thriller
samurai resurrection," 37,000 Peasants perished in the Shimbara Revolt: among them, the leader of that uprising, Shiro Amakusa. Amakusa is resurrected from hell bent on revenging the death of his fellow comrades by over throwing the Shoganate. Shiro resurrects an army of living dead swordsmen by ""Makai Tensho"" (Demonic transmigration). Only the Legendary Samurai Jubei Yagyu, stands in his way! Written by Jessica Greenhood ",action
saraband,"After their divorce, Johan and Marianne lost touch for many, many years. Johan, now a retired professor, has withdrawn to his grandparents' summerhouse in the western province of Dalarna. He bought the house after inheriting a minor fortune from a Danish aunt, a once-famous opera singer. Here he leads a solitary life with his books and a housekeeper. Marianne, who has continued her practice as a family and divorce lawyer, suddenly decides to look up Johan and break through his isolation....",drama
saturday night live: the best of chris farley,"Everybody remembers Chris Farley, the big loveably guy from Saturday Night Live. Before he was the Beverly Hills Ninja, or Tommy Boy, or even before he was in Black Sheep or Almost Heroes, Chris was on Saturday Night Live and played characters like Matt Foley the energized motivational speaker, Bennet Brauer the gross-out news correspondent, Chippendales' dancer, and many more!  - Written byDylan Self <[email protected]> ",comedy
save the green planet,"Save the Green Planet is a tilt-a-whirl genre-blender from Korea that turns film history against itself to create one of the most savage, affecting and inspired anti-violence movies ever made. This is a movie that defies all marketing labels and is exactly what it wants to be: like nothing you've ever seen before.Lee Byeong-Gu (Shin Ha-Gyun, JSA) is a sensitive, blue collar sad sack hopped up on conspiracy theories and sci-fi films whose life has been derailed by one bad break after another....",comedy
saved by the belles," When the Chemical Sisters, Montreal's fabulous club kid duo find an unconscious naked boy on their way out from yet another jetset event, they decide to bring him home and take matters into their own glittery hands. After baptizing their amnesiac boy-toy Chris, the infamous pair takes him on a grand tour of their wild nightlife frolic, their spontaneous media extravaganza and their dazzling diva lifestyle in order to help him find his identity and his way home. Written by Anonymous ",comedy
schultze gets the blues,"Schultze is an accordion player and newly unemployed. When the local music club celebrates its 50th anniversary, his taste of music changes unexpectedly.",comedy
scream bloody murder," In this horror spoof, the girls from Cherry Mount Academy are on their way to a dance at a nearby all-boys school when the van they're riding in breaks down. With no other choice but to spend the night at their tow truck driver's junkyard, the girls soon find themselves at the mercy of a cold-blooded killer. Written by Anonymous ",comedy
screen door jesus,"The central thread of this unusual story involves a vision of Jesus sighted on the screen door of Mother Harper's (Cynthia Dorn) front porch. The misadventures begin as the media and crowds gather around the phenomenon and the townsfolk start to take sides. As more people flock to the door, some for guidance, some for healing and some for pure entertainment, the pressure on this sleepy town starts to build...",comedy
second generation," A modern reworking of King Lear, where a businessman lies in a coma while 2 of his daughters plan to turn off his life support machine and sell his business. His third daughter has his best interests at heart but is estranged from the family. Written by bob the moo ",drama
secret agent men, A group of young Kiwis are recruited by a secret organization to act as spies attempt to save the world from various fiendish villains with plans for world domination at the same time having to contend with the mundane problems of teenage life. Written by Anonymous ,adventure
seducing doctor lewis,"A much-needed boost, in the form of a new factory, is promised to the residents of the tiny fishing village St. Marie-La-Mauderne, provided they can lure a doctor to take up full-time residency on the island. Inspired, the villagers devise a scheme to make Dr. Christopher Lewis a local.",comedy
see jane date," Single, ambitious, magazine assistant editor Jane Grant has just received an invitation to her younger cousin's wedding, and it's engraved with two of the most dreaded words a perpetually available single can encounter: ""plus guest."" Come wedding day, Jane had better deliver. After all, she's already told everyone, including her meddlesome and obnoxious Aunt Ina and now-famous high school nemesis Natasha Nutley, that she's in a serious relationship. Now, Jane has...",comedy
sex with love," In Santiago, Chile, the schoolteacher Luisa proposes a debate about sex with the parents of her students with the intention of giving classes about sex education to the youngsters. Luisa is a young independent woman that is split between the love for her also young mate, the painter Valentín (Francisco Pérez-Bannen), and for her experienced lover, the middle-age father of one of her students and successful writer Jorge. Jorge still lives with his wife Mónica, but their marriage...",comedy
shark zone,"D’après la légende, un coffre de diamants appartenant à la Couronne d’Espagne est enfoui sur le ""Santa Cruz"", une frégate échouée au fond de l’océan depuis 1712, date de son naufrage. De nos jours : Andrew Wagner, vétéran de la Navy, propose des plongées sur le navire disparu pour des aventuriers en mal de sensations. Accompagné d’un groupe, il meurt ainsi que le groupe, dévoré par un requin devant les yeux de son fils Jimmy. 10 années se sont écoulées et Jimbo,...",drama
shattered city: the halifax explosion," Shattered City, an epic two-part mini-series, dramatizes a compelling piece of Canadian history. It is the story of how a tragic incident at the height of the First World War became a living metaphor for the worldwide conflict, and how Halifax arose from the ashes after severe destruction and devastation. In the early hours of December 6, 1917, the Mont Blanc, a French-owned freighter loaded to the gunnel's with thousands of tons of TNT, collided with a Belgian relief ship and exploded in...",drama
she's not 17," A Kibutz in Israel is heavily in debt. In a last effort to produce a viable financial restructuring, the old, ""unproductive"" members are asked to leave the kibutz, to make room for younger, more productive new members. Among those destined to leave is Shraga. His marriage to Clara is loveless while he desperately loves Bracha, his late brother's widow. Clara dreams of starting afresh with her husband in an old age home, in the far north of the country. Bracha on the other hand...",drama
she's one of us,"Christine Blanc (Sasha Andres) is a 30-something temporary secretary who yearns to belong, to have her work valued, to become part of a team-any team. She leads a normal enough life-she frequents the local mall, visits her parents, takes driving lessons, and lives alone in an unassuming condo-but there is something slightly off about Christine: she always seems to arrive in the middle of a conversation, starts off for one location and winds up elsewhere. Christine always seems out of place. She...",drama
shelter," Three inner-city teens find themselves stranded in a secluded beach house. In this strange and magical setting, Ray, his brother Spider and the pregnant Maria, set up housekeeping for the last few weeks of summer. But when jealousies erupt, forcing them to choose their alliances, their makeshift family is put to the test. Written by Anonymous ",drama
shelter island,"Ally Sheedy is a retired golfer turned motivational speaker. Patsy Kensit plays her lover and also works with her. There is another girl as well. There are some difficulties at work, a New York firm. So Ally decides she's going to go away for the weekend to some property she owns at Shelter Island. Her lover goes with her. A big storm is coming to the island and the mansion is very isolated from the rest of the island's people. The storm is a perfect set-up for the visitor who just happens to...",thriller
shin hokuto no ken,"In the 21st century, a nuclear war turned most of the Earth's surface into a desert wasteland, which also resulted in the contamination of the Earth's water supply. A man named Sanga has built the fortified haven of the ""Last Land"", where he rules as its dictator by monopolizing the city's uncontaminated water supply. When he learns that the neighboring residents of Freedom Village are trying to dig up a well for their own, Sanga sends his underlings to sabotage their effort. Kenshiro, master...",action
shoreditch,"London 1939. In the weeks before the beginning of the Second World War, the Say When jazz club keeps London's Shoreditch swinging. Run by Thomas (Richie) and his wife Massie (Natasha Wightman), it's a place where gangsters and aristocrats, home office gents, and loose women can kick back and relax. Thomas' job is to keep everything running smoothly. But when he starts having an affair with singer Butterfly (Joely Richardson), this carefully balanced world disintegrates into blackmail, drugs,...",drama
short cut road," Four couples take a short cut to an annual rock festival to celebrate the last day of college when they start to encounter strange things. Something happened during the previous year's festival that the couples were unaware of and, one by one, things start to happen to them...very unpleasant things. The music will rock but the heads will roll. Written by Selz, Marc ",horror
shredder,"At an exclusive, secluded North American ski resort up on Mount Rocky Summit, brutal slashing, severing and beheading on a group of teenagers are taking place and are believed to be the work of a mysterious skier dressed in black.",horror
shrek 4-d," Lord Farquaad was eaten by the dragon, but his ghost has returned, and he's still evil. With the help of his henchman, Thelonious, he kidnaps Fiona. Shrek and the donkey set out to save her, with help from the dragon, before she goes over a waterfall on a raft. Written by Jon Reeves <[email protected]> ",comedy
shrink rap,The lives of a glamorous power couple are turned upside down when the bartender for their anniversary party turns out to be a student therapist who won't go home...until he helps them and becomes the next Dr. Phil!,comedy
silent waters,"Silent Waters is set in 1979 in Pakistan, when General Zia-ul-Haq took control of the country and stoked the fires of Islamic nationalism. Ayesha, a Muslim woman who gets by on her late husband's pension and by teaching young girls the Koran, invests her hopes in her beloved son Saleem. But when Saleem takes up with a group of Islamic fundamentalists just as a group of Sikh pilgrims come to town, Ayesha's haunted past turns her present life upside down.",drama
silmido,"On 31 January 1968, 31 North Korean commandos infiltrated South Korea in a failed mission to assassinate President Park Chung-hee. In revenge, the South Korean military assembled a team of 31 criminals on the island of Silmido to kill Kim Il-sung for a suicide mission to redeem their honor, but was cancelled, leaving them frustrated. It is loosely based on a military uprising in the 1970s.",action
skenbart: en film om tåg,"Christmas 1945. In a train from Stockholm to Berlin are a motley collection. It is the failure of the author Gunnar who wants to leave his old life and make a contribution in Berlin; physician Henry who plan to marry Marie and likewise Henry's current wife Karin, who he plans to kill during the journey, the middle-aged gay couple Pompe and Sixten, a soldier going to Uppsala but is on the wrong train: the cheerful and cynical old Margaret, and a dressed elf and a surly conductor. With the train...",comedy
skin deep," The two black men (Anthony and Michael) are successful in the high tech world of Silicon Valley, and have known each other since childhood. The story takes place over the course of a day, when the couples get together for an afternoon of dining, drinking, and hot tubbing. Later, one of the wives is found dead in the hot tub, setting off a series of events that reveal their inner beliefs. Things turn dark as racism, paranoia, and the mistress come into play. This results in more deaths, until...",action
sky blue,"""Sky Blue"" is a love story set against the forces of destruction, a dystopian vision of Earth's destiny, yet ultimately a reminder of our hope for the future.",action
sky high,"A serial-murderer is on the loose who just so happens to also be removing the hearts of his victims and taking them with him. His victims however, are not merely random humans as thought by the police. They are in fact, the past and present guardians of the gateway of the afterlife.On the day he is to be married, Detective Kanzaki, who happens to be on the case, discovers that his fiancé Mina has been murdered with her heart also missing. He also learns that the killers are Kudo, a geneticist,...",fantasy
smala sussie,"When Erik, a Stockholm urbanite, learns that his beauty-queen sister, Susie, is missing, he goes to their country roots to look for her. But after talking to the eccentric locals -- including a shy video store clerk and a corrupt police officer -- Erik finds a woman who is not at all like the girl he left behind. Award-winning director Ulf Malmros helms this black comedy infused with hipster flair.",comedy
small cuts," PETITES COUPURES tells the story of Bruno (Daniel Auteuil), a communist newspaper journalist suffering a mid-life crisis. Torn between his wife Gaëlle ('Emmanuel Devos' ) and his young girlfriend Nathalie (Ludivine Sagnier), his political beliefs battered by the wind of history, Bruno seems to have lost his bearings. After responding to a call for help from his uncle (Jean Yanne), who is fighting a losing battle for re-election as the communist mayor of a small town near...",drama
snitch'd," When the South Side Gang and the Cut Throat Mafia start a drug war at a local high school in Santa Ana, CA, detective McClure goes undercover to investigate the brutal murder of a young Latina student. The gang members are the key suspects but nobody is talking. And as McClure continues to dig for answers, it becomes clear that the two gangs are fighting for territory - and nobody is getting in their way. Written by R Casiano <[email protected]> ",action
sol goode,"The story of a group of guys who have everything going for them except real jobs, steady relationships and money. Led by Sol Goode (Balthazar Getty), the gang realizes that the charm, good looks and fast-talk that have carried them through life are slipping away and if they don't shape up, they're going to be in big trouble.",comedy
soldiers of salamina," When the professor and writer Lola Sánchez is assigned to write a column in the newspaper about the Spanish Civil War, she researches and finds for the first time about the shooting of Rafael Sánchez Mazas. Lola has lost her passion for writing, and she becomes intrigued about Rafael, who was a writer and journalist that returned to Spain from the Italy of Mussolini and founded the fascist party Spanish Falange, becoming advisor of the leader Jose Antonio Primo de Rivera. When the...",drama
