title,plot,genre
a farewell to fools,"A German soldier is found dead near a village, and the local authorities must finger the culprit or they will all be shot by Nazis the following morning.",comedy
a fighting man,"An aging fighter (Dominic Purcell) in search of redemption steps into the ring with a hungry young pugilist (Izaak Smith) with something to prove in this boxing drama featuring James Caan and Louis Gossett, Jr. co-star in a film featuring Famke Janssen, Kim Coates, Adam Beach, Sheila McCarthy and Michael Ironside.",drama
a fine step,"A Fine Step is an uplifting family drama centering on Cal Masterson (Luke Perry, Beverly Hills 90210) an award winning horseman whose relationship with his beloved horse Fandango allows him to achieve multiple championship wins. However tragedy strikes when Cal and Fandango are involved in a serious accident, ending Cal's horse riding days forever. Cal's devastation is slowly overcome when his new neighbour, 14 year old Claire Mason (Anna Claire Sneed, Glee) takes an interest in Fandango and...",drama
a girl at my door,"Do-Hee (Kim Sae-Ron) experiences family violence. Young-Nam (Bae Doo-Na) works as the head of police substation. She tries to protect Do-Hee from her violent stepfather Yong-Ha (Song Sae-Byeok). Though Do-Hee looks naive, she hides a secret. Young-Nam becomes involved in a case with her life at stake.",drama
a good man,"After an illustrious special ops career ends in disaster, Alexander (Seagal) goes off the grid and attempts to lead a quiet life as a handyman at an apartment complex. But when one of his tenants and her family fall under the thumb of a Russian gangster, Alexander is dragged into an all-out war between rival Chinese and Russian gangs; forcing him to not only defend the family, but bringing him face to face with an old foe, and giving him one more chance to reconcile his past. -",action
a hard day,"Driving back from his mother's funeral, homicide detective Gun-su runs over a man in a dark rural street. In a moment of desperation, he dumps the body in a coffin alongside his mother. A few days later, Gun-su flips through a listing of open cases and finds his accident victim. His colleague is on the accident case and is slowly making progress. Making matters worse, a witness steps forward, a detective named Park. For a reason unclear to Gun-su, Park wants the body. Without another choice to...",action
a leading man,"Everyone is happy for rising actor GQ Qi – the network, his mother, his best friend – everyone except GQ himself. He is stuck playing an offensive stereotype on a television sitcom, and the day he decides to speak up for himself on set, the executive producer fires him. Struggling to pick up the pieces, he starts dating A-list casting director Rachel. Love and work become intertwined. Their relationship survives the protestations of GQ’s mother and best friend, but starts to show strain...",drama
a little game,"Ostracized at her posh new uptown school and shaken by the death of her beloved grandmother, a 10 year-old downtown girl finds an unlikely mentor in the form of an irascible chess-master, who uses the game to teach Max lessons in resilience, perseverance, and how to embrace inevitable change.",adventure
a magic christmas,"Jack Carter, a man constantly living in a state of regret, takes his technology-obsessed family, including their lovable dog Buster, on a Christmas vacation to the mountains in the hopes of reconnecting with them. While on vacation, Jack and his family run into an estranged, uber-competitive friend of Jack's, who now lives the life of luxury Jack pines for. Through a series of juvenile competitions, Jack realizes that the love of his family is more rewarding than anything money could buy.",family
a matter of faith,"A Christian girl, Rachel Whitaker (Jordan Trovillion) goes off to college for her freshman year and begins to be influenced by her popular Biology professor (Harry Anderson) who teaches that evolution is the answer to the origins of life. When Rachel’s father, Stephen Whitaker (Jay Pickett) senses something changing with his daughter, he begins to examine the situation and what he discovers catches him completely off guard. Now very concerned about Rachel drifting away from her Christian...",drama
a merry friggin' christmas,"Boyd and his family are forced to spend a dreaded Christmas at his parent’s house with his eccentric father that he has been avoiding for years. When he realizes that he left his son's gifts at home, Boyd and his father must hit the road in a blizzard to retrieve the gifts before sunrise to save Christmas.",comedy
a million miles away,An adult woman (the conductor) on the edge of failing and a pack of teenage girls (the choir) simultaneously experience a supernatural version of coming-of-age. The transformation is equal parts tense and tender. It unravels patiently to the infectious beat of an 80s era heavy metal anthem rearranged as a lamentation.,comedy
a murder foretold,A murdered Guatemalan man has videos of his killers distributed after his death in order to uproot the corruption that led to the death of many others,drama
a nightingale falling,"Set against a backdrop of a turbulent, war-torn Ireland in the early 1920’s, this is a story of three people and the unfolding events from a crucial time in their extradionary and tragic lives.",drama
a reason,"Serena, a young, gay introvert and her controlling older brother Nathan, are forced to endure a dreaded family gathering at the house of their elegant elderly Aunt Irene to hear the reading of her will - setting off an unexpected course of events that ultimately forces the clan to reevaluate their views on love, forgiveness, and family.",drama
a short history of decay,"Nathan Fisher (Greenberg) can’t seem to quite get it together. He’s a wannabe writer living in Brooklyn, temping at an ad agency while bouncing from plays to novels to screenplays without ever finishing anything. When his ambitious novelist girlfriend (Emmanuelle Chriqui), about to publish her first book, finally gets fed up and decides to leave him he resolves to get down to some serious work once and for all. But life intervenes. After getting a call that his father has had a stroke,...",comedy
a wonderful christmas time,"A young man and young woman, both who have recently gone through break-ups, become friends over the festive season though don't wish to be each other's respective rebound. To get over this, the man goes on a series of disastrous dates so he can get together with the girl he really likes.",comedy
aanmodderfakker,"Aanmodderfakker is a coming-of-age film, but 15 years too late. The film is about the 32-year old student Thijs who fils his life with beer, chicks and working in a large electronics store. But then something grows between Thijs and Lisa, the 16-year old baby-sitter at Thijs' sister.",comedy
abducted,"In an attempt to rebuild his marriage after the death of his son, Matt Hollis decides to take his wife and six year old daughter Lara on a trip of a lifetime to LA, to escape the constant reminders of their loss. Shortly after their arrival Matt's world is turned upside down when his wife is attacked in their holiday home, leaving her in a coma and their daughter LARA kidnapped by a child trafficking ring. Hunted by the police who mistakenly believe Matt has absconded with his daughter, he must...",action
about alex,"In ABOUT ALEX, a circle of twenty-something friends reunite for a weekend away after one of them suffers an emotional breakdown. Despite the group’s best efforts to keep it light and enjoy themselves, a tinderbox of old jealousies, unrequited love, and widening political differences leads to an explosion that, coupled with the flammable combination of drugs, wine, and risotto, cannot be contained. An honest appraisal of adult friendship for our current social media moment, ABOUT ALEX is a...",drama
ace wonder: message from a dead man,"Ace Wonder is a 10-year-old detective, struggling to find a storyline for his latest novel. When his path tangles with Derek Morton, a simple family mystery becomes a very real case of corporate espionage, scientific discovery, and one coldblooded killer.",adventure
adult beginners,"In the film, a young, narcissistic entrepreneur (Kroll) crashes and burns on the eve of his company’s big launch. With his entire life in total disarray, he leaves Manhattan to move in with his estranged pregnant sister (Byrne), brother-in-law (Cannavale) and 3-year-old nephew in his suburban childhood home — only to become their nanny. Adult Beginners is a comedy about priorities, growing up and beginning again…as an adult.",comedy
afflicted,"Best friends Derek and Clif set out on a trip of a lifetime. Their plan: travel to the ends of the earth, see the world, and live life to the fullest. But the trip soon takes a dark and bloody turn. Just days in, one of the men shows signs of a mysterious affliction which gradually takes over his entire body and being. Now, thousands of miles from home, in a foreign land, they must race to uncover the source of his illness before it consumes him completely. Footage of their travelsmeant to...",horror
affluenza,"Follows aspiring photographer Fisher Miller as he escapes his middle-class life in upstate New York for the moneyed mansions of Great Neck, Long Island, when he moves in with his aunt and uncle while he applies to college in Manhattan. Finding himself on the outside looking in at his beautiful cousin Kate’s circle of indulged and entitled friends, he ingratiates himself with a stash of high-quality weed and a vintage camera that he uses to document their hard-partying exploits. Invited to the...",drama
after,This intricate story of loss and family came about as a way for the filmmakers to process their post-9/11 grief. The husband and wife filmmaking team of Pieter Gasperz and Sabrina Gennarino lived next to the World Trade Center and were deeply impacted by the tragedy. Writer Sabrina Gennarino loosely based the film on her own tight-knit Italian family in upstate New York (the film was shot at her family’s quarry in Rochester) and how they may have reacted to heart-breaking loss. Gennarino's...,drama
after school massacre,"High school history teacher, Ty Anderson, has a minor online communication with a teasing student which finds him immediately fired and snaps him into a psychotic killing spree, terrorizing his former female students at their slumber party.",comedy
after the fall,"When everyday family man Bill loses his job, his peaceful life quickly spirals out of control. Terrified that he will lose everything he has achieved, he turns to a life of crime, descending into drastic and dangerous measures to stay ahead of the law. As he fights to provide for his family, Bill discovers that the only thing worse than getting caught is getting away with it.",thriller
after the tone,How do you deal with the fact that someone close to heart has suddenly disappeared without a trace? Can you go on living whilst waiting for his return?,drama
against the sun,"Producer and American Film Co. president Brian Falk will be making his directorial debut recounting the incredible journey of pilot Harold Dixon (Dillahunt), bombardier Tony Pastula (Felton), and radioman Gene Aldrich (Abel) – virtual strangers assigned to a scouting mission on January 16, 1942. When they are forced to ditch their plane, the men are left with no food, water, or supplies; only a 4x8-foot yellow life raft to keep them afloat on a dangerous ocean.",drama
age of ice,"Massive earthquakes open the Arabian tectonic plate, resulting in unstable weather and freezing temperatures that will be unsurvivable by nightfall. Attempting to reach safety, a vacationing family in Egypt must battle the rapidly cooling temperatures that usher in a new Ice Age, covering the Sphinx, Pyramids, and Sahara Desert with mountains of snow.",adventure
age of tomorrow,"Mankind must fight to survive as Earth is invaded by hostile UFOs bent on destroying the planet. As the epic battle wages on, astronauts sneak aboard the mothership where they discover a portal to the aliens' home world. They manage to alert Earth before they are brutally murdered. Left with no other choice, Earth sends an elite military team of science and combat specialists through the portal where they attempt to stop the invasion from the inside out.",action
agent 13,"The film is based on a little known comic book from 1988. It was created by G.I. Joe and Transformers cartoon writer Flint Dille and David Marconi, who went on to pen the Will Smith thriller Enemy of the State as well as Live Free or Die Hard.The comic had post-modern pulp overtones, replete with femme fatales and explosive cliffhangers. The main character is male and despite Theron's involvement, will remain that way. (The actress is attached to play another part.)",scifi
agent zigzag,"The film is based on a Ben Macintyre book that tells the story of Edward Arnold Chapman, a career criminal who was trained by the Nazis to be a spy during WWII. On a mission to sabotage an airplane factory in England, he contacted the British and began a life as a double agent.",drama
air,"In the near future, breathable air is nonexistent. Virtually all of humanity has disappeared and those chosen to reestablish society reside in a controlled state of suspended animation. Two engineers tasked with guarding the last hope for mankind struggle to preserve their own sanity and lives while administering to their vital task at hand.",scifi
airplane vs volcano,"When a commercial airliner is trapped within a ring of erupting volcanoes, the passengers and crew must find a way to survive – without landing.",action
aka dan,"YouTube musician and Korean American adoptee Dan Matthews travels to South Korea to perform and reunite with his biological family, including a long lost twin he never knew he had.",adventure
alicia en el país de maría,"Tonatiuh and Maria experience a passionate and turbulent relationship. One night, in the heat of an argument, they suffer a dramatic automobile accident. Tonatiuh is left in a coma, where he sees Alicia, his nurse, including her in his dreams about Maria. Time later, Alicia has an accident and suffers amnesia while Tonatiuh wakes up. One year later, Tonatiuh and Alicia meet and an impossible love arouses from oblivion, haunted by the ghost of Maria's memories.",drama
alien abduction,A vacationing family encounters an alien threat in this pulse-pounding thriller based on the real-life Brown Mountain Lights phenomenon in North Carolina.,horror
alien strain,"On a camping trip, Matthew's girlfriend Rachel was abducted by a UFO. A year later Rachel returns to the very spot from which she was taken but the creature she has become has Matthew fearing for his life.",horror
all hell breaks loose,"Based upon obviously not true events, All Hell Breaks Loose is the story of love, leather, and violence. When the Satan's Sinners, a vicious motorcycle gang from hell, kidnaps one man's bride, they bite off more than they can chew. Now the man is out to save his wife, any way he can... even if it means dying over and over again. With the help of a shit-kicking sheriff, a perverted priest, and a cowboy who just might be God, all hell is bound to break loose.",action
all over brazil," It's Summer 1974 and all looks rosy, with the Scotland World Cup team, under Billy Bremner's captaincy, in the Finals. After being all over Brazil in their first match, Scotland now has to beat Yugoslavia to get into the knock-out rounds. But in suburban Glasgow, 13 year old Stephen, is keener on seeing his favorite glam rock band in concert than following the progress of Scotland's World Cup football squad. Meanwhile his football fanatic father Charley isn't about to let...",drama
all relative,"Availabile Same Day as Theaters. When Harry (Jonathan Sadowski), a graduate student in New York City, meets Grace (Sara Paxton), he immediately falls for her. With the help of some dating tips from a seductive divorcee (Connie Nielsen), Harry successfully courts Grace. But when he's introduced to her parents, a shared secret turns his world into a living nightmare. Forced to survive a weekend riddled with tension and socially awkward moments, the bonds of both couples are tested to their...",comedy
all the wilderness,"James has shut himself off from his surroundings, falling into a world of imagination and darkness. Visits with his psychiatrist have proven unhelpful - though he takes a liking to fellow patient, Val. As James begins to rebel against his single mother, he ventures into the night where he meets a mysterious kid who welcomes him into an eccentric city. Relationships are put to the test as James navigates unfamiliar territory, wrestling with the reality of his own personal wilderness.",drama
alléluia,"Michel is a serial womaniser and professional hustler. When he meets Gloria, she falls in love with him just like the others. But this time, things will be different. Gloria finds her reason to live in Michel. When Gloria discovers Michel's hustling she becomes his accomplice rather than risk losing him. Together they embark on a wild odyssey that becomes deadly and murderous.",drama
allies,"August 1944 two months after D-Day, the Allies are advancing across France. A team of British and American commandos are dropped behind enemy lines on a secret mission to ambush a German Officer and steal maps charting the location of the enemy artillery along the front line.",action
almost married,"When Kyle returns from his stag-do with a sexually transmitted disease, he's left unable to have sex with his fiancée Lydia in the run-up to their wedding.",comedy
altered minds,"A family reunion goes awry when the oldest son makes the accusation that his dying father, a famed psychiatrist who also did work for the CIA, adopted his children for the purposes of psychological experimentation.",drama
altergeist,"Tedi Sarafian, writer of TERMINATOR 3: RISE OF THE MACHINES and TANK GIRL makes his feature directorial debut with this horror/sci-fi thriller based on true events. King’s Ransom Winery is known as one of the most haunted places in North America. Gruesome suicides and murders, suspicious fires, and strange otherworldly phenomena have occurred with disturbing frequency throughout the dark history of the estate, all linked back to a past shocking slaughter where the victim was stabbed thirteen...",horror
amapola,A romantic reimagining of William Shakespeare’s A Midsummer Night’s Dream set against the turbulent backdrops of the 1962 Argentinian military coup and the 1982 war for the Falkland Islands.,comedy
american gladiators,"Johnny Ferraro, creator of the ""American Gladiators"" TV franchise, is bringing a live-action adaptation of the property to the big screen.The film will be based on the TV show that first aired in 1988 and has been on the air every year except one during the past 20 years. Most recently, NBC aired a primetime installment in 2008.The goal is to create an action story that takes place inside the world Ferraro has created.Ferraro noted ""American Gladiators"" was originally conceived as a film,...",action
american muscle,John Falcon did 10 years of hard time in prison. Now he's got 24 hours to get revenge on every person who had a hand in sending him there.,action
amira & sam,"Rousing, smart, and sweet, Amira & Sam is a confident feature debut from writer-director Sean Mullin, and follows Sam (Martin Starr, ""Freaks & Geeks"", ""Silicon Valley""), an army veteran adapting back to civilian life after a lengthy tour overseas. Upon reuniting with his unit's former Iraqi translator in New York City, he meets Amira (newcomer Dina Shihabi), his war buddy's niece; suspicious of soldiers, she wants nothing to do with him. However, when Amira runs into immigration trouble, Sam...",comedy
among ravens,"Inspired by real events, ""Among Ravens"" follows the intertwined lives of a group of friends and family as seen through the eyes of a 10-year old girl, Joey (Sequoyah). When the group gathers for their annual 4th of July holiday weekend in Idaho, her mom (Smart), step-father (Leonard) and father (Friedenberg), along with a combustible mix of friends and entanglements, secrets begin to unravel and have an impact on young Joey.",comedy
amor de mis amores,"Two couples get to know what we all dream about: love at first sight. The problem is they meet it with different people to the ones they are engaged with, and they are just at seven days to get married. Up to that moment, they have to reconsider what’s love and what’s a habit, and to face them going against an idea with an expiration date: marriage. ""Love of my loves"" is based upon the successful mexican theatrical play ""Un dos tres por mí y por todos mis amores"", and explores compromise,...",comedy
amour fou,"Forever under-appreciated and melancholy, Heinrich is a young poet in Romantic Era Berlin who determines his best way out of despair is to end it all, and he sets about finding a woman to join him in his predetermined departure. Recently diagnosed with a terminal illness, the well-off but unremarkable Henrietta, fascinated by Heinrich's controversial ""The Marquise of O,"" finds his offer intriguing, if a bit strange. And yet, she agrees to navigate the uncharted journey towards a suicide pact...",comedy
an american in hollywood,"Are there any Heroes left? Hailing from New York City, a talented filmmaker Josiah aka ""The Dissenter"" (Richard Carroll Jr.) leads childhood friends and fellow artists Dorian and Paul (JD Williams and Hassan Johnson from HBO's hit series ""The Wire"") to Los Angeles in pursuit of the Hollywood dream. Wielding the artistic powers of writing, directing, acting, stand-up comedy, music, drawing, painting, and graffiti, this team of ""Real Artists"" battles the ""Entertainment Empire"" of Hollywood...",drama
an evergreen christmas,"Leaving her seemingly glamorous Hollywood life on hold, Evie Lee is forced to return to her small hometown of Balsam Falls, Tennessee and her family's once-thriving Christmas tree farm to attend her father's unexpected funeral. As the eldest sibling, she finds herself executor of an estate that owes a massive inheritance tax, much to her younger brother's dismay. Torn between pursuing her music career and saving her family's legacy, she must decide what it really means to find her place in the...",family
anatomy of a love seen,"From Writer/Director Marina Rice Bader (Executive Producer Elena Undone, A Perfect Ending) comes this film within a film that explores love in all its painful and messy glory. Six months ago Zoe and Mal fell for each other while filming a love scene, which led to an intense, whirlwind affair, followed by a devastating breakup. Soon after their split, things get complicated when the two have to meet on set once more to re-shoot that fateful sequence.",drama
anatomy of deception,"A district attorney who, tapped to replace the outgoing mayor, is stalked by a man who engineers her fall from grace, leading her to push back and beat him at his own game.",drama
angels in stardust,"Vallie Sue (AJ Michalka), a young teenager with big dreams, lives in a desolate, gritty little town, built on the site of an old drive-in movie theater. The townspeople and her own mother (Alicia Silverstone) barely pay attention to her, but she finds solace from a mystical cowboy and a former enemy. With their help, she finds the courage and strength to reach her potential without losing her heart.",comedy
angry kelly,"Tanya is upset about her life when a coworker tells her a story about a former employee, Kelly Cage. Kelly Cage was a woman in free fall a glumly average thirty-something desperately seeking an escape from her horrible life. A former alcoholic loses her daughter, her high profile position and her dignity. She is doing all she can to straighten out and her closest friend is her laptop. Cage discovers blogging about her life experiences is a therapeutic way to release her anxiety, fear and anger....",drama
animals,"Animals tells the story of Jude and Bobbie: a young couple that exist somewhere between homelessness and the fantasy of their imaginations. Though they masterfully con and steal in an attempt to stay one step ahead of their addiction, they are ultimately forced to face the reality of their situation when one of them gets hospitalized.",drama
ankhon dekhi,"Raje Bauji is a man in his late fifties, living out a dreary but eventful life in a small house in old Delhi where he lives with his extended family. A random incident is going to change his life in a dramatic way- though he does not realize it yet.",comedy
annihilator,"Annihilator tells the story of a young Chinese expatriate, Ming, who must choose between remaining in prison or enlist in a secret US super soldier program. The program uses targeted genetic enhancements from various animal species. Ming chooses to undergo this nearly fatal procedure and through his extreme resolve, gained as a result of his family’s tradition of practicing Qijong and martial arts, he survives. Now, armed with remarkable abilities, he must confront a former rival with his own...",adventure
another,"Compelled by the possibility that she could have a dark twin, Jordyn (Paulie Rojas) questions her own sanity, and reality itself. Jordyn’s curiousity pulls her into a dark underworld of demonic possession, desire and extreme indulgences churning a dead witch’s brew that tears her very soul apart.",fantasy
