title,plot,genre
red sky,"Disgraced Top Gun fighter pilot Butch Masters leads a rogue squad in recovery of a WMD. Masters must navigate a fractured friendship, a love triangle, and must take to the skies to reclaim his military and personal honor.",action
redeemed,"Paul Tyson is a loving husband, devoted father and well-respected businessman on the brink of the biggest business deal of his career. And then Julia walks in. Breathtakingly beautiful, Julia is sent to manage the high-stakes buy-out of Paul's company but the relationship goes a bit farther than intended. As the pressures of a crumbling company creep in and intense new feelings abound, wedding vows get put on the back burner and the question arises... Just what is adultery?",drama
redirected,"Flight is an outrageous The Hangover meets Snatch action-comedy-thriller with distinct Eastern European exotic flare. It tells the story of four friends - John, Ben, Tim and Michael - turned first-time robbers, who, through a series of misadventures, get stranded in an Eastern European country and have to find their way back home. To do so, they'll have to overcome smugglers, hit men, cheap beer, whores, dirty cops and fantasies, all while rediscovering each other as friends.",action
redlands,"The lives of three residents of Redlands, California -- a middle-aged glamour photographer named Allan, his nude model Vienna, and her indie-musician boyfriend Zack -- intersect and ultimately collide in this claustrophobic adult drama.",drama
relentless justice,"Former Australian Intelligence operative Victoria Dev Ries, lives a quiet life in suburban America where as a single mother she raises her only daughter and trains fighters in her own M.M.A. gym. But when her daughter goes on a camping trip and fails to return, she is forced to go back into action.",action
remake,"Lisa's life is a movie. Everything she experiences she captures on film. Recording every memory, every step, everyone she meets. As Martin's and Lisa's relationship fall apart, the exhibitionist Lucas makes an entrance in the view-finder.",drama
reminiscence,"There are worlds, there are humans and there are Others. But there is only one Time which is the border between worlds. What if time breaks down? Reminiscence based on true events and physics, telling the story of a couple that trying to experiment the unproved parallel time and black-hole theories. They traveled to a town called Cesme for their research. But what they will face is much beyond the human mind.",horror
repentance,"An earnest life-coach/author, Thomas Carter, is mysteriously abducted by a deranged client, Angel Sanchez, who delves into Thomas' teachings and uses his spiritual messages of Karma - action and reaction (Vipaka), against him to terrorize him and his family for their past sins.",horror
revelation trail,"In the late nineteenth-century, a holy man known only as the Preacher (Daniel Van Thomas) confronts unspeakable evil as a gruesome power consumes the frontier. Standing between ruin and salvation, he joins forces with the town Marshal (Daniel Britt), a man with his own set of demons, in a savage fight against the undead.",horror
revenge of the green dragons,"In the vein of crime classics like Mean Streets and Infernal Affairs, Revenge of the Green Dragons follows two immigrant brothers Sonny (Justin Chon) and Steven (Kevin Wu) who survive the impoverished despair of New York in the 1980s by joining Chinatown gang ""The Green Dragons"". The brothers quickly rise up the ranks, drawing the unwanted attention of hard-boiled city cops. After an ill- fated love affair pits Sonny against his own brother, he sets out for revenge on the very gang who made him...",action
rex mundi,A physician in the 1930s investigates the mysterious death of a priest and embarks on a journey for the Holy Grail. Based on a series of graphic novels by Arvid Nelson and Eric Johnson.,thriller
ride,"In Ride, when an editor from The New Yorker (Helen Hunt) follows her son (Brenton Thwaites) to LA after he drops out of college to surf and find himself, she ends up being the one thrust into a sea change of self-discovery. In this comedy written and directed by Helen Hunt, she befriends a limo driver (David Zayas), rediscovers her sexuality with a younger surf instructor (Luke Wilson), and begins to heal her fractured relationship with her son and herself.",comedy
"ride report: 10,000 miles to rio","When filmmakers Tiernan Turner and Matt Kendall decide to attend the world famous Carnaval, they embark on a 10,000 mile, cross-continental road trip of a lifetime – from Las Vegas to Rio de Janeiro – on nothing but Suzuki motorcycles and the help of the burgeoning, international social network of adventure riders and couch-surfers. Along the way they make life-changing connections with strangers and fellow travelers, proving that, despite all our fears, the world is full of kind and...",adventure
road to the open,"A man helps his best friend and tennis partner out of a desperate rut in life through a long shot attempt at an international tennis tournament, The Open.",comedy
road to your heart,"Basson has five days to make it to his father's funeral in Cape Town, but needs to complete certain tasks on this trip before he can call the family company his own. On the road he meets free-spirited bohemian girl, Amory. As they journey across the breathtaking landscape of South Africa, they meet wonderful characters that allow for hilarious moments and life-changing experiences. Their trip takes a sudden turn for the worst when a villainous figure makes an appearance. Basson and Amory are...",adventure
roar,"Uday, a young photojournalist on assignment in the jungles of the Sundarbans, rescues a white tiger cub ensnared in a poacher's trap and brings the cub to a small settlement he is based in. Soon, panic among the villagers sets in. In order to bring calm back to the villagers, the forest warden takes the cub away. (C) Official Site",thriller
romeo and juliet,"Orlando Bloom and Condola Rashad take on the title characters in a modern adaptation of the timeless classic, Romeo and Juliet. This Broadway stage production is being broadcast in movie theaters.",romance
rosewater,"The feature film Rosewater is based on The New York Times best-selling memoir “Then They Came for Me: A Family’s Story of Love, Captivity, and Survival,” written by the BBC journalist Maziar Bahari. A true story, the film marks the screenwriting and directorial debut of “The Daily Show” host and executive producer Jon Stewart, and stars Gael García Bernal, leading an international cast. Rosewater is produced by Scott Rudin, Stewart, and Gigi Pritzker, with Lila Yacoub, Eli Bush and...",drama
rumors of wars,"Rumors of Wars is a suspenseful, action packed film with two converging story-lines, the first one centering around an aspiring college journalist named Roxy (Jennifer Cooper), finds herself searching for answers when she investigates end time prophecies for a term paper. Recording her research in a diary, her findings prove to have more of an impact than she could have ever imagined. Her diary is discovered years later, in the rubble of a post apocalypse society filled with decay and violence....",thriller
run,"Run escapes... He just killed the Prime Minister of his country. In order to do so, he had to act as if he was a crazy man, wandering through the city. His life comes back by flashes ; his childhood with Tourou when his dream was to become a rain miracle-worker, his adventures with Gladys the eater, and his past as a young member of militia, in the heart of the politic and military conflict in Ivory Coast. All those lives, Run didn't choose them. Everytime, he felt in by running...",thriller
run & jump,"After a stroke leaves her husband disabled and fundamentally changed, a spirited Irish wife struggles to keep her family members together. All the while they are under the microscope of an American researcher documenting their recovery process.",drama
running season,Arthur Zimmer travels to Prince Edward Island to sell his father's house just as detached feet have been turning up on the island's shores.,comedy
rurouni kenshin: kyoto inferno,"Kenshin has settled into his new life with Kaoru and his other friends when he is approached with a request from the Meiji government. Makoto Shishio, a former assassin like Kenshin, was betrayed, set on fire and left for dead. He survived, and is now in Kyoto, plotting with his gathered warriors to overthrow the new government. Against Kaoru's wishes, Kenshin reluctantly agrees to go to Kyoto and help keep his country from falling back into civil war.",action
sacrament,"Leaving the city behind for a weekend of booze, bud and bonding at the coast, seven friends find themselves stranded en route to South Padre Island when a big storm interferes with their plans. The town of Middle Spring is more than happy to welcome them with open arms, however; located in the rhinestone buckle of the Bible Belt, Middle Spring is smack-dab in the middle of a big barbecue and tent revival and there’s always room at their table for a few more warm bodies. Unfortunately, no one...",drama
saga - curse of the shadow,"A secret cabal, The Shadow, works to bring about the return of Goth Azul - the Undead God - in the rich world of SAGA, populated by elves, orcs, dwarves and dragons. A ruthless elven bounty huntress (Nemyt) shoots down the dragon ridden by the fugitive orc shaman, Fangtor Bloodmoon. When Fangtor refuses to surrender quietly, the huntress must battle for her own life against the dangerous villain, and comes away with more than just his head.",action
sahar,"Nadim's parents struggle to understand the carefree and westernized lifestyle of their daughter Sahar. With tension high and tolerance low, the household remains at a standstill, waiting for her to come home.",drama
saints and soldiers: battle of the tanks,"Germany, May 1945, deep in the Harz Mountains a U.S. tank crew discovers a platoon of Germans preparing to ambush U.S. supply trucks.",action
sale gueule,"Loik, a disfigured sailor, is posted to a remote lighthouse with Morlaix, a tyrannical head keeper. But soon, the two men find themselves besieged by a strange storm.",adventure
salesmen,"Ron Livingston (Office Space) will star in indie comedy ""The Company Men,"" - Livingston will play an aging businessman who struggles with a collapsing economy as he tries to save a sinking company.",comedy
salvation street,"One day, one moment, one idea can change lives. Noah Davis is a Pastor in an affluent community. Depressed after losing his wife to illness, he is contacted by an old friend who has opened a mission in a rough inner city neighborhood. With Christmas approaching, he packs up and together with his two daughters, moves into Salvation Street Mission. Now the family must struggle with the challenges they face in the crime ridden community. Noah's inspiration guides his daughters, the mission and the...",family
samba,"Samba migrated to France 10 years ago from Senegal, and has since been plugging away at various lowly jobs. Alice is a senior executive who has recently undergone a burnout. Both struggle to get out of their dead-end lives Samba's willing to do whatever it takes to get working papers, while Alice tries to get her life back on track until fate draws them together",comedy
santa claws,"Santa is allergic to cats, so he has a policy against delivering them as gifts, but little Tommy has been SO good, and all he wants is one small kitty. Santa says OK, but instead of one, the whole litter climbs into the sack. When Santa has a major allergic reaction, the kittens have to take over and deliver the presents on time.",family
santa con,"Small-time con man Nick DeMarco is ordered by his parole officer to take a minimum-wage job as a department store Santa during the holidays...and he hates it. Near the end of his first shift, he hastily promises a young boy, Billy, that Santa will bring his estranged parents back together by Christmas. Nick decides to make good on his promise to the child, somehow. But after meeting the boy's mother Carol, will Nick ultimately choose to put the happiness of others ahead of his own?",comedy
saphirblau,"Gwen has just discovered, that she's the final member of the secret time-traveling Circle of Twelve. Now she has to juggle with constant trips to the past, her relationships with Gideon and figuring out dark secrets surrounding the Circle.",drama
saul: the journey to damascus,"Known as Saul the Butcher, the stoning of Stephen was said to have shattered Saul's faith in the Temple and its denial of Christ as the Messiah. His conversion to Christianity and baptism as Paul changed the history of the world.",drama
scarlet's witch,"Alienated by her peers as a young girl, Scarlet finds escape from her loneliness in the forest where she meets a mysterious witch. Scarlet refuses the offer of magic at first, but maintains the friendship into her college years. When her blossoming relationship with a handsome boy at school is threatened by another girl, Scarlet turns to her old friend and her sorcery to get what she wants. Will her newfound powers fulfill all her desires or destroy everything she has known and loved?",drama
schönefeld boulevard,"Cindy lives in Berlin Schoenefeld. As she becomes acquainted with the business men near the international airport, she discovers the big wide world in front of her own door.  - Written byAnonymous ",comedy
school dance,"High schooler Jason has found his dream girl-the gorgeous Anastacia. There's just one problem: she doesn't know he exists. If he can win a spot on the school's hottest dance crew, Jason might have a shot. But before he does, he'll have to overcome his battle-ax of a mother, survive Anastacia's gangsta brother, and pass the crew's initiation-in this fresh, sexy, and outrageously funny comedy.",comedy
sea fog,"The film is adapted from the 2007 stage play of the same name, which in turn was based on the true story of 25 Korean-Chinese illegal immigrants who suffocated to death in the storage tank of the fishing vessel Taechangho; their bodies were dumped by the ship's crew into the sea southwest of Yeosu on October 7, 2001. A young crew member falls in love with one of the illegal immigrants being smuggled to South Korea on board a fishing vessel. When there is a tragedy at sea, he must fight to...",drama
seal team eight: behind enemy lines,"Seal Team Eight must fight their way deep into Africa's Congo, decommission a secret uranium mine, and stop our most dangerous enemy from smuggling weapon's grade yellow-cake out of the country.",action
seasons of love,"Set in the picturesque backdrop of New York, ""Seasons of Love"" is a romantic, soulful holiday drama about two people who struggle to find love against the odds, while reconciling with the past and learning the true value of family.",comedy
second coming,"A married, middle-class London couple (Nadine Marshall and Idris Elba) are shocked when they seem to have been blessed — or cursed — with an immaculate conception, in the provocative second feature by award-winning British playwright Debbie Tucker Green.",drama
secreto matusita,Video footage depicting a supernatural encounter is all that remains of a filmmaker and his crew who disappeared while exploring a haunted house.,horror
secrets of war,"Summer 1943. Tuur and Lambert are best friends. The surrounding of their idyllic village has no secrets for the teenagers. From the farm of Lamberts dad to the marl caves in the woods - it's their world. But the war is closing in and is about to change their lives forever. Tuurs dad joined the resistance and even his big brother seems so be part of it. Lamberts family on the other hand choose to obey the Germans. Then a new girls from the city shows up, befriending the boys but telling her...",drama
seed 2,"Coming back from her bachelor party in Las Vegas, Christine and her friends are driving through the hot desert of Nevada. But they are not alone - serial killer Max Seed is back and he brought the whole family.",horror
semper fight,A Los Angeles Police Officer was fired for the duplication and distribution of a violent home movie made by Marines after returning home from Afghanistan.,drama
separation anxiety,"On her own for the first time in years, Jeane tries to cope with the loneliness of life without her boyfriend, Arthur. She soon finds herself being pursued by a group of mysterious strangers. Is it all in her head or is something more nefarious going on?",drama
set fire to the stars,"An aspiring poet in 1950s New York has his ordered world shaken when he embarks on a week-long retreat to save his hell raising hero, Dylan Thomas.",drama
seve the movie,"Despite being blocked at almost every turn in pursuit of the sport he loved, Seve Ballesteros fought against adversity to become the most spectacular and charismatic golfer to ever play the game.",drama
sex ed,"“Sex Ed” follows Eddie (Haley Joel Osment) as he lands his first teaching gig at an inner city middle school, where he quickly finds that his highly pubescent pupils are receiving no form of sexual education. Eddie isn’t exactly equipped to teach them – he’s a virgin. And he’s falling in love with Pilar (Lorenza Izzo), the older sister of one of his students. But Eddie goes off lesson plan and, in doing so, incurs the wrath of the local Reverend (Chris Williams). Ultimately, Eddie...",comedy
"sex, marriage and infidelity","Charles is a middle aged successful CEO with a beautiful wife and teenage daughter. He has been happily married for 17 years, but as sometimes happens, he begins an office romance with his young voluptuous secretary. Emily, his wife, finds out about his philandering nearly from the beginning but is reluctant to confront Charles. The story focuses on decisions Charles makes to both hide and rationalize his illicit romance and consequences that ultimately occur. Emily too, ultimately develops her...",comedy
"sexo fácil, películas tristes","Buenos Aires screenwriter Pablo is hired to write a new romantic comedy. As he begins his story, he visualizes his characters living in Madrid. Pablo creates a meet-cute between Marina and Víctor, a cute couple in Madrid who are soon totally in love. Yet as Pablo gets more and more into the script, he finds it difficult to separate his movie characters from what is happening in his own real life – specifically, his own love life.",comedy
sharknado 2: the second one,"In Sharknado 2: The Second One, a freak weather system turns its deadly fury on New York City, unleashing a Sharknado on the population and its most cherished, iconic sites - and only Fin and April can save the Big Apple.",horror
she's lost control,"In a world of increasing layers between people, intimacy is perhaps the most elusive ingredient of human interaction. A person can either take the plunge and emotionally connect with their OS or, in the case of She’s Lost Control, psychotherapists can refer patients to sex surrogates. Engaging in that line of work, NYC-based Ronah puts to use her considerable psych-studies experience, as well as her natural solicitous warmth, to engage in close but professional relationships. Until, that is,...",drama
shelby,"This isn't just a Christmas miracle... It's Christmas magic! In this heart-warming family tale, rescue dog Shelby manages to escape the dog pound on Christmas Eve and runs straight into the arms of little Jake (John Paul Ruttan, Robocop). Immediately the two are inseparable! Jake wants to be a magician and Shelby soon becomes the best friend and magical assistant he's always wanted... The only thing standing between them and a perfect Christmas is the notorious local dogcatcher - he has Shelby...",family
shirin in love,"Love has no borders and therein lies the premise of the charming, new Iranian-American romantic comedy ""Shirin in Love."" Nazanin Boniadi plays Shirin, an absent-minded, young Iranian-American living in ""Tehrangeles"" (the large Iranian community in Los Angeles) with her overbearing mother and empathetic father. Despite being engaged for years to a successful Iranian plastic surgeon in Beverly Hills, Shirin finds herself breaking loyalty and tradition when she falls in love with a mysterious...",comedy
shock value,"Miles Fowler makes horror movies. Cheap, perverted, blood-soaked schlock-fests that few see and fewer enjoy. Wallowing in obscurity and desperate to make a name for himself, Miles happens upon a bizarre opportunity when he’s the sole witness to a brutal, real-life murder. Sensing a once-in-a-lifetime chance at artistic (and financial) glory, the z-level auteur decides to build his next project around his new “discovery” - serial killer Nick. But when he finds that Nick is in no way ready...",comedy
shockwave darkside,The nano-plague that poisoned Earth’s water supply has reached its 60-year critical mass. The Unlight enemy forced the first exodus to the moon where the outlawed banished population was supposed to die. But now the Unlights have launched from Earth and are amassing on the south-west sector of the darkside of the moon for a massive ice-mining operation. It will be the last Great War and lunar troops are sent into battle for the precious resource. However one squad is shot down and the five...,action
shongram,"Shongram (struggle) is a romantic drama set during the 1971 liberation struggle of Bangladesh. A British Bengali on his death bed is interviewed by a daring London reporter, where four decades later, Karim is able to recall and finally share his past. We are transported to 1971, when Bangladesh was still East Pakistan and a young Karim (a Muslim) is in love with a beautiful Asha (a Hindu). The peaceful village life is suddenly interrupted by war and Karim must grow up fast to survive in an...",action
shooting for socrates,"SHOOTING FOR SOCRATES is a David Vs. Goliath set in Belfast against the backdrop of the 1986 World Cup. It tells the story of a momentous time in Northern Ireland's football history through the eyes of players, fans and the media. The film also follows the lives of passionate football supporter Arthur and his son Tommy from East Belfast. The lead up to a momentous day in the life of a young boy (his 10th birthday) mirrors the build up to the big day for the Northern Ireland football team as...",comedy
shrew's nest,"After a debilitating fall, an unlucky neighbour finds himself trapped in the mad, cloistered world of two shut-in sisters, in this Misery-style Spanish thriller produced by Midnight Madness favourite Álex de la Iglesia.",drama
silver or lead,"Silver or Lead – accept a bribe, or forever wear a target on your back. This is the choice that General Hugo Martinez faces when he refuses the world’s most controversial and notorious drug lord, Pablo Escobar, and his six million dollar ‘request’ for Martinez to call off his relentless pursuit. Based on true events, this thrilling, epic action drama tells the story of the ruthless, charismatic Pablo Escobar and the man who risked it all to try to bring him to justice.",drama
silver shoes,"This award-winning explicit erotic trilogy intertwines three short stories about the carnal power of what we wear. Fun, bittersweet, surprising, and intimate, the stories may or may not be connected. It's up to you to decide. In Undressed, delicate Liandra is hiding a secret tough masculine side. In The Housesitter, lonely young AnnaBelle has a surprisingly intense reaction to what she finds in the owner's closet. And in Mimosa, Liandra hosts a brunch party and meets Joost, a handsome man with...",drama
simindis kundzuli,"The Inguri River forms a natural border dividing Georgia from Abkhazia. One of the spring floods has created a little island in the middle of the river, as if made for the cultivation of corn. At least, this is the belief of an old peasant, whose sunburned face resembles the landscape he has trodden for dozens of years.",drama
simshar,"Young Theo is sent on his first trip with his Maltese sea faring family, but things go terribly wrong when the 'Simshar' sinks, leaving the crew stranded in the Mediterranean... Simultaneously, Alex - a medic reluctantly dispatched onto a Turkish Merchant vessel which has rescued a group of stranded African boat people between Malta and Italy - gets stuck on the boat as the countries wage a bureaucratic war over who should take in the migrants... The stories unravel in parallel and culminate...",drama
sinbad: the fifth voyage,"When the Sultan's first born is taken by an evil sorcerer, Sinbad is tasked with traveling to a desert of magic and creatures to save her.",fantasy
singham returns,"Singham Returns is an Indian action film directed by Rohit Shetty and produced by Reliance Entertainment. The sequel to the 2011 film Singham, actor Ajay Devgn reprises his role from the previous film, as well as co-producing the project, while Kareena Kapoor Khan plays the female lead.",action
sins of a call girl,"An ex-addict call girl, recently released from prison, returns to the same neighborhood that brought her down to search for her missing son. Her ex-pimp uses her desperation to his advantage by selling her services to a local man that has been snooping around in exchange for the safe return of her son. She accepts, but learns the local man is an undercover cop trying to bring down the pimp for his own daughter's death.",drama
six dance lessons in six weeks,A retired woman hires a dance instructor to give her private dance lessons at her home -- one per week for six weeks. What begins as an antagonistic relationship turns into a close friendship as they dance together.,comedy
