title,plot,genre
 Real Time ,"""Real Time"" is about a hit man (Randy Quaid) who gives a compulsive gambler (Jay Baruchel) one hour to live. The movie takes place in real time and its ultimate subject is what we do with the time we have in this world. The film begins when Andy, a hyperactive compulsive gambler, is plucked off the street by the calm yet imposing Reuban. Reuban tells Andy that he's been dispatched to kill him. Andy doesn't believe him at first. He figures it's just another one of Reuban's scare tactics to get...",Comedy
 Recep Ivedik ,"Adamın biri yolda cüzdanını düşürür, başka bir adam tam cüzdanı kapıp kaçacakken Recep İvedik onunla mücadeleye girer. Sonunda, sahibine teslim etmek üzere, evsiz adamın elinden cüzdanı almayı başaran Recep İvedik kafasını çevirdiği anda cüzdan sahibinin çoktan gittiğini farkeder.",Comedy
 Red Canyon ,"In Red Canyon, Regina and Devon return to their family home in the badlands of Utah to face the memory of a brutal attack - and put it behind them. But in coming home they awaken a killing rage in a town where everyone has ties that bind.",Action
 Red Mist ,"A young doctor in a US hospital administers a powerful and untested cocktail of drugs to a coma victim. But instead of curing him, it triggers a powerful ""out-of-body"" experience and enables the patient - a depraved and dangerous loner - to inhabit other people's bodies and, through them, take revenge on the bullying medical students who were accidentally responsible for his condition. The doctor, who was herself a part of this group, is also targeted and as her colleagues are singled out and...",Horror
 Red Victoria ,An unsuccessful romance writer is convinced by his agent to write a horror film to help make ends meet. He winds up accidentally releasing an undead muse named Victoria in his efforts to write horror. She takes charge of the situation by inspiring him to write a horror script by killing all his friends and family.  - Written byAnthony Brownrigg ,Comedy
Redbelt,"A fateful event leads to a job in the film business for top mixed-martial arts instructor Mike Terry (Ejiofor). Though his refuses to participate in prize bouts, circumstances conspire to force him to consider entering such a competition.",Drama
 Reel Zombies ,"Three film directors make a documentary about the undead in an invested world, he filmed in a time of real zombies. The crew filmed the backdrop of the zombie apocalypse, the real zombie invasion is underway",Action
" Reigo, the Deep-Sea Monster vs. the Battleship Yamato ","Set in World War II, the film depicts the story of the real-life Japanese battleship, the Yamato, which is confronted in the Pacific Ocean by giant monsters, including the most fearsome of them all, Reigo.",Fantasy
 Remarkable Power ,"To punish his cheating wife and save his low-rated talk show from cancellation, TV host Jack West (Kevin Nealon) attempts to pull off an audacious media stunt, which alters the lives of various L.A. locals, including a private eye (Tom Arnold) and a bogus finance guru (Christopher Titus). Directed by Brandon Beckner, this unpredictable showbiz comedy also stars Evan Peters, Nora Zehetner, Kip Pardue and Dul Hill.",Comedy
 Rent: Filmed Live on Broadway ," Set in New York City's gritty East Village, the revolutionary rock opera RENT tells the story of a group of bohemians struggling to live and pay their rent. ""Measuring their lives in love,"" these starving artists strive for success and acceptance while enduring the obstacles of poverty, illness and the AIDS epidemic. Written by Anonymous ",Drama
Rest Stop: Don't Look Back,"One year after running away from home, Nicole (Julie Mond) and Jesse (Joey Mendicino) are still missing. When Jesse’s brother, Tom (Richard Tillman), returns home from active duty, he sets out with his friends Marilyn (Jessie Ward) and Jared (Graham Norris) to locate the lost couple. Their search leads them to the stretch of old highway with a mysterious Rest Stop, where they find themselves in the same predicament as Nicole and Jesse: confronting the madman (Brionne Davis) driving the...",Horror
 Restless ,"Moshe Amar is a once poet and now a ""businessman"" who left his wife with their new born in Israel twenty years ago and spent them in the land of limitless possibilities trying to leave a mark of immortality but, up to that point, only got the marks that frantic debt collectors are more than happy to give. Tsach is the abandoned son who is now a skilled sniper in the Israeli Army. Tsach resents his father for both abandoning his mother for 21 years and not attending her funeral.",Drama
 Resurrection County ," When travelling through Resurrection County, mind the signs, one false move out there could be your last. When four suburbanite campers roll into the remote town of Enoch, they find that southern hospitality still exists. But things are not what they appear to be, as a weekend camping trip turns deadly, and the locals are all too happy to serve up their own brand of an eye for an eye justice. The laws that you so willingly follow are not always right. Written by Michael 'Hallows...",Horror
 Resurrection Mary ," On a dark and creepy road, teenager Jeff Pryce nearly runs down a beautiful, yet mysterious young girl walking alone by Resurrection Cemetery. Jeff offers to give her a ride and by the time he drops her off, a mutual attraction is obvious. But Jeff's life begins to spin out of control shortly after he asks ""Mary"" to be his date at Homecoming -- as one by one, his friends are brutally murdered. Having spent time in juvenile hall, Jeff becomes the prime suspect. Who is Mary? Why...",Romance
 Return to Sleepaway Camp ," It's summer camp as usual at Camp Manabe where the kids torment each other for fun while the underpaid camp staff provides as little supervision as possible. Greedy camp owner Frank and junior partner Ronnie do their best to keep everyone in line, but something sinister is about to put a slash in the roster. When campers and staff mysteriously begin disappearing and turning into gruesome corpses, paranoid Ronnie can't shake the memory of a series of grisly murders that took place at...",Comedy
 Reversion ,"Eva is a woman desperate to get in front of her fate. One of a growing number of human mutants who lack the ability to perceive time, she is aware of the disaster that's set to befall her and her lover, Marcus. Knowing she has seen too much, she believes (or hopes) that she can also alter her destiny. It's a feeling most of us have experienced, even without the benefit of Eva's heightened self-awareness. The film is reminiscent of key works of the French New Wave, as if Alain Resnais were to...",Drama
 Riddles of the sphinx ,"This release from the documentary series NOVA takes a look at the mysteries of the Sphinx, one of the largest and most ancient statues in the world. A hybrid of a man and a lion, the 4,500-year-old monument has perplexed historians and archaeologists for centuries. This examination offers leading theories on how the statue was built, what it represented to the people who created it, and why. ~ Cammila Albertson, Rovi",Fantasy
 Rigged ,"In the seedy underground of illegal prizefighting, a corrupt boxing promoter is embroiled in a dangerous fight-fixing scheme with his female prizefighter.",Action
 Rika: The Zombie Killer ,"When typical Japanese high school student Rika skips school to visit her grandfather, she fails to take into account the fact that his remote village is infested with the living dead.",Action
 Rock Monster ,"A college student, traveling with his friends to a remote eastern-European village, unwittingly releases the Rock Monster from it's ancient slumber to wreak havoc on the surrounding countryside... for realz!",Fantasy
 Rock On!! ,"Sakshi Shroff, the lonely and neglected wife of busy banking executive, Aditya, decides to give him a surprise on his birthday on July 22nd, but ends surprising him multiple times. While Aditya is thrilled to know that he is going to be a dad, he is unhappy when he notices that Sakshi had also invited some ghosts (Rob Nancy and Kedar Zaveri) from his past. This gives rise to unpleasant memories involving a failed music group 'Magik' ; why the music group broke up, the acrimony especially...",Drama
 Rome & Jewel ,This modernization of Shakespear's tragic love story Romeo and Juliette is set in Los Angeles against a backdrop of inter-racial romance.,Drama
 Rough Cut ,"Gang-pae is #2 gangster in his organization who longs to become an actor. Su-ta is a superstar actor who takes on the role of a gangster in an action movie called Rough Cut. When another actor leaves the set due to Su-tas violent ways, the production is on the verge of shutting down. Su-ta asks Gang-pae, whom he met by chance, to play alongside him in the movie in order to save the production.",Action
 Roxy Hunter and the Horrific Halloween , It's Roxy's first Halloween in serenity falls and it looks like it's going to be a bust until Roxy discovers that her classmate Stefan is actually a vampire from Transylvania...or so she thinks. The truth she comes to find is actually much darker. Written by Anonymous ,Family
 Roxy Hunter and the Myth of the Mermaid ," Roxy is at it again when, in pursuit of a local journalism award, she brings home a mysterious amnesiac who was found soaking wet outside of the local coffee shop. After ceremoniously naming her ANNIE NONYMOUS, Roxy takes the young lady home and finds that even the most common household item is a complete mystery to Annie. When Annie returns dripping wet from the lake several nights in a row, Roxy determines what is abundantly clear to her, Annie is a mermaid. A mermaid who has to find her way...",Family
 RSO [Registered Sex Offender] ,There may be one thing worse than being a sex offender sent to prison: Being a sex offender released from prison. RSO tells the story of one offender's unlikely rehabilitation.,Comedy
Rudo & Cursi,"""Y Tu Mamá También"" co-stars Gael García Bernal and Diego Luna are reunited on the big screen under the direction of Carlos Cuarón (brother of Alfonso) for this comedy drama detailing the love/hate relationship shared between two professional soccer-playing siblings.",Comedy
 Run Papa Run ,"Run Papa Run is a 2008 Hong Kong comedy-drama film directed and co-written by Sylvia Chang, and based on a novel by Benny Li. It was produced by JCE Movies Limited, with Jackie Chan serving as an executive producer. Featuring an ensemble cast, the film stars Louis Koo as Lee Tin-Yun, a Triad boss who struggles to hide his criminal lifestyle when he is faced with raising his daughter.",Drama
 S.I.S. ," When LAPD elite cop Billy Beckett is traumatized by his partner's death, Joseph Armstrong recruits him for his secret Special Investigation Squad, an elite quartet which gets a very free hand to hunt down and eliminate some of the worst criminals which would escape justice. Despite colleague Gabriel's suspicion and a reporter who hired a private detective to expose their 'police abuse', he proves his value in the fight against ruthless gangster Vic, who sacrifices even his...",Action
 Salt ," What begins as a childish prank of pique vertiginously devolves into protracted murder. When the true nature of an abusive husband's twisted extra-marital relationship was revealed to his all too innocent wife, the stage is set for sexual manipulation, revenge and his horrifying yet oddly apt demise. Written by Anonymous ",Thriller
 Salt of This Sea ," Soraya, born in Brooklyn in a working class community of Palestinian refugees, discovers that her grandfather's savings were frozen in a bank account in Jaffa when he was exiled in 1948. Direct, stubborn, and determined to reclaim what is hers, she fulfills her life-long dream of ""returning"" to Palestine. Slowly she is taken apart by the reality around her and is forced to confront her own anger. She meets Emad, a young Palestinian whose ambition, contrary to hers, is to leave...",Drama
 Sarkar Raj ,"When Anita Rajan, CEO of Sheppard power plant, an international Company, brings a power plant proposal to set up in rural Maharashtra before the Nagres, insightful Shankar is quick to realize the benefits the power plant can bring to the people. After convincing Sarkar who is against it for various reasons, Shankar undertakes a journey along with Anita to the villages of Maharashtra to mobilize support from the masses. However, things are not what they seem to be and Shankar's dream project...",Action
 Saturday Night Live Presidential Bash '08 ,A two-hour election-themed special that highlights skits from the current season as well as political satire taken from throughout the show's 33-year history. New material is also included.,Comedy
 Say Goodnight ,"Three guys tell a friend the stories of how they met the loves of their lives, and how they managed to completely screw up the relationships.",Comedy
 Scarce ,"""Scarce"" depicts the gruesome fate of three lost snowboarders trapped at an isolated forest cabin owned by two menacing locals who harvest human flesh. As the day of the slaughter nears, they attempt to escape barefoot through the frozen wilderness.",Horror
 Scars of Youth ,"In a post-apocalyptic world 200 years in the future, society has broken down into fragmented groups who now dwell within a tangled wood, completely unaware of any civilization that exists beyond and governed by the white-suited agents of some ominous force, which could perhaps be nothing more than a high-tech manifestation of their own guilt and suffering. In this world, a young man living in a decaying wreck of a dwelling struggles to come to terms with his bleak existence while trying to save...",Fantasy
 Second Hand Wedding ," A small film with a big heart, SECOND HAND WEDDING is a bittersweet dramatic comedy set in the present, in a time when trademe and e-bay threaten the primeval urge for a firsthand crack at the second-hand. Jill keeps the dream alive until she is forced to confront the habits of a lifetime and concede that no bargain is worth her daughter's happiness. Father of the bride, Brian, quips that Cheryl's upcoming wedding will be the first time anyone in the Rose family has given something...",Comedy
 Second to Last Worst Day of My Life ," William Sloan wakes up to experience the second to last worst day of his life. While watching a guy with a pillow case on his head for his friend, Ruby, Sloan must deal with the escapades of his one night stand from the night before (who's name he can't remember) and deal with three hit men who are after him, another handful of killer who are after the pillow case guy, his lawyer/landlord, a pizza guy, a package delivered to the wrong house, a convenience store hold up, and a slew of...",Comedy
 Secrets Of State ," In France, terrorist groups and intelligence agencies battle in a merciless war everyday, in the name of radically opposed ideologies. Yet, terrorist and secret agents lead almost the same lives. Condemned to secrecy, these masters of manipulation follow the same methods. Alex and Al Barad are two of them. The former is the head of the D.G.S.E.'s (Direction Générale de la Sécurité Extérieure, the French equivalent of the CIA or the MI6) counter-terrorism unit...",Thriller
 Sekai de ichiban utsukushii yoru ," Its streets overrun with children, the village of Kaname has distinguished itself with the highest birth rate in Japan. Its citizens are excited-tomorrow, the Prime Minister arrives to formally celebrate Kaname's demographic distinction. The spirit is festive, except for one 14-year-old girl. She knows the secret of Kaname's fecundity, and she's typing up a tell-all letter to a prominent journalist, revealing the crazy, complicated tale. It all began 14 years ago... Betrayed and...",Drama
 Senior Skip Day ,"Adam Harris, a semi-lame senior, is head over heels in love with Cara. Unfortunately she is the most popular girl in school. On the one day of the year that he could actually have a chance, senior skip day, he screws it all up by accidentaly slipping the location of the party to his principle. But have no fear, in a last resort effort he moves the party to his house and all seems to be well. Or is it...",Comedy
 Serbis ,"The Pineda family operates a run-down movie house in a city in the province, which shows dated sexy double-feature films. The family has taken up actual residence in the old building as well. The matriarch Nanay Flor, her daughter Nayda, son-in-law Lando and adopted daughter Jewel take turns manning the ticket booth and the canteen. Her nephews Alan and Ronald are the billboard painter and projectionist respectively.Nanay Flor had filed a bigamy case against her estranged husband and is...",Drama
 Sex and the USA ,"Thirteen year old Audrey Shaw is new to Bellweather, California and certain shell never fit in when she meets Krista Rich, the pretty, popular girl she aspires to be ""or be with"" shes just not sure. In a conservative California town, 14-year-old Audrey is new to Bellweather, California and certain shell never fit in when she meets Krista Rich, the pretty, popular girl she aspires to be ""or be with"" shes just not sure. Blending traditional filmmaking with social networking-inspired video...",Drama
 Shades of Ray ,"American-born Ray Rehman (Zachary Levi) comes home one night to find his Pakistani father on his doorstep. Ray's Caucasian mother threw him out. It's an awkward time for his father to move in as Ray just proposed to his Caucasian girlfriend - who hasn't given him an answer. While trying to get his parents back together, Ray meets a South Asian girl of mixed descent, just like him, and must decide where his identity truly lies.",Comedy
 Shaolin Girl ," Produced by Stephen Chow (Shaolin Soccer, CJ7), Shaolin Girl tells the story of a girl by the name of Rin, who is compelled to take over her late grandfather's kung-fu dojo. She endures 3,000 days of brutal training at the Shaolin Martial Arts School in China before returning to her native Japan. But what awaits her is a dojo that lies in tatters and students who have abandoned the true discipline of Shaolin kung-fu. While struggling to restore her grandfather's school to its former...",Action
 Shark in Venice ," The seemingly tranquil waterways of Venice are terrorized by the perfect killing machine. In search of his father who has mysteriously disappeared diving in the city, David stumbles across the cryptic trail leading to the long-lost fortune of the Medici. As the unwitting pawn in a Mafia plot to recover the treasure, David's girlfriend is kidnapped at gunpoint, plunging him into a desperate race against time. If he has any hope of saving her he must enter the deadly waters. Can David...",Horror
 Sherman’s Way ,"A real crowd-pleaser, ""Sherman’s Way"" starts with two strangers forced into a road trip of convenience only to veer off the path into a quirky exploration of friendship, fatherhood and the universal task of finding one’s place in the world – a world in which one wrong turn can change your destination.",Comedy
 Shirin ,"A hundred and fourteen famous Iranian theater and cinema actresses and a French star: mute spectators at a theatrical representation of Khosrow and Shirin, a Persian poem from the twelfth century, put on stage by Kiarostami. The development of the text -- long a favorite in Persia and the Middle East -- remains invisible to the viewer of the film, the whole story is told by the faces of the women watching the show.",Drama
 Show Stoppers ,"""Show Stoppers"" is a comedy-drama set in the world of Greek stepping on a historically black university in Virginia ""where Greek steppers get as much attention as star athletes.""",Comedy
 Shred ,"SHRED is a motion picture that tells the story of two washed up pro snowboarders from the 90s named Max (played by Dave England) and Eddie (played by Renee Renee) who attempt to cash in on the fantastic growth of the sport by starting their own snowboard camp. Hoping to recapture their former glory, they begin by sharing their wacky wisdom with a group of up and coming young snowboarders. The story takes them from the run down ski hill where they grew up to a major event at one of the biggest...",Comedy
 Singh Is Kinng ,"A comic caper about Happy Singh, a Punjabi villager who goes through a series of misadventures and eventually becomes the Kinng of the Australian underworld.",Action
 Sisters Apart ,"Taru elää ratsutilalla harmonista elämää miehensä Harrin ja tytärpuolensa Ninnin kanssa. Kaikki muuttuu, kun Ninni loukkaantuu hevosonnettomuudessa. Kymmenen vuotta sitten Ruotsiin lähtenyt Ninnin biologinen äiti Eve kutsutaan paikalle Tarun pyynnöstä. Even pikaiseksi kuviteltu käynti muuttuu pidemmäksi vierailuksi, kun Eve tajuaa, että hän haluaa menetetyt kymmenen vuotta elämästään takaisin. Kauan kytenyt kaipaus Ninni-tytärtä kohtaan nousee pintaan. Vähä vähältä Eve...",Drama
 Six Reasons Why ,"""Six Reasons Why"" is an Indie Film like no other. Inspired by the classic western masters such as Leone, Eastwood and Peckinpah; 'Six Reasons Why' attempts to seamlessly cross the Western/Sci-Fi genres. SRW is Produced, Written, Directed and Edited by The Campagna Brothers following their international no-budget success with 'Roots of a Man'. The brothers, Jeff (23) and Matt (25), were determined to create a film with the look of a classic spaghetti western and the structure of a contemporary...",SciFi
 Slap Shot 3: The Junior League ,"The Hanson Brothers are back, and who better to whip a ragtag youth team into shape for the upcoming championships than the most unpredictable trio ever to strap on skates? Time is running short before the big game, but perhaps if the Hanson Brothers can teach their young protégés the true value of a solid check, these inexperienced underdogs can use brutality to their advantage and finally score a winning goal.  - Written byAnonymous ",Action
 Slaughter House ," It's ""Last House on the Left"" meets ""The Desperate Hours"" when four escaped cons enter an isolated safe-house retreat for abused women. Some have called it an exercise in depravity while others have deemed it to be an illustration of the strength that exists in all women. No matter how you view it, ""Slaughter House"" is a 90 minute odyssey of absolute terror! Don't watch it alone! Written by Parrish Randall ",Horror
 Slaughtered ," Harold Parkinson has a snuff site on the web ""Slaughtered Sheep"". He hires young models never intending to pay them. Instead he murders them and uses their pictures on his website. Harold's victims are not happy about being brutally murdered and that Harold continues to add to their numbers. After several warnings, which the psychotic Harold ignores. His past victim's band together in order to stop Harold and prevent him from murdering more models, While exacting their own...",Horror
Sleep Dealer,"""Sleep Dealer"" is our tomorrow today, a corporation-controlled, militarized near future where the United States has successfully closed its borders. Finally. Through American technology we have developed a capacity, a digital network, to have all the work with none of the workers constructing our buildings, picking our fruit, manning our planes. There are no water shortages.",Drama
 Small Crime ," Leonidas, a young, ambitious police officer, is assigned to a remote island in the Aegean Sea. He dreams of solving important crimes, but there are few to be found in the sleepy beach community where he is left to such menial chores. Each day at the town café, Leonidas and the other locals watch the beautiful Angeliki, the small islands most famous daughter, as she hosts a popular talk show on national TV. These daily rituals are shattered when the island experiences what appears to be an...",Comedy
 Smother ,"What would you do if your mother moved in with you and just wouldn't leave? When Noah Cooper, 29, is fired from his job as a therapist, he thinks his day can't possibly get worse. When he arrives home his already full house gets even crazier when Marilyn, Noah's overbearing mother arrives with her five dogs in tow needing a place to stay. Comedy ensues as Noah learns to deal with the pressures of finding a job, a wife who desperately wants a baby, and worst of all a mother who won't quit...",Comedy
 Soccer Mom ,"When Becca's losing soccer team needs a new coach, her mom decides to masquerade as the famous Italian soccer star 'Lorenzo Vincenzo' and take the job.",Comedy
 Solar Flare ,"An only child raised by a tough-talking single mother, fifteen-year-old Riley has always stood out. A math genius fascinated by the universe, Riley has developed a groundbreaking new way to accurately predict the frequency of dangerous solar flares. Soon he discovers that a huge solar storm is hours away from frying the earth's power grid. With the help of his professor, the no-nonsense Dr. Clark, he sets out on a race against time to convince the world to prepare for the worst before it's too...",Action
 Sold Out: A Threevening with Kevin Smith ,"Kevin Smith brings his famous and ""infamous"" Q&A back to his hometown of Red Bank, New Jersey for his 37th birthday.  - Written byAnonymous ",Comedy
 Somers Town ,"Two teenagers, both newcomers to London, forge an unlikely friendship over the course of a hot summer. Tomo (Thomas Turgoose) is a runaway from Nottingham; Marek (Piotr Jagiello) lives in the district of Somers Town, between King's Cross and Euston stations, where his dad is working on a new rail link.",Comedy
