title,plot,genre
 The Lost Patrol ,"A World War I British Army patrol is crossing the Mesopotamian desert when their commanding officer, the only one who knows their destination is killed by the bullet of unseen bandits. The patrol's sergeant keeps them heading north on the assumption that they will hit their brigade. They stop for the night at an oasis and awake the next morning to find their horses stolen, their sentry dead, the oasis surrounded and survival difficult.",Adventure
 The Lucky Texan ," When miners Mason and Benson turn in their gold at the assay office, the assay officials trail Benson back to the mine and shoot him. Mason is then arrested for the murder. But the supposedly dead Benson survived and now plans a surprise for the culprits at Mason's trial. Written by Maurice VanAuken <[email protected]> ",Romance
 The Man Who Reclaimed His Head ," A brilliant but impoverished writer, who is a pacifist, goes to work for a publisher and writes anti-war editorials. When he discovers that the publisher has betrayed him and is in league with munitions manufacturers to make money off of war, he goes insane. Written by [email protected] ",Drama
 The Murder in the Museum ,"When a city councilman is murdered while investigating allegations of drug dealing going on a a somewhat disreputable sideshow, the daughter of the chief suspect teams up with a newspaper reporter to find the real killer.",Thriller
 The Old Fashioned Way ,"The Great McGonigle's traveling theatrical troupe are staying at a boarding house. They are preparing to put on a production of ""The Drunkard"" (and do so during this movie). Cleopatra Pepperday puts up money for the show provided she can have a part (""Here comes the prince!""). Little Albert Wendelschaffer torments McGonigle all through lunch (""How can you hurt a watch by dipping it in molasses?""). In spite of being pursued by several sheriffs, McGonigle is able to keep going and...",Comedy
 The Painted Veil ," In Austria, Katrin is lonely after her sister's marriage and she agrees to marry her father's research associate Dr. Walter Fane. Fane takes her to China but constantly ignors her in favour of his medical research. Lonely Katrin has an affair with Jack Townsend of the British Embassy. When it is discovered by Walter he becomes very bitter. Fane travels to fight a cholera epidemic and Katrin goes with him and helps. They grow closer together than ever before but Walter is knifed in a...",Drama
 The Richest Girl in the World ,"A wealthy heiress switches places with her secretary to test a man's love. Millionairess Dorothy Hunter (Miriam Hopkins) is tired of finding out that her boyfriends love her for her money, and equally weary of losing eligible beaus who don't want to be considered fortune-hunters. That's why she trades identities with her secretary Sylvia (Fay Wray) before embarking on her next romance with Tony Travers (Joel McCrea). This causes numerous complications not only for Dorothy and Tony but for...",Comedy
 The Scarlet Empress ,"Young Princess Sophia of Germany is taken to Russia to marry the half-wit Grand Duke Peter, son of the Empress. The domineering Empress hopes to improve the royal blood line. Sophia doesn't like her husband, but she likes Russia, and is very fond of Russian soldiers. She dutifully produces a son -- of questionable fatherhood, but no one seems to mind that. After the old empress dies, Sophia engineers a coup d'etat with the aid of the military, does away with Peter, and becomes Catherine the...",Drama
 The Scarlet Letter , At the end of the 17th century a impetuous woman of noble birth but poor arrives in Boston when it was just a village rather than a city. As she is married to an old doctor she tries to change her life. Written by Volker Boehm ,Drama
 The Scarlet Pimpernel ,"Leslie Howard plays Sir Percy Blakeney, an 18th century English aristocrat who leads a double life. He appears to be merely the effete aristocrat, but in reality is part of an underground effort to free French nobles from Robespierre's Reign of Terror. Based on the novel by Baroness Orczy.",Adventure
 The St. Louis Kid ,"Trucker Eddie Kennedy gets involved with the law when he has an car accident with Ann Reid and knocks the owner of a dairy out. He evades a penalty when he claims, that he had done it as an act of solidarism with the farmers. The farmers start an boycott action against this dairy, so the owner has to bring milk from elsewhere to his dairy, but the farmers closed the road, and Kennedy is arrested once more. He leaves jail at night to meet Ann, but meanwhile the owner has asked...",Romance
 The Star Packer ,"John Travers and Yak, his faithful Indian sidekick, pick up where a murdered sheriff leaves off, and try to nab the mysterious Shadow.",Romance
 Them Thar Hills ," Stan and Ollie take a trip into the mountains ('the high multitude') so that Ollie can recover from gout. Bootleggers have dumped their moonshine in the well from which the boys sample their 'healthy' mountain water. Mr Hall, who has left his wife with the boys while he re-fuels his car is not amused at his wife's condition when he returns. Written by Stephen Harrison <[email protected]> ",Comedy
 Thirty Day Princess ," On a visit to a spa in the Ruritanian Kingdom of Tyronia, American financier Richard Gresham meets the country's ruler, King Anatol XII, and convinces him that he could arrange for $50 million dollars in loans to benefit his impoverished nation if the king's charming daughter could do reciprocal public relations in the States. Unfortunately Princess Catterina falls ill with the mumps and is quarantined for a month aboard ship. Rather than risk having his very lucrative endorsement...",Comedy
 Three on a Honeymoon ,This romantic comedy takes place on an ocean liner. One of the few unattached passengers is heiress Joan Foster. Joan finds herself in the arms of the ship's second officer. Little does she know that he has been hired by her father to keep other men away from her.,Comedy
 Treasure Island ," Young Jim Hawkins is caught up with the pirate Long John Silver in search of the buried treasure of the buccaneer Captain Flint, in this adaptation of the classic novel by Robert Louis Stevenson. Written by Jim Beaver <[email protected]> ",Adventure
 Twentieth Century ,"Oscar Jaffe is a successful Broadway director; Lily Garland, one of his stars. But when she leaves his direction, his success goes with her. When he recognizes her aboard the Twentieth Century Limited, the train that both of them are riding, he tries to get her back for a new show. But accomplishing that feat isn't as simple as he had thought.",Comedy
 Wagon Wheels ,"The trio of Belmet, Burch, and O'Meary are leading a wagon train west and Murdock is out to stop them. The settlers fight off his initial Indian attack and reach the mountains. With the wagon train vulnerable as it crosses a river, Murdock has the Indians make a final attack.",Action
 We're Not Dressing ," Beautiful high society type Doris Worthington is entertaining guests on her yacht in the Pacific when it hits a reef and sinks. She makes her way to an island with the help of singing sailor Stephen Jones. Her friend Edith, Uncle Hubert, and Princes Michael and Alexander make it to the same island but all prove to be useless in the art of survival. The sailor is the only one with the practical knowhow to survive but Doris and the others snub his leadership offer. That is until he starts a clam...",Comedy
