title,plot,genre
 The Most Beautiful ," During World War II, the management of a war industry of optical instruments for weapons requests an effort from the workers to increase the productivity during four months. The target for male workers is an increase of 100% of the production, but the female workers, led by the dedicated Tsuru Watanabe, ask the direction to surpass their goal from 50% to 70%. During the period, the women have to overcome illness and their personal problems to complete their quota. Written by Claudio...",Drama
 The Mummy's Curse ,"An irrigation project in the rural bayous of Louisiana unearths Kharis the living mummy (Lon Chaney Jr.), who was buried in quicksand 25 years earlier.",Horror
 The Mummy's Ghost ,"In Egypt, Yousef Bey (John Carradine) journeys to a remote temple in answer to a summons from Andoheb, High Priest of Arkham (George Zucco). Andoheb has called him to undertake a mission for the priesthood, but first refreshes his memory on the story of Kharis (Lon Chaney Jr.).",Horror
 The Princess and the Pirate ,"Princess Margaret is travelling incognito to elope with her true love instead of marrying the man her father has betrothed her to. On the high seas, her ship is attacked by pirates who know her identity and plan to kidnap her and hold her for a king's ransom. Little do the cutthroats know that she will be rescued by that unlikeliest of knights errant, Sylvester the Great, who will lead them on a merry, and madcap, chase.",Adventure
 The Purple Heart ,"This is the story of the crew of a downed bomber, captured after a run over Tokyo, early in the war. Relates the hardships the men endure while in captivity, and their final humiliation: being tried and convicted as war criminals.",Drama
 The Rats of Tobruk ,"Tells the story of three men--Bluey, a tough two fisted drover (Taylor), Milo, a laconic dingo trapper (Rafferty), and Pete, an intellectual English ""new chum"" (Finch). Together they serve in North Africa, fighting against the forces of Rommel in what has now become one of Australia's greatest wartime legends--The Rats of Tobruk.  - Written byPatrick Dominick <[email protected]> ",Action
 The Seventh Cross ," In Nazi Germany in 1936 seven men escape from a concentration camp. The camp commander puts up seven crosses and, as the Gestapo returns each escapee he is put to death on a cross. The seventh cross is still empty as George Heisler seeks freedom in Holland. Written by Ed Stephan <[email protected]> ",Drama
 The Tower of the Seven Hunchbacks , In the Madrid of the 19th century a young man plays roulette. A mysterious character helps him by pointing with his walking stick the next number where the ball is going to fall. The protagonist is the only one able to see him. The mysterious man turn out to be the ghost of an archaelogist and ask the young man to defend his daughter from a gang of hunchbacks. Written by Miguel A. Andrade <[email protected]> ,Comedy
 The Uninvited ,A brother and sister move into an old seaside house they find abandoned for many years on the English coast. Their original enchantment with the house diminishes as they hear stories of the previous owners and meet their daughter (now a young woman) who now lives as a neighbor with her grandfather. Also heard are unexplained sounds during the night. It becomes obvious that the house is haunted.,Fantasy
 The White Cliffs of Dover ," London based American nurse, Lady Susan Ashwood née Dunn, is at the hospital awaiting the imminent arrival of injured soldiers. She is hoping that her enlisted son, Sir John Ashwood II, who resembles his father both in appearance and temperament, is not among those injured. As she waits, she remembers back to WWI when her husband, Sir John Ashwood I, was enlisted, and the waiting she endured on any news from and about him while he was away in battle. From a humble background, Sue almost...",Drama
 Thirty Seconds Over Tokyo ,"In the wake of Pearl Harbor, a young lieutenant leaves his expectant wife to volunteer for a secret bombing mission which will take the war to the Japanese homeland.",Drama
 Torment ," Jan-Erik Widgren is a high-school senior. His Latin teacher, Caligula, is feared by everybody, both teachers and students. Widgren falls in love with Berta, who works in a tobacco store. She tells him that she is harassed by a mean, sadistic man, but does not tell him that it is Caligula himself. Written by Mattias Thuresson ",Drama
