title,plot,genre
 The Adventures of Milo and Otis ,"The story of two animals and their adventures. Milo, the cat, and Otis, the dog, are two animals who grew up together on the same farm. One day, the two are separated and begin a journey to find each other. The adventurous, and often perilous quest finds the two animals traveling across mountains, plains, and snow-covered lands searching for one another.",Adventure
 A Better Tomorrow ,"A death-hardened cop battles the Hong Kong underworld, including his own brother who joins the bad guys. This progenitor of Woo's ""heroic violence"" films introduces the theme of loyalties between men shattered by a violent world that forces them apart. Only through sacrifice can honor be attained.",Action
Deadly Friend,"Paul is a new kid in town with a robot named ""BB"". He befriends Samantha and the three of them have a lot of good times together. That is, until Samantha's abusive father throws her down some stairs and kills her. In an effort to save her life, Paul implants BB's computer brain into Samantha's human brain.",Drama
 Rawhead Rex ,"Ireland will never be the same after Rawhead Rex, a particularly nasty demon, is released from his underground prison by an unwitting farmer. The film follows Rex's cross country rampage, while a man struggles to stop it.",Horror
 Armed and Dangerous ,"Dooley, a cop wrongly sacked for corruption, teams up with a useless defence lawyer in their new careers... as security guards. When the two are made fall guys for a robbery at a location they are guarding, the pair begin to investigate corruption within the company and their union. They soon make enemies of everyone, but can the unlikely duo save the day?",Action
 Invaders from Mars ,"In this remake of the classic 50s SF tale, a boy tries to stop an invasion of his town by aliens who take over the the minds of his parents, his least-liked schoolteacher and other townspeople. With the aid of the school nurse the boy enlists the aid of the U.S. Marines.",Horror
 Down and Out in Beverly Hills ,"Beverly Hills couple Barbara and Dave Whiteman are very rich but not happy Dave is a hard working business man, his wife is only interested in yoga, aerobics and other meditation classes, and he sleeps with the house maid. Their teenage son is confused about his sexuality and their daughter is suffering from eating disorders. While they are celebrating thanksgiving having plenty of food, street tramp Jerry is hungry, homeless, sleeping rough and has lost his dog. Jerry decides to end his life...",Comedy
 What Every Frenchwoman Wants ,"Roger is a 16-year-old who seeks to lose his virginity in this softcore erotic drama. His initial efforts are unsuccessful, but World War I breaks out and men are seen marching off to battle. Roger goes overboard when he is presented with several amorous opportunities. He soon impregnates the maid, his aunt, and his sister in quick succession. Roger desperately tries to marry off the women to other men to avoid a lurid scandal.",Comedy
 Castaway ,"Middle-aged Gerald Kingsland advertises in a London paper for a female companion to spend a year with him on a desert island. The young Lucy Irving takes a chance on contacting him and after a couple of meetings they decide to go ahead. Once on the island things prove a lot less idyllic than in the movies, and gradually it becomes clear that it is Lucy who has the desire and the strength to try and see the year through.",Adventure
 Slaughter High ,"Eight different people are invited to their 10-year high school reunion at their now-closed down high school where a former student, disfigured from a prank gone wrong, is there to seek revenge.",Comedy
 My Life as a Dog ,"A boy and his brother don't get along well. In order to let her ill mother rest, they're separated and sent each one with their relatives.",Drama
 Manon of the Spring ,"In this, the sequel to Jean de Florette, Manon (Beart) has grown into a beautiful young shepherdess living in the idyllic Provencal countryside. She plots vengeance on the men whose greedy conspiracy to acquire her her father's land caused his death years earlier.",Drama
 Matador ,"Ex-bullfighter who is getting turned on by killing, lady lawyer with same problem and young man driven insane by over-religious upbringing - these are the main characters in this stylish black comedy about dark sides of human nature.",Drama
 F/X ,"A movies special effects man is hired by a government agency to help stage the assassination of a well known gangster. When the agency double cross him, he uses his special effects to trap the gangster and the corrupt agents.",Action
" ""Walt Disney's Wonderful World of Color"" Help Wanted: Kids "," When the Burkes loose their jobs in New York, they have to move to Arizona, where Tom has an job-offer in the management of a small company for children's clothing. Unfortunately Tom's new boss Sirus Lovelin turns out to be extremely fond of the traditional American family and automatically assumes Amanda to be housewife and mother - but the Burkes don't even have children! To not offend him, they ""hire"" two kids they met prowling the streets. When they turn out witty,...",Adventure
" ""Walt Disney's Wonderful World of Color"" The Thanksgiving Promise ",A teenage boy is torn between his love for an injured Canadian goose that he has found and his agreement to fatten and kill it for an approaching Thanksgiving dinner for his neighbors.,Adventure
 '38 ,"The film presents the political events surrounding the Anschluss in March of 1938 through the lives of Carola Hell, a popular young actress at the prestigious Theater in der Josefstadt, and Martin Hofmann, the Jewish journalist she plans to marry. When we encounter the couple in the lovely springtime weather their future is full of promise. They are determined to stay clear of politics. Yet in the climate of the time, nobody of her prominence or his religion can remain apolitical. Although...",Drama
" 'night, Mother ","It happened in 1983. It was a rare and remarkable theatrical experience. Controversial. Provocative. And shocking. Now, two Academy Award-winning actresses make the Pulitzer Prize-winning play the motion picture event of the year. What would you do if someone you loved sat down with you one night and calmly told you that they were going to end their life before morning?",Drama
 'Round Midnight ,"Inside the Blue Note nightclub one night in 1959 Paris, an aged, ailing jazzman coaxes an eloquent wail from his tenor sax. Outside, a young Parisian too broke to buy a glass of wine strains to hear those notes. Soon they will form a friendship that sparks a final burst of genius in director Bertrand Tavernier",Drama
 A Fine Mess ,Two friends an actor and a chef discover a plot to fix a horse race and try to capitalize on it. But also have to deal with the two men who fixed it who are trying to silence them. And there's also the mob boss whom the two guys work for who planned the fixing thing whose wife is having an affair with the actor.,Action
 A Judgment in Stone ," An English woman, psychotic and sexually repressed, murders her sadistic father, then moves to America. She soon secures a job as a maid for a wealthy family. Soon her severe psychosis and her attempts to keep her sexuality from asserting itself combine to cause trouble for all concerned. Written by [email protected] ",Horror
 A Man and a Woman: 20 Years Later , Jean-Louis and Anne have had their fling and separated. Now 20 years have passed. He is still dating various women. She is now a big time director whose most recent film was a very expensive bomb. She comes up with the idea of making a romance based upon her fling with Jean-Louis. She contacts him to gain his permission. Jean-Louis is still in racing and goes away for a desert rally while she begins filming. She finds the mood of their romance difficult to recapture in her film. Written by ...,Drama
 Abducted ,"Dan Haggerty, TV's Grizzly Adams, has a more complex role than usual in Abducted. Haggerty plays the father of a mixed-up mountain boy (Lawrence King-Phillips) who has kidnapped a pretty college student (Roberta Weiss). Though Haggerty tries to explain why his sons behaves the way he does, the girl would just as soon dispense with the backstory and make her escape. But the son has no intention of freeing his captive, thereby setting the stage for a final showdown with his own father.",Drama
 Abel ," An extremely weird comedy revolving around the life of 31- year-old Abel, who has never left home (literally). After failing with doctors and psychiatrists, Abel's father Victor brings home Christine, a friend, in an attempt to teach Abel basic social skills. But Victor's wife Duif accuses him of having an affair, and in the ensuing row Abel is thrown out into the street. But help is at hand when he runs into kind-hearted stripper Zus - whose show Victor is obsessed with... Written...",Comedy
 Absolute Beginners ,"A musical adaptation of Colin MacInnes' novel about life in late 1950s London. Nineteen-year-old photographer Colin is hopelessly in love with model Crepe Suzette, but her relationships are strictly connected with her progress in the fashion world. So Colin gets involved with a pop promoter and tries to crack the big time. Meanwhile, racial tension is brewing in Colin's Notting Hill housing estate...",Drama
 Acceptable Risks ," Oakbridge, a mid-size midwest American city, is the site of a major chemical disaster. At Citichem, the production manager, is forced to shortcut his safety procedures to speed up the production of a highly toxic and volatile chemical. Of course, as expected, an accident occurs. A worker is killed and the town is exposed to calamitous impacts. Cicely Tyson also co-stars as the City Manager who has misgivings about the whole operation. Written by John Sacksteder...",Drama
 Adventures of Huckleberry Finn ,This adaptation of the Mark Twain novel tells the story of a young boy and a runaway slave and the adventures they encounter as they travel down the Mississippi River on a raft.,Comedy
 Aladdin ,"Updating of the old ""Aladdin"" Arabian Nights tale, as a teenager in modern-day Miami finds a magic lantern and out pops a genie, who's been asleep for 200 years and in his gratitude grants the boy several wishes.",Adventure
 Alex Is Lovesick ,"The movie is a romantic comedy which takes place in Israel during the Austerity period of the 1950s. The movie's hero is Alex, a 13 year old boy who is about to attend his Bar Mitzvah. Alex has a typical Polish mother and father that suffers quietly. On account of the difficult economic situation they are compelled to share their apartment with a Persian tenant named Faruk that tries to fight his baldness by means of different creams. Alex falls in love with the new girl in his...",Comedy
 All Passion Spent ,"his three-part miniseries begins with elderly Lady Slane (Wendy Hiller) sitting watchfully by the deathbed of her husband. Tended by her equally aged French maid Genoux (Eileen Way), who has served her faithfully for a lifetime, Lady Slane deals with a succession of advice from her large flock of middle-aged children. The family is chagrined by, but honors, her choice to live a modest country retirement at some distance, in Hampstead Heath. Lady Slane competently comes to terms to lease and...",Drama
 America 3000 ,"900 years after a nuclear war in the USA, mankind is back to the stone ages. Amazon women rule the tribes, while the men are weak and dumb - either kept as slaves or living wild as animals. Only Korvis and a friend are intelligent enough to flee and found a tribe of their own. Will they manage to teach the women love to men again?",Action
 American Anthem ,"Steve is a talented gymnast who has given up competition and is working at his father's bike shop. Julie is the new girl at his old gym, who has moved to town to train with their powerful coach. Inspired by Julie, Steve resumes training. While dealing with the conflicts in their personal lives and the stress of training, they prepare for the US Olympic Trials.",Drama
 Armed Response ,"One of Tanaka's underlings has stolen a rare statuette that he had planned to use as a peace offering between the local Yakusa and Chinese Tong. He hires two private investigators to exchange ransom money to recover the statuette, but the trade goes down bad and Clay Roth is killed. This angers Roth's brothers and father, all combat veterans, and they go after the people responsible",Action
 Assassin ,"A retired agent from an Intelligence Agency is contacted by the Agency in order to stop an ultra-secret robot who is killing some government officials. That will be not an easy task, because the robot looks human and it was specifically builded to be an efficient killer, not to mention that it is almost invulnerable.  - Written byLuis Carvacho <[email protected]> ",Thriller
 Babul ,"Bikram (Gyan Shivpuri), a fugitive, finds a two-year-old orphaned girl and ends up adopting her. The criminal transforms into a loving foster-father, changes his name to Janak and becomes a fruit-seller to raise the child by honest means. Years roll by; the girl, Nandni grows into a charming young woman (Upasna Singh) and Janak, a prosperous fruit merchant. He gets into a tiff over his property with Rameshwar, a rich businessman, but later, when he learns that Nandni is in love with Ashok...",Drama
 Bad Guys ," Two hotshot LAPD cops get in hot water after breaking up a fight at a local bar. They get suspended from the force and have to find a way to pay the rent. First they try construction work, then stripping, but newspaper reporter Janice Edwards has a really good idea...professional wrestling. A rival manager, Lord Percy, does not like her new team, The Boston Bad Guys (the cops) and will do anything he can to keep them from appearing on the same card as his team, the Kremlin Crushers. Still, the...",Comedy
 Belizaire the Cajun ,"Drama - In 19th-century Louisiana's Cajun country, Belizaire (Armand Assante) is the informal spokesman for his citizens, who don't see eye to eye with local racists who wish to eradicate all Cajuns. Complicating matters is the fact that Belizaire's former flame (Gail Youngs) is now married to his biggest rival (Will Patton), an affluent landowner's son. Before he knows it, Belizaire is caught up in a web of murder, lies and prejudice. - Armand Assante, Gail Youngs, Michael Schoeffling",Drama
 Betrayed by Innocence ,A married commercial filmmaker (Barry Bostwick) is charged with statutory rape when it is revealed that his lover (Cristen Kaufman) is only 16.,Drama
 Biggles: Adventures in Time ,"Unassuming catering salesmen Jim Ferguson falls through a time hole to 1917 where he saves the life of dashing Royal Flying Corps pilot James ""Biggles"" Bigglesworth after his photo recon mission is shot down. Before he can work out what has happened, Jim is zapped back to the 1980s......",Adventure
 Billy The Kid and The Green Baize Vampire ," Cocky cockney snooker player Billy Kid accepts the challenge of a grudge match from Maxwell Randall (the Green Baize Vampire), six times world champion; the loser will never play professional snooker again. Written by Roisin Moriarty <[email protected]> ",Comedy
 Body Count ," A bodybuilder, a junk-food addict and a wild blonde nymph and their friends are stalked by a terrifying figure. An horrific tale of murder as a fun-loving group of college students explore the Colorado wilderness. Written by Maarten Dinger <[email protected]> ",Horror
 Born American ," Three American students vacationing in Finland, cross the border into Russia for fun of it. When they are spotted by the Russian soldiers who are shooting to kill, it's not fun anymore. Captured and thrown in jail, they find it's not fun either. It's a nightmare. Written by Brian W Martz <[email protected]> ",Action
 Born to Defense ," Jet, a young soldier at the end of the second world war must overcome some abusive Americans who are bullying him as well as the Chinese people. Written by Tom MacNeill ",Action
 Breeders ,"The Manhattan General Hospital has admitted a string of young women who have been raped by something otherworldly. The perpetrator only attacks women who are virgins. Dr. Pace and Detective Andriotti work together to try and isolate the strange organic material found on the victims, and to try and locate the fiend. Soon the victims begin arising in a trance and leaving the hospital by an underground passage where their fate awaits them.",Horror
 Brighton Beach Memoirs ,"Eugene, a young teenage Jewish boy, recalls his memoirs of his time as an adolescent youth. He lives with his parents, his aunt, two cousins, and his brother, Stanley, whom he looks up to and admires. He goes through the hardships of puberty, sexual fantasy, and living the life of a poor boy in a crowded house.",Comedy
 Bullies ,"When the peaceful Morris family move to a small town and buy the town grocery store, they run afoul of the Cullen family. The Cullen's have been bullying the town's folk for years, and now they are harassing the Morris family every chance they get. Matt meanwhile meets and starts seeing a lot of Becky who also likes him. Unfortunately her last name is Cullen, and when the rest of the family finds out about their relationship, they decide to get even, and their harassment is elevated to vicious...",Action
 Carnage ,"Carol and Jonathan, a newlywed couple, move into their new house which is haunted by the ghosts of another newlywed couple who commited suicide in the house three years earlier.",Horror
 Choices ," A 19 year old girl suddenly finds herself pregnant. Not wanting to face motherhood or dealing with the consequences of a child, she contemplates an abortion without the knowledge of her boyfriend. However, her father, a retired 62 year old judge discovers her situation and is strongly opposed to abortion in principle. However, he soon finds he has to re-examine his own beliefs as his younger 38 year old second wife suddenly announces she is also pregnant. The two, when first married, agreed...",Drama
 Choke Canyon ," Pilgrim Corporation has leased Choke Canyon to research physicist David Lowell for 99 years. Lowell has built an impressive research laboratory there. When Pilgrim suddenly needs Choke Canyon for toxic waste storage, they resort to violence to force out the renitent Lowell. However, Pilgrim Corportation vastly underestimates Lowell, who is a tenacious, principled, and ingenious man. Written by Ken Miller <[email protected]> ",Action
 Class of Nuke 'Em High ,"Created by the same lunatics who brought you THE TOXIC AVENGER, CLASS OF NUKE 'EM HIGH takes place in the radioactive halls of Tromaville High School, where a dangerous radiation leak turns great minds into great mutants. The clean-cut preppies of the honor society are becoming a vicious gang of motorcycle punks, physical education is turning into a nightmare of violence, and teen lust is producing slimy mutant offspring with a taste for blood! Expose yourself to outrageously awesome doses of...",Comedy
 Cobra Mission ," Ten years after the end of the war in Vietnam, four ex-Marines decide to return to S.E. Asia to investigate reports of American POWs still being held there. These four include Roger, whose daughter's just been married, the unemployed James, Mark, who's quit his job at an Arizona roadside tavern, and Richard, recently a patient at a mental hospital. In the jungles of S.E. Asia they discover American POWs but also find out about a U.S. Government plot to keep this knowledge a secret. ...",Action
 Dangerously Close ," Rebel without a cause or a clue at an elite but uptight college discovers some of his classmates have formed an even more elite clique more or less hell-bent on ridding the school, and quite possibly American society, of what they deem to be its undesirables because of ethnicity, politics, etc. Our hero recruits a teacher and some other ""less desirable"" classmates to undermine the elitists, and, naturally, things get quite violent. Written by meebly ",Action
 De Aanslag ,"In January 1945, during the 2nd world-war, the Dutch resistance kills a collaborator in the street where the 12 year old Anton Steenwijk lives. The man was shot in front of his neighbours house, but is moved by them to the house of the family Steenwijk. Because of this, his father, mother and brother are killed by the Germans, and there house is set to fire. During his life, Anton meets several people that tell him more about what really happened on the night of the assault.",Drama
 Dead End Drive-In ,"In the near future, drive-in theatres are turned into concentration camps for the undesirable and unemployed. The prisoners don't really care to escape because they are fed and they have a place to live which is, in most cases, probably better than the outside. Crabs and his girlfriend Carmen are put into the camp and all Crabs wants to do is escape.",Action
 Dead Man's Letters , The world after the nuclear apocalypse. Pale light lits the scenery of total destruction. The surviving humans vegetate in wet cellars under the nuclear winter. But somehow human spirit still sees somewhere the dim light of a new and better future. The next generation starts the walk towards a new life. Written by Jens Bertheau <[email protected]> ,Drama
 Deadtime Stories ,"A babysitting uncle tells his charges three horror stories--about a killer witch, Little Red Riding Hood and a werewolf, and a story about ""Goldi Lox"" and the three bears.",Horror
 Defence of the Realm ,"A reporter Mullen 'stumbles' on a story linking a prominent Member of Parliament to a KGB agent. In fact it is also linked to a near Nuclear disaster involving a teenage runaway and an Americal USAF base. Has there been a Government cover-up,Mullen teams up with Vernon Bayliss, an old hack, and Nina Beckam the MP's assistant to find out the truth.",Thriller
 Dèmoni 2: L'incubo Ritorna ,A group of tenants and visitors are trapped in a 10-story high-rise apartment building infested with demons who proceed to hunt the dwindling humans down.,Horror
 Desert Bloom ,"The story involves Rose Chismore's youth. She flashes back and remembers her coming-of-age. Her recollections are sometimes less than sweet, particularly those of her troubled and alcoholic step-father. Her memories of Robin, her first-love, are much happier and she also recalls her colorful Aunt Starr -- who's visit is fun but also detrimental to her family's health. The setting of 1950s Las Vegas' bomb testing is increasingly significant to the development of the story.",Drama
 Detective School Dropouts ,Two bumbling private detectives get themselves hired to find a missing person. They find themselves in the middle of a mob war when it turns out that the missing person is somebody the mob wants to stay missing.,Comedy
 Diavolo in corpo ," An Italian high school student becomes infatuated with a woman he sees outside his class window. Her fiancée is in jail for being involved in a radical movement, and she spends much time in court providing moral support. At first she resists the student's advances, but eventually begins an affair with him. Their situation is condemned by her family and his father, who is the woman's psychologist. Written by Ed Sutton <[email protected]> ",Drama
 Dirty Pair: Project Eden ,"Sent to the planet Agerna to investigate a feud between two opposing factions, Kei and Yuri must find out why strange creatures are attacking vezorium test plants.",SciFi
 Dogs in Space ,"The place is Melbourne, Australia 1978. The punk phenomenon is sweeping the country and Dogs In Space, a punk group, are part of it. In a squat, in a dodgy suburb, live a ragtag collection of outcasts and don't-wanna-be's who survive on a diet of old TV space films, drugs and good music. And the satellite SKYLAB could crash through their roof at any moment...",Drama
 Dust in the wind ," A-yuan and A-yun are both from the small mining town of Jio-fen. In the city, A-yuan is an apprentice by day and goes to night school, and A-yun works as a helper at a tailors. Everyone thinks they are meant for each other, so do they. They fail to see time and fate are beyond their control. Written by jck ",Drama
 Echo Park ," In the Echo Park neighborhood of Los Angeles, everyone is more than they initially seem. May waits tables, raises a son, Henry, and is an aspiring actress. She needs a roommate and takes in a pizza deliverer named Jonathan, an aspiring songwriter. In the adjoining flat is August, an Austrian body sculptor who appears in a deodorant commercial and dreams big dreams. May takes a job delivering singing telegrams as a stripper, Jonathan invites Henry to tag along with him on deliveries, August...",Comedy
 El amor brujo ," In a Gypsy village, the fathers of Candela and José promise their children to each other. Years later, the unfaithful José marries Candela but while defending his lover Lucía in a brawl, he is stabbed to death. Carmelo, who secretly loves Candela since he was a boy, is arrested while helping José and unfairly sent to prison. Four years later he is released and declares his love for Candela. However, the woman is cursed by a bewitched love and every night she goes to the...",Drama
 Eliminators ,"A former pilot rebels against his creator, teaming up with the scientist responsible for android technology, her pet robot Spot, a rough-and-tumble riverboat guide, and a martial arts warrior.",Action
