title,plot,genre
Something Real and Good,"A young man and woman meet by chance in an airport while waiting for a delayed flight. When the plane is rerouted, they decide to make the best of it, and over the course of one night, realize that sometimes it takes a detour to make a connection.",Drama
 Somewhere Slow ,"When Anna Thompson gets mixed-up in a convenience store robbery, she makes a split-decision to walk out of her life and into the unknown. On her travels, she meets Travis, a teenage drifter on his own journey of self-discovery.",Comedy
 Sons of Liberty ,A special operations unit races to find and prevent the construction of a devastating micro nuclear device created by a group of radical mercenaries whose political beliefs blur the line between terrorist and revolutionary.,Action
 Soof ,"Soof is reaching 40 and has everything she ever wanted: three children, a small catering business, a sweet husband Kasper and a lovely home. Until she starts asking herself: 'is this all there is'?",Comedy
 Sorg og glæde ,"Filmmaker Johannes and his wife, schoolteacher Signe, experience the biggest sorrow and misfortune one can ever imagine. Nevertheless, in all the hopelessness they must try to reach for mutual and mature love in order to continue life after death.",Drama
 South Is Nothing ,"Set in a tiny seaside town, Fabio Mollo’s feature debut is a quietly evocative drama about a family’s attempts to cope with the loss of their son, and the impact of his absence on his teenaged sister Grazia.",Drama
 Space Warriors ,"Jimmy Hawkins (Thomas Horn, Extremely Loud and Incredibly Close) has always dreamed of traveling to outer space. The son of a retired NASA astronaut who lived on the International Space Station, Jimmy has lived and breathed astrophysics his entire life.When an opportunity arises to compete and win a seat on the next space shuttle, Jimmy desperately wants to apply. But Jimmys parents, Capt. Andy Hawkins (Dermot Mulroney) and Sally Hawkins (Oscar Winner Mira Sorvino) have strong reservations...",Family
 Sparks ,A masked vigilante who discovers the dark side to heroism. Going after the nation's most notorious super criminal leaves Sparks' life and reputation in ruins.,Action
 Sparrows Dance ,"centers on a former actress (Marin Ireland) whose stage fright gets the best of her, leaving her confined to her apartment, crippled by fear of the outside world. Living off delivery food and residuals from her acting career, she spends her days watching bad TV and spying on the city from her window. But when her toilet overflows and a kind, compassionate plumber (Paul Sparks) shows up, she reluctantly allows him into her refuge.",Comedy
 Speak No Evil ,"Speak No Evil is the story of Anna, a single mother fighting to protect her daughter from demonically possessed children and a town gone mad.",Horror
Special ID,"A cop and his team of comrades go undercover in one of China's most ruthless underworld organizations to stop a gang leader, only to put themselves in great danger after being exposed one by one.",Action
Spiders,"Harkening back to the beloved creature features from the 50's and the 60's, Spiders centers on mutant spiders created by pieces of material from a disabled Soviet space station that crash lands on Earth. With New York City threatened to be overrun by the gigantic killer spiders who have invaded the metropolitan subway system, it's a race against time to stop the Queen Spider from uniting with her eggs before a deadly chain of events are triggered from the deadly reunion.",SciFi
 Spijt! ,"Jochem is the target of bullying. David does not participate, but he dares intervene. The class teacher also does not engage., Jochem seems to attract the harassment, which gets worse every day. One morning David feels guilty. Why did he never opened his mouth?",Drama
 Splatter Sisters ,"The film, written by Lough, is the first in a planned franchise and is a sexploitation-serial-killer-slasher-road-movie circa 1989, with a fresh spin that raises the bar.""This is a role Marilyn Manson was born to play, and with Evan Rachel Wood bringing dramatic gravity to the ensemble, I have no doubt this will take the horror genre to a new level,"" Green said.",Horror
 Spud 2: The Madness Continues ,"The year is 1991, and Spud Milton's long walk to manhood is still creeping along at an unnervingly slow pace. Approaching the ripe old age of fifteen and still no signs of the much anticipated ball-drop, Spud is coming to terms with the fact that he may well be a freak of nature. With a mother hell-bent on emigrating, a father making a killing out of selling homemade moonshine, and a demented grandmother called Wombat, the new year seems to offer little except extreme embarrassment and more...",Comedy
Stag,"Ken is the king of pranks and doesn’t hold back when it comes to his friends’ stag parties. He’s pulled some outrageous stunts that have resulted in some scars… both emotional and physical. Now he’s scared… it’s HIS stag party and payback time. Only something’s wrong, his friends aren’t doing anything. Ken doesn’t know whether to be relieved or dismayed. But the night’s not over yet!",Comedy
 Stalled ,"It's Christmas Eve, and a soon-to-be-shit-canned maintenance gopher (Dan Palmer) is changing light bulbs and cleaning toilets instead of drinking egg nog and making out with drunk receptionists at the annual office party. Unfortunately for this forlorn floor-sweeper, he chooses to use the ladies restroom the very second a zombie outbreak occurs! Will he bowl us over and flush away the undead or (like in his pre-apocalypse life) simply remain ...Stalled?",Comedy
 Standing Up ,"Standing Up tells the story of a boy and a girl, ages 11 and 12, who are ostracized by their peer groups at summer camp. The outsiders soon find themselves victims of a vicious prank, but rather than returning to camp to face the humiliation, they decide to take off on the run together. As they slowly navigate what lies ahead, they develop a bond and help each other over- come adversity and start down the path of self-discovery.",Family
 Stars ,Glen is on a drunken road trip when he plots to commit suicide on his birthday. His decision sends him on a spirited adventure.....,Drama
 Status: It's Complicated! ,"Manny and Jerry have been best buddies and housemates for a long time. Manny believes that love, just like sex, should be shared with as many partners as possible. On the other hand, Jerry thinks that he should wait it out for that special someone. They decide to swap lifestyles just to prove whose theory is right.  - Written byKeylogger24 ",Comedy
 Steel Cold Winter ,"High schooler Yoon-soo's trivial remark was turned into a vicious rumor and led to his friend's suicide. Not being able to bear the guilt, he attempts suicide and his family moves to a rural village to help him recover. Once there he meets a mysterious girl named Hae-won, whom the entire village alienates. As if seeing himself in her, he offers her kindness and sympathy, and she slowly opens up to him. But soon, Yoon-soo is also consumed by brutal rumors surrounding her and...",Thriller
Step Dogs,"Meatball is a carefree, wisecracking country dog. Cassie is Hollywood’s most pampered pet They couldn’t be more different, and when their owners marry and move the entire blended family to the rural north, the claws come out It’s only when two bumbling thieves scheme to break into their house, that these four-legged foes must team up to defend their home. This riotously funny and heartwarming comedy proves that it takes all breeds to make a family.",Family
Still of the Night,"A paranoia thriller that builds to a pulse-pounding crescendo, Still of the Night is a smart, stylish ride packed with shocking twists that will give you nightmares – because it could actually happen to you. Katie Tyler (Michelle Monaghan) is an aspiring career woman with everything finally falling into place…until her sister Gwen disappears. Fully aware of Gwen’s tainted past and suddenly left to take care of her young daughter, Katie sets out determined to bring her back. But as she...",Thriller
 Stockholm ,"The story of the encounter between a boy and a girl. He confesses that he fell in love with her at first sight, but she does not believe him. However, as they walk through the night in Madrid, they share their desires, secrets, and maybe a few little lies. But soon the film brings us back to the harsh reality of power struggles, psychological games and conflicts between the sexes. Stockholm thus offers an incredible reading of the relations between young people today.",Drama
 Stockholm Stories ,"The lives of five seemingly unrelated lost souls intertwine in Sweden’s chilly capital in this delicate and wryly funny ensemble film. A precocious yet untalented young writer, a friendless advertising genius, a tight-lipped workaholic, a shy upper-class boy with a secret crush, and a recently dumped young woman all come to realize hard truths about love and life over the course of several days.",Drama
 Stonados ,"When a tornado appears in the waters south of Boston, former storm chaser Joe Randall is intrigued by the unusual weather. But as twisters begin to strike across the Boston shoreline, Joe quickly realizes this is no ordinary storm front. As the storms threaten to move inland, the citizens of Boston find themselves trapped in a tempest turning deadlier by the minute. With the city under siege, Joe, his sister Maddy and his old storm chasing partner Lee realize they’re dealing with a never...",SciFi
 Stop the Pounding Heart ,"Sara is a young girl raised in a family of goat farmers. Her parents homeschool their twelve children, rigorously following the precepts of the Bible. Like her sisters, Sara is taught to be a devout woman, subservient to men while keeping her emotional and physical purity intact until marriage. When Sara meets Colby, a young amateur bull rider, she is thrown into crisis, questioning the only way of life she has ever known.",Drama
 Storm Rider ,"Spoiled 18-yr-old Dani Fielding's world is turned upside down when her father gets arrested for securities fraud, and she has to leave her upscale life in the city to stay with her gruff Uncle Sam out in the country. As Dani and her uncle struggle to bond, she's given an orphaned horse to foster and train. Dani pours her affection into this young horse, calling her Stormy and giving her all the attention she's missing from her unsettled life. Dani soon realizes that truly caring about others is...",Family
 Straight A's ,"Seeking redemption, family outcast Scott returns to his hometown only to throw everyone’s lives into disarray. This is particularly troubling for his sister-in-law who was once his high school sweetheart.",Comedy
 Stranded ,"When the isolated U.S. military moonbase is bombarded by a rogue meteor storm, Colonel Gerard Brauchman (Christian Slater) and his small crew are cut off from Earth with their life support failing. Before long, the crew discovers the meteors harbored alien spores…and they’re replicating. Now a vicious, shape-shifting predatory life form is loose inside the crippled facility, picking off victims one by one. Locked in a desperate fight for survival, Brauchman and the terrified remaining...",Horror
 Strong Black Woman ,"Veronica, a 27-year-old black woman, runs her house very well. Veronica has a college degree in corporate law and works for a popular firm. Darnell is a freelance photographer. A series of moments changes the course of the marriage. Veronica has choices to make as she decides whether she wants to continue on the path she's on in her marriage or learn to become a stronger woman.",Drama
Substitution,"A troubled high-schooler strikes up a friendship with a charismatic substitute teacher, only to find himself blackmailed into in a ""murder-swapping"" scheme.",Thriller
 Suddenly ,"Four assassins led by Baron, pose as Secret Service agents to commandeer the house of war-widow ELLEN. Her home is a prime sniper position for their plan to assassinate the President on his visit to the small town of Suddenly. The men fool the local cops except for one, TODD. A washed-up former war hero and deputy who is now the town drunk, Todd served with Ellen’s deceased husband and has developed romantic feelings for her over the years. But she rebuffs his advances. Todd visits the house...",Thriller
 Sugar ,"Based on true events, Sugar is the story of a young girl with a troubled past trying to survive on the streets of Venice Beach. Sugar suffers from PTSD after losing her entire family in a horrific car crash. She survives with her group of outcast friends on the streets of Venice Beach trying to find their own place in the world. Like so many homeless youth, Sugar is running from the pain of her past and will do anything to escape it. However with the help of Bishop, her counselor in the youth...",Drama
 Summer League ,"When Allie (Danielle Evon Ploeger) returns home during her final college summer break, she doesn't anticipate staying long, but that all changes when there's a death in the family and Allie inherits her childhood home. Her life-long BFF, Kenzie (Kelsey Thomas) helps her deal with her loss, and other family drama, by forcing her to join The Browncoats, the team she captains in the small town's co-ed softball league. Kenzie's advice for Allie is simple... When life sucks, just grab your glove,...",Comedy
 Summoned ,"Recently divorced artist, Laura, lives a quiet life in Marin County. When she sees a news story about an apparent suicide, she discovers that the victim, Nathan, sat with her on the jury of The Midnight Murderer Trial - the trial of Evan Barber, one of San Francisco's most heinous serial killers. Writing a book about the case, Nathan had been investigating The Midnight Murderer Case on his own just before his death.Although police rule Nathan's death a suicide, Laura is suspicious and picks...",Horror
 Sune på bilsemester ,"Sune and his family discovers an old painting that could be worth a fortune. There's only one problem, it lacks a signature. Follow the Anderssons in a wacky roadtrip through Europe, filled with crazy fun.",Comedy
Sunlight Jr.,"Sunlight Jr. spotlights hard-working convenience store clerk Melissa (Naomi Watts) and her disabled boyfriend, Richie (Matt Dillon), who are trapped in a generational cycle of poverty. Their luck may be changing when they learn that Melissa has become pregnant. But as soon as she loses her job and they get evicted from the motel they live in, their joy vanishes. Through this adversity, the couple realizes that they can never lose everything as long as they have each other.",Drama
 Super Buddies ,"Watch the fur fly as a new breed of superhero is born in Disneys fun-filled epic adventure. An ordinary day at Fernfield Farms turns extraordinary when Budderball, Mudbud, B- Dawg, Buddha and Rosebud discover mysterious rings that grant them each a unique superpower. Before you can say,deg;Buddies, assemble; the pups unleash their amazing abilities and race to the rescue when a shape-shifting bully from outer space threatens the planet.",Family
Survival Code,"In 2045 A.D. a steadily shrinking icecap leaves several countries struggling for control of the town of Borealis and the last untapped oil, gas and mineral deposits on the planet. Vic, a former mixed martial arts fighter, has bribed and manipulated his way into a position of authority, and controls the only way in or out. When the UN sends in corrupt officials, Vic must take matters into his own hands by returning to his roots to challenge a local Russian group to a cage fight, with the town's...",Action
 Suzanne ,"The story of a destiny. Suzanne's and her family's. The ties that bind them, keep them together, and the love she pursues... to the point of leaving everything behind.",Drama
 Svengali ,"Svengali tells the story of Dixie (Jonny Owen), a postman from South Wales, and a music fanatic. All his life he’s dreamed of discovering a great band and then one day, trawling through YouTube, he finds them… ‘The Premature Congratulations’. He hunts them down and offers them his management services. They are young, arrogant, sexy and utterly magnificent. Putting their demo on a cassette tape, Dixie heads out onto the streets of London…",Comedy
Sweet Talk,"A troubled young woman (Natalie Zea, The Following, Justified) and a blocked writer (Jeffrey Vincent Parise, CSI: New York), both at loose ends in their lives, meet over a phone sex line, and after some provocative and amusing verbal dueling, take a journey together that turns out to be a great deal more romantic and erotic than either of them suspected. Sweet Talk is a sensual tale about the transformative power of storytelling.",Drama
Sweetwater,"In the late 1800s, a fanatical religious leader, a renegade Sheriff, and a former prostitute collide in a blood triangle on the rugged plains of the New Mexico Territory.",Thriller
 Sxtape ,"When a budding artist and her voyeuristic boyfriend break into an old abandoned hospital while scouting locations for an art exhibition, they have no idea what they are letting themselves in for. Joined by another couple, they form an unlucky gang and find themselves fighting for their lives as it slowly becomes clear they are not alone.",Horror
 Systemfehler - Wenn Inge tanzt ,"The ambitious punk rocker Max and the eco-activist Inge cannot stand each other, ever since Max publicly exposed her by singing the offensive song ""When Inge is Dancing"" in front of the whole school. But for Max and his classmates Fabio, Joscha and Lukas this song in particular has become a real hit at school as well as in the regional music scene: Their band called Systemfehler is on the verge of a breakthrough. But just before the important gig, which could get them a record deal, guitarist...",Comedy
 Table No. 21 ,"A couple live a mediocre life and are thrilled to have won an exotic vacation to Fiji & their excitement increases when they get a chance to play ""Tell all truth"" game for a mind boggling prize money. The game begins and the couple discovers that the game isn't really a game, but is a game of survival.",Adventure
 Taigâ masuku ,"Trained to be a villain by the mysterious Tiger's Cave, Naoto Date was prepared to make his debut as the villain Tiger Mask. But when he donates all of his earnings to an orphanage, Tiger's Cave brands him a traitor.  - Written byKarasu87 ",Action
 Taken for Ransom ,"A wealthy high powered woman suffers a horrible tragedy after which she descends into substance abuse,turning her back on her family. She later discovers that someone close to her may be behind her subsequent abduction and kidnapping.",Drama
Taking Flight,"Young criminal Colton Harris-Moore becomes a cultural phenomenon as his crimes baffle local police, Homeland Security, and the FBI.",Adventure
 Tales From the Dark 1 ,"In the first of a two-part film project, three short stories from acclaimed Hong Kong horror writer Lilian Lee are adapted for the big screen in this horror anthology.",Horror
 Tales From the Dark 2 ,"In ""Haunted Pillow,"" TVB starlet Fala Chen is still obsessed with her lover (Gordon Lam) after their breakup and invariably suffers from insomnia. She gets hold of a Chinese herbal pillow that eventually helps her fall asleep again but it also draws her near something unexpected. ""Hide And Seek"" casts a group of young newcomers into an abandoned school campus where they meet longtime janitor Mr. Chan who takes shelter at the school. Playing hide-and-seek after midnight, the teenagers go...",Horror
 Tangerines ,"Set in 1992, during the growing conflict between Georgia and Abkhazian separatists in the wake of the Soviet Union’s dissolution, this compassionate tale focuses on two Estonian immigrant farmers who decide to remain in Georgia long enough to harvest their tangerine crop. When the war comes to their doorsteps, Ivo (played by legendary Estonian actor Lembit Ulfsak) takes in two wounded soldiers from opposite sides. The fighters vow to kill each other when they recover, but their extended...",Drama
 Tarok ,"A family saga spanning three decades based on the mythology of the most famous race horse Denmark has ever seen. A horse which did the impossible and put Denmark on the world map through its many great victories. The film is first and foremost about the family who owned Tarok and believed in its greatness - and who, against all odds, gave Denmark hope and courage to dream.",Drama
 Tasmanian Devils ,A group of daredevil base jumpers in a remote Tasmanian national park are pursued by grizzly bear-sized Tasmanian Devils – legendary creatures created to protect the land from intruders.,Horror
 Tasting Menu ,"A year ago, just before his break, Marc and Rachel manage to book a table at one of the best restaurants in the world, reserve to which none of them is willing to give. In this idyllic corner of the Costa Brava will find connoisseurs worldwide. Together they share one of the best sensory experiences of his life. It will be an unforgettable evening.",Comedy
 Taxi! Taxi! ,"""Taxi! Taxi!"" is a social comedy set in the metropolitan city-state of Singapore, told through the encounters of two characters who are in what is widely perceived as the most sociable profession on the island taxi drivers. Inspired by famed blogger Dr Cai Mingjie's real life accounts as a taxi driver in his bestseller ""Diary Of A Taxi Driver: True Stories From Singapore's Most Educated Cabdriver"", the movie follows the trials and tribulations of a retrenched microbiology...",Comedy
 Teen Ape VS. the Monster Nazi Apocalypse ,"From genre legend Chris Seaver, and starring Troma starlets Debbie Rochon (Return to Nuke 'Em High Vol. I & II, Tromeo & Juliet) and Nicola Fiore (Mr. Bricks), this hilarious, gore-filled romp begins in 1945 where the Paranormal Investigation Agency has landed in Nazi Germany and defeated Adolf Hilter and the Third Reich. In present day, Hilter's right-hand henchwoman clones Hitler using a vial of his DNA. Only Teen Ape and the PIA can stop the rise of the Fourth Reich!",Comedy
 Tenshin ,"Artist, writer, teacher, revolutionary. Meet Okakura Tenshin, the man who made an unforgettable mark on Japanese modern art. (IMDB)",Drama
 Terrible Angels ,"Detective Ben Nolan is sent to investigate the story of a convicted prostitute and known drug dealer Linda Grossel. Linda explains that she was kidnapped and held captive for weeks. As the investigation unfolds, Linda's sanity is put to question, leaving Ben to decide whether to go on with the investigation or leave Linda to the fate of the prison system.",Thriller
Test,"Set in the free-spirited San Francisco of 1985, Test lovingly portrays this exciting and harrowing era as young Frankie (Scott Marlowe) confronts of challenges of being an understudy in a modern dance company where he's taunted to ""dance like a man."" Frankie embarks on a budding relationship with Tom (Matthew Risch), a veteran dancer in the same company and the bad boy to Frankie's young innocent. As Frankie and Todd's friendship deepens, they navigate a world of risk - it's the early years of...",Drama
 Thalaivaa ,"The film opens in the year 1988 with the death of Mumbai's King of Dharavi (Asia biggest slum) Varadarajan Mudaliar. Following his death, the rival group goes on a rampage and we are introduced to Anna (Satyaraj) who takes the job of protecting Varadarajan's Dharavi in his hands and letting his son Vishwa (Vijay) to be brought up in Australia. Over there he leads a dance troop and falls in love with Meera (Amala Paul). Later, Vishwa finds that Meera is a Mumbai cop and she...",Action
 That Boy Emil ,"‘E-e-emil!’ shouts father across the small farm in Katthult, the boy is up to his old tricks and will have to be banished to the woodshed. Except that Emil doesn’t see this as punishment – on the contrary: he locks the door from inside so that he can continue undisturbed to carve another of his wooden figures, of which he has a whole collection. His little sister Ida also wants to sit inside the shed, but she’s too well-behaved. This new adaptation of Astrid Lindgren’s beloved...",Family
The Amateur Photographer,The 1970-set tale follows a young man who discovers his artistic calling after being drafted by the denizens of a sleepy little New England mill town to serve as photographer of their most intimate moments.,Drama
 The Amazing Catfish ,"22-year-old Claudia lives alone in Guadalajara. One night, she ends up in the emergency room with signs of appendicitis. There she meets Martha, lying on the bed next to her. 46-year-old Martha has four children and endless lust for life, in spite of her illness. Moved by the lonely young woman, Martha invites Claudia to come and live with her when she leaves the hospital. At first, Claudia is bewildered by the somewhat chaotic organization of the household, but soon she finds her place in the...",Comedy
 The Amityville Asylum ,"Lisa Templeton begins a new job as a cleaner at High Hopes Hospital, a mental institution in Amityville, Long Island. Initially delighted to get the job, Lisa soon realises that all is not as it seems. Intimidated by staff and the psychotic ramblings of the patients, she is further unnerved by apparent supernatural occurrences on the night shift. To preserve her sanity Lisa must uncover the mysterious history of the institution and it's inmates. But the truth is far more...",Horror
 The Animal Project ,"As a thirty something acting teacher attempts to push a group of eager young performers out of their comfort zones, he struggles with his own ability to live an authentic and fulfilling life with his teenage son.",Comedy
