title,plot,genre
" Goodbye, Mr. Chips "," Arthur Chipping is an academic teaching at Brookfield Boys School outside of London in the 1920's. Although he does what he considers best for his students, they don't much like him, nicknaming him ""Ditchy"", short for ""dull as ditch water"". His life changes when he meets Katherine Bridges, a music hall actress and a woman with a questionable past. She affectionately calls him Mr. Chips. Despite their differences, they fall in love. He in particular realizes that...",Drama
" Goto, Island of Love ","Borowczyk's film is an insane dream-like look into a shattered and dysfunctional world, which if I was to guess, is probably how he sees our own one.",Drama
 Goyôkin ," Tatsuya Nakadai plays a samurai overcome with guilt over his unwitting part in a massacre of a small village. Now a ronin, he learns of a scheme by his old clan to repeat the same crime. determined to stop them, he endures great hardships in an attempt to atone for his earlier mistakes. Written by <[email protected]> ",Action
" Hail, Hero! ","Hail, Hero! stars Michael Douglas in his screen debut as long-haired college student Carl Dixon. Reversing the usual procedure in late-1960s films, Dixon decides to quit school and enlist in the Army, even though he's already run afoul of the law as a Vietnam protestor. It is our hero's intention to use love, rather than bullets, to combat the Viet Cong. Needless to say, his idealism is no match for the harsher realities of war, but this doesn't stop him from endlessly spouting the sort of...",Drama
 Hamlet ,"Tony Richardson's Hamlet is based on his own stage production. As a filmed record of a production originally designed for the stage it is not an ideal introduction for those new to the text. Filmed entirely within the Roundhouse in London (a disused train shed) it is shot almost entirely in close up, focusing the attention on faces and language rather than action. Nicol Williamson is a brilliant and idiosyncratic prince, a puritanical intellectual at odds with the sensuality of the new Danish...",Drama
 Hannibal Brooks ,"A POW in World War II is put to work in a Munich zoo, looking after an Asian elephant. The zoo is bombed by the Americans and the director of the zoo decides it is not safe for his Asian elephant Lucy to remain there. So he sends Brooks to safety with Lucy. They escape and go on the run in order to get to Switzerland.",Comedy
 Hard Contract ,"A cold hearted American hit man goes to Europe for 'one last score'. His encounter with a beautiful young woman casts self doubt on his lifeblood, and influences him to resist carrying out the contract",Drama
 Hell's Angels '69 ,"Two brothers have a plan on how to rob the Ceasar's Palace in Las Vegas. They join a motorcycle gang and while the others are drinking and partying outside of town, they change their clothes and head off to rob the casino. Of course, the police do not look for two well dressed criminals among the Hell's Angels.",Action
 Hell's Belles ,"When hot-headed Dan out-drives the thoroughly vicious Tony in a motorcycle race and wins a brand new bike, he sets in motion a chain of events that includes one blazing gas station and a disastrous rock slide.",Action
 Hello Down There ,"Given the chance to live in a simulated underwater home for a month, a scientist convinces his family to take advantage of the offer. Once the family agrees to move in, underwater mayhem occurs!",Comedy
 Hibernatus ,"The frozen body of Paul Fournier is discovered in Greenland where he had disappeared during a scientific expedition in 1905. Perfectly conserved he is brought back to life in the 1960s. His descendants take care of him: to spare him the cultural shock they behave so to make believe it's 1905 and they are his cousins, uncle...",Comedy
" Hook, Line And Sinker "," Man (Lewis) is told by his doctor (Lawford), and best friend, that he has a terminal illness. At his wife's urging, he lives life to the fullest, racking up insurmountable debts. When the damage is done, his friend the doctor tells him that he's not dying. Unfortunately, his life will eventually be ruined by his actions. So, they decide to stage his death so that his wife and family will not have to suffer for what he's done. Lewis eventually discovers that his friend, the...",Comedy
 Horror House ,Teenagers gathered in an old mansion are being murdered one by one. The survivors must discover who among them is the killer before he finishes off everybody.,Horror
 How to Commit Marriage ,A young couple decide to live together and they wind up having a baby. They decide they should give the baby up for adoption. The baby's Mother's parents wind up adopting the baby using a fake name.,Comedy
 How to Irritate People ," In this mock-documentary, John Cleese narrates a series of sketches on irritation -- types and techniques. Included are parents irritating their children, old ladies irritating movie-goers in a theater, an overly subservient waiter, a car repairman denying obvious car trouble, a party guest hinting for a ride, airplane pilots playing practical jokes on their passengers, and a talk show host who doesn't stop talking. Written by Samuel Stoddard <[email protected]> ",Comedy
 Invocation of My Demon Brother ,"Experimental short, featuring strobe-like erotic imagery with several shots of the Rolling Stones in performance and an original synthesizer score by Mick Jagger.  - Written byAnonymous ",Horror
 Jackal of Nahueltoro ,"Based on an actual event that occurred in the southern region of Chillán in 1960, tells the story of an illiterate peasant who, while drunk, murdered the woman with whom he had relationships and her five daughters",Drama
 Journey to the Far Side of the Sun ,"A planet is discovered in the same orbit as Earth's but is located on the exact opposite side of the sun, making it not visible from Earth. The European Space Exploration Council decide to send American astronaut Glenn Ross and British scientist John Kane via spaceship to explore the other planet. After a disastrous crash-landing Ross awakes to learn that Kane lies near death and that they apparently have returned to Earth, as evidenced by the presence of the Council director and his staff....",SciFi
 Justine ,"In Alexandria, in 1938, Darley, a young British schoolmaster and poet, makes friends through Pursewarden, the British consular officer, with Justine, the beautiful and mysterious wife of a Coptic banker. He observes the affairs of her heart and incidentally discovers that she is involved in a plot against the British, meant to arm the Jewish underground in Palestine. The plot finally fails, Justine is sent to jail and Darley decides to return to England.",Drama
 Kiss Me Monster ,"It was shot at the same time as Rote Lippen Sadisterotica (1969), and once again features Yanni and Reynaud as statuesque “Red Lips” girls, a detective duo with undefined links to Interpol. It’s a phantasmagoric mixture of ultracamp and virtually incomprehensible hi-jinks.",Comedy
 La voie lactée ,"Two tramps going on a pilgrimage to Santiago de Compostela in Spain, meet different christian heresies. They meet too the Marquis of Sade.",Comedy
 Latitude Zero ,"A massive underwater volcano erupts and puts a group of investigative scientists in danger. They are rescued by an atomic super submarine named The Alpha under the command of Captain McKenzie. The group is quickly taken to a vast underwater city known as Latitude Zero, a fantastic, Atlantean type utopia, a world beneath the ocean with its own sun. It is soon discovered that Captain McKenzie is at war with the evil Dr. Malic, a cruel scientist who wishes to rule mankind all the while conducting...",Action
 Laughter in the Dark ,"Deals with the affection of a middle-aged man for a very young woman, resulting in a mutually parasitic relationship. (from Wikipedia)",Drama
 Le Grand Amour ," Pierre married Florence, the only daughter of a small industrialist. 15 years later, he is the boss, but his middle-class life worries him a lot. When a new young and lovely secretary comes, he starts dreaming. Written by Yepok ",Comedy
 Life Love Death ,"François Toledo, married businessman and father, falls head-over-heels in love with Janine, a work colleague. However, he is soon found out: after three dates, he strangles some prostitutes, when, the victim of blackmail, he becomes dishonored. He is taken to court, and sentenced to be killed by a guillotine.",Drama
 Lions Love ,"“The pressures here in Hollywood are so great, from all the dead people,” opines Warhol superstar Viva in Varda’s experimental feature, shot in Los Angeles in 1968.",Comedy
 Love Camp 7 ," Set in a Nazi ""Love Camp"" that services the needs of front line officers. The video packaging claims that this film is based on fact, but the plot is so far fetched you would have a hard time believing that. Two young WAC officers go undercover as POW's in the prison camp hoping to get some information from a scientist that's being held there, before being sprung out by the French resistance. Unfortunately things go wrong with the break out and they end up overstaying their...",Horror
 Ma nuit chez Maud ,"In the brilliantly accomplished centerpiece of Rohmer’s “Moral Tales” series, Jean-Louis Trintignant plays Jean-Louis, one of the great conflicted figures of sixties cinema. A pious Catholic engineer in his early thirties, he lives by a strict moral code in order to rationalize his world, drowning himself in mathematics and the philosophy of Pascal. After spotting the delicate, blonde Françoise at Mass, he vows to make her his wife, although when he unwittingly spends the night at the...",Drama
 Macunaíma ,"Macunaíma is a lazy anti-hero born black in Amazonas. After the death of his mother, he moves with his two brothers to Rio de Janeiro, but along his journey, he baths in a fountain and becomes Caucasian. Once in Rio, he incidentally meets the killer guerrilla woman Ci, who wears an amulet made of stone, and they fall in love for each other. They live together and a couple of months later, Ci delivers a black baby. While carrying a bomb for a terrorist attack in the stroller, the bomb explodes...",Fantasy
 Malenka ,"A beautiful virgin inherits a castle, but when she arrives at it, she finds that the inhabitants include a strange nobleman and a bevy of beautiful women she suspects may be vampires.",Horror
 Marooned ,"After spending several months in an orbiting lab, three astronauts prepare to return to earth only to find their rockets wont fire. After initially thinking they might have to abandon them in orbit, NASA decides to launch a daring rescue. Their plans are complicated by a Hurricane headed towards the launch site and a shrinking air supply in the astronauts capsule.",Adventure
 Me and My Brother ," Julius Orlovsky, after spending years in a New York mental hospital, emerges catatonic and must rely on his brother Peter, who lives with poet Allen Ginsberg. When Julius wanders off in the middle of filming, Frank hires and actor (Joseph Chaikin) to play the character and begins a fictional version of his psychological portrait. Then, as suddenly as he vanished, Julius turns up in an institution where he and Peter must face their relationship. Written by skunkgoddess1 ",Drama
" Me, Natalie ","Since she was a child, Natalie Miller has always thought she was an ugly ducking. Despite her mother's encouragement that she will grow up to be pretty, Natalie has never believed it will happen. She rents a Greenwich Village apartment from an eccentric landlady and gets a job at the Topless Bottom Club. She rides a motorcycle to work, decorates her loft with a moose head, and rides up and down a dumbwaiter to get to her apartment. There Natalie meets David an artist, and the two have a love...",Comedy
 Medea ,"Based on the plot of Euripides' Medea. Medea centers on the barbarian protagonist as she finds her position in the Greek world threatened, and the revenge she takes against her husband Jason who has betrayed her for another woman.",Drama
 Medium Cool ," John Cassellis is the toughest TV-news reporter around. His area of interest is reporting about violence in the ghetto and racial tensions. But he discovers that his network helps the FBI by letting it look at his tapes to find suspects. When he protests, he is fired and goes to the 1968 Democratic National Convention in Chicago, Illinois. Written by Mattias Thuresson ",Drama
 Metti una sera a cena ,"A liberal-thinking author watches his wife as she attempts to seduce his best friend at a dinner party. She ends up taking on another man as well, and the writer has an affair with the another dinner guest. Soon the three men and two women are entangled in a confusing series of partner-swapping sex sprees where everyone's morals are challenged in the wake of the sexual revolution.",Drama
 Mondo Trasho ,"A day in the lives of a hit-and-run driver and her victim, and the bizarre things that happen to them before and after they collide (sexual assault by a crazed foot-fetishist, visions of the Virgin Mary, strange chicken-foot grafting operations).  - Written byMichael Brooke <[email protected]> ",Comedy
 Motel Confidential ,"An old Italian dude runs the aptly named Quickie Motel where a variety of customers come for romantic romps, seedy sex and afternoon delights.",Comedy
 My Dog the Thief ,"As ratings for Jack Crandall's lifeless airborne traffic reports plummet, a super-size St. Bernard on the lam stows away in his chopper. Crandall's new co-pilot helps send ratings sky-high, but the canine's chronic kleptomania generates girl trouble, jewel thievery, and loads of laughs.",Adventure
 My Side of the Mountain ,"film adaption of the novel by Jean Craighead George. A family movie made by Paramount Studios, the story revolves around thirteen-year old Sam Gribley (Teddy Eccles), a devotee of Thoreau, as many were back in the in 1960's. Sam decides to leave the city (set in Toronto) to spend a sabbatical in the Canadian woods and see if he can make it as a self-sufficient spirit after his parents promise a summer trip that doesn't pan out.",Adventure
 Olsen-banden ,"Fengslene har alltid vært utklekkingsanstalt for den perfekte forbrytelse. Fangene lærer av hverandre. Slik er det også med Egon Olsen, leder for Olsenbanden. Mens han satt inne pønsket han ut hvordan han kunne stjele den fantastiske gullfiguren (verdt 12 millioner kroner) som tidligere hadde tilhørt den tyske keiseren, og som nå skal stilles ut i Oslo.",Comedy
 Olsen-banden på spanden ,"A good looking female social welfare worker makes Egon Olsen forget about crimes for some time, but when an American gangster breaks into a local bank and the police think its Egon's work, he has to get back to work to prove he's innocent.",Comedy
 Orgasmo ," Kathryn West, a glamorous American widow, arrives in Italy several weeks after the death of her older, extremely wealthy husband. With the help of Brian, her lawyer, Kathryn moves into a luxurious villa and proceeds to lead a lonely, uneventful existence until one day, a handsome young man named Peter Donovan shows up at the front gate, looking for tools so he can fix his sports car. Kathryn lets him stay the night, and the next thing she knows, she's madly making love to him in the...",Drama
 Paris N' Existe Pas ,"In this film, an artist attending a party smokes some dope and develops the ability to see into the future and the past. He returns to his apartment where he sees the vision of a woman who had lived there 30 years ago. His psychedelic hallucinations increase with time. Starring Richard Leduc and Danièle Gaubert with Serge Gainsbourg who also did the score.",Drama
 Pippi Longstocking ,"Pippi Longstocking, a super-strong redheaded little girl, moves into her father's cottage Villa Villekulla, and has adventures with her next-door neighbors Tommy and Annika in this compilation film of the classic Swedish TV series. No overview found.",Adventure
 Pit Stop ,"Grant Willard sponsors drivers in a ""new"" form of race car driving called The Figure Eight. The rise and fall of one such driver is the whole story behind PIT STOP.",Action
 Play Dirty ," The Dirty Dozen meet the Stiff Upper Lip. A British Petroleum executive (Michael Caine) is assigned to work with the British Army in North Africa handling port duties for incoming fuels. This gives him the official rank of Captain in the British Army. The Colonel (Nigel Green) in charge of the Dirty Dozen is told he must have a British officer accompany his men on a dangerous mission 400 miles behind the German lines and is saddled with the Petroleum executive, who tries to argue his way out...",Adventure
 Porcile ," Two dramatic stories. In an undetermined past, a young cannibal (who killed his own father) is condemned to be torn to pieces by some wild beasts. In the second story, Julian, the young son of a post-war German industrialist, is on the way to lie down with his farm's pigs, because he doesn't like human relationships. Written by Adalberto Fornario ",Drama
 Putney Swope ,"Swope is the only black man on the executive board of an advertising firm, and is accidentally put in charge after the death of the chairman of the board.",Comedy
 Que la bête meure ,"When his young son is killed in a hit and run accident, Charles Thenier resolves to hunt down and murder the killer. By chance, Thenier makes the acquaintance of an actress, Helène Lanson, who was in the car at the time of the accident. Initially suspecting that she is the target of his revenge, Therier pretends to be in love with her, savoring his moment of triumph. Then his view changes when Helène confesses to having had a nervous breakdown at about the time of the car accident. Therier...",Thriller
 Red Lion ," Impersonating an Imperial Army officer by wearing a ""red lion's mane"", a poor servant returns to his village after 10 years of absence to end the village's suffering caused by corrupt officials and businessmen. Written by Alex Ebora <[email protected]> ",Action
 Ring of Bright Water ," Whoever said dog is man's best friend never met Mij! Mij is a cute, cuddly pet shop otter who captures the heart of Graham Merill (Bill Travers). It doesn't take Graham long to realize that London is no place to raise a slippery otter. So he takes Mij to live in a ramshackle cottage on the coast of Scotland. Together they set out to explore the curious and magnificent natural wonders that surround their seaside home--from orphaned geese to tooth-less sharks. While Mij spends his days...",Comedy
 Run a Crooked Mile ," A man witnesses a murder in a secluded mansion. When he reports it, there's no evidence of the murder, or that anyone was there. He finds a key on the floor and goes to his boss to get help when he's struck from behind. He wakes up in a hospital room after a polo accident to find he's had amnesia for two years, is now married, and living in Switzerland. He still has the key and the memories of the murder. He goes back to England to try to resolve the mystery. Written by Ralph...",Drama
" Run Wild, Run Free ","Directed by Richard C. Sarafian, this 1969 British children's film stars Mark Lester as a young boy, unable to speak, who befriends both a wild colt with blue eyes and a falcon named ""Lady"". The cast also includes John Mills, Gordon Jackson and Sylvia Sims.",Drama
" Run, Angel, Run! "," Angel, a member of a tough motorcycle gang roaming the Southwest, gets on offer from a major news magazine. In exchange for giving the magazine a big scoop by exposing the inner workings of his gang, the magazine will pay him $10,000. Angel takes the offer, although it means he and his girlfriend must now go on the run from cyclists looking for revenge. Along the way, they hide out with a sheep farmer, earning their keep by taking care of the farm and building a new life together. Written by...",Action
" Running in Madness, Dying in Love ",With both political and jealous motives kills an anarchist and his sister-in-anarchist brother. Crowd Angular with guilt and confusion gives to the two set off on a journey to escape justice and bring order to their lives.,Drama
 Sam Whiskey ,"In this tongue-in-cheek adventure, a woman (Angie Dickinson) hires a gambler (Burt Reynolds) to retrieve a sunken treasure stolen by her late (crooked) husband. She wants to return it--pronto--to its owner...the Denver Mint.",Comedy
 Secrets of the Pirates' Inn ,"A gang of kids helps a sea captain relative search for a pirate’s treasure that’s rumored to be hidden somewhere in the old dilapidated inn the sea captain just inherited from his dead brother. Along the way, they unravel a series of clues which lead to a variety of hidden passages and trap doors. But they are not alone in their quest for Jean Lafitte’s pirate goodies!",Family
" Silent Night, Lonely Night "," Over the Christmas holidays in a small New England college town, a man and a woman share a brief interlude. He is there to visit his wife, who is a mental patient at the university, and she is there visiting her son, who is a student, after discovering her husband's infidelity. Written by [email protected] ",Drama
 Some Kind of a Nut ,"A New York City bank teller becomes a media celebrity when he refuses to comply with his employer's demands that he shave his beard. Directed by Garson Kanin, this 1969 comedy stars Dick Van Dyke, Angie Dickinson, Rosemary Forsyth, Zohra Lampert, Carole Shelley, David Doyle, Elliott Reid, Pippa Scott, Connie Gilchrist, Roy Roberts and Peter Turgeon.",Comedy
 Spalovac mrtvol ,"Kopfrkingl enjoys his job at a crematorium in Czechoslovakia in the late 1930s. He likes reading the Tibetan book of the dead, and espouses the view that cremation relieves earthly suffering.",Comedy
 Tell Them Willie Boy Is Here ," Based on true events, Tell Them Willie Boy Is Here, tells the story of one of the last Western manhunts, in 1909. Willie Boy, a Native American, kills his girlfriend's father in self defense, and the two go on the run, pursued by a search posse led by Sheriff Christopher Cooper. Written by Jon Hertzberg <[email protected]> ",Drama
 Tepepa ," In Mexico, at the beginning of the twentieth century, a man is to be executed by Cascorro's men. Doctor Henry Price, en Englishman, arrives in his car and saves him. The nickname of the man is Tepepa and he was a hero of the Revolution. Tepepa asks doctor Price way he saved him and the answer is chilly: to have the pleasure to kill him himself. And he aims his gun at him. Written by Baldinotto da Pistoia ",Action
 Thank You All Very Much ,"Rosamund Stacey (Sandy Dennis), a young 'bookish' girl in London society, spends her days studying for a doctorate in the British Museum and her nights avoiding the sexual attention of the men in her life. But one day, all that changes. Through a friend, she is introduced to rising TV newsreader/announcer George Matthews (Ian McKellen) and after a further chance meeting and a tumble on the sofa, she finds herself pregnant from her first sexual encounter. A failed attempt at self-abortion just...",Drama
 That Cold Day in the Park ,"A rich but lonely woman, Frances Austen, one day invites a boy from a nearby park to her apartment and offers to let him live there.",Drama
 The Adding Machine ,An accountant whose job is about to be taken over by a computer starts to re-examine his life and his priorities.  - Written by<[email protected]> ,Comedy
 The April Fools ,"Newly-promoted if none too happily married Howard Brubaker leaves a rowdy Company party early with the stunning Catherine, whom it turns out is herself unhappily married - to the boss. They spend an innocent night in New York becoming more and more attracted to each other, so that when Catherine announces she intends to leave her husband and return to Paris Howard asks to go along too. In the cold light of morning problems and pressures from spouses crowd in",Comedy
 The Arrangement ,"Eddie is a very rich man who has everything he wants; money, family, success. But a car crash is all that needs to make him reconsider the life he leads. Searching for the happiness he lost, he remembers his one time lover, Gwen. Meanwhile his wife conspires to take his fortune.",Drama
 The Assassination Bureau ,The Assassination Bureau has existed for decades (perhaps centuries) until Diana Rigg begins to investigate it. The high moral standing of the Bureau (only killing those who deserve it) is called into question by her. She puts out a contract for the Bureau to assassinate its leader on the eve of World War I.,Action
 The Battle of Neretva ,"In January 1943 the German army, afraid of an Allied invasion of the Balkans, launched a great offensive against Yugoslav Partisans in Western Bosnia. The only way out for the Partisan forces and thousands of refugees was the bridge on the river Neretva.",Drama
 The Bed Sitting Room ," Set in post-nuclear-holocaust England, where a handful of bizarre characters struggle on with their lives in the ruins, amongst endless heaps of ash, piles of broken crockery and brick, muddy plains, and heaps of dentures and old boots. Patriotically singing ""God Save Mrs. Etheyl Shroake, Long Live Mrs. Etheyl Shroake"", they wander through this surrealistic landscape, forever being warned by the police to ""keep moving"", and prone to the occasional mutation into a parrot,...",Comedy
 The Best House in London ,"In Victorian London, the British Government attempts a solution to the problem of prostitution by establishing the world's most fabulous brothel.",Comedy
