title,plot,genre
Ferris Bueller's Day Off,"Ferris is a street-wise kid who knows all the tricks. Today he decides to take the day off school. When Ferris takes the day off, so must his best friends, Cameron and Sloane. Cameron is reluctantly persuaded to borrow his father's Ferrari (which is never used). And together they hatch a plan to get Sloane out of class. Suspicious principal Ed Rooney knows all about Ferris, but can never catch him. Ferris' sister Jeanie is also frustrated that Ferris always gets away with his tricks and she...",Comedy
Top Gun,"Maverick is a reckless ace fighter pilot, living with the ghosts of his famous aviator father and his own penchant for hijinks. Along with his best friend and navigator, Goose, Maverick attends the Navy's elite air combat academy where the two work together to compete for the title of Top Gun against the best of the best Naval aviators.Breaking rules and convention is his specialty and, true to form, Maverick falls in love with a civilian instructor at the academy. When his best friend,...",Action
Stand By Me,"Based on Stephen King's Short story ""The Body"", ""Stand By Me"" tells the tale of Gordie Lachance, a writer who looks back on his preteen days when he and three close friends went on their own adventure to find the body of a kid their age who had gone missing and presumed dead. The stakes are upped when the bad kids in town are closely tailing - and it becomes a race to see who'll be able to recover the body first.",Adventure
Aliens,"Ripley (Sigourney Weaver), the sole survivor from the original ALIEN, is awakened after 57 years of drifting through space, her stories disbelieved by Company executives who tell her that the alien?s planet is now inhabited and colonized. When contact is suddenly lost with the colonists, Ripley returns to the planet with a squad of marines, an android (Lance Henriksen), and a Company executive (Paul Reiser) with a mission of his own. Once on the planet, no survivors can be found except for...",Action
Howard the Duck,A scientific experiment unknowingly brings extraterrestrial life forms to the Earth through a laser beam. First is the cigar smoking drake Howard from the duck's planet. A few kids try to keep him from the greedy scientists and help him back to his planet. But then a much less friendly being arrives through the beam...,Action
Platoon,"A gritty and emotional look at the lives of a platoon of American soldiers as they patrol, fight and die in the jungles of Vietnam as seen through the perspective of a young recruit. Two veteran sergeants clash when one of them precipitates a massacre of villagers.",Action
Highlander,"An immortal Scottish Highlander, Duncan McCloud (Christopher Lambert) clashes with other immortals across time to fulfil the prophecy, ""In the end, there can be only one"". Also stars Sean Connery.",Action
Pretty in Pink,"Young Andie is one of the not-so-popular girls in high school. She usually hangs out with her friends Iona or Duckie. Duckie has always had a crush on her, but now she has met a new guy from school, Blane. He's one of the rich and popular guys but can the two worlds meet?",Comedy
Labyrinth,"Frustrated with baby-sitting on yet another weekend night, Sarah - a teenager with an active imagination - summons the Goblins from her favourite book, ""Labyrinth"", to take the baby step-brother away. When little Toby actually disappears, Sarah must follow him into the world of the fairy tale to rescue him from the Goblin King!",Adventure
The Karate Kid Part II,Picks up where the first movie (Karate Kid) leaves off. Mr. Miyagi and Daniel take a trip to Okinawa to visit Mr Miyagi's dieing father. After arriving Mr Miyagi finds he still has feelings for an old love. This stirs up trouble with an old rival that he originally left Okinawa to avoid. In the mean time Daniel encounters a new love and also makes some enemies.,Action
 House ,"William Katt stars in this 1980s horror/comedy as Roger Cobb, a writer who has just split from his wife and is looking to complete a novel about his experiences in Vietnam. In order to work in peace, Roger moves into his aunt's old house, which she left to him after committing suicide, apparently after a bout with mental illness. However, Roger quickly learns that his aunt's suicide was probably the result of the strange forces at work inside her house, forces which begin giving Roger terrible...",Comedy
Big Trouble in Little China,"When trucker Jack Burton agreed to take his friend Wang Chi to pick up his fiancee at the airport, he never expected to get involved in a supernatural battle between good and evil. Wang's fiancee has emerald green eyes, which make her a perfect target for an immortal sorcerer named Lo Pan and his three invincible cronies. Lo Pan must marry a girl with green eyes so he can regain his physical form. Now, Jack must save Wang's fiancee from Lo Pan and his henchmen, and win back his stolen truck....",Action
The Fly,"In David Cronenberg's remake of the 1958 classic, Jeff Goldblum plays Seth Brundle, a young scientist on the verge of creating ""TelePods,"" a machine that teleports a person from one TelePod to another. He is also falling in love with Veronica Quaife (Geena Davis), a reporter helping him with, what they think is, the ""story of the year."" But the only problem is, the TelePods won't transport matter, and when they do, what happens isn't a pretty sight. After Seth irons all the bugs out of the...",Horror
 Nine 1/2 Weeks ,"An erotic story about a woman, the assistant of an art gallery, who gets involved in an impersonal affair with a man. She barely knows about his life, only about the sex games they play, so the relationship begins to get complicated.",Drama
 Der Name der Rose ,The Franciscan friar William of Baskerville and his young apprentice investigate a series of mysterious deaths in a medieval abbey.,Drama
Little Shop of Horrors,"Seymour Krelborn is a nerdy orphan working at Mushnik's, a flower shop in urban Skid Row. He harbors a crush on fellow co-worker Audrey Fulquard, and is berated by Mr. Mushnik daily. One day as Seymour is seeking a new mysterious plant, he finds a very mysterious unidentified plant which he calls Audrey II. The plant seems to have a craving for blood and soon begins to sing for his supper.",Comedy
 The Wraith ,"Packard Walsh and his motorized gang control and terrorize an Arizona desert town where they force drivers to drag-race so they can 'win' their vehicles. After Walsh beats the decent teenager Jamie Hankins to death after finding him with his girlfriend, a mysterious power creates Jake Kesey, an extremely cool motor-biker who has a car which is invincible. Jake befriends Jamie's girlfriend Keri Johnson, takes Jamie's sweet brother Bill under his wing and manages what Sheriff Loomis couldn't;...",Action
Maximum Overdrive,"When a comet passes close to the earth, machines all over the world come alive and go on homicidal rampages. A group of people at a desolate truck stop are held hostage by a gang of homicidal 18-wheelers. The frightened people set out to defeat the killer machines ... or be killed by them.",Action
Crocodile Dundee,"Sue is a big-time New York reporter who is on assignment in Australia to meet and interview Mick 'Crocodile' Dundee. After spending a few days touring the Outback with her guide, Sue invites Mick to come back with her to visit New York. Mick has some hilarious trouble adjusting to life in the big city and Sue finds that she's more than just a little charmed by the Aussie bushman.",Adventure
Back to School,"Millionaire businessman Thornton Melon is upset when his son Jason announces that he is not sure about going to college. Thornton insists that college is the best thing he never had for himself, and to prove his point, he agrees to enroll in school along with his son. Thornton is a big hit on campus: always throwing the biggest parties, knowing all the right people, but is this the way to pass college?",Comedy
Critters,A massive ball of furry creatures from another world eat their way through a small mid-western town followed by intergalactic bounty hunters opposed only by militant townspeople.,Action
Flight of the Navigator,"After a mystifying disappearance aboard a spectacular, futuristic spacecraft, David Freeman returns to earth possessing vast, undiscovered knowledge about the farthest reaches of the universe. With these sudden navigational powers, David is able to take the fantastic flying machine anywhere he desires.",Family
 The Mission ,"Jeremy Irons plays a Spanish Jesuit who goes into the South American wilderness to build a mission in the hope of converting the Indians of the region. Robert DeNiro plays a slave hunter who is converted and joins Irons in his mission. When Spain sells the colony to Portugal, they are forced to defend all they have built against the Portugese aggressors.",Adventure
 From Beyond ,"Based on the pulp-horror fiction of H.P. Lovecraft, From Beyond stars Jeffrey Combs as the mild-mannered Crawford Tillinghast, apprentice to the dangerously obsessed Dr. Pretorious, and co-inventor of an enigmatic and ominous-looking device known as ""The Resonator"" - a machine designed to stimulate the vestigial sensory apparatus contained within the human pineal gland. Such stimulation allows participants to ""see"" the slimy creatures which occupy a dimension parallel to our own, but with some...",Horror
The Texas Chainsaw Massacre 2,"Young DJ Vantia Block is hosting a music show when two renegade hoodlums phone her and start making trouble. The situation changes rapidly as the kids drive to a passageway and get sawed to pieces by Leatherface while the shocked DJ listens the kids' screams. Local sheriff approaches Block and convinces her to play the recording made from the phone call on radio, hoping that the killers would show up.",Comedy
 Heartbreak Ridge ,"1983. Tom Highway is a well-decorated career military man in the United States Marine Corps, he who has seen action in Korea and Vietnam. His current rank is Gunnery Sergeant. His experiences have led him to become an opinionated, no nonsense man, who is prone to bursts of violence, especially when he's drunk, if the situation does not suit him, regardless of the specifics or people involved. Because of these actions, he has spent his fair share of overnighters behind bars. Close to retirement,...",Action
Friday the 13th Part VI: Jason Lives,"Tommy goes to a graveyard to get rid of Jason's body, but he accidentally brings him back to life. Jason wants revenge! Tommy must defeat Jason once and for all!",Horror
 Iron Eagle ,"When Doug's father, an Air Force Pilot, is shot down by MiGs belonging to a radical Middle Eastern state, no one seems able to get him out. Doug finds Chappy, an Air Force Colonel who is intrigued by the idea of sending in two fighters piloted by himself and Doug to rescue Doug's father after bombing the MiG base.",Action
Lucas,"A socially inept fourteen year old experiences heartbreak for the first time when his two best friends -- Cappie, an older-brother figure, and Maggie, the new girl with whom he is in love -- fall for each other.",Comedy
 Three Amigos! ,"When silent film stars Lucky Day, Dusty Bottoms and Ned Nederlander get fired, they take a job offer from Mexico: Doing a show with El Guapo, supposedly the most famous actor there. Traveling there in hope of getting good money, they arrive only to learn soon that El Guapo is not an actor, but a cruel gang leader suppressing people. He abducts the mayor's beautiful daughter Carmen (to be his wife) in revenge for the people's cry for help. Now, all hopes of the village folks rest on the weak...",Adventure
Cobra,"A gang of neo-fascist thugs, led by the self-proclaimed 'Night Slasher', are breaking into people's homes & cars, then killing them at random. When of of these thugs holds up a food store & takes hostages, Lt. Marian Cobretti (Stallone) - an intense, take-no-prisoners cop, is brought onto the scene to end the hostage-taking. Ranting bizarrely about a 'New World', the man levels a sawed-off shotgun at Cobretti, who hits him with a knife, then guns him down when the man refuses to put down his...",Action
The Golden Child,"Eddie Murphy plays a detective with a speciality of finding lost children. He is told he is the 'Chosen one' who will find and protect the Golden Child, a Bhuddist mystic who was kidnapped by an evil sorcerer. Murphy disbelieves the mysticism but finds more and more evidence of demon worship as he investigates.",Action
Star Trek IV: The Voyage Home,"To save Earth from a destructive space probe, Kirk and his fugitive crew go back in time to 20th century Earth to recover two humpback whales, who are the only Earth beings who can respond to it.",Adventure
The Hitcher,"Driving someone else's car from Chicago to San Diego, a young man picks up a hitchhiker with a taste for murder. The police, unaware of the real murderer i.e. the John Ryder, blame Jim. Ryder shows super human powers in his destructive spree.",Action
The Color of Money,"Pool hustler Fast Eddie Felson finds the young, promising pool player Vincent in a local bar and he sees in him a younger version of himself. To try and make it as in the old days, Eddie offers to teach Vincent how to be a hustler. After some hesitations Vincent accepts and Eddie takes him and Vincent's girlfriend Carmen on a tour through the country to work the pool halls. However, Vincent's tendency to show off his talent and by doing so warning off the players and losing money, soon leads to...",Drama
" No Retreat, No Surrender ","Young Jason Stillwell (Kurt McKinney) moves with his parents to Seattle, where local bullies harass them without mercy. Jason's father Tom (Tim Baker) does not believe in violence, so the family takes it on the chin. One day Jason enrolls in a martial arts class and quietly rises in rank to be a major contender. His mettle is tested in an international match against Ivan, a Russian champion.",Action
 Offret ,"Alexander, a journalist, philosopher and retired actor, celebrates a birthday with friends and family when it is announced that nuclear war has begun.",Drama
 Hannah and Her Sisters ,"Between two Thanksgivings, Hannah's husband falls in love with her sister Lee, while her hypochondriac ex-husband rekindles his relationship with her sister Holly.",Comedy
 The Delta Force ,A 707 aircraft jetliner on its way from Athens to Rome and then to New York City is hijacked by Lebanese terrorists. The terrorists demand that the pilot take them to Beirut. What the terrorists don't realize is that an elite team of commandoes led by Major McCoy (Norris) and by Colonel Alexander (Marvin) has been called into service to eliminate all terrorists on the jetliner.,Action
 Children of a Lesser God ,"James is a new speech teacher at a school for the deaf. He falls for Sarah, a pupil who decided to stay on at the school rather than venture into the big bad world. She shuns him at first, refusing to read his lips and only using signs. Will her feelings change over time?",Drama
 RAD ,A talented BMX rider has to make a choice between competing in a race and taking his college entrance exams. For BMX racing enthusiasts only.,Drama
 Youngblood ,A skilled young hockey prospect hoping to attract the attention of professional scouts is pressured to show that he can fight if challenged during his stay in a Canadian minor hockey town. His on-ice activities are complicated by his relationship with the coach's daughter.,Drama
 Solarbabies ,"This futuristic tale features the top talents of Hollywood's new generation including Jami Gertz, Lukas Haas and Jason Patric as prisoners in a fortress who plan their dazzling escape on wheels.",Action
 Crossroads ,"Eugene is an extraordinary talent in classic guitar, but he dreams of being a famous Blues guitarist. So he investigates to find a storied lost song. He asks the legendary Blues musician Willie Brown to help him, but Willie demands to free him from the old-people's prison first and to really learn the blues on the way to it's origin: Mississippi Delta. Eugene doesn't know yet about Willie's deal with the devil, that he now wants to revoke.",Drama
 April Fool's Day ,"A group of eight college friends gather together at an island mansion belonging to heiress Muffy St. John to celebrate their final year of school. They soon discover that each has a hidden secret from their past which is revealed, and soon after, they turn up dead. Yet, are they really dead? Or is it just part of some very real and cruel April Fool's jokes?",Comedy
 Betty Blue ,"Betty Blue, a mentally unbalanced and sexually aggressive free spirit who becomes involved with Zorg, a repairman moonlighting as a writer. The two engage in a variety of sexual encounters, and grow more passionate toward each other. Betty finds Zorg's book and is aggressively supportive; over time, her instability begin to catch up with her,leading to a grisly and shocking conclusion.",Drama
SpaceCamp,"For five typical teens, NASA's space camp promises to be a fun way to blow off the summer. But when a space shuttle exercise misfires, they find themselves launched into orbit, facing the adventure of a lifetime. Now, the only way back to Earth is to take command of the ship and control of their destinies, before time-and oxygen-run out.",Adventure
 Poltergeist II: The Other Side ,"The Freeling family move in with Diane's mother in an effort to escape the trauma and aftermath of Carol Anne's abduction by the Beast. But the Beast is not to be put off so easily and appears in a ghostly apparition as the Reverend Kane, a religeous zealot responsible for the deaths of his many followers. His goal is simple - he wants the angelic Carol Anne.",Horror
 Jumpin' Jack Flash ,"Terry works for a bank, and uses computers to communicate with clients all over the world. One day she gets a strange message from an unknown source. The message is coded. After decoding the message, Terry becomes embroiled in an espionage ring. People are killed, and Terry is chased. Throughout she remains in contact with this unknown person, who needs Terry to help save his life.",Comedy
 The Clan of the Cave Bear ,"Natural changes have the clans moving. Iza, medicine woman of the ""Clan of the Cave Bear"" finds little Ayla from the ""others""' clan - tradition would have the clan kill Ayla immediately, but Iza insists on keeping her. When the little one finds a most needed new cave, she's allowed to stay - and thrive.",Adventure
Troll,"An evil troll, Torok, the transformed state of the ex-husband of an old friendly witch named Eunice St. Clair, has chosen her apartment building to be the heart of the restoration of the world he once knew. To do this he uses an Emerald ring, and takes possession of a little girl named Wendy, whose brother Harry immediately suspects something wrong. ",Fantasy
 Something Wild ,"A free-spirited woman ""kidnaps"" a yuppie for a weekend of adventure. But the fun quickly takes a dangerous turn when her ex-con husband shows up.",Comedy
 The Mosquito Coast ,An eccentric and dogmatic inventor sells his house and takes his family to Central America to build an ice factory in the middle of the jungle...,Adventure
Hoosiers,"High school basketball is king in small-town Indiana, and the 1954 Hickory Huskers are all hope and no talent. But their new coach -- abrasive, unlikable Norman Dale -- whips the team into shape ... while also inciting controversy.",Drama
 Gung Ho ,When a American car manufacturer is purchased by a Japanese firm a clash of cultures occurs as the Japanese work ethic is pushed through out the plant.,Comedy
Chopping Mall,Eight teenagers are trapped after hours in a high tech shopping mall and pursued by three murderous security robots out of control.,Comedy
 Psycho III ,"Norman Bates is still running his little motel, and he has kept the dressed skeleton he calls mother. One of his guests is a young girl who has left the convent where she lived. To get some help he employs a young man. One day a nosey journalist comes to see him to ask questions about his past.",Horror
About Last Night,"Rob Lowe doesn't want to get serious. Demi Moore doesn't want to get used. Together they are an unforgettable couple in the sexy, contemporary comedy ABOUT LAST NIGHT. After drinks at a favourite Chicago hang out, Danny(LOWE) and Debbie (MOORE) head to Danny's place to indulge in the predictable singles quest - the one night stand.",Comedy
 Raw Deal ,"Mark Kaminsky is kicked out of the FBI for his rough treatment of a suspect. He winds up as the sheriff of a small town in North Carolina. FBI Chief Harry Shannon, whose son has been killed by a mobster named Patrovina, enlists Kaminsky in a personal vendetta with a promise of reinstatement into the FBI if Patrovina is taken down. To accomplish this, he must go undercover and join Patrovina's gang",Action
 Heartburn ,"Rachel is a food writer at a New York magazine who meets Washington columnist Mark at a wedding and ends up falling in love with him despite her reservations about marriage. They buy a house, have a daughter, and Rachel thinks they are living happily ever after until she discovers that Mark is having an affair while she is waddling around with a second pregnancy.",Comedy
 Club Paradise ,"Injured while risking his life to save an angry German shepard, Chicago Firefighter Jack Moniker retires and moves to a small carribean island named St. Nicholas. There, he is befriended by the owner of a run-down resort, Ernest Reed. Greedy developers are schemeing to wrest Reed's coveted beach front property from him for non-payment of taxes. Jack comes to Ernest's rescue, and together they renovate and reopen the resort catering to affluent Americans. The film follows the zany exploits of...",Comedy
 She's Gotta Have It ,"The story of Nola Darling's simultaneous sexual relationships with three different men is told by her and by her partners and other friends. All three men wanted her to commit solely to them; Nola resists being ""owned"" by a single partner.",Comedy
 Ruthless People ,"Slime ball businessman Sam Stone plots to murder his horrible wife for her money, so he can marry his mistress. He can't believe his luck when she is kidnapped by Ken and Sandy Kessler who wanted revenge from Sam for stealing their savings, and Sandy's money making fashion design, then marketing it as his own. When Barbara learns of what Sam has done to this couple and then realises that he isn't doing anything to secure her release, she becomes friends with her kidnapper and they plan to teach...",Comedy
Night of the Creeps,"In 1959, an alien experiment crashes to earth and infects a fraternity member. They freeze the body, but in the modern day, two geeks pledging a fraternity accidentally thaw the corpse, which proceeds to infect the campus with parasites that transform their hosts into killer zombies.",Comedy
 Down by Law ,The story of three men from completely different tracks who all meet in a Louisiana prison cell and eventually begin an awkward journey together. A refreshing black comedy from cult director Jim Jarmusch.,Comedy
 The Boy Who Could Fly ,"Milly and Louis, and their recently-widowed mom, Charlene, move to a new neighborhood. Once there, they all deal with a variety of personal problems, but Milly finds a friend in Eric, her autistic next door neighbor. Eric has a fascination with flight, and as the story progresses, he exerts an enthralling force of change on all those around him.",Drama
 Black Moon Rising ,"Working for the US Government to retrieve a cassette with vital information, Sam Quint, a former CIA agent (Jones), runs into Marvin Ringer (Lee Ving), another hitman he replaced, who is after the same cassette. In a desperate attempt to evade Ringer and get the tape back to a government official (played by Bubba Smith), Quint hides the cassette in a 300-MPH prototype vehicle, the Black Moon, which is on a transporter destined for a public presentation in Los Angeles. Before Quint can recover...",Action
 Running Scared ,"Gregory Hines and Billy Crystal star in the motion picture that asks the question, How come the bad guys always drive the good cars? The answer has them Running Scared in this lightning-paced comic thriller.",Action
 Police Academy 3: Back in Training ,"When police funding is cut, the Governor announces he must close one of the academies. To make it fair, the two police academies must compete against each other to stay in operation. Mauser persuades two officers in Lassard's academy to better his odds, but things don't quite turn out as expected...",Comedy
 Pirates ,"Captain Red runs a hardy pirate ship with the able assistance of Frog, a dashing young French sailor. One day Capt. Red is captured and taken aboard a Spanish galleon, but thanks to his inventiveness, he raises the crew to mutiny, takes over the ship, and kidnaps the niece of the governor of Maracaibo. The question is, can he keep this pace up ?",Adventure
 Allan Quatermain and the Lost City of Gold ,"After his brother Robeson disappears without a trace while exploring Africa in search of a legendary 'white tribe', Alan Quatermain decides to follow in his footsteps to learn what became of him. Soon after arriving, he discovers the los City of Gold, controlled by the evil lord Agon, and mined by his legions of white slaves.",Action
 TerrorVision ,"A family's new satellite TV system starts receiving signals from another planet, and soon it becomes the passageway to an alien world.",Comedy
