title,plot,genre
Easy Rider,Easy Rider is the classic cult film from the 1960’s. A road movie that embodies the feeling of being a hippie as two friends head cross-country to Mardi Gras. A controversial period film by Dennis Hopper and Peter Fonda with some classic music from a generation of wanderers.,Drama
 Midnight Cowboy ,"A ""cowboy,"" Joe Buck, moves to New York City from Texas to make his fortune as a hustler servicing rich Park Avenue women. Shortly after arriving, he is hustled by homeless con man Ratzo Rizzo, who had said he would manage him for a $20 fee. Bent on getting his money back, Buck finds the rapidly deteriorating Rizzo, ends up feeling sorry for him, and moving into Rizzo's room in an abandoned building to care for him. The two remain hopeful of striking it rich with Rizzo managing Buck's career,...",Drama
Butch Cassidy and the Sundance Kid,"This revisionist Western comedy, which served as the prototype of the buddy film for years to come, stars Paul Newman and Robert Redford as Butch Cassidy and the Sundance Kid, respectively. At the turn of the 20th century, the twosome have become notorious for the skill with which they rob banks and trains--with the help of the Hole in the Wall gang. But their last few jobs have been botched, and after Butch and Sundance return from a brief vacation, Harvey Logan (Ted Cassidy) challenges...",Adventure
 Sweet Charity ,"Taxi dancer Charity continues to have Faith in the human race despite apparently endless disappointments at its hands, and Hope that she will finally meet the nice young man to romance her away from her sleazy life. Maybe, just maybe, handsome Oscar will be the one to do it.",Comedy
 On Her Majesty's Secret Service ,"James Bond tracks archnemesis Ernst Blofeld to a mountaintop retreat where he's training an army of beautiful but lethal women. Along the way, Bond falls for Italian contessa Tracy Draco -- and marries her in order to get closer to Blofeld. Meanwhile, he locates Blofeld in the Alps and embarks on a classic ski chase.",Action
True Grit,"A drunken, hard-nosed U.S. Marshal and a Texas Ranger help a stubborn young woman track down her father's murderer in Indian territory.",Adventure
 The Italian Job ,"Charlie 's got a 'job' to do. Having just left prison he finds one his of friends has attempted a high risk job in Italy, right under the nose of the mafia. Charlie's friend doesn't get very far, so Charlie takes over the 'job'. Using three Mini Coopers, a couple of Jaguars and a bus, he hopes to bring Torino to a standstill, steal a fortune in gold and escape in the chaos.",Action
 Battle of Britain ,"In 1940, the Royal Air Force fights a desperate battle against the might of the Luftwaffe for control of the skies over Britain, thus preventing the Nazi invasion of Britain.",Action
Hello Dolly!,"A matchmaker named Dolly Levi takes a trip to Yonkers, New York to see the ""well-known unmarried half-a-millionaire,"" Horace Vandergelder. While there, she convinces him, his two stock clerks and his niece and her beau to go to New York City. In New York, she fixes Vandergelder's clerks up with the woman Vandergelder had been courting, and her shop assistant.",Comedy
 Carry on Again Doctor ,"Dr Nookey is disgraced and sent to a remote island hospital. He is given a secret slimming potion by a member of staff, Gladstone Screwer, and he flies back to England to fame and fortune. But others want to cash in on his good fortunes, and some just want him brought down a peg or two.",Comedy
 Mackenna's Gold ,"The gangster Colorado kidnaps Marshal McKenna. He believes that McKenna has seen a map which leads to a rich vein of gold in the mountains and forces him to show him the way. But they're not the only ones who're after the gold; soon they meet a group of ""honorable"" citizens and the cavalry crosses their way too - and that is even before they enter Indian territory.",Romance
 Women in Love ,"The battle of the sexes and relationships among the elite of Britian's industrial Midlands in the 1920s. Gerald Crich and Rupert Berkin are best friends who fall in love with a pair of sisters Gudrun, a sculptress and Ursula Brangwen, a schoolteacher. Rupert marries Ursula, Gerald begins a love affair with Gudrun, and the foursome embarks upon a Swiss honeymoon. But the relationships take markedly different directions, as Russell explores the nature of commitment and love. Rupert and Ursula...",Drama
 Paint Your Wagon ,"A Michigan farmer and a prospector form a partnership in the California gold country. Their adventures include buying and sharing a wife, hijacking a stage, kidnapping six prostitutes, and turning their mining camp into a boom town. Along the way there is plenty of drinking, gambling, and singing. They even find time to do some creative gold mining.",Comedy
 Fellini Satyricon ,"Film is loosely based on Petronius's work, Satyricon, a series of bawdy and satirical episodes written during the reign of the emperor Nero and set in imperial Rome.",Drama
 Support Your Local Sheriff! ,"A quick-witted drifter wanders into a lawless town in the midst of a gold rush. Shocked by the prices of food and meals he reluctantly takes the job of sheriff by amazing the Mayor with his lightning quick, dead eye pistol accuracy. He makes the town council know that he is really just passing through on his way to Australia and he will pull up and leave anytime he chooses (including at the first sign of real trouble). His first day on the job he takes on the biggest, meanest ranching family...",Comedy
 The Good Guys and the Bad Guys ,"Marshal Flagg, an aging lawman about to be retired, hears that his old nemesis, the outlaw McKaye, is back in the area and planning a robbery. Riding out to hunt down McKaye, Flagg is captured by McKaye's gang and finds out that McKaye is no longer the leader of the gang, but is considered just an aging relic by the new leader, a youngster named Waco. Waco orders Mackaye to shoot Flagg, and when Mackaye refuses Waco abandons both of them. Flagg then takes Mackaye back to town only to find out...",Comedy
 Carry on Camping ,"Sid and Bernie keep having their amorous intentions snubbed by their girlfriends Joan and Anthea. The boys suggest a camping holiday, secretly intending to take them to a nudist camp. Of course they end up in the wrong place, and meet up with the weirdest bunch of campers you can imagine! Coach loads of sex-starved schoolgirls and bands of hippies all add to the laughs",Comedy
 La caduta degli dei (Götterdämmmerung) ,"In the early days of Nazi Germany, a powerful noble family must adjust to life under the new dictatorship regime. The transition from democracy to dictatorship is thus dramatized through the lives of the family which also owns a powerful German industrial firm. Through such characters as a German Baron, a child molester, a Nazi Storm Trooper, an innocent man framed for murder, and a Captain in the German SS, ""Damned"" thus shows how so called ""German Upper Class Nobility"" first resented Adolf...",Drama
 Cactus Flower ,"A dentist pretends to be married to avoid commitment, but when he falls for his girlfriend and proposes, he must recruit his lovelorn nurse to pose as his wife.",Comedy
 Topaz ,"A high ranking Russian official defects to the United States, where he is interviewed by US agent Michael Nordstrom. The defector reveals that a French spy ring codenamed ""Topaz"" has been passing NATO secrets to the Russians. Michael calls in his French friend and counterpart Andre Devereaux to expose the spies.",Thriller
 The Prime of Miss Jean Brodie ,A headstrong young teacher in a private school in 1930s Edinburgh ignores the curriculum and influences her impressionable 12 year old charges with her over-romanticized world view.,Comedy
" ""Star Trek"" The Way to Eden "," The Enterprise is ordered to pursue a group of anti-establishment idealists who have stolen a space cruiser and made off for the mythical planet Eden. When the group pushes their stolen ship beyond its limits, the Enterprise is forced to rescue them by transporting them aboard. This merry band of space-hippies includes an insane leader (Dr. Sevrin), an academy drop-out and former love interest of Chekov (Irina), and the son of a Catullan ambassador (Tongo Rad). With the Federation undergoing...",Action
" ""The Saint"" Vendetta for the Saint: Part 1 "," Templar is having a drink at a bar in Naples when he witnesses a mêlée between two of the customers. It appears that one of them has mistaken the other for an old colleague. Templar's suspicions are raised the next morning when he reads in the newspapers that one of the men has been murdered. He begins to investigate only to find himself thrown into the world of the Sicilian Mafia, and that few people are willing to help him. Written by Sebastian Tombs...",Action
 100 Rifles ," Reynolds plays Yaqui Joe, an Indian who robs a bank in order to buy guns for his people who are being savagely repressed by the government. Set in turn of the century Mexico, it tells the story of his flight into Mexico and his pursuit by an American lawman. They eventually become allies and team up with Welch to take up the cause of the Indians. Written by Fryingham ",Adventure
 12 + 1 ," Mario, a young philanderer, receives 13 antique chairs in a bad state by inheritance and decides to sell off them to get some money. Afterwards he gets to know that one of them contains documents worth a lot of money. So he begins an adventurous trip to regain possession of the chair. On the way he meets many strange people who would like to help or to swindle him. Written by Adalberto Fornario ",Comedy
 99 Women ,"Jesus Franco's campy women's prison film is worthwhile for genre devotees primarily due to an outstanding cast. Mercedes McCambridge is unintentionally hilarious as sadistic lesbian warden Thelma Diaz, spitting tacky dialogue with exuberant venom in a performance so overbearing that it verges on classic. The plot is standard for the genre, as three women (Maria Rohm, Elisa Montes, Luciana Paluzzi) are sentenced to an island prison off the Panamanian coast, only to encounter torture, rape, and...",Action
 A Dream of Kings ,"Drama - A powerful and touching drama set in Chicago's vibrant Greek- American community, A Dream of Kings benefits from the regal talent of Anthony Quinn in a role he was born to play: Matsoukos, a proud, earthy optimist, very much like his unforgettable stage and screen Zorba. Determined to take his ailing son with him to Greece, Matsukos would move all creation to secure the travel money, even risk the hard-earned respect and love he's won as a community counselor. - Anthony Quinn, Irene...",Drama
 A tanú ,"Known as the best satire about communism, banned for over a decade in Hungary. 'The Witness' has become a cult classic, well received by critics and general audiences when it was finally released outside of Hungary. 'The Witness' takes place during the height of the Rákosi Era, which was closely modeled after the ruthless and brutal Stalin regime. The film follows the life of an ordinary dike keeper, József Pelikán, who has been caught for illegally slaughtering his pig, Dezsõ. Instead of...",Drama
 Alfred the Great ,"While Old England is being ransacked by roving Danes in the 9th century, Alfred is planning to join the priesthood. But observing the rape of his land, he puts away his religious vows to take up arms against the invaders, leading the English Christians to fight for their country. Alfred soundly defeats the Danes and becomes a hero. But now, although Alfred still longs for the priesthood, he is torn between his passion for God and his lust for blood.",Drama
 Alice's Restaurant ,"Alice's Restaurant is a 1969 movie adapted from a song by Arlo Guthrie. The song is Arlo Guthrie's most famous work, a talking blues based on a true story that began on Thanksgiving Day 1965. The movie reproduces the events of the song, in addition to other scenes.",Comedy
 All Neat in Black Stockings ,"A small comedy drama about the life and sex adventures of an amorous window cleaner, in the hip and swingin' London of the 60's.",Comedy
 An Elephant Called Slowly ," Bill and Ginny are invited by a naturalist friend to take care of his home in Africa while he is away, and they find themselves adopted by three orphan elephants. Written by ""Sirius"" <[email protected]> ",Comedy
 Angel in My Pocket ,"The new minister in a small town faces the challenge of winning over its eccentric citizens. Director Alan Rafkin's 1969 film stars Andy Griffith, Lee Meriwether, Jerry Van Dyke, Kay Medford, Edgar Buchanan and Gary Collins.",Comedy
 Anne of the Thousand Days ,"Henry VIII of England discards one wife, Katharine of Aragon, who has failed to produce a male heir, in favor of the young and beautiful Anne Boleyn.",Drama
 Army of Shadows ,"France, 1942, during the occupation. Philippe Gerbier, a civil engineer, is one of the French Resistance's chiefs. Given away by a traitor, he is interned in a camp. He manages to escape, and joins his network at Marseilles, where he makes the traitor be executed...",Drama
 Battle of the Commandos ," Irish Colonel Charlie McPhearson has just had his platoon of twenty-eight slaughtered by German troops. Angered at his superiors for this suicide mission, he takes convicts on his next, along with fornicating American explosives technician Major Burke, to defuse underwater mines so that a commando squado can prepare for a June 10 invasion to destroy a tank gun. Because Colonel Ackerman, whose troops killed his last platoon, is the leader of the platoon in charge of the gun, McPhearson insists...",Action
 Becoming Pony Boi ,"From Hollywood Geek, to the Hugh Hefner of Hip Hop. The comedic journey of the most famous rap superstar you've never heard of. Hollywood director Jackie Stein, decides to live out his childhood dream of becoming a rap superstar. In the vein of This is Spinal Tap, we follow his journey as he transforms himself from Hollywood geek, to the Hugh Hefner of Hip Hop called Pony Boi. Pony Boi makes an album, a video featuring Dabrat, gets more women than he imagined and lives his dream, but at what...",Comedy
 Before Winter Comes ,"Comedy set in a refugee camp in occupied Austria after World War II. A shrewd multi-lingual interpreter who mediates between Russian and British military brass enters into a friendly rivalry with British Major Giles Burnside, who is in charge of assigning the displaced persons into either the American or Russian zones.",Drama
" Birds, Orphans and Fools ","This mosaic-like parable is set in undefined space and time, still its crazy world without ideals filled with violence, cynicism and hopelessness clearly resembles the social atmosphere in Czechoslovakia after August 1968. Three strange loners survive only thanks to their ""foolishness"" - a life based on play and philosophy of joy. But the tragic ending of their coexistence is an inevitable outcome of reality that only offers two possibilities: insanity or death.",Comedy
 Blaumilch Canal ," A madman escapes from the asylum in Tel-Aviv, and starts digging a canal right in the middle of one of the main streets. Due to the bureaucratic mess in the city administration, not only does nobody try to stop him, he actually receives the help of the police, the city engineer, etc. The one city clerk who finds out what is really going on is, of course, declared insane... Written by Yuval Kfir <[email protected]> ",Comedy
 Blind Beast ," A blind sculpter kidnaps a beautiful young model and takes her back to his home. He and his mother live in a warehouse that he has turned into a surreal tribute to the senses. It is filled with huge sculptures of body parts and the female form. He is obsessed with exploring the senses to the fullest. At first, the model only wants to escape from this bizarre scene, but eventually she succumbs to his strange vision and even surpasses his obsession. Written by Fred Cabral...",Drama
 Blood of Dracula's Castle ,"Count Dracula and his wife capture beautiful young women and chain them in their dungeon, to be used when they need to satisfy their thirst for blood.",Horror
 Bob & Carol & Ted & Alice ,"Couples Bob & Carol Sanders and Ted & Alice Henderson are best friends. After attending a weekend self-help self-discovery session, Bob and Carol feel newly enlightened, and want their friends, Ted and Alice, to feel the same way.",Comedy
 Burn! ,The professional mercenary Sir William Walker instigates a slave revolt on the Caribbean island of Queimada in order to help improve the British sugar trade. Years later he is sent again to deal with the same rebels that he built up because they have seized to much power that now threatens British sugar interests.,Action
 Caine ,"A gunrunner loses his cargo near a small coastal Sudanese town so he's stuck there. When a woman hires him to raid a sunken ship in the shark-infested waters, he sees a chance to compensate for his losses. He's not the only one.",Adventure
 Captain Nemo and the Underwater City ,"Some survivors of a drowning ship are rescued by Captain Nemo and his submarine crew. They are taken to an underwater city, where they may be trapped for the rest of their lives.",Adventure
 Castle Keep ,"During the Battle of the Bulge, an anachronistic count shelters a ragtag squad of Americans in his isolated castle hoping they will defend it against the advancing Germans.",Drama
 Chastity ,"Go on a cross country adventure with Cher in her first dramatic film, Chastity. Chastity ('Cher') is a lonely young girl who is hitchhiking across the country in hopes of finding someone to love her and make her forget her disturbed past. She does find love with a man whom she calls Andre ('Stephen Whittaker'). Chastity feels that the relationship is getting too serious so she decides to run. She goes to Mexico where she starts working at a whorehouse, there she befriends the strange lesbian...",Drama
 coming apart ," Joe is a psychiatrist who puts a hidden camera behind his couch, facing a wall sized mirror in order to document a number of women who come and go. Obsessed with a former lover, Joe intends to perform and record an ""experiment in contemporary sexual aberration."" In the process, Joe documents his own mental breakdown as well as a number of sexually volatile encounters with the women who come to see him. Written by alfiehitchie ",Drama
 Crossplot ,"A successful London ad-exec hires a beautiful Hungarian girl to pose for some modeling shots, little realising that she has overheard an assassination plot and is now being hunted by some dangerous killers.",Thriller
 Devil in the Flesh , Based on the infamous novel by Leopold Sacher-Masoch this fine film follows the perverted passions of a young couple as Severin watches the beautiful Wanda writhing naked amongst furs. His disturbing peeping tomism triggers off a whirlpool of emotions due to a childhood episode which punishes voyeurism with pain. Written by Ørnås ,Drama
 Dirkie ,"An 8-year-old boy and his dog are left to face a vast desert wasteland alone after a plane crash, while an army of men and machines penetrate the desert searching for them. Based on true events.",Adventure
 Don't Drink the Water ,"The Hollander family's European vacation is interrupted when their plane is forced to land in Vulgaria. The Hollanders leave the plane to take pictures which results in accusations of spying. Chased by Vulgarian soldiers, they take refuge in the American Embassy under the protection of the absent ambassador's hapless son.",Comedy
 Double Suicide ,"Set in Osaka in the 18th century, the film centers on the doomed romance between Jihei (Kichiemon Nakamura), a down and out married paper merchant passionately in love with doe-eyed courtesan Koharu (Shima Iwashita), whom he cannot afford to buy out of servitude. Koharu herself has also fallen in love with Jihei; she even starts turning away other patrons to be with him. Their love is further imperiled by Tahei (Hosei Komatsu), a rich, obnoxious merchant who flaunts his ability to buy Koharu's...",Drama
 Downhill Racer ,"Downhill Racer was a 1969 film directed by American director Michael Ritchie in his film debut. A drama about ski racing, it starred Robert Redford and Gene Hackman.",Drama
 En passion ,"Andreas, a man struggling with the recent demise of his marriage and his own emotional isolation, befriends a married couple also in the midst of psychological turmoil. In turn he meets Anna, who is grieving the recent deaths of her husband and son. She appears zealous in her faith and steadfast in her search for truth, but gradually her delusions surface. Andreas and Anna pursue a love affair, but he is unable to overcome his feelings of deep humiliation and remains disconnected. Meanwhile,...",Drama
 Eros + Massacre ," In the 20's, the anarchist revolutionary Sakae Osugi is financially supported by his wife, journalist Itsuko Masaoka. He spends his time doing nothing but philosophizing about political systems and free love and visiting with his lovers Yasuko and the earlier feminist Noe Ito. He conveniently defends three principles for a relationship between a man and a woman: they should be financially independent (despite the fact that he is not); they should live in different places; and they should...",Drama
 Eye of the Cat ,"A man and his girlfriend plan to rob the mansion of the man's eccentric but wealthy aunt. However, the aunt keeps dozens of cats in her home, and the man is deathly afraid of cats.",Horror
 Femina Ridens ,"Beautiful PR woman Maria finds herself trapped in the home of the sinister and troubled Dr Sayer, where she is subjected to a series of increasingly bizarre, terrifying and degradating sex games. Sayer admits that he has murdered several women after the same ordeal, always killing them at the point of orgasm. But all is not what it seems, and this is revealed to be the fantasy of a troubled man. Sayer finds salvation in Maria and falls for her, only for her to turn the tables on him and...",Thriller
 Five the Hard Way ," Motorcycle racer Rommel and his fiancée Rita become friendly with a biker gang led by the unstable J.C. When Rita is raped and murdered by J.C. in a jealous rage, Rommel gathers some biker pals and goes on a hunt for vengeance. Written by Marty McKee <[email protected]> ",Action
 Frankenstein Must Be Destroyed ,"Blackmailing a young couple to assist with his horrific experiments the Baron, desperate for vital medical data, abducts a man from an insane asylum. On route the abductee dies and the Baron and his assistant transplant his brain into a corpse. The creature is tormented by a trapped soul in an alien shell and, after a visit to his wife who violently rejects his monstrous form, the creature wrecks his revenge on the perpetrator of his misery: Baron Frankenstein.",Horror
 Fraulein Doktor ,"A seductive and ruthless spy in the service of Germany steals state secrets- including the formula for poison gas-from England and France during World War I. British intelligence, in turn, tries to hunt her down.",Drama
 Free Grass ,"Here's an ""Easy Rider"" - inspired plot with the combination of ""West Side Story"" stars. Richard Beymer falls in love with Lana Wood (sister Natalie wasn't available). They need cash so they agree to help Russ Tamblyn and his gang smuggle grass from Mexico to L.A. on motorcycles. When Beymer objects to narcotics agents being killed, his long-haired pal from the Jets puts LSD in his drink, tries to burn him alive, and has Lana kidnapped. No musical numbers, however. With Bing's son Lindsay...",Action
 From Nashville with Music ,"From Nashville With Music is another slim plot that gives an excuse for Nashville country stars to perform. The stars are Leo G. Carroll, Marilyn Maxwell, Jose Gonzalez-Gonzalez, Marty Robbins (singing ""El Paso""), Buddy Allen, Bill Anderson, Don Gibson, Merle Haggard, George Jones, Cousin Jody, Buck Owens, Bonnie Owens, Charley Pride, Susan Raye, Carl Smith, Wynn Stewart and Tammy Wynette. (from http://archive.tennessean.com/article/20070511/SPECIAL0907/705110501/1969-Movie-From-Nashville-Music)",Comedy
 Future Women ," Jeff Sutton arrives in Rio de Janeiro with a suitcase with 10 million dollars, and the powerful mobster Sir Masius sends his henchman Carl with his gangsters to follow Jeff and get the money. Jeff has one affair with the manicure Leslye and succeeds to escape from Sir Masius' mobsters. Meanwhile, Sumuru, the leader of the women of the City of Femina that wants to defeat the men and take over the world, captures Jeff and brings him to Femina expecting to get the money. Sumuru has several...",Action
" Gaily, Gaily ","Director Norman Jewison's 1969 period comedy, based on Ben Hecht's memoirs, stars Beau Bridges as a young apprentice at a big city newspaper. The cast also includes Melina Mercouri, Brian Keith, Hume Cronyn, George Kennedy, Wilfred Hyde-White and Margot Kidder.",Comedy
 Generation ," Jim Bolton, a well-off businessman from Chicago hears that his daughter Doris is pregnant in New York. Since he did not even know she was seeing anyone he fears the worst. Unbeknownst to him, his daughter and the father of his grandchild, Walter marry shortly before Jim's arrival in New York. Upon his arrival he is shocked to hear that Doris and Walter plan not only a natural childbirth but the birth will take place in their apartment NOT a hospital. To make matters worse, Walter states...",Comedy
 Godzilla's Revenge ," Using footage from previous films, the story revolves around a boy who uses his imagination to take him to Monster Island so he can escape the pains of real life. Written by Todd A. Bobenrieth <[email protected]> ",Family
