title,plot,genre
Iron Man,"Based on the long-running Marvel comic book series, ""Iron Man"" tells the story of Tony Stark, the enigmatic heir to the Stark Enterprises fortune. A driven inventor and executive who seems to have it all, Tony is haunted by his dark side. Though he commands his empire by day, by night he secretly becomes ""Iron Man,"" the living embodiment of decades of defense spending and innovation. Strapping on billions of dollars worth of state-of-the-art armor and weaponry each night to fight crime,...",Action
The Dark Knight,"The follow-up to the action hit ""Batman Begins,"" ""The Dark Knight"" reunites director Christopher Nolan and star Christian Bale, who reprises the role of Batman/Bruce Wayne. In the new film, Batman raises the stakes in his war on crime. With the help of Lieutenant Jim Gordon and District Attorney Harvey Dent, Batman sets out to dismantle the remaining criminal organizations that plague the city streets. The partnership proves to be effective, but they soon find themselves prey to a reign of...",Action
The Incredible Hulk,"""The Incredible Hulk,"" to be directed by Louis Leterrier, will return to the roots of the long-running comic series, combining a well-developed character storyline with incredible action and fun. Zak Penn, who previously collaborated with Marvel on X2 and this summer's smash hit X-Men: The Last Stand, is writing the script. The project is being produced by Avi Arad, Kevin Feige and Gale Ann Hurd and will be executive produced by Michael Helfant and Ari Arad.",Action
Hellboy II: The Golden Army,"The sequel to the 2003 movie based on Mike Mignola's Dark Horse comic character.Ron Perlman returns to the title role as Hellboy, a humanoid creature born in the flames of Hell and brought to Earth as an infant. Raised in secret, the adolescent ""HB"" becomes an agent for the secret Bureau for Paranormal Research and Development (BPRD), a covert government agency which serves as the planet's line of defense against otherworldly evil. Selma Blair will also reprise the role of Liz Sherman, a...",Action
Mamma Mia!,"Meryl Streep will play the rebellious single mother of a bride-to-be who never met her father. The daughter invites three likely paternal candidates to her wedding, and the ensuing conflict triggers the performance of 22 Abba hits including ""Dancing Queen,"" ""Take a Chance on Me"" and ""The Winner Takes It All."" Based on the crowd-pleasing musical that has played in 130 cities around the world and has grossed $1.6 billion since its 1999 opening.",Comedy
Wanted,"Based upon Mark Millar's explosive graphic novel series and helmed by the stunning visualist director Timur Bekmambetov--creator of the most successful Russian film franchise in history, the ""Night Watch"" series--""Wanted"" tells the story of one invisible drone's transformation into a dark avenger. In 2008, the world will be introduced to a superhero for a new millennium: Wesley Gibson.",Action
Twilight,"""Twilight"" is an action-packed, modern-day love story between a teenage girl and a vampire. Bella Swan (Kristen Stewart) has always been a little bit different, never caring about fitting in with the trendy girls at her Phoenix high school. When her mother re-marries and sends Bella to live with her father in the rainy little town of Forks, Washington, she doesnt expect much of anything to change. Then she meets the mysterious and dazzlingly beautiful Edward Cullen (Robert Pattinson), a boy...",Drama
Tropic Thunder,"In the action-comedy ""Tropic Thunder,"" Ben Stiller plays pampered action superstar Tugg Speedman, who is cast in the biggest, most expensive war movie ever produced. He sets out to Southeast Asia with a ""Who's Who"" of celebrity co-stars. They include Kirk Lazarus (Robert Downey Jr.), an intense, three-time Oscar-winning actor; Jeff Portnoy (Jack Black), star of the popular gross-out comedy franchise ""The Fatties""; multi-platinum hiphop-star-turned-entrepreneur-turned-actor Alpa Chino (Brandon...",Action
Indiana Jones and the Kingdom of the Crystal Skull,"In 1957, Indiana Jones is thrust back in action, venturing into the jungles of South America in a race against Soviet agents to find the mystical Crystal Skull.",Action
Quantum of Solace,"""Quantum of Solace"" continues the high octane adventures of James Bond (Daniel Craig) in ""Casino Royale.""Betrayed by Vesper, the woman he loved, 007 fights the urge to make his latest mission personal. Pursuing his determination to uncover the truth, Bond and M (Judi Dench) interrogate Mr White (Jesper Christensen) who reveals the organisation which blackmailed Vesper is far more complex and dangerous than anyone had imagined.Forensic intelligence links an Mi6 traitor to a bank account in...",Action
Taken,"“I don’t know you who you are. I don’t know what you want. If you’re looking for a ransom, I can tell you, I don’t have money. But what I do have are a very particular set of skills acquired over a very long career in the shadows, skills that make me a nightmare for people like you. If you let my daughter go now, that will be the end of it. I will not look for you, I will not pursue you. But if you don’t, I will look for you, I will find you. And I will kill you.”With these...",Action
The Curious Case of Benjamin Button,"""I was born under unusual circumstances."" And so begins ""The Curious Case of Benjamin Button,"" adapted from the 1920s story by F. Scott Fitzgerald about a man who is born in his eighties and ages backwards: a man, like any of us, who is unable to stop time. We follow his story, set in New Orleans from the end of World War I in 1918, into the 21st century, following his journey that is as unusual as any man’s life can be. Directed by David Fincher and starring Brad Pitt and Cate Blanchett with...",Drama
Gran Torino,"Disgruntled Korean War vet Walt Kowalski (Eastwood) sets out to reform his neighbor, a young Hmong teenager, who tried to steal Kowalski's prized possesion: his 1972 Gran Torino.",Drama
The Hurt Locker,"""The Hurt Locker,"" winner of the 2008 Venice Film Festival SIGNIS Grand Prize, is a riveting, suspenseful portrait of the courage under fire of the military’s unrecognized heroes: the technicians of a bomb squad who volunteer to challenge the odds and save lives in one of the world’s most dangerous places. Three members of the Army’s elite Explosive Ordnance Disposal (EOD) squad battle insurgents and each other as they search for and disarm a wave of roadside bombs on the streets of...",Drama
 The Sisterhood of the Traveling Pants 2 ,"In ""Sisterhood of the Traveling Pants 2,"" based on Ann Brashares' best-selling series of novels, four young women continue the journey toward adulthood that began with ""The Sisterhood of the Traveling Pants."" Now three years later, these lifelong friends embark on separate paths for their first year of college and the summer beyond, but remain in touch by sharing their experiences with each other as they always have--with honesty and humor. Discovering their individual strengths, fears, talents...",Comedy
In Bruges,"Bruges (pronounced ""broozh""), the most well-preserved medieval city in the whole of Belgium, is a welcoming destination for travellers from all over the world. But for hit men Ray (Colin Farrell) and Ken (Brendan Gleeson), it could be their final destination; a difficult job has resulted in the pair being ordered right before Christmas by their London boss Harry (two-time Academy Award nominee Ralph Fiennes) to go and cool their heels in the storybook Flemish city for a couple of weeks.",Comedy
Sex and the City: The Movie,"The movie version of the long-running HBO series featuring the further exploits of Carrie Bradshaw, Samantha Jones, Charlotte York and Miranda Hobbes. The series was originally based on autobiographical columns written by Candace Bushnell.",Comedy
Step Brothers,"Will Ferrell and John C. Reilly will play coddled guys who live with their respective single parents. Their folks fall in love and marry, making the guys stepbrothers. From the team that brought you ""Talladega Nights: The Ballad of Ricky Bobby"" and ""Anchorman: The Legend of Ron Burgundy.""",Comedy
The Boy in the Striped Pajamas,"Bruno's life is forever changed after he and his family move to a remote new home, and he strikes up a friendship with the only boy who appears to be around.",Drama
Slumdog Millionaire,"The film is the story of Jamal Malik, an 18 year-old orphan from the slums of Mumbai, who is about to experience the biggest day of his life. With the whole nation watching, he is just one question away from winning a staggering 20 million rupees on India’s “Who Wants To Be A Millionaire?”But when the show breaks for the night, police arrest him on suspicion of cheating; how could a street kid know so much? Desperate to prove his innocence, Jamal tells the story of his life in the slum...",Drama
Seven Pounds,"Academy Award® nominee Will Smith stars in the drama ""Seven Pounds,"" re-teaming with the director and producers of ""The Pursuit of Happyness"" for the emotional story of a man who will change the lives of seven strangers.",Drama
Get Smart,"Maxwell Smart (Steve Carell) is on a mission to thwart the latest plot for world domination by the evil crime syndicate known as KAOS. When the headquarters of U.S. spy agency Control is attacked and the identities of its agents compromised, the Chief (Alan Arkin) has no choice but to promote his ever-eager analyst Maxwell Smart, who has always dreamt of working in the field alongside stalwart superstar Agent 23 (Dwayne Johnson). Smart is partnered instead with the lovely-but-lethal veteran...",Action
Forgetting Sarah Marshall,"From the comedic minds of the guys who brought you Knocked Up and The 40 Year-Old Virgin comes Universal Pictures' newest romantic disaster comedy - Forgetting Sarah Marshall starring Jason Segel, Kristen Bell, Mila Kunis, Russell Brand, Bill Hader, Paul Rudd, Jack McBrayer and Jonah Hill. For anyone who has ever had their heart ripped out and cut into a billion pieces...here comes a hilarious, heartfelt look at relationships. Part romantic comedy, part disaster film, Forgetting Sarah Marshall...",Comedy
"Definitely, Maybe","Ryan Reynolds stars as Will Hayes, a 30-something Manhattan dad in the midst of a divorce when his 10 year-old daughter, Maya (Abigail Breslin), starts to question him about his life before marriage. Maya wants to know absolutely everything about how her parents met and fell in love.",Comedy
 Martyrs ,"France. A night at the beginning of the 1970s. Lucie, a little girl missing for over a year, is discovered wandering by the side of a country road. Near catatonic, she can say nothing about what has happened to her. The cops quickly find the place in which she's been incarcerated - a disused slaughterhouse. Every indication is that she never once left the empty, freezing room in which she was imprisoned. Filthy, starving, dehydrated, the child's body nonetheless bears no traces of sexual abuse...",Horror
Zack and Miri Make a Porno,"Lifelong platonic friends Zack (Rogen) and Miri (Banks) look to solve their respective cashflow problems by making an adult film together. As the cameras roll, however, the duo begin to sense that they may have more feelings for each other than they previously thought.",Comedy
RocknRolla,"Butler stars as One Two, a street-smart mobster who has learned to play both sides of the fence, and Wilkinson is playing the lethal head mobster, Lenny Cole, part of London's old mob regime, which is quickly losing ground to the wealthier foreign mob.When a Russian mobster orchestrates a crooked land deal, millions of dollars are up for grabs, and all of London's criminal underworld wants in on the action. Everyone from a dangerous crime lord to a sexy accountant, a corrupt politician and...",Action
The Happening,Mark Wahlberg will play a man who takes his family on the run when the world turns upside and a cataclysmic natural crisis threatens to end the world.,SciFi
The Chronicles of Narnia: Prince Caspian,"""Prince Caspian"" finds the Pevensie siblings pulled back into the land of Narnia, where a thousand years have passed since they left. The children are once again enlisted to join the colorful creatures of Narnia in combating an evil villain who prevents the rightful Prince from ruling the land. ""Prince Caspian"" was first published in 1951, and is the fourth book in the seven-book series written by Lewis. It was intended as a continuation of ""The Lion, The Witch and The Wardrobe.""",Action
Let the Right One in,"Terrorized by bullies, lonely 12-year-old Oskar befriends a new neighbor, a mysterious young girl whose arrival coincides with a series of gruesome deaths and attacks. Though Oskar realizes that she's a vampire, his friendship with her is stronger than his fear.",Drama
"10,000 B.C.","From director Roland Emmerich comes a sweeping odyssey into a mythical age of prophesies and gods, when spirits rule the land and mighty mammoths shake the earth. In a remote mountain tribe, the young hunter, D'Leh (Steven Strait), has found his heart's passion - the beautiful Evolet (Camilla Belle). When a band of mysterious warlords raid his village and kidnap Evolet, D'Leh is forced to lead a small group of hunters to pursue the warlords to the end of the world to save her.",Action
Disaster Movie,"In ""Disaster Movie,"" the filmmaking team behind the hits ""Scary Movie,"" ""Date Movie,"" ""Epic Movie"" and ""Meet the Spartans"" this time puts its unique, inimitable stamp on one of the biggest and most bloated movie genres of all time - the disaster film.""Disaster Movie"" follows the comic misadventures of a group of ridiculously attractive twenty-somethings during one fateful night as they try to make their way to safety while every known natural disaster and catastrophic event - asteroids,...",Comedy
Hancock,"""Hancock"" centers on a tortured superhero (Will Smith) who crash-lands in Sheepshead Bay, Brooklyn, and tries to transform himself by romancing an alluring housewife, causing chaos in the city.",Action
The Spirit,"Adapted from the legendary comic strip, THE SPIRIT is a classic action-adventure-romance told by genre-twister FRANK MILLER (creator of 300 and SIN CITY). It is the story of a former rookie cop who returns mysteriously from the dead as the SPIRIT (Gabriel Macht) to fight crime from the shadows of Central City. His arch-enemy, the OCTOPUS (Samuel L. Jackson) has a different mission: he's going to wipe out Spirit's beloved city as he pursues his own version of immortality. The Spirit tracks this...",Action
 Diario de una ninfómana ,"A chronicle of the life of a middle-class French girl's sexual adventures, her then fall into prostitution, and her ultimate redemption.",Drama
The Wrestler,"Film centers on Randy ""The Ram"" Robinson, a 1980s-era star pro wrestler who has become a burnt-out shell of his former self. After he has a heart attack during a small-time match, a doctor tells him he could die if he fights again. In an effort to build a new life, Robinson takes a job at a deli, moves in with an aging stripper and tries to build a relationship with her son. But the prospect of a rematch with his old nemesis the Ayatollah proves too tempting to resist, even if it means risking...",Drama
The Fall,In a hospital a little girl with a broken collar bone meets a bedridden man who starts telling her a fantastical story which reflects his state of mind. As time goes by fiction and reality start to intertwine in this uplifting epic fantasy.,Adventure
Jumper,"A genetic anomaly allows a young man to teleport himself anywhere. He discovers this gift has existed for centuries and finds himself in a war that has been raging for thousands of years between ""Jumpers"" and those who have sworn to kill them.",Action
Rambo,"In Thailand, a group of Christian aid workers recruit John Rambo to guide them up the Salween River to deliver medical supplies to the Karen tribe of neighboring Burma (aka Myanmar). When the missionaries fail to return, Rambo is persuaded to take a group of mercenaries back into the war-torn border region to find them. What follows is a descent into hell on earth.",Action
Bronson,"In 1974, a hot headed 19-year-old named Michael Peterson (Tom Hardy, in a blazing, transformative performance) decided he wanted to make a name for himself and so, with a homemade sawed-off shotgun and a head full of dreams he attempted to rob a post office. After making off with only £26.18, he was swiftly apprehended and originally sentenced to seven years in jail, Peterson has subsequently been behind bars for 34 years, 30 of which have been spent in solitary confinement. During that time,...",Action
The Strangers,"""Strangers"" is a suspense thriller revolving around a couple in a remote suburban house who are targeted by three dangerous masked strangers. The resulting clashes force the couple to go well beyond what they thought themselves capable of in order to survive.",Horror
"Synecdoche, New York","A theater director (Hoffman) struggles with his work, and the women in his life, as he attempts to create a life-size replica of New York inside a warehouse as part of his new play.",Drama
Yes Man,"A man (Carrey) who finds himself very depressed, and is always saying no. When friends ask him out, he always says no, ""Yes Man"" will explore what happens when he decides to say YES to every thing that comes his way.",Comedy
The Spiderwick Chronicles,"When the three Grace children -- troubled Jared; his bookish twin, Simon; and their sister, Mallory, a fencing jock -- move to the ancient Spiderwick mansion, they are at first none-too-enchanted by the rundown Victorian ... until they discover a Brownie, an enchanted creature, living in the walls. They soon find a book -- Arthur Spiderwick's Field Guide to the Fantastical World Around You -- that will open their eyes to the invisible, odd, and sometimes dangerous world of dragons and boggarts,...",Adventure
The Day the Earth Stood Still,"A remake of the 1951 sci-fi classic about a humanoid alien named Klaatu (Keanu Reeves) who arrives on Earth accompanied by an indestructible, heavily armed robot and a warning to world leaders that their continued aggression will lead to annihilation by species watching from afar.",Drama
Never Back Down,"At his new high school, a rebellious teen (Faris) is lured into an underground fight club, where he finds a mentor in a mixed martial arts veteran (Hounsou).",Action
 Wild Child ,"Sixteen-year-old Poppy (Emma Roberts, Nancy Drew) is a self-obsessed, incorrigible brat who lives a pampered life in her L.A. world. Though she’s handed credit cards with unlimited balances and surrounded by countless hangers on, Poppy can’t escape the mounting frustration she feels with her family situation. And she makes sure that everyone knows it.",Comedy
All the Boys Love Mandy Lane,"A group of high schoolers invite Mandy Lane (Amber Heard), a good girl who became quite hot over the summer, to a weekend party on a secluded ranch. While the festivities rage on, the number of revelers begins to drop quite mysteriously.",Horror
 Ip Man ,"The trio behind the cult hit Kill Zone -- director Wilson Yip, star Donnie Yen, and action choreographer Sammo Hung -- reteam for the award-winning action hit IP MAN. Yen (Hero, Seven Swords), currently Hong Kong’s biggest action star and gaining international recognition as the most diverse martial artist in the world, stars with Simon Yam (Bodyguards and Assassins, Tomb Raider) and Hiroyuki Ikeuchi (Tajomaru, Space Battleship) in the biopic based on the life of Ip Man, a grandmaster of the...",Action
Nick and Norah's Infinite Playlist,"Based on the novel by Rachel Cohn and David Levithan, the story revolves around two bridge-and-tunnel teenagers, nursing broken hearts, who fall in love during one sleepless night in New York while searching for their favorite band's unannounced show.",Comedy
 Eden Lake ,"Nursery teacher Jenny and her boyfriend Steve, escape for a romantic weekend away. Steve, planning to propose, has found an idyllic setting: a remote lake enclosed by woodlands and seemingly deserted. The couple's peace is shattered when a gang of obnoxious kids encircles their campsite. Reveling in provoking the adults, the gang steals the couple's belongings and vandalizes their car leaving them completely stranded. When Steve confronts them, tempers flare and he suffers a shocking and...",Horror
27 Dresses,"A young woman (Heigl) who has made a career out of being a bridesmaid but never a bride and faces her worst nightmare when her sister (Akerman) becomes engaged to the man of her dreams. Luckily, the wedding brings around the man (Marsden) who will change her bridesmaid status for good.",Comedy
Changeling,"Angelina Jolie plays a woman whose son is abducted but retrieved; she suspects, however, that the returned child is not her kid. The woman must then confront corruption in the LAPD. The story is based on true events in 1920s Los Angeles.",Drama
Journey to the Center of the Earth,"When a group of kids find Jules Verne's original manuscript for his book ""Journey to the Center of the Earth,"" they discover that he actually took the trip himself, and using the manuscript as a map, they follow his course into the earth's core.",Action
Doomsday,"In ""Doomsday,"" a lethal virus spreads throughout a major country and kills hundreds of thousands. To contain the newly identified Reaper, the authorities brutally quarantine the country as it succumbs to fear and chaos. The literal walling-off works for three decades - until Reaper violently resurfaces in a major city. An elite group of specialists, including Eden Sinclair (Mitra), is urgently dispatched into the still-quarantined country to retrieve a cure by any means necessary. Shut off from...",Action
Defiance,"Based on an extraordinary true story, ""Defiance"" is an epic tale of family, honor, vengeance and salvation in World War II. The year is 1941 and the Jews of Eastern Europe are being massacred by the thousands. Managing to escape certain death, three brothers take refuge in the dense surrounding woods they have known since childhood. There they begin their desperate battle against the Nazis. Daniel Craig, Liev Schreiber and Jamie Bell star as brothers who turn a primitive struggle to survive...",Action
Death Race,"A penitentiary full of felons has inspired the jailers to create a grisly pastime ripe for lucrative kickbacks. Now, adrenalized inmates, a global audience hungry for televised violence and a spectacular arena come together to form the Death Race. Three-time speedway champion Jensen Ames is an expert at survival in the harsh landscape that has become our country. Just as he thinks he has turned his life around, the ex-con is framed for a gruesome murder he didn't commit. Forced to don the...",Action
Doubt,"John Patrick Shanley brings his Pulitzer Prize and Tony Award winning play to the screen as a gripping story about the quest for truth, the forces of change, and the devastating consequences of blind justice in an age defined by moral conviction.It's 1964, St. Nicholas in the Bronx. A vibrant, charismatic priest, Father Flynn (Academy Award® winner Philip Seymour Hoffman), is trying to upend the schools' strict customs, which have long been fiercely guarded by Sister Aloysius Beauvier...",Drama
Role Models,"Paul Rudd and Seann William Scott star in ""Role Models"" as Danny and Wheeler, two salesmen who trash a company truck on an energy drink-fueled bender. Upon their arrest, the court gives them a choice: do hard time or spend 150 service hours with a mentorship program. After one day with the kids, however, jail doesn't look half bad.",Comedy
Australia,"A romantic action-adventure set in northern Australia prior to World War II, AUSTRALIA centers on an English aristocrat (Kidman) who inherits a ranch the size of Maryland. When English cattle barons plot to take her land, she reluctantly joins forces with a rough-hewn cattle driver (Jackman) to drive 2000 head of cattle across hundreds of miles of the country's most unforgiving land, only to still face the bombing of Darwin, Australia by the Japanese forces that had attacked Pearl Harbor only...",Adventure
The Ruins,"A group of friends whose leisurely Mexican holiday takes a turn for the worse when they, along with a fellow tourist embark on a remote archaeological dig in the jungle, where something evil lives among the ruins.",Horror
" Angus, Thongs and Full-Frontal Snogging ","Based on Louise Rennison's 1999 best-selling young-adult novel, the story centers on a 16-year-old girl who keeps a diary about the ups and downs of being a teenager, including the things she learns about kissing.",Comedy
Bottle Shock,"The story of the early days of California wine making featuring the now infamous, blind Paris wine tasting of 1976 that has come to be known as ""Judgment of Paris"".",Comedy
Speed Racer,"Based on the classic 1960s series created by anime pioneer Tatsuo Yoshida that later was retooled for North American audiences, the big-screen film will follow the adventures of the young race car driver Speed in his quest for glory in his thundering gadget-laden vehicle, Mach 5. The movie will feature other characters from the show, including Speed's family and his mysterious archrival, Racer X.",Action
Eagle Eye,"“Eagle Eye” is a race-against-time thriller starring Shia LaBeouf, Michelle Monaghan, Rosario Dawson, Anthony Mackie and Billy Bob Thornton. Jerry Shaw (LaBeouf) and Rachel Holloman (Monaghan) are two strangers thrown together by a mysterious phone call from a woman they have never met. Threatening their lives and family, she pushes Jerry and Rachel into a series of increasingly dangerous situations – using the technology of everyday life to track and control their every move. As the...",Action
