title,plot,genre
she wore a yellow ribbon,"After Custer's defeat at the Little Big Horn, a US Cavalry Captain takes his troop out on a final patrol to handle a breakout from a nearby Indian reservation. His mission is further complicated by the commanding officer's wife and niece who accompany the patrol.",drama
the fighting kentuckian," Following Napoleon's Waterloo defeat and the exile of his officers and their families from France, the U.S.Congress, in 1817, granted four townships in the Alabama territory to the exiles. Led by Colonel Georges Geraud and General Paul DeMarchand, the struggling settlers have made a thriving community, called Demoplis, by the summer of 1819. On a shopping trip to Mobile, Fleurette DeMarchand, the General's daughter, meets John Breen, a Kentucky rifleman, who detours his regiment...",adventure
the fountainhead,"An uncompromising, visionary architect struggles to maintain his integrity and individualism despite personal, professional and economic pressures to conform to popular standards.",drama
the heiress,"Dull and plain Catherine (Olivia de Havilland) lives with her emotionally distant father, Dr. Sloper (Ralph Richardson), in 1840s New York. Her days are empty -- filled with little more than needlepoint. Enter handsome Morris Townsend (Montgomery Clift), a dashing social climber with his eye on the spinster's heart and substantial inheritance. William Wyler's Oscar-winning film is an adaptation of the Henry James novel Washington Square.",drama
a connecticut yankee in king arthur's court,"Hank Martin (Bing Crosby), an American mechanic, is knocked out and wakes up in the land of King Arthur. Here he finds romance with Alisande La Carteloise (nicknamed Sandy) played by Rhonda Fleming, and friendship with Sir Sagramore (nicknamed Clarence) played by William Bendix, and King Arthur played by Cedric Hardwicke as a semi-perpetual, cold-in-the-nose invalid. But unfortunately, the heroic Hank also finds danger and enmity with both Merlin and Morgan Le Fay as well.",comedy
a kiss for corliss,"After a brief encounter with the romantic and thrice divorced Kenneth Marquis, Corliss Archer decides to write in her diary that they are together in order to make her boyfriend Dexter jealous. Corliss' father had also served as attorney representing Kenneth Marquis' ex-wife during his most recent divorce trial. When Corliss and Dexter don't come home one evening until five in the morning, Corliss decides to pretend to have amnesia to avoid the inevitable punishment awaiting...",comedy
a letter to three wives,"Just as their boat sets off for the day, Deborah (Crain), Rita (Southern) and Lora Mae (Darnell) receive a letter from the alluring Addie Ross (narrator Celeste Holm) stating she has left town with one of their husbands. Each wife spends the fretful day pondering the state of her marriage and the affection each of their husbands has for Addie. By the end of the day, each woman is convinced she must surely be the betrayed wife.",drama
a woman's secret,"Susan is in the hospital with a bullet near her heart. Marian has told the police that she shot Susan in a rage as Susan was giving up singing. Marian and Luke found Susan when she was a failure. A singer with a limited range, she was a diamond in the rough which Marian and Luke taught how to walk, dress and talk. With the singing lessons, Marian had hoped that she would have the career that Marian would have had if she had not lost her voice. Even though Susan is a scatterbrain girl, Luke does...",drama
"abbott and costello meet the killer, boris karloff","Lost Caverns Hotel bellhop Freddie Phillips is suspected of murder. Swami Talpur tries to hypnotize Freddie into confessing, but Freddie is too stupid for the plot to work. Inspector Wellman uses Freddie to get the killer (and it isn't the Swami).",comedy
adam and evelyne," The father of a girl in an orphanage has been writing his daughter, who doesn't remember him, tales of his success in business. Actually, he is impersonating a friend, a handsome gambler. When the father dies, the gambler takes to girl from the orphanage and tells her the truth. But the girl is now a full-grown beauty and complications arise, including those provided by a black-sheep brother. Written by Les Adams <[email protected]> ",comedy
adam's rib,"Spencer Tracy and Katharine Hepburn play Adam and Amanda Bonner, a husband-and-wife attorney team, both drawn to a case of attempted murder.",comedy
all the king's men,"All The King's Men is the story of the rise of politician Willie Stark from a rural county seat to the spotlight. Along the way, he loses his initial innocence, and becomes just as corrupt as those who he assaulted before for this characteristic. Also included is the romance between one of his ""right hand women"" and the up-and-coming journalist who brings Stark to prominence.",drama
always leave them laughing,"Director Roy Del Ruth's 1949 film, about a self-absorbed comedian who steps all over his friends and colleagues in order to achieve success, stars Milton Berle, Virginia Mayo, Ruth Roman, Bert Lahr and Alan Hale.",comedy
batman and robin," Antisocial Prof. Hammil's Remote Control device, which enables the user to take over any motor vehicle within 50 miles (!), is stolen by The Wizard, black-hooded mastermind, and his gang. Batman and Robin (who drive about in a standard convertible) must prevent the Wizard from obtaining diamonds, needed as fuel for the device, and rescue magazine photographer Vicki Vale from periodic perils. Where is the Wizard's base, reached only by remote controlled submarine? Which of several...",action
battleground,"The film concentrates on the camaraderie and the divisions between the troops as they ready for the big offensive. Told in a taut narrative, the men of the 101st, led by Van Johnson, wait out the winter in the Ardennes forest to confront the German army in what would be the last major offensive of World War II. The men are demoralized and trapped, with no hope of support from the Allies.",action
beyond the forest,"""What a dump!"" That's the classic line delivered by Bette Davis at the halfway point of Beyond the Forest, her final Warner Bros. effort of the 1940s. Some Davis devotees feel as though this vituperative utterance is the high point of an otherwise turgid melodrama; others consider the line a succinct assessment of the entire film.",drama
blondie hits the jackpot," Through his blundering intervention in a party date set up by his boss for his son, resulting for the loss of a contract, Dagwood loses his job once again. Dagwood gets a construction job on a site for the lost client, and discovers the workmen are using faulty material on the job. He tells Blondie. Blondies takes over, and sets out to set matters right. Written by Les Adams <[email protected]> ",comedy
"bomba, the jungle boy","George Harland and his daughter Pat are photographers who discover a wild boy in the jungle. When Pat becomes lost, Bomba brings her back, overcoming plagues of locusts, forest fires and fierce wild animals.",adventure
canadian pacific,A surveyor for the Canadian Pacific Railroad must fight fur trappers who oppose the building of the railroad by stirring up Indian rebellion.,adventure
caught,"It was her childhood dream come true. She had married a man worth millions. But her innocent dream became a tormented nightmare once she realized the truth about her husband. He was more than a millionaire, he was absolutely insane!",drama
champion,"An unscrupulous boxer fights his way to the top, but eventually alienates all of the people who helped him on the way up. One of the all-time great boxing movies. Academy Award Nominations: 6, including Actor--Kirk Douglas, Best Screenplay. Academy Awards: Best Film Editing.",drama
chicago deadline,"On Chicago's South Side reporter Ed Ames finds the body of a dead girl. Her address book leads to a host of names of men frightened by her death but claiming never to have known her. Ames comes to know quite a lot, dangerously so.",drama
come to the stable,"1949 film from 20th Century Fox that was nominated for numerous Oscars including Loretta Young for best Actress and Celeste Holm and Elsa Lanchester for best Supporting Actress. It is a simple, reverent story of French nuns and their powerful faith as they push New Englanders toward funding a new hospital. Old-fashioned and tedious by the standards of today, it ought to be remembered if only for it's Oscar nominations (none of which earned a an Oscar).",drama
conspirator," On a visit to London, 18 year-old American Melinda Greyton goes to her first party, a Regimental ball. There she meets and falls madly in love with Major Michael Curragh, a handsome bachelor who returns her affections. After a relatively short period of time, they marry and all is bliss. Michael has some peculiar habits such as when he gets upset when Melinda sends an old overcoat out for cleaning or when she takes a few £1 notes from his wallet. In fact, Michael is a Communist spy and...",thriller
crows and sparrows,"At a Shanghai apartment, Mr Hou, a Nationalist official, gets ready to move to Taiwan upon the imminent defeat of the KMT during the Civil War. Mrs Hou gives an ultimatum to the rest of the tenants to move out on behalf of her husband, who is the ""owner"" of the flat and who is now planning to sell it. From the conversations with the rest, we find out that Hou has been a Hanjian during the Sino-Japanese War and that he has since taken over the apartment by force from the old landlord, Mr Kong. ...",drama
down to the sea in ships,A re-make of the 1922 silent film that details the lives of the people in a small Quaker community and the adventures of a whaling ship.,action
easy living,"A football halfback (Victor Mature) has a heart condition, a nagging wife (Lizabeth Scott) and a team secretary (Lucille Ball) who loves him.",drama
"edward, my son","Following the death of his only son, a ruthless businessman reflects on his life, his unhappy marriage and his questionable parenting skills. Released in 1949, starring Spencer Tracy and Deborah Kerr.",drama
fighting fools,"The boys are working at the local boxing arena where their friend, Jimmy Higgins, is boxing. During a crooked match Jimmy is killed. The boys seek out his older brother, Johnny, a former boxer who gave up the sport rather than go crooked, and help train him to get back in the ring. They try to get him a shot at the title, and when they do the same crooked gangsters that were behind Jimmy's death try to get Johnny to take a dive.",drama
flame of my love," A woman's struggle for equality in Japan in the 1880s. Eiko Hirayama leaves Okayama for Tokyo, where she helps the fledgling Liberal Party and falls in love with its leader Kentaro Omoi, just as the party is being disbanded by the government. Eiko and Omoi are jailed because of a fire at a factory instigated by Chiyo, a servant girl from Eiko's home in Okayama, who was sold to slavery. A few years later the 1889 constitution is proclaimed, Eiko, Omoi, and Chiyo are pardoned, and the...",drama
forgotten women,"A tale of three women who hang out in a bar and bend the ear of Harry the bartender. Kate Allison drinks to forget playboy Andy Emerson, whom she might have married if her husband, John Allison hadn't come home before the divorce was final, which is no big deal as actors Norris and Douglas were pretty much interchangeable anyway; Ruth Marshall is reunited with husband Richard Marshall on the pleas of their son in the divorce court of Judge Donnell; and Clair Dunning makes up with husband Bill...",drama
gigi,"Gilberte is a sixteen year old girl raised by her aunt and grandmother to be a demimondaine. But she's not ready for that yet, and spends her days in lessons and in teasing Mamita's old friend, the rich playboy Gaston LaChaille, and following his affairs from afar. But when Gaston throws off his latest mistress, it looks as if Gigi just might be ready to begin her destined career.",comedy
hideout,"Philip Ford's crime thriller stars Lloyd Bridges as a city attorney who comes to the dawning realization that a jewelry heist may be behind the discovery of a dead body in the park -- and that the culprit may be one of the town's leading citizens (Ray Collins). Unfortunately, his investigation is hampered by his girlfriend and ex-secretary (Lorna Gray), who could very well be in cahoots with the bad guys.",thriller
hold that baby!,Slip (Leo Gorcey) and Sach (Huntz Hall)lose their jobs with a laundry company after they wreck the delivery truck. They talk Louie (Bernard Gorcey) into using the back room of his Malt Shop..,drama
holiday affair," Just before Christmas, department store clerk Steve Mason meets big spending customer Connie Ennis, really a commercial spy. He unmasks her but lets her go, which gets him fired. They end up on a date, which doesn't sit well with Connie's steady suitor, Carl, but delights her son Timmy, who doesn't want Carl for a step-dad. Standard (if sweet) romantic complications follow. Written by Rod Crawford <[email protected]> ",comedy
home of the brave," A sensitive, educated black man's World War II-time problems. This is essentially the duplicate of his peace-time problems which are pointed up in a flashback of his life, and primarily of his war-time adventures with four white soldiers on a dangerous reconnaissance mission on a Japanese-held island. Written by alfiehitchie ",drama
house of strangers,"Gino Monetti is a ruthless Italian-American banker who engaged in a number of criminal activities. Three of his four grown sons, refuse to help their father stay out of prison after he's arrested for his questionable business practices. Three of the sons take over the business but kick their father out. Max, a lawyer, is the only son that stays loyal to his father.",drama
i pirati di capri," A group of men calling themselves 'The Pirates of Capri"", headed by Captain Sirroco, who is really Count Amalfi, are trying to restore freedom to the people of Naples in 1779. The Queen is advised of the pirate's assault of a member of her court and she seeks to escape to Palermo. But, she is advised it would be good politics for her to attend a ball Amalfi is giving for his fiancée, Mercedes, who is unaware of the dual role Amalfi is playing. Written by Les Adams...",adventure
i shot jesse james," While the law hunts him, Jesse James lives quietly in a rented house on the corner of Lafayette and Twenty-first street in St. Joseph, Missouri, under the alias of Tom Howard. His wife Zee begs him to end his association with the Ford brothers. Before they can leave on a ""last"" bank holdup, Bob learns that his childhood sweetheart, Cynthy Waters, now an actress, is in St. Joe and he brushes aside all caution to see her. Cynthy is beginning to realize that she is a liability to her...",drama
i was a male war bride,"Captain Henri Rochard is a French officer assigned to work with Lieut. Catherine Gates. Through a wacky series of misadventures, they fall in love and marry. When the war ends, Capt. Rochard tries to return to America with the other female war brides. Zany gender-confusing antics follow.",comedy
illegal entry,"Long before he became producer/director of The Tonight Show, Fred DeCordova helmed the Universal meller Illegal Entry. Howard Duff, who later worked with DeCordova on the TV series Mr. Adams and Eve, stars as Bert Powers, an undercover agent for the U.S. Department of Immigration. While attempting to bring a vicious gang of alien smugglers to justice, Powers falls in love with Anna Duvak (Marta Toren), a gang member who is Not What She Seems.",action
in the good old summertime,"In this musical remake of The Shop Around the Corner, feuding co-workers in a small music shop do not realize they are secret romantic pen pals.",comedy
intruder in the dust," Rural Mississippi in the 1940s: Lucas Beauchamp, a local black man with a reputation of not kowtowing to whites, is found standing over the body of a dead white man, holding a pistol that has recently been fired. Quickly arrested for murder and jailed, Beauchamp insists he's innocent and asks the town's most prominent lawyer, Gavin Stevens, to defend him, but Stevens refuses. When a local boy whom Beauchamp has helped in the past and who believes him to be innocent hears talk of a...",drama
it happens every spring,A college professor is working on a long term experiment when a baseball comes through the window destroying all his glassware. The resultant fluid causes the baseball to be repelled by wood. Suddenly he realizes the possibilities and takes a leave of absence to go to St. Louis to pitch in the big leagues where he becomes a star and propels the team to a World Series appearance.  - Written byJohn Vogel <[email protected]> ,comedy
jour de fête,"Jour de fête tells the story of an inept and easily-distracted French mailman who frequently interrupts his duties to converse with the local inhabitants, as well as inspect the traveling fair that has come to his small community. Influenced by too much wine and a newsreel account of rapid transportation methods used by the United States postal system, he goes to hilarious lengths to speed the delivery of mail while aboard his bicycle.",comedy
kind hearts and coronets,"Louis Mazzini's mother belongs to the aristocratic family D'Ascoyne, but she ran away with an opera singer. Therefore, she and Louis were rejected by the D'Ascoynes. Once adult, Louis decides to avenges his mother and him, by becoming the next Duke of the family. Murdering every potential successor is clearly the safest way to achieve his goal.",comedy
king of the rocket men,"Prof. Millard pretends to be dead and helps Jeff King ferret out Vulcan, the evil traitor at the science academy. Donning his Rocket Man costume King goes from one hair raising rescue to the next in order to keep the newly invented Decimator out of the clutches of Vulcan and his minions.  - Written byRandy Spencer <[email protected]> ",action
late spring,"Noriko is 27 years old and still living with her widowed father. Everybody tries to talk her into marrying, but Noriko wants to stay taking care of her father.",drama
love happy," Young hopefuls trying to stage a Broadway show on a shoestring are sustained with food by expert shoplifter Harpo. They little suspect that his donations include the special sardine can hiding the Romanoff diamonds! Slinky Madame Egelichi and her henchmen will do anything to get them back, but the Marx Brothers lead them a merry chase. Written by Rod Crawford <[email protected]> ",comedy
ma and pa kettle,"The Kettles and their fifteen children are about to be evicted from their rundown rustic home when Pa wins the grand prize by coming up with a new tobacco slogan. Birdie Hicks is jealous of the family's new wealth, which includes a completely automated modern home, and accuses Pa of stealing the slogan. Reporter Kim Parker proves Birdie wrong and marries Tom Kettle.",comedy
madame bovary," French author Gustave Flaubert is on trial for writing the ""indecent"" novel ""Madame Bovary."" To prove that he wrote a moral tale, Flaubert narrates the story of beautiful Emma Bovary, an adulteress who destroyed the lives of everyone she came in contact with. Written by Daniel Bubbeo <[email protected]> ",drama
malaya," After living abroad for several years, journalist John Royer returns to the United States just after the U.S. enters World War II. His boast that he could easily smuggle rubber, a key wartime natural resource, out of Malaya has him tasked with doing just that. He manages to get someone from his past, Carnaghan, sprung from Alactraz and together they head off to South East Asia posing as Irishmen. Once there, Carnaghan lines up some of his old cronies and with Royer and a few plantation owners...",adventure
malice in the palace," Set in a desert land where the stooges run a restaurant, the boys set out to recover the stolen Rootin Tootin diamond after they learn from the thieves that the Emir of Shmo has absconded with the contraband jewel. They journey to the stronghold of Shmo where they disguise as Santa Clauses and scare the ruler into giving them the diamond. Written by Mitch Shapiro <[email protected]> ",comedy
master minds,"When Sach eats too much sugar, he goes into a trance whereby he's able to predict the future. Slip tries to make some money off of Sach by using him as a fortune teller in a carnival, until a mad scientist kidnaps Sach to use him in an intelligence-switching experiment with a monster.",horror
mighty joe young,"Seven-year-old Jill Young is a lonely little girl living on her fathers farm in Africa. One day she barters for a pet/friend: a baby gorilla carried by two African natives. Twelve years later, a New York nightclub entrepreneur, Max OHara, plans to open an African-themed nightclub in Hollywood. Gregg Johnson, a champion roper from Oklahoma, whose rodeo just closed locally, visits to ask to go to Africa with OHara, who agrees, having come up with the idea of having the cowboy lasso lions. In...",adventure
miss grant takes richmond," A bookie uses a phony real estate business as a front for his betting parlor. To further keep up the sham, he hires dim-witted Ellen Grant as his secretary figuring she won't suspect any criminal goings-on. When Ellen learns of some friends who are about to lose their homes, she unwittingly drafts her boss into developing a new low-cost housing development. Written by Daniel Bubbeo <[email protected]> ",comedy
neptune's daughter,"Scatterbrained Betty Barrett mistakes masseur Jack Spratt for Jose O'Rourke, the captain of the South American polo team. Spratt goes along with the charade, but the situation becomes more complicated when they fall in love. Meanwhile, Betty's sensible older sister Eve fears Betty's heart will be broken when Jose returns to South America. She arranges to meet with the real O'Rourke and love soon blossoms between them as well.",comedy
never fear,A dancer who has just gotten engaged to her partner and choreographer and is about to embark on a major career is devastated to learn that she has contracted polio.,drama
not wanted," Twentyish Sally Kelton is unhappy at home and in the drab town in which she lives, until she meets roving musician Steve Ryan. Sally falls for Steve, but to Steve, she's just another fling before he heads to another town. Sally decides to ""pull up stakes"" and heads on a bus to Steve's next stop. On the road, she meets Drew Baxter, owner of a gaseteria in the town where she's heading. Drew sets Sally up with a room at a local boarding house and a job at his business....",drama
occupe-toi d'amélie !,"Young Amélie is currently enjoying life as the kept woman of her reasonably well off boyfriend Étienne. But when Étienne is called off for military duty, he enlists his playboy friend Marcel to keep an eye on her....something of a problem seeing that he is currently looking for a woman with which to create a sham marriage so he can quickly inherit a large sum of money from his father. Then suddenly the Prince of Palestra enters into the picture and boldly asks for Étienne's romantic favors...",comedy
outpost in morocco," Capt. Gerard, greatest lover in the Foreign Legion, is assigned to escort an emir's daughter to her father's mountain citadel and find out what he can about the emir's activities. Gerard enjoys his work with lovely Cara, but arrives to find rebellion brewing. Can the garrison be reinforced in time? Written by Rod Crawford <[email protected]> ",action
passport to pimlico,"During the bombing a document and treasure is found that makes the residents of Pimlico, a borough of London, declare independence. The government has other ideas.",comedy
prince of foxes,"In 1500, Duke Cesare Borgia hopes to marry his sister (widowed by poison) to the heir apparent of Ferrara, which impedes his conquest of central Italy. On this delicate mission he sends Andrea Orsini, his sister's lover and nearly as unscrupulous as himself. En route, Orsini meets Camilla Verano, wife of the count of Citta' del Monte (Borgia's next intended conquest); and sentiment threatens to turn him against his deadly master, whom no one betrays twice...",adventure
prison," A movie director is approached by his old math teacher with a great movie idea: the Devil declares that the Earth is hell. The director rejects the idea, but subsequent events in the life of a writer, a friend of the director's, and a young prostitute he loves seem to prove the math teacher's idea. Written by Erik Gregersen <[email protected]> ",drama
rabbit hood,"While unwittingly trespassing in the royal gardens in search of carrots, Bugs runs afoul of the Sheriff of Nottingham, who tries to apprehend him for poaching. The royal grounds are, in fact, amply posted with ""No Poaching"" signs (one sign reads ""Not even an egg""), but Bugs either didn't see or ignored them. Of course, Bugs sets out to endlessly turn the tables on the hapless Sheriff, at one point talking him into building a six-room two-door home in the middle of the King's...",animation
roseanna mccoy,"It's the Hatfields vs. the McCoys in this 1949 film, with Farley Granger and Joan Evans as the hillbilly Romeo and Juliet whose forbidden romance rekindles a long-standing feud between their respective families.",drama
rusty saves a life,"The eponymous doggie hero, portrayed by a very busy canine thespian named Flame, does exactly what the film's title says he does. But before this prophecy can be fulfilled, the story spends a great deal of time with young Danny Mitchell (Ted Donaldson), who briefly turns to juvenile delinquency when he's denied an expected inheritance",drama
