title,plot,genre
penny serenade,"A light-hearted romantic drama starring Cary Grant & Irene Dunne as a couple who meet, fall in love, quarrel and reunite. While listening to a recording of ""Penny Serenade"", Julie Gardiner Adams (Irene Dunne) begins reflecting on her past. She recalls her impulsive marriage to newspaper reporter Roger Adams (Carey Grant), which begins on a deliriously happy note but turns out to be fraught with tragedy. Other songs remind her of their courtship, their marriage, their desire for a child, and...",drama
pot o' gold,"Filled with great musical numbers and a thoroughly amusing storyline, Jimmy Stewart plays a small-town music lover who reluctantly travels to the city to help his uncle run the family business. Once there, he falls for the daughter of a rival family (think: Hatfields and McCoys), unbeknownst to both parties. That is, until a live radio broadcast ends up getting everyone into trouble! Also starring Paulette Goddard, Charles Winninger (who is hilarious as Uncle Charlie) and bandleader Horace...",comedy
princess iron fan,"The story was liberally adapted from a short sequence in the popular Chinese folk tale Journey to the West. Princess Iron Fan is a main character. Specifically, the film focused on the duel between the Monkey King and a vengeful princess, whose fan is desperately needed to quench the flames that surround a peasant village.",animation
riders of death valley," Promoted and advertised as ""The Million Dollar Serial"", most of which appears to have been spent on advertising and the most elaborate pressbook ever put out by Universal on a serial (or 95% of their feature films for that matter), Universal's 51st sound-era serial (following ""Sky Raiders"" and before ""Sea Raiders"" and, to quote the late Oliver Drake who wrote the original story,...""we were lucky they didn't call it 'Land Raiders'),...",action
ringside maisie," Young undefeated boxer Terry Dolan, who's been lying to his invalid mother about his career, confides to Maisie that he hates and is terrified by boxing and wants out. Not wanting to let down his best friend and manager Skeets Maguire, who has hopes of him becoming the next champion, he is reluctant to bring up the subject with him. Maisie convinces Terry to tell Skeets, whose unexpected reaction induces him to step into the ring again. Written by Doug Sederberg...",comedy
road show,"Rich playboy Drogo Gaines is in imminent danger of marrying a gold digger, and escapes by feigning insanity. The joke's on him when he wakes up in an asylum full of comical lunatics. There he befriends Colonel Carraway, and together they escape, catching a ride with a beautiful blonde who proves to be Penguin Moore, carnival owner.",comedy
sea raiders,"The Sea Raiders, a band of foreign agents, led by Carl Tonjes and Elliott Carlton, blow up a freighter on which Billy Adams and Toby Nelson are stowaways, seeking to avoid Brack Warren, a harbor patrol officer assigned to guard a new type of torpedo boat built by Billy's brother, Tom Adams. Intended targets or not, getting blown up does not set well with Billy and Toby and, together with their gang coupled with the members of the Little Tough Guys, they find the Sea Raiders'...",action
sheriff of tombstone," The mayor has sent for a gunslinger who, though appearing to clean up the town, is really to be the mayor's means of taking the town over. When Roy and Gabby arrive in Tombstone, Roy is mistaken for the gunslinger. Just as Roy is ready to expose the mayor, the real gunslinger shows up. Written by Ed Stephan <[email protected]> ",comedy
sis hopkins," A young girl from the ""sticks"" comes to the city to live with her wealthy relatives. At first she is the objection of derision and made fun of because of her unsophisticated nature, but it turns out that there's a bit more to her than most of her snooty relatives and their condescending friends think. Written by [email protected] ",comedy
sky raiders," Former World War One ace Captain Bob Dayton (Donald Woods), with his buddy, Lieutenant Ed Carey (Robert Armstrong), operates Sky Raiders Inc., an airplane manufacturer. Dayton has perfected a fast pursuit plane intended for the U.S. Army. But Felix Lynx (Eduardo Ciannelli), an agent for a foreign government, has a spy in the Sky Raiders office that keeps him informed about the new airplane. Written by Les Adams <[email protected]> ",action
skylark,"As her fifth wedding anniversary approaches, a woman realizes that she is fed up with always coming in second to her husband's advertising business. Just at the moment when she is trying to decide what to do, she meets a handsome attorney, and their innocent flirtation begins to turn into something a bit more serious.",comedy
south american george,"To help out his exact double, George Formby (in a dual role) takes the place of a noted South American tenor. This way he can help the opera star fulfill contract obligations and also win the heart of the man's lovely press agent, Linden Travers.",comedy
spooks run wild,"The boys are sent to a mountain camp. Stranded in a small rural town, they hear about a ""monster killer"" roaming the countryside. At night, they sneak out. Peewee is shot by a grave-digger, and they are forced to seek aid at an old mansion. The owner of the mansion (Lugosi), insists that the boys spend the night. After seeing PeeWee walk around the house in a trance, the boys decide that the man turned him into a zombie. They gang up on him and tie him up. The nurse at the boys camp (Dorothy...",horror
sullivan's travels,"Sullivan is a successful, spoiled, and naive director of fluff films, with a heart-o-gold, who decides he wants to make a film about the troubles of the downtrodden poor. Much to the chagrin of his producers, he sets off in tramp's clothing with a single dime in his pocket to experience poverty first-hand, and gets a reality shock...",adventure
sun valley serenade,"Skating star Sonja Henie and the Glenn Miller Orchestra share the spotlight in Sun Valley Serenade. Henie plays a Norwegian refugee adopted by band pianist John Payne, who mistakenly thought that the full-grown Miss Henie was a 10-year-old little girl. Payne's girlfriend, Lynn Bari, is a soloist with the Miller band, and also a violently jealous sort. When Bari quits Miller out of pique, Henie stages an elaborate ice show as a substitute. This impromptu spectacular thrills the audience at the...",comedy
superman," When Lois is kidnapped by a mad scientist, she is given a demonstration of his energy cannon as he attacks Metropolis. Only Superman can stop it in his first cinematic adventure Written by Kenneth Chisholm <[email protected]> ",animation
tarzan's secret treasure,A scientific expedition happens to discover that gold exits on Tarzan's escarpment. The villainous Medford and Vandermeer kidnap Jane and Boy to extort from Tarzan the location of the gold. Everyone is captured by wicked natives. Tarzan and his elephants rush to the rescue.,action
that hamilton woman,"Sir William Hamilton, a widower of mature years, is British ambassador to the Court of Naples. Emma who comes for a visit with her mother wouldn't cut the grade with London society but she gets along well with the Queen of Naples. Emma likes being Lady Hamilton and life goes smoothly until Lord Nelson pays a visit. Sir William decides at first to let his young wife have her fling and pretends not to know what is going on. But the real life lovers, whose first screen romance was in ""Fire Over...",drama
that night in rio," An entertainer in Rio impersonates a wealthy aristocrat. When the aristocrat's wife asks him to carry the impersonation further, complications ensue. Written by Ed Stephan <[email protected]> ",comedy
that uncertain feeling,"Against her better judgement, happily married Jill Baker is persuaded to see a popular psychoanalyst about her psychosomatic hiccups. Soon, she's disillusioned about husband Larry; and one day in the doctor's waiting room she meets pianist Alexander Sebastian, who's even more confused than she is. Can this marriage be saved? Larry has a plan that is pure Lubitsch...  - Written byRod Crawford <[email protected]> ",comedy
the 47 ronin," Lord Asano resists a bribery attempt by a member of the Shogun's court. His honesty, however, is useless against the corruption of the administration, and he is forced to commit harakiri. His samurai retinue are dispersed as masterless ronin. The leader of the samurai, Oichi, plots with a loyal band of ronin to seek revenge for their master's dishonor. Written by Jim Beaver <[email protected]> ",action
the bad man,"Lopez is a bandit who has stolen the herd at Gil's ranch, so Hardy is about to foreclose. But Lucia has come back from New York and Gil is happy until he meets her husband, Morgan.",comedy
the black cat," Greedy heirs gather to wait for the death of Henrietta Winslow. Murder, thunder claps, howling cats, gun shots, screams in the night, hidden passages -- all the proper ingredients. Written by Ed Stephan <[email protected]> ",comedy
the bride came c.o.d.," Oil heiress Joan is going to elope with bandleader Allen whom she's known four days. Out-of-money pilot Steve is going to fly them to Nevada but makes a deal with her father to deliver her home unmarried. He flies off with her, an apparent kidnaping, but is forced down in the desert. The bandleader arrives with a preacher, but their marriage (in California, not Nevada) is not valid. Pilot Steve will marry her because her father is a millionaire. Written by Ed Stephan...",comedy
the chocolate soldier,"Maria and Karl Lang are the singing duo of Vienna. Maria is very flirtatious and Karl very jealous. Karl decides to masquerade as a Russian guardsman and attempts to make Maria flirt with him - to test her loyalty to him - as the Russian, Karl makes a vigorous attempt to seduce Maria. For a moment she accepts then rejects. Karl is left in turmoil...",comedy
the corsican brothers,"The bloody hostility of two noble families on Corsica determines the destiny of two brothers who were divided - as Siamese twins born, successfully operated and apart grown up - by the love to a woman. In the revenge against the murderers of her parents they join.",adventure
the devil and miss jones,"The wealthiest man in the world, John P. Merrick, is a private person who likes to stay anonymous. One of his many assets, so small that he didn't even knew that he owned it, is Neeley's Department Store. There is labor unrest at the store, and the employees' anger is directed at Merrick, who they hang in effigy outside the store despite not knowing what he looks like. Merrick, not happy at what he sees going on, decides to mete out the rabble-rousers. So he goes undercover as a sales clerk,...",comedy
the devil commands," Dr. Julian Blair is engaged in unconventional research on human brain waves when his wife is tragically killed in a freak auto accident. The grief-stricken scientist becomes obsessed with redirecting his work into making contact with the dead and is not deterred by dire warnings from his daughter, his research assistant, or his colleagues that he is delving into forbidden areas of knowledge. He moves his laboratory to an isolated New England mansion where he continues to try to reach out to...",horror
the flame of new orleans," French farce comes to the New World in 1840 as Claire Ledoux convinces the middle-aged banker who is her fiance that she is two different women -- a deception made necessary by the arrival of a man acquainted with the swath she cut across Europe. Giraud has been about to foreclose on a $150 loan made to a sea captain who needed the funds to court Claire. Get Claire's ""cousin"" out of New Orleans before the wedding, Giraud tells the sea captain and the debt will be paid. Written...",comedy
the great lie," Sandra and Pete elope but their marriage is invalid since she's not yet divorced. Sandra is, however, pregnant by Pete. Pete marries his former fiancée Maggie, then flies to South America where his plane crashes. Maggie pays Sandra to let her adopt Pete's baby. Pete returns ""from the dead"". Sandra and Maggie contend for Pete and the baby. Written by Ed Stephan <[email protected]> ",drama
the lady eve,"Returning from a year up the Amazon studying snakes, the rich but unsophisticated Charles Pike meets con-artist Jean Harrington on a ship. They fall in love, but a misunderstanding causes them to split on bad terms. To get back at him, Jean disguises herself as an English lady, and comes back to tease and torment him.",comedy
the lone rider crosses the rio," In the second film of this 17-film series (whis was followed by ""The Lone Rider in Ghost Town"" and not one of the 1943 films as somebody seems to think), Tom Cameron and ""Fuzzy"" Jones, running from a Texas sheriff's posse, on a frame-up charge, disguise themselves and cross the Rio Grande into Mexico. The Mexican Rurales arrest Tom as being the notorious bandit, El Puma, as charged by Jarvis, but the town mayor, Torres, an old friend of Tom's, laughs at the idea...",romance
the reluctant dragon,"Humorist Robert Benchley attempts to find Walt Disney to ask him to adapt a short story about a gentle dragon who would rather recite poetry than be ferocious. Along the way, he is given a tour of Walt Disney Studios, and learns about the animation process.  - Written byAnonymous ",animation
the sea wolf," Humphrey van Weyden, a writer, and fugitives Ruth Webster and George Leach have been given refuge aboard the sealer ""Ghost,"" captained by the cruel Wolf Larsen. The crew mutinies against Larsen's many crimes, and though van Weyden, Ruth, and George try to escape Larsen's clutches, they find themselves drawn inexorably back to him as the ""Ghost"" sails toward disaster. Written by Jim Beaver <[email protected]> ",drama
the story of the fox," In the kingdom of animals, Master Fox is used to trick and fool everyone. So the King, the Lion, receives more and more complaints about him. He orders that Master Fox is arrested and brough to him... One of the first animation film with puppets. The story is taken from a from a French medieval fable. Written by Yepok ",animation
three girls about town," Faith and Hope Banner, sisters, are ""convention hostesses"" in a hotel. A body is discovered next door as the magician's convention is leaving and the mortician's convention is arriving, and the sisters, with help from manager Wilburforce Puddle, try to hide it. Complicating matters, Hope's boyfriend, Tommy, is a newspaper reporter in the hotel covering some labor negotiations. Written by Jon Reeves <[email protected]> ",adventure
tom dick and harry," Ginger Rogers, a telephone operator, is pursued by George Murphy (a down-to earth fellow), Alan Marshal (a rich man) and Burgess Meredith (a noncomformist). She dreams what life would be life married to each of them. Written by Jack McKillop <[email protected]> ",comedy
topper returns,"Topper is once again tormented by a fun-loving spirit. This time, it's Gail Richards, who was accidentally murdered while vacationing at the home of her wealthy friend, Ann Carrington (Landis), the intended victim. With Topper's help, Gail sets out to find her killer with the expected zany results.",comedy
two-faced woman,"While at a ski lodge, Larry Blake sees instructor Karin Borg and decides to sign up for private lessons. The next thing he knows, she is Mrs. Blake. When he announces that he is going back to work on his magazine in New York the next day, Karin refuses to go with him. She later comes to New York, buys expensive clothes, and goes to meet him when she sees he is with old flame Griselda. Caught by Blake's business partner, O.O. Miller, before she can leave, she explains that she is really Karin's...",comedy
underground,"A World War II Hollywood propaganda film detailing the dark underside of Nazism and the Third Reich set between two brothers, Kurt and Erik Franken, whom are SS officers in the Nazi party. Kurt learns and exposes the evils of the system to Erik and tries to convince him of the immoral stance that marches under the symbol of the swastika.",adventure
washington melodrama,"An elderly businessman (Frank Morgan) plans what he thinks is an innocent night on the town while his wife is away. Instead, he finds himself involved in a showgirl's murder.",drama
week-end in havana," A ship company employee, Jay Williams, is sent to Florida where one of the company cruise ships is stuck on a reef off of the coast. He obtains waivers from all of the passengers with the exception of Nan Spencer, a department store salesgirl who wants her vacation NOW, not later. Jay is instructed to take Nan to Havana and set her up in the best hotel and keep her entertained. She visits a night club where the star attraction is Rosita Rivas, and meets Rosita's worthless manager, Monte...",comedy
weekend for three,"A young married couple's weekend is interrupted by the arrival of a brash, loud-mouthed acquaintance of the wife, who knew her before her marriage. He immediately proceeds to turn their life upside-down, despite their best efforts to politely get rid of him. Complications ensue.  - Written by[email protected] ",comedy
whistling in the dark,"The operators of 'Silver Haven', a cultish group bilking gullible rich people out of money, is set to inherit a large sum after the deceased woman's heir also dies. Leader Joesph Jones decides to hurry the process along and kidnaps Wally Benton, his fiancé, and a friend, to further this goal. Wally, 'The Fox', is a radio sleuth who solves murders on the air. Jones wants him to devise a perfect murder, and isn't above killing others sloppily along the way to get his foolproof murder plot.",comedy
you belong to me," On a ski trip, rich, idle Peter Kirk pursues and falls (literally) for Helen Hunt, M.D. After a courtship of hypochondria, she agrees to marry him on the condition that she continue to practice medicine. But will jealous Peter be able to reconcile himself to his wife's seeing male patients? Written by Rod Crawford <[email protected]> ",comedy
ziegfeld girl,"Discovery by Flo Ziegfeld changes a girl's life but not necessarily for the better, as three beautiful women find out when they join the spectacle on Broadway: Susan, the singer who must leave behind her ageing vaudevillian father; vulnerable Sheila, the working girl pursued both by a millionaire and by her loyal boyfriend from Flatbush; and the mysterious European beauty Sandra, whose concert violinist husband cannot endure the thought of their escaping from poverty by promenading her glamor...",drama
