title,plot,genre
sands of iwo jima,"The relationship between Sergeant Stryker and a group of rebellious recruits is made difficult by the Sergeant's tough training tactics. At Tarawa, the leathernecks have a chance to see Stryker in action, and begin to appreciate him.",action
siren of atlantis,"Two Foreign Legion soldiers, Jean (Dennis O'Keefe) and Andre (Jean Pierre Aumont), accidentally discover the famed lost continent of Atlantis. Bewitched by the sultry, beauty of the Queen of Atlantis (Maria Montez) the two men vie for her affections; little realising that her previous lovers have been embalmed into statues that line the passages of her kingdom.",adventure
slattery's hurricane," A pilot wants a life of ease, flying for drug smugglers and looking the other way until his conscience is tweaked by a woman he has misused. The story unfolds in flashbacks as the pilot battles the storm and recalls his failures, including a love affair with the wife of his best friend. Written by Ed Lorusso ",drama
take me out to the ball game," The Wolves baseball team gets steamed when they find they've been inherited by one K.C. Higgins, a suspected ""fathead"" who intends to take an active interest in running the team. But K.C. turns outs to be a beautiful woman who really knows her baseball. Second baseman Dennis Ryan promptly falls in love. But his playboy roommate Eddie O'Brien has his own notions about how to treat the new lady owner and some unsavory gamblers have their own ideas about how to handle Eddie. ...",comedy
task force,"After learning the finer points of carrier aviation in the 1920s, career officer Jonathan Scott and his pals spend the next two decades promoting the superiority of naval air power. But military and political ""red tape"" continually frustrate their efforts, prompting Scott to even consider leaving the Navy for a more lucrative civilian job. Then the world enters a second World War and Scott finally gets the opportunity to prove to Washington the valuable role aircraft carriers could play in...",drama
tell it to the judge,"Marsha Meredith, an attorney-at-law, is nominated for a Federal judgeship, but her nomination is opposed by a 'Good-Government' group who think her divorce makes her unfit for the job. This evolves into situations, happening in Flordia, New England, Washington D.C. and the Adirondacks, such as the misunderstood husband trying to win back his wife, and the misunderstood wife trying to make her husband jealous, and one case of mistaken identity after another, after another. ...",comedy
that forsyte woman,"Soames and Irene Forsyte have a marriage of convenience. Young Jolyon Forsyte is a black sheep who ran away with the maid after his wife's death. Teenager June Forsyte has found love with an artist, Phillip Bosinny. The interactions between the Forsytes and the people and society around them is the truss for this love story set in the rigid and strict times of the Victorian age.",drama
the adventures of ichabod and mr. toad,"The Wind in the Willows: Concise version of Kenneth Grahame's story of the same name. J. Thaddeus Toad, owner of Toad Hall, is prone to fads, such as the newfangled motor car. This desire for the very latest lands him in much trouble with the wrong crowd, and it is up to his friends, Mole, Rat and Badger to save him from himself. - The Legend of Sleepy Hollow: Retelling of Washington Irving's story set in a tiny New England town. Ichabod Crane, the new schoolmaster, falls for the town beauty,...",animation
the barkleys of broadway,"Josh (Astaire) and Dinah (Rogers) Barkley are a successful musical-comedy team, known for their stormy (but passionate) relationship. Dinah feels overshadowed by Josh, and limited by the lighthearted musical roles he directs her in, and decides to stretch her skills by taking a role in a serious drama, directed by another man.",comedy
the beautiful blonde from bashful bend," Saloon-bar singer Freddie gets very angry whenever boyfriend Blackie seems to be playing around. She always packs a six-shooter, so this is bad news for anything that happens to be in the way. As this is usually the local judge's rear-end, Freddie and friend Conchita are soon hiding out teaching school in the middle of nowhere. Written by Jeremy Perkins <[email protected]> ",comedy
the big steal,"Army Lieutenant Halliday, accused of stealing the Army payroll, pursues the real thief on a frantic chase through Mexico aided by the thief's ex-girlfriend and is in turned being chased by his accuser, Capt. Blake.",comedy
the clay pigeon,"Jim Fletcher, waking up from a coma, finds he is to be given a court martial for treason and charged with informing on fellow inmates in a Japanese prison camp during WWII. Escaping from the hospital he tries to clear himself by enlisting the aid of Martha Gregory, widow of a service buddy he was accused of informing on. Helped also by Ted Niles, a surviving fellow prisoner, he gets closer to finding the answers he needs, and becomes ensnared in a grandiose scheme involving his Japanese...",drama
the crooked way,"A war veteran suffering from amnesia, returns to Los Angeles from a San Francisco veterans hospital hoping to learn who he is and discovers his criminal past.",action
the doctor and the girl,"A young doctor discovers new value in his profession after he falls in love with a patient. MGM's 1949 film stars Glenn Ford, Janet Leigh, Charles Coburn, Gloria DeHaven, Nancy Davis and Bruce Bennett.",drama
the fan," Lord Windermere appears to all -including to his young wife Margaret - as the perfect husband. But their happy marriage is placed at risk when Lord Windermere starts spending his afternoons with an adventuress who is working her way through London's high society, Mrs. Erlynne. Worse, Windermere gives her big sums of money. To crown it all he asks his wife to invite the detestable woman to her own birthday party. Upset and outraged, the puritan Lady Windermere decides to leave her husband...",comedy
the girl from jones beach,"Glamour artist Bob Randolph is world famous for his paintings of a stunning beauty dubbed ""The Randolph Girl"". What the world doesn't know is that his pin-up creation is really a composite of parts of the anatomy of 12 different models. In an effort to find one girl who possesses all the proper physical attributes, Randolph and PR man Chuck Donovan pursue Ruth Wilson, a beauteous schoolteacher who prefers to be admired for her brain rather than her curves. Ruth changes her tune, however, when a...",comedy
the girl from the third row,"In the summer of 1981 a 10-year old girl is left behind with an aunt when the rest of her family goes to Africa as aid workers. The aunt, soon courted by a man, leaves the girl with the promise to return ""in just a few days"". The girl doesn't tell anyone that she is now completely abandoned and the summer passes by. With sharpening senses she gradually discovers the often absurd and careless adult world.-- (C) Olive Films",drama
the great gatsby," Nick Carraway, a young Midwesterner now living on Long Island, finds himself fascinated by the mysterious past and lavish lifetyle of his landlord, the nouveau riche Jay Gatsby. He is drawn into Gatsby's circle, becoming a witness to obsession and tragedy. Written by Cleo <[email protected]> ",drama
the great lover," The French Surete and private eye Higgins are after a killer who uses innocent young Americans in a crooked gambling racket, and who sets sail on an ocean liner that also carries inept scoutmaster Freddie Hunter and his troop of boys. Freddie, who's been a ""boy scout"" too long, has designs on gorgeous Duchess Alexandria. The boys, far better organized than Freddie, are determined to save him from himself. But who will save Freddie from being the killer's next victim? ...",comedy
the great sinner," A young writer goes to Wiesbaden to write about gambling and gamblers, only to ultimately become a compulsive gambler himself. Losing all his wealth, as well as his moral fibre, he commits the ultimate degradation of robbing a church poor box in order to feed his compulsion. Written by <[email protected]> ",drama
the green promise," A stubborn old farmer won't listen to any of his neighbors about how to improve the efficiency of his farm with modern methods, as he thinks ""the old ways"" were just fine. His three daughters live on the farm with him, and the oldest one, a teenager, has fallen in love with a local boy. However, she knows that she is expected to help her father work the farm and is torn between her love for the local boy and her father's expectations for her to continue working the farm. ...",drama
the inspector general,A down and out is mistaken for the Inspector General when they believe he is traveling incognito. They worry that he might stumble onto their petty crimes and they plan to get rid of him.,comedy
the lady gambles,"When Joan Boothe accompanies husband-reporter David to Las Vegas, she begins gambling to pass the time while he is doing a story. Encouraged by the casino manager, she gets hooked on gambling, to the point where she ""borrows"" David's expense money to pursue her addiction. This finally breaks up their marriage, but David continues trying to help her.",drama
the legend of sleepy hollow," In a small town named Sleepy Hollow, a gangly schoolteacher named Icabod Crane comes to town. Despite his unattractive appearance, he quickly proves to be a ladies man who charms the local beauty, much to the local tough, Brom Bones', displeasure. A subtle rivalry erupts, only to have Crane continually gaining the upper hand. The situation changes when Brom learns of Crane's superstitions and exploits them as he musically tells the legend of the fearsome Headless Horseman to frighten...",family
the lost tribe,"Jungle Jim rescues a beautiful native girl, Li Wanna, who is being chased by two sailors. She comes from a hidden village and the men were using her to find it. Jim visits the village and learns they are rich in diamonds. The village elder gives Jim a bag of diamonds which he wants delivered to the men looking for them. A bag of diamonds will not satisfy them however. Along the way, Jungle Jim faces several challenges.  - Written bygarykmcd ...",adventure
the mysterious desperado," Learning Chito's wealthy uncle died without a will, Tim and Chito head for California. Arriving they quickly learn someone is out to kill Chito, and the other heir, Chito's cousin Ramon, is wanted for a murder he did not commit. Stevens is the culprit. As executor he is selling parts of the estate and needs the heirs out of the way. Written by Maurice VanAuken <[email protected]> ",action
the quiet duel," In 1944, in WWII, Dr. Kyoji Fujisaki cuts his finger with the scalpel during a surgery in a field hospital and is infected by spirochete from his patient Susumu Nakada. After the blood test, he realizes that he has contracted syphilis, but he does not have the necessary medicine to treat the disease. He advises Nakada to seek medical treatment for his disease. In 1946, after the war, he breaks off his six years engagement with his beloved fiancée Misao Matsumoto but he does not tell the...",drama
the reckless moment,"In the charming community of Balboa 50 miles from Los Angeles, middle-class housewife Lucia Harper travels to Los Angeles to meet scoundrel, Ted Darby. Her seventeen year-old daughter Beatrice is in love with Ted. He asks for money to leave Bea, but Lucia refuses to give any. Bea does not believe her mother when told and during the night she sneaks out to the boat garage to meet Ted who admits that Lucia told the truth. Bea pushes him and Ted falls to his on an anchor. The next...",thriller
the secret garden," When Cholera takes the parents of Mary Lennox, she is shipped from India to England to live with her Uncle Craven. Archibald Craven's house is dark, drafty, with over 100 rooms built on the edge of the moors. Mary finds that her Uncle does not wish to see her, which is fine with Mary as she herself is rude and spoiled. While walking the gardens the next day, Mary notices that there is a area in the garden surrounded with a high stone wall and no doorway. Dickon, brother of a house maid,...",drama
the silence of the sea," In a small town in occupied France in 1941, the German officer, Werner Von Ebrennac is billeted in the house of the uncle and his niece. The uncle and niece refuse to speak to him, but each evening the officer warms himself by the fire and talks of his country, his music, and his idealistic views of the relationship between France and Germany. That is, until he visits Paris and discovers what is really going on ... Written by Will Gilbert ",drama
the small back room, The best bomb disposal officer during World War II was badly injured and is in frequent pain. He finds solace and relief from his pain in the whisky bottle & the pills that are never far away. A new type of booby trapped bomb push his nerves & resolution to the limit. Written by Steve Crook <[email protected]> ,drama
the story of seabiscuit," Horse trainer Shawn O'Hara and his lovely niece, Margaret, come to America to escape the memory of an accident involving Margaret's brother, Danny. Working with thoroughbreds in Kentucky, Shawn takes a liking to a yearling named Seabiscuit, and fights to convince the horse's owner that the tiny horse with big knees will become a top-notch racehorse. Meanwhile, Margaret begins a tentative relationship with jockey Ted Knowles, but is haunted by her brother's death in a...",drama
the sun comes up,"Set in the rural south of the United States, a bereaved war widow learns to to put aside her bitterness and grief as she grows to love a young orphan boy and his dog.",drama
the wind in the willows,"This animated fairy tale for kids tells the classic story of a dapper, automobile loving fellow named Mr. Toad, whose passion becomes a problem when he's framed for stealing cars by a band of rogue weasels.",animation
the window,"At the age of 9, Tommy Woodry has a reputation for telling tall tales -- the latest one being that his family is moving from Manhattan to a ranch out west. When the landlord interrupts the Woodrys at dinner to show their about to be vacated apartment, the Woodrys tell Tommy enough is enough. Then that hot summer night Tommy decides to sleep on the fire escape -- outside the Kellerson's apartment, since it is a story higher and gets more breeze. Tommy sees the Kellersons kill a...",thriller
thieves' highway,"War-veteran truck driver ""Nick"" Garcos (Conte) arrives at home to find his father, a farmer, crippled. He learns that his father was crippled at the hands of an amoral produce dealer in San Francisco, Mike Figlia (Cobb). Garcos vows revenge.",drama
thirst," In 1946, nervous ballet dancer Rut and her husband Bertil are returning to Sweden from his scholarship tour around Italy. In a Basle hotel room and on a train they quarrel; give food through the window to starving Germans; overhear wisdoms about marriage by Swedish clergymen returning from a conference; and finally make up. In flashbacks, Rut reminisces her romance with middle-aged officer Raoul, her subsequent abortion, and her ballet career. In a seemingly separate episode set in quiet...",drama
tokyo joe," Joe Barrett returns to Tokyo after World War II where he once owned a bar, Tokyo Joe's, and deserted his wife Trina. They have a seven-year-old daughter. Kimura forces Joe into piloting war criminals by revealing that during the war Trina made treasonous propaganda broadcasts. Written by Ed Stephan <[email protected]> ",drama
top o' the morning,A singing insurance investigator comes to Ireland to recover the stolen Blarney Stone...and romance the local policeman's daughter.,comedy
train of events,"A train disaster is told as four short stories to give character studies of the people involved, how it will affect them and how they deal with it.",drama
tulsa,"It's Tulsa, Oklahoma at the start of the oil boom and Cherokee Lansing's rancher father is killed in a fight with the Tanner Oil Company. Cherokee plans revenge by bringing in her own wells with the help of oil expert Brad Brady and childhood friend Jim Redbird. When the oil and the money start gushing in, both Brad and Jim want to protect the land but Cherokee has different ideas. What started out as revenge for her father's death has turned into an obsession for wealth and power.",action
twelve o'clock high,"In this story of the early days of daylight bombing raids over Germany, General Frank Savage must take command of a ""hard luck"" bomber group. Much of the story deals with his struggle to whip his group into a disciplined fighting unit in spite of heavy losses, and withering attacks by German fighters over their targets. --KC Hunt",action
we were strangers," China Valdes joins the Cuban underground after her brother is killed by the chief of the secret police, Ariete. She meets and falls in love with American expatriate Tony Fenner. Tony develops a plan to tunnel under the city's cemetery to a plot owned by a high official, assassinate him, and blow up the whole Cuban hierarchy at the ensuing state funeral. Together with a band of dedicated revolutionaries, they begin digging. Written by Jim Beaver <[email protected]> ",adventure
whisky galore,"Based on a true story. The name of the real ship, that sunk Feb 5 1941 - during WWII - was S/S Politician. Having left Liverpool two days earlier, heading for Jamaica, it sank outside Eriskay, The Outer Hebrides, Scotland, in bad weather, containing 250,000 bottles of whisky. The locals gathered as many bottles as they could, before the proper authorities arrived, and even today, bottles are found in the sand or in the sea every other year.",comedy
