title,plot,genre
sharpe's siege, Jane and Sharpe are married in Spain but he must leave her stricken with the fever that is sweeping the camp to join an invasion force led by inexperienced but arrogant young Colonel Bampfylde to capture a strategic French chateau which the Comte Maquerre assures them will instigate a revolt against Bonaparte if taken. Bampfylde's incompetence leads to heavy losses in an ill-advised storming but Sharpe's regiment take the chateau by stealth. However Maquerre has led them into a trap...,action
sik san,"The God of Cookery, a brilliant chef who sits in judgement of those who would challenge his title, loses his title when a jealous chef reveals him to be a con-man and humiliates him publicly. As this new chef takes on the God of Cookery's role, the former God tries to pull himself back on top again, to challenge his rival and find once and for all who is the true God of Cookery.",action
silent trigger,"Waxman is a former Special Forces soldier who is now working as a heavily armed assassin for a top secret government agency. When a covert mission goes terribly wrong, Waxman and fellow assassin Clegg become that agency's prime targets.",action
sinbad: son of a preacher man,"Experience veteran comedian Sinbad as he returns to his college town of Denver and performs at the Paramount Theatre for this next installment of his famed HBO Comedy Specials. Sinbad: Son of a Preacher Man is a self-styled monologue that comments on the perils of skiing, para-sailing during a bad vacation, fashion trends in lingerie, and more!",comedy
skin & bone,"Harry, Billy and Dean are three hustlers at different stages in their careers. All must deal with the realities of their profession. One falls in love with a client, another enters deeper into denial, and another begins to learn the ropes.",comedy
slayers return," Outrageous enemies such as secret organizations aiming to dominate the world and mysterious strongest fighting forces attack Lina and Naga one after another for legendary ""treasure"" lying in a village in which Elves used to live. In addition, an immortal monster not affected by attacking magic appears and drive Lina and Naga into a terrible pinch. What they should do? Written by Lady Andromeda <[email protected]> ",animation
small faces," Three teenage brothers, gang-member Bobby, troubled mama's boy Alan and self-assured prankster Lex, reside in a downtrodden section of Glasgow, Scotland, circa 1968. But while Bobby and Alan are beginning to experience the power of raging hormones, the story focuses on Lex, who begins a downward spiral after he accidentally shoots the leader of Bobby's gang. Lex's cockiness and immaturity unfortunately prevent him from understanding the effect his subsequent crimes will have on...",drama
solo,"On a top secret mission against rebel forces in Latin America, Solo (Mario Van Peebles), a human-like mechanical soldier, refuses to obey an order that would result in the deaths of innocent villagers. His military superiors, who see his refusal as a clear defect in his software, order his creator to reprogram him. Realizing that reprogramming would wipe out his memory and thus his sense of self, Solo escapes to the jungles of Latin America, where he is discovered by a young boy, who takes him...",action
some mother's son,"Two women (Helen Mirren, Fionnula Flanagan) battle to save the lives of their sons who are involved in the tragic Irish hunger strike of 1981.",drama
somebody up there likes me,"A young rebel falls for the sister of a local kickboxing champion. In order to stay out of jail, he is advised by his parole officer to begin training in the art of kickboxing. His romance with the girl blossoms but comes to a crashing halt when he is forced to face her brother in the ring. When the brother is accidentally killed, the romance ends and the young kickboxer participates in illegal street fights. When the kickboxer has a shot at the Golden Belt against the Japanese...",action
sometimes they come back... again, Jon Porter returns to his hometown after the sudden and bizarre death of his mother. He hopes to leave as soon as the funeral is over but it's too late. The sinister forces that caused his sister's brutal murder 30 years ago are back. Jon knows the nightmare can't continue. He must stand up to his fear and exorcise the demons who have risen again to take posession of his beautiful teenage daughter - body and soul. Written by Anonymous ,horror
sonic the hedgehog: the movie," Sonic the Hedgehog and his sidekicks Tails and Knuckles the Echidna are determined to thwart a plan that would turn their Land of the Sky into the equivalent of The Land of Darkness, which lurks beneath the surface (and is obviously the former planet Earth). So they plow through to the center of the planet and the ancient city of Robotropolis (the former New York City?) to do righteous battle. The big question of the day is whether the usually evil Dr. Robotnik is telling the truth for once or...",animation
sono pazzo di iris blond," Romeo, a lovelorn Roman musician in his 40s with 20 years since his only hit, consults a fortuneteller who predicts he'll find love and money with a foreign singer named for a flower. In Brussels he meets Marguerite, an older chanteuse who interprets Jacques Brel and loves her yappy dog. Then, late one night, while binging on burgers, he meets Iris, 25, a waitress, free spirit, poet and singer who sleeps with a new man nearly every night. Romeo falls for her, and, better, he puts her...",comedy
south beach academy,"A wide-eyed virgin (Feldman) goes on 'babe watch' when he enrolls in his big brother's top-notch, top-heavy beach academy. But it's not all fun and games. His wacky uncle (Al Lewis) has impulsively bet a jealous rival that South Beach's female volleyball team is invincible, using the family business as collateral! Now the brothers must embark on a quest for curves and the perfect serve to save the day in this sexy, buoyant beach adventure!",comedy
spill,A United States Presidential bodyguard risks everything to save the day when a truck chock full of biological weapons contrives to crash in a National Park,action
splatter: naked blood,"A scientist taints his mother's scientific experiment with his own drug that transforms pain into a pleasurable experience. Unfortunately for the three women involved in the experiment, the drug works a little bit too well.  - Written bysmcarter ",horror
spring and chaos,"Set in the beginning of the 20th century Japan, the film follows the bright and eccentric Kenji from his late student years through his adulthood. Kenji suffers the tragedy of being an artist who's art isn't recognized during his lifetime. Based on the life of the author Kenji Miyazawa, the film depicts his brief but intense existence.",animation
star hunter," Star hunters are the space monsters who hunt helpless creatures for pleasure. One night couple of high school football players and their cheerleaders are returning home after the lost game. But, when their bus makes the wrong turn, they are going to meet those creatures, and the real game will begin. Written by Dragan Antulov <[email protected]> ",scifi
street corner justice,"A Pittsburgh detective is kicked off the force for beating a rape suspect and moves to L.A. There, he becomes the central force in a bullet ridden neighborhood battle to win back its streets from brutal gang members.  - Written byAnonymous ",action
suburbia,"Amidst a featureless wasteland of asphalt, concrete and brick, through sprawling arrays of power lines, tract homes and strip malls, beneath the constant drone of traffic and within an all-encompassing air of quiet desperation, the denizens of suburbia pursue their perfectly ordinary lives, searching for meaning in a world marked by its utterly unremarkable sameness, day after day, night after night, block after block, forever. But... Perhaps not. On a perfectly ordinary corner, outside a...",comedy
sunset park,"A white school teacher takes over a talented, but undisciplined black high school basketball team and turns them into a winning team.",drama
superman - the last son of krypton," Shunned by Krypton's leaders for his theories of planetary destruction, scientist Jor-El rockets his infant son Kal-El to safety on Earth. There Kal is raised as Clark Kent and develops unusual abilities, moves to a shining Metropolis and meets a fiesty female reporter with a knack for trouble. Written by Ray Schaff -2- ",animation
supernatural," A woman sees her best friend murdered before her eyes, and thus becomes very traumatised. Her husband tells her to stay at home, where she discovers a little gris-gris bag. She opens the bag, without knowing it's magical origin and smells a powder. She begins investigating and discovers a strange address: ""Academia #10"". She then goes there and meets a witch, who warns her of the dangers of the powder she smell and the dark powers of voodoo. She then meets a psychologist, who...",horror
tabutta rövasata,"Araba sevdalısı bir otomobil hırsızının hüzünlü öyküsü. Rumelihisarını mesken tutan Mahsun (Ahmet Uğurlu), evsiz-barksız işsiz ve kimsesi olmayan bir garibandır. Tüm dostları balıkçılardır. Sabahçı kahvesindeki çay borçlarına kadar herşeyine balıkçı dostlarından Reisin (Tuncel Kurtiz) sahiplendiği Mahsun, otomobil çalarak yaşamını sürdürür. Yaşamındaki tek tutkusu arabalardır. Geceleri çaldığı arabaları sabaha dek gezdikten sonra yerlerine...",drama
temptress moon," Not far from Shanghai, in a country twon stands the palatial home of the Pang family. Old Master Pang is an addict who brings up his beautiful daughter Ruyi on opium smoke. Her older brother, Zhengda, is addicted as well, and then paralysed and effectively brain-dead. Zhongliang, Zhengda's brother-in-law, is a successful gigolo in Shanghai who seduces married older women and then blackmails them. When Older Master Pang dies, the clan elders makes Ruyi to take over the role as the head of...",drama
terminal," A hospital in need of funds announces a cure for a form of brain cancer, having saved several wealthy men's lives. When a young girl with the cancer dies, one doctor notices that she and all the cured men had been treated with exactly the same medicine. Investigating further, she uncovers a plot by the administration to locate wealthy men already suffering from a serious condition, and give them the cancer, which can then be treated successfully. Written by Cynan Rees...",drama
terminal justice," In 2008 cybersex can only be surpassed by one thing: Cloned women, especially created for their clients. This puts Pamela Travis, a famous and much sought-after cybersex star in great danger - Dr. Vivyan, scientist and genius in the field of biotechnology wants her DNA to clone her for his many customers. Sergeant Bobby Chase is assigned to protect her, but can't prevent her from being kidnapped. In order to free Pamela, Chase has to risk his life in a deadly virtual reality game called...",action
terminal rush,"A group of terrorists, led by a Brit and a psycho (in a great performance by ""Rowdy"" Roddy Piper) take control of the Hoover Dam and demand $25 million or they will kill civilians and dam workers they have taken hostage. But the terrorists didn't count on Sheriff Jacob Harper, (Don ""The Dragon"" Wilson), an ex-Army Ranger whose father is one of the hostages. But after the FBI takes over the the crisis, and relieves him of his duties, he must take on the terrorists by himself and save his father...",action
the abduction," While their marriage may have started off happily, Kate now finds that her police officer husband Paul has grown more unstable and abusive with each passing year. At long last, she leaves him and tries to start a new life for herself. Paul, however, has become obsessed with the thought of getting Kate back, and starts stalking her. Matters come to a head when he takes her hostage and threatens to kill her. Will she get out of this alive, or will it end in tragedy? Written by Jean-Marc...",drama
the adventures of pinocchio,"A nose that grows, a giant sea monster and a wild theme park where youthful patrons take the ultimate thrill ride are just some of the larger-than-life exploits that Pinocchio encounters during his quest to become a real boy. Pursued by the evil showman Lorenzini (Udo Kier), Pinocchio must learn to sidestep the enticing traps set for him by the cunning Felinet (Bebe Neuwirth), and her partner in crime Volpe (Rob Schneider). Finally with the help of a wickedly funny, wisecracking cricket...",fantasy
the angel of pennsylvania avenue,"When an unemployed Detroit man is arrested for a crime he didn't commit, his three children is determined to get him out of jail in time for Christmas and they decide to enlist the help of ""the most powerful man in the world"" - President Hoover. En route to the White House, they meet an array of colorful characters.",drama
the appointment,"The Appointment centers around Peter Bundle, a mid-thirties everyman who has never been known for making wise choices in life... See full synopsis »",thriller
the associate,"Financial analyst Laurel Ayres (WHOOPI GOLDBERG) is intelligent, sharpwitted and talented in matters of money. She seems to have all the right elements required for vaulting to the top of the Wall Street corporate ladder. But when Laurel fails to get a well-deserved promotion - given instead to her ethically-challenged, devious colleague Frank (TIM DALY) - she finally realizes that she likely will never crack the so-called ""glass ceiling,"" a feat so easily and quickly accomplished by her male...",comedy
the babysitter's seduction," The mother of the family for which Michelle baby-sits dies unexpectedly. Michelle is asked to take over looking after the children and is gradually ""seduced"" by the father. When suspicions arise that the mother had been murdered (and had been having an affair), Michelle unknowingly becomes enveloped in a web of lies until she herself is suspected. Gradually she realises all is not as it seems... Written by David Laoide-Kemp ",drama
the beast,"Fishing and jobs are becoming scarce in the small seaport village of Graves Point, when mysterious deaths and unexplained disappearances begin to occur. Divers vanish and a young couple disappears at sea, their empty raft washing up on the shore. When a large, strange claw is discovered on the raft, the unsettled towns-people call on the marine biologist Dr. Herbert Talley (Ronald Guttman), who identifies it as belonging to a rare giant squid. With the help of Whip Dalton, the hunt is on! It...",action
the bermuda triangle,"After a strange storm in the Carribean causes a boat to sink, a family finds itself stranded on an island in the ""27th dimension"".",adventure
the boy who stopped talking," Young Memo is a happy boy who lives in a small village in the east of Turkey. His father lives in The Netherlands, where he works as a foreign labourer. Things are not going too good in Turkey though, Memo and his family are Kurds. When Memo's father hears there's a war going on against the Kurds, he decides to take his family to The Netherlands. But Memo is not all happy about this, even though he almost immediately finds a friend, Jeroen after arriving in The Netherlands. He wants...",drama
the boys next door,"Jack Palmer is a social worker whose job has taken precedence over his personal life. Mainly, his job is to help four mentally challenged men live regular lives in a home. They consist of: Norman, who works at a donut shop and has a thing for keys; Barry, who thinks he is a golf pro and doesn't communicate well with his father; Arnold, who is into all things Russian and has a habit of spending money; and Lucien, who is into Spider Man and must testify before the state senate....",comedy
the canterville ghost," When a teenaged girl moves to England, with her brothers and parents into the ancient Canterville Hall, she's not at all happy. Especially as there's a ghost and a mysterious re-appearing bloodstain on the hearth. She campaigns to go back home, and her dad, believing the ghost's pranks are Ginny's, is ready to send her back. But then Ginny actually meets the elusive 17th-century Sir Simon de Canterville (not to mention the cute teenaged duke next door), and she sets her...",family
the day a pig fell into the well,"Tong-u, a plain married man in his thirties, visits Chŏnju (4 hour bus ride from Seoul) on a business trip. After endless incidents of waiting, his purpose continually frustrated, he has to spend the night in this strange place and has a disengaging encounter with a prostitute which however leaves him with 'consequences' due to a ruptured condom.",drama
the daytrippers,"Eliza D'Amico thinks her marriage to Louis is going great, until she finds a mysterious love note to her husband. Concerned, she goes to her mother for advice. Eliza, her parents, her sister Jo and Jo's boyfriend all pile into a station wagon, to go to the city to confront Louis with the letter. On the way, the five explore their relations with each other, and meet many interesting people.",comedy
the dog in the manger,"Diana, the Countess of Belflor, is an intelligent, impulsive woman in love with her secretary, Teodoro. He is engaged to Marcela, one of the countess's ladies in waiting. When the countess finds out about the engagement, driven by jealousy, she does everything possible to separate the lovers. Film adaptation of the play by Lope de Vega that respects the text in verse",comedy
the embalmer,A deranged mortician preys on a group of teenage friends in a desperate attempt to obtain their bodily fluids needed to bring his family back to life.,horror
the escort," L'ESCORTE is a comedy of manners where cynicism and false naiveté mingle in a bittersweet study of love, lies and friendship in the age of AIDS. Amid the laughter and the tears, the hustle and bustle of life goes on. Written by Claude O <[email protected]> ",comedy
the evening star,"Continuing the story of Aurora Greenway in her latter years. After the death of her daughter, Aurora struggled to keep her family together, but has one grandson in jail, a rebellious granddaughter, and another grandson living just above the poverty line.",comedy
the fortunes and misfortunes of moll flanders," In her filthy cell in Newgate prison Moll Flanders, dubbed 'the wickedest woman in England' tells her story. Born in the gaol, after her mother is transported Moll is raised by the kindly mayor of Colchester and his wife, whose two sons lust after her. She enjoys sex with handsome Rowland, who teaches her that money talks, but, realizing he only wants her as a mistress, she marries his duller brother Robin, who conveniently dies after five years, leaving her wealthy. She goes to...",comedy
the glimmer man,"When a serial murderer with a macabre, ritualistic style plunges the families of Los Angeles into terror, the L.A.P.D., making no headway on the baffling case, are forced to summon the one man whose instinct and understanding of the criminal mind are unrivaled: Detective Jack Cole (Steven Seagal) from New York. This time, in the urban jungle of Los Angeles, Cole is not the killer hunting prey, but the hunter seeking a killer. The iconoclastic Cole is paired with seasoned local homicide...",action
the grand dukes," Three aging and failed comedians, Georges Cox, Victor Vialat and Eddie Carpentier, hit the road again with a lousy production of a lousy play, of course under the worst possible conditions. Written by Vincent Merlaud <[email protected]> ",comedy
the great white hype,"Reverend Fred Sultan. Rich, powerful and dressed like a prince, the bigger-than- life Sultan is nothing less than the American Dream personified -- the ultimate capitalist.But despite his hustling and financial wizardry, Sultan's Vegas fiefdom is fading as boxing attendance is dwindling, along with public interest. The problem, according to Sultan, is that people are tired of paying money to see 'brothers' beating up 'brothers'. Sultan finds his Great White Hope in a would-be contender, Terry...",comedy
the haunting of lisa," A young and innocent girl named Lisa receives mysterious visions about the murder of a young child. When the visions become increasingly more intense, Lisa's parents ask for the help of a priest to figure out what is going on. Are Lisa's visions real? What are they trying to say? Soon, these visions set in motion a search for the killer who may also be responsible for other deaths and who may need to kill Lisa to avoid being caught. Written by Anonymous ",drama
the ice princess," This is another variation of the Cinderella story: the bright and beautiful Ella lives in the household of a lord since her mother died. She's unhappy because the lord's daughters treat her like their servant. The country is in problems, because the prince is a dreamer and doesn't realize that his chancellor abuses his power. When the day nears the prince is forced by law to find a wife, a celebration on a frozen lake is arranged. Ella manages to skate on the lake for him too,...",fantasy
the juror,"Blind to outside influences, entrusted with the fate of the accused, the juror is the single most powerful image of the American justice system. The court promises anonymity, in return, the juror promises impartiality. In an ideal world, the juror can vote guilty or innocent and get on with his or her life. But in reality it's not as simple as that. A single mother (Demi Moore) becomes embroiled in a dangerous game when she is chosen to serve as a juror in the trial of a powerful mobster. A...",drama
the last days of frankie the fly," Frankie is an unrespected little man, who works for mob bosses Sal and Vic. He meets Margaret, who is an ex-porn actress and plans to become a serious one, falls in love with her and tries to save her from Sal's influence. Written by Anonymous ",comedy
the lottery," On his deathbed in the hospital, Jason's father asks that his ashes be spread over the top of his wife's grave. Jason, who came to the city with his father at a young age, remembers little of the town or his mother, but he undertakes the charge. It is an idyllic place, but gradually snips of memory return, until he remembers the significance of the fact that most of the tombstones in the town cemetery, including his mothers, bear the same day and month, one death each year. Caught up...",drama
the making of the mahatma," One of two feuding Mohammedan cousins living in Britain but of Indian origin seek the assistance of an Indian Barrister to travel to Britain and settle their matter in a court of law. The Barrister travels to Britain, and finds that all Asians are treated as coolies, and their status is worse than of servants. Despite of being dressed in a suit and a tie, he is thrown out of a first class train compartment; is asked to remove his cap in a court of law; asked to ride with the driver of the...",drama
the method,"Christian, Damian, Jack and Alex are four aspiring actors who will stop at nothing to be the best. In a theatrical production where they are cast as bank robbers, the four actors cannot get a feel of their roles. In desperation they are introduced to a new source of motivation real guns. With guns in hand, each of them begins to acquire a taste of power and in their search for inspiration, reality begins to blur and ""method acting"" begins to take on an entirely new meaning.",action
the munsters' scary little christmas,"The made for television movie Munster's Scary Little Christmas, created three decades after the demise of the original series, concerns son Eddie missing his home in Transylvania. Soon the entire family bands together to teach the young boy everything great about the holiday season.",comedy
the other side of sunday," The Other Side of Sunday, Also known in Norwegian as ""Sndags Engler"", is a movie that criticizes the small, and often tight church community. We follow the Preachers Daughter; Maria in her journey to liberate herself from the stiff church community and her father. Written by Ole Pettersen <[email protected]> ",comedy
the pallbearer,A young man stuck in arrested development reconnects with his high school crush while preparing a eulogy for a classmate he doesn't remember.,comedy
the paper brigade,"Gunther Wheeler, fourteen, a city tough-guy from New York moves to a small town called Pleasant Valley. Gunther isn't making very many friends in his new town. Until he meets Allison Robbins a beautiful blond girl his age, the girl of his dreams. Gunther is anxious to score on Allison by taking her out on a date. When Chad, Luke, and Wylie, a couple of neighborhood bullies give Gunther a chance to see Screamin' Banchees, an awesome band, but the tickets for the concert are $150. Gunther doesn't...",adventure
the people next door," When hapless Anna Morse decides to leave her violent husband for good and moves into an Albuquerque rental house with her three little daughters, things are gradually looking up again at first. But soon enough it all starts to fall apart when not only her newfound job and the love of her mother, but also the friendship of the caring next door neighbours all don't appear as reliable as they seemed. And then the real nightmare is about to begin... Written by Swie Tio...",drama
the pillow book,"Nagiko (Vivian Wu) is a Japanese model in search of pleasure and new cultural experience from various lovers. The film is a rich and artistic melding of dark modern drama with idealized Chinese and Japanese cultural themes and settings, and centers around body painting.",drama
