title,plot,genre
the wicked lady," 17th-century beauty Barbara Worth starts her career of crime by stealing her best friend's bridegroom. Her next exploit is to recover gambling losses by donning mask and cloak and taking to the roads as a highwayman! The thrill of these ventures proves addictive...especially when she meets a male highwayman who becomes her lover. Together, the two desperados lead a gay secret life, pursued by the local magistrate Sir Ralph Skelton...Barbara's husband! To what further crimes will the...",adventure
they were expendable,"Shortly after Pearl Harbor, a squadron of PT-boat crews in the Philippines must battle the Navy brass between skirmishes with the Japanese. The title says it all about the Navy's attitude towards the PT-boats and their crews.",drama
vacation from marriage," Robert and Catherine have a quiet little marriage until WWII separates them for three years. Serving in the navy dramatically transforms both of them and they realize how much they resented their old mundane life together. Both dread their inevitable reunion and separately decide to ask for a divorce, but is the marriage really over? Written by Kathy Li ",drama
voice of the whistler," The 4th film of the Columbia series based on the CBS radio program, ""The Whistler"", finds wealthy John Sinclair, with no health or friends, being advised by his doctor to take a long vacation. Heading for the Great Lakes, he becomes ill in the cab operated by Ernie Sparrow an is taken to a clinic where he meets nurse Joan Martin, who is engaged to intern Fred Graham. Doctors now tell him he has only a few months to live and advise him to go to Maine (where, evidently, it will seem...",drama
week-end at the waldorf,"Anything can happen during a weekend at New York's Waldorf-Astoria: a glamorous movie star meets a world-weary war correspondent and mistakes him for a jewel thief; a soldier learns that without an operation he'll die and so looks for one last romance with a beautiful but ambitious stenographer; a cub reporter tries to get the goods on a shady man's dealing with a foreign potentate. And it all happens in the opulent, grandiose New York landmark hotel as a sort of tongue-in-cheek take-off on the...",comedy
what a blonde," Lingerie tycoon F. Farrington Fowler is in a spot as he has ran out of gas-ration coupons. He enlists his butler, Pomeroy, to drum up riders so that he can get extra coupons from the ration board. Pomeroy gets a bunch of showgirls and parks them in Fowler's mansion, this being easy since Mrs. Fowler is away visiting her mother. Leon adds to the number by bringing home a young promoter. The showgirls, headed by Pat, run riot on the premises and Fowler passes them off as new domestics when...",comedy
without love," In WWII Pat Jamieson is a scientist working, with Government support, on a high-altitude oxygen mask for fighter pilots. But he has nowhere to conduct his research in secret until he meets Jamie Rowan, a woman with an unused house with a scientist's basement. Jamie has no hopes of marrying for love (and neither does Pat) but Jamie wants to help the war effort and she likes this quirky scientist and his dog, so to satisfy the proprieties they agree on a business arrangement: a marriage of...",comedy
wonder man,"Boisterous nightclub entertainer Buzzy Bellew was the witness to a murder committed by gangster Ten Grand Jackson. One night, two of Jackson's thugs kill Buzzy and dump his body in the lake at Prospect Park in Brooklyn. Buzzy comes back as a ghost and summons his bookworm twin, Edwin Dingle, to Prospect Park so that he can help the police nail Jackson.",comedy
yolanda and the thief," Johnny Riggs, a con man on the lam, finds himself in a Latin-American country named Patria. There, he overhears a convent-bred rich girl praying to her guardian angel for help in managing her tangled business affairs. Riggs decides to materialize as the girl's ""angel"", gains her unquestioning confidence, and helps himself to the deluded girl's millions. Just as he and his partner are about to flee Patria with their booty, Riggs realizes he has fallen in love with the girl...",fantasy
zombies on broadway,"Two inept press agents are ordered to the island of San Sebastian to get a zombie for an opening night publicity stunt of a nightclub. They find a likely source in Dr. Paul Renault, who has spent much time studying (and experimenting) on the subject, but Renault has other ideas.  - Written byKen Yousten <[email protected]> ",comedy
